Transaction_ID,Customer_ID,Name,Email,Phone,Address,City,State,Zipcode,Country,Age,Gender,Income,Customer_Segment,Date,Year,Month,Time,Total_Purchases,Amount,Total_Amount,Product_Category,Product_Brand,Product_Type,Feedback,Shipping_Method,Payment_Method,Order_Status,Ratings,products,Date_parsed,Time_parsed,Data_Quality_Issues
9823195.0,14549.0,Danielle Bennett,James20@gmail.com,2200037745.0,9980 Bryant Road,Portsmouth,England,84238.0,UK,62.0,Female,Medium,Regular,11-08-23,,November,17:08:17,4.0,104.5063373,418.0253491,Books,Penguin Books,Fiction,Excellent,Express,Cash,Processing,5.0,Literary fiction,2023-11-08,2025-11-15 17:08:17,Missing values; 
7379891.0,47846.0,Mary Kim,Katherine73@gmail.com,3268643153.0,5028 Tammy Brook,Portsmouth,England,97711.0,UK,65.0,Male,Low,Regular,6/24/2023,2023.0,June,1:17:23,4.0,478.109162,1912.436648,Grocery,Coca-Cola,Juice,,Same-Day,Debit Card,Delivered,,Pineapple juice,2023-06-24,2025-11-15 01:17:23,Missing values; 
7018142.0,67530.0,Mathew Fitzgerald,Erik18@gmail.com,,4169 Robert Lodge,Portsmouth,England,67486.0,UK,50.0,Male,Low,Regular,8/23/2023,2023.0,August,1:40:26,7.0,178.0342511,1246.239758,Clothing,Adidas,T-shirt,Excellent,Standard,PayPal,Processing,4.0,Crew neck tee,2023-08-23,2025-11-15 01:40:26,Missing values; 
7361679.0,47748.0,Alexis Smith,Karen91@gmail.com,9388217725.0,69821 Beard Locks,Portsmouth,England,25474.0,UK,39.0,Male,Medium,Regular,03-05-23,2023.0,March,7:54:44,10.0,300.2684416,3002.684416,Clothing,Adidas,Jacket,,Standard,PayPal,Pending,,Varsity jacket,2023-03-05,2025-11-15 07:54:44,Missing values; 
5050125.0,14196.0,Michael Perkins,Tabitha57@gmail.com,8979005491.0,432 Raven Terrace,Portsmouth,England,69649.0,UK,37.0,Male,High,Regular,09-12-23,2023.0,September,18:24:39,1.0,253.0541571,253.0541571,Clothing,Zara,Dress,Average,,PayPal,Pending,2.0,Sheath dress,2023-09-12,2025-11-15 18:24:39,Missing values; 
8744927.0,39728.0,Derek Perez,Brandon75@gmail.com,2175018981.0,54835 Jon Viaduct Suite 484,Portsmouth,England,527.0,UK,50.0,Male,High,Regular,7/23/2023,2023.0,July,20:46:04,,417.0340015,1251.102005,Grocery,Pepsi,Water,Average,Standard,Credit Card,Pending,2.0,Sparkling water,2023-07-23,2025-11-15 20:46:04,Missing values; 
3601539.0,93979.0,Sarah Hess,Tammy57@gmail.com,5973779364.0,294 Palmer Inlet Apt. 966,Portsmouth,England,51469.0,UK,,Female,Low,Regular,01-09-24,2024.0,January,8:44:51,10.0,32.11555907,321.1555907,Grocery,Coca-Cola,Water,Average,Same-Day,Credit Card,Pending,2.0,Bottled water,2024-01-09,2025-11-15 08:44:51,Missing values; 
9596556.0,36083.0,Fred Whitaker,Scott44@gmail.com,3207950518.0,658 Louis Courts Apt. 000,Portsmouth,England,72704.0,UK,69.0,Female,Medium,Regular,3/16/2023,2023.0,March,13:26:29,7.0,222.9131135,1560.391794,,Nestle,Chocolate,Excellent,Standard,Debit Card,Shipped,5.0,White chocolate,2023-03-16,2025-11-15 13:26:29,Missing values; 
7637365.0,23631.0,Rita Ruiz MD,Elizabeth9@gmail.com,7884475046.0,592 Jacob Groves Suite 528,Portsmouth,England,86955.0,UK,48.0,,Medium,Regular,2/29/2024,2024.0,February,3:41:21,9.0,159.507104,1435.563936,Electronics,Apple,Smartphone,Excellent,Standard,Cash,Shipped,5.0,iPhone,2024-02-29,2025-11-15 03:41:21,Missing values; 
4138830.0,17705.0,Michelle Simmons,Peter4@gmail.com,3235195556.0,91972 Randolph Locks,Portsmouth,England,98403.0,UK,62.0,Male,Low,Regular,7/14/2023,2023.0,July,18:24:33,5.0,64.80243279,324.0121639,,HarperCollins,Non-Fiction,Excellent,Same-Day,Cash,Pending,5.0,Self-help,2023-07-14,2025-11-15 18:24:33,Missing values; 
8119453.0,65754.0,Savannah Molina PhD,Dawn43@gmail.com,3346178091.0,087 Lee Squares,Portsmouth,England,1709.0,UK,33.0,Male,High,Regular,09-08-23,2023.0,September,6:45:50,10.0,14.02323893,140.2323893,Books,HarperCollins,Non-Fiction,Good,Express,,Processing,4.0,Business,2023-09-08,2025-11-15 06:45:50,Missing values; 
7443430.0,28320.0,Vanessa Hawkins,Nicholas51@gmail.com,9779145745.0,329 Marie Mount Suite 522,Portsmouth,England,10810.0,UK,,Female,High,Regular,10/20/2023,2023.0,October,3:59:07,9.0,211.2599296,1901.339367,Grocery,Nestle,Snacks,Average,Same-Day,Cash,Processing,2.0,Beef jerky,2023-10-20,2025-11-15 03:59:07,Missing values; 
6188453.0,92425.0,Jack Castillo,Kathy72@gmail.com,9436772615.0,787 Bailey Roads,Portsmouth,England,9654.0,UK,48.0,Male,High,Regular,11/29/2023,2023.0,November,7:59:04,4.0,472.6305959,,Electronics,Sony,Television,Good,Same-Day,PayPal,Shipped,4.0,Plasma TV,2023-11-29,2025-11-15 07:59:04,Missing values; 
6043487.0,24751.0,Shawn Anderson,Richard53@gmail.com,6534249382.0,1977 Erica Gateway,Portsmouth,England,42783.0,UK,27.0,Female,High,Regular,11-11-23,2023.0,November,12:49:08,3.0,392.7667326,1178.300198,Books,Random House,Non-Fiction,Excellent,Same-Day,Cash,,4.0,Business,2023-11-11,2025-11-15 12:49:08,Missing values; 
2100341.0,83805.0,Glenn Ellison,Diana46@gmail.com,4180243220.0,,Portsmouth,England,3771.0,UK,57.0,Female,High,Regular,11/23/2023,2023.0,November,12:13:44,9.0,188.8032542,1699.229287,Electronics,Apple,Laptop,Excellent,Standard,Credit Card,Delivered,5.0,Microsoft Surface Laptop,2023-11-23,2025-11-15 12:13:44,Missing values; 
7324033.0,17887.0,Paul Larson,John66@gmail.com,6100966567.0,9847 Baker River Suite 669,Portsmouth,England,21746.0,UK,50.0,Female,High,Regular,5/17/2023,2023.0,May,5:56:47,10.0,456.8265235,4568.265235,Home Decor,Bed Bath & Beyond,Bathroom,Good,Same-Day,Credit Card,,3.0,Sink,2023-05-17,2025-11-15 05:56:47,Missing values; 
4100214.0,10662.0,Adam Huerta,Elizabeth38@gmail.com,4874410658.0,657 Tony Circles,Portsmouth,England,,UK,21.0,Male,High,Regular,4/14/2023,2023.0,April,10:52:05,3.0,141.5893071,424.7679212,Grocery,Coca-Cola,Soft Drink,Average,Standard,Credit Card,Pending,2.0,Lemon-lime soda,2023-04-14,2025-11-15 10:52:05,Missing values; 
6023759.0,39325.0,Vernon Hull,Tina81@gmail.com,2387702499.0,079 Kathy Cape Apt. 758,Portsmouth,England,72092.0,UK,21.0,Male,High,Regular,10/20/2023,2023.0,October,22:21:57,4.0,277.1678356,1108.671342,Home Decor,IKEA,Decorations,Excellent,,Credit Card,Delivered,5.0,Mirrors,2023-10-20,2025-11-15 22:21:57,Missing values; 
3555553.0,25374.0,Mary Torres,Michaela2@gmail.com,5412655690.0,894 Flores Mall Apt. 672,Portsmouth,England,7809.0,UK,21.0,Female,High,Regular,3/14/2023,2023.0,March,6:49:55,6.0,418.3245574,2509.947344,Grocery,Pepsi,Soft Drink,Bad,Same-Day,Debit Card,,1.0,Ginger ale,2023-03-14,2025-11-15 06:49:55,Missing values; 
1153740.0,13769.0,Susan Johnson,Kayla21@gmail.com,5468841227.0,9308 Watts Plains Apt. 587,Portsmouth,England,833.0,UK,21.0,Female,High,Regular,03-07-23,2023.0,March,10:24:29,6.0,487.0326036,,Clothing,Adidas,Jacket,Average,Standard,PayPal,Pending,2.0,Blazer,2023-03-07,2025-11-15 10:24:29,Missing values; 
9168609.0,45787.0,Shannon Henry,Thomas91@gmail.com,7160259647.0,33526 Darrell Tunnel Suite 098,Portsmouth,England,89302.0,UK,21.0,Male,High,Regular,7/25/2023,2023.0,July,18:19:34,5.0,386.2007693,,Books,Penguin Books,Non-Fiction,Excellent,Express,Cash,Pending,4.0,Science,2023-07-25,2025-11-15 18:19:34,Missing values; 
1510109.0,67589.0,Dr. Brian Williams,Stacy13@gmail.com,9818707396.0,42414 Garcia Spurs Apt. 849,Portsmouth,England,69240.0,UK,21.0,Male,High,Regular,5/27/2023,2023.0,May,21:54:07,7.0,,1991.244975,Grocery,Pepsi,Juice,Good,Same-Day,Credit Card,Delivered,3.0,Cranberry juice,2023-05-27,2025-11-15 21:54:07,Missing values; 
9076126.0,,Kara Harris DDS,Yvette79@gmail.com,7246836622.0,8226 David Lakes,Portsmouth,England,68085.0,UK,21.0,Female,High,Regular,9/18/2023,2023.0,September,1:03:08,4.0,450.9701122,1803.880449,Home Decor,Bed Bath & Beyond,Kitchen,Average,Same-Day,Debit Card,Delivered,2.0,Microwave,2023-09-18,2025-11-15 01:03:08,Missing values; 
4461752.0,85987.0,Ashley Mcpherson,Jerry43@gmail.com,6719591585.0,13277 Carr Mount Apt. 544,Portsmouth,England,38806.0,UK,21.0,Male,High,Regular,10/29/2023,2023.0,October,21:37:19,8.0,303.0734203,2424.587363,Home Decor,,Furniture,Average,Standard,Credit Card,Shipped,2.0,Bookshelf,2023-10-29,2025-11-15 21:37:19,Missing values; 
8090310.0,37410.0,Daniel Robles,Amber33@gmail.com,8488353094.0,176 Chambers Lodge,Portsmouth,England,86520.0,UK,21.0,Female,High,Regular,2/18/2024,2024.0,February,9:30:44,8.0,263.3352408,2106.681927,Electronics,Samsung,Smartphone,Average,Standard,Credit Card,,2.0,LG G,2024-02-18,2025-11-15 09:30:44,Missing values; 
7287475.0,76667.0,Deborah Cunningham,Nicholas9@gmail.com,7763755386.0,31040 Emily Prairie,Portsmouth,England,73928.0,UK,21.0,Male,High,Regular,4/15/2023,2023.0,April,4:25:08,,229.6577387,229.6577387,Clothing,Nike,Shorts,Good,Express,Credit Card,Pending,3.0,Swim trunks,2023-04-15,2025-11-15 04:25:08,Missing values; 
9839593.0,44057.0,Edward Barnes,Allison33@gmail.com,8907123725.0,41714 Martin Brook Apt. 552,Portsmouth,England,28617.0,UK,21.0,Female,High,Regular,08-01-23,2023.0,August,13:42:07,1.0,394.4196548,,Books,Penguin Books,Non-Fiction,Excellent,Standard,Cash,Processing,4.0,Cooking,2023-08-01,2025-11-15 13:42:07,Missing values; 
7164868.0,22781.0,Jon Adkins,,3306375178.0,35382 Richard Avenue Apt. 174,Portsmouth,England,44972.0,UK,21.0,Female,High,Regular,03-01-23,2023.0,March,10:52:31,9.0,272.2966366,2450.66973,Home Decor,IKEA,Lighting,Average,Standard,Cash,Pending,2.0,Recessed lighting,2023-03-01,2025-11-15 10:52:31,Missing values; 
4936631.0,23030.0,Joseph Campbell,Jonathan28@gmail.com,6353251046.0,97943 Wise Forges,Portsmouth,England,71088.0,UK,21.0,Male,High,Regular,3/25/2023,,March,4:23:34,6.0,405.5029897,2433.017938,Electronics,Apple,Laptop,Average,Standard,Cash,Pending,2.0,Razer Blade,2023-03-25,2025-11-15 04:23:34,Missing values; 
6621541.0,63634.0,Christina Grimes,Steven61@gmail.com,,53195 Gonzalez Field,Portsmouth,England,4478.0,UK,21.0,Male,High,Regular,12/23/2023,2023.0,December,14:01:40,1.0,335.1369003,335.1369003,Books,Penguin Books,Children's,Excellent,Standard,Debit Card,Delivered,5.0,Toys,2023-12-23,2025-11-15 14:01:40,Missing values; 
1410637.0,68504.0,Willie Hanson,Amy87@gmail.com,7046021243.0,7651 Silva Lane,Portsmouth,England,65999.0,UK,21.0,Female,High,Regular,12/14/2023,2023.0,December,7:59:24,5.0,359.3574698,,Electronics,Samsung,Tablet,Good,Same-Day,Cash,Processing,3.0,Asus ZenPad,2023-12-14,2025-11-15 07:59:24,Missing values; 
,21179.0,Brett Bailey,Maxwell26@gmail.com,2208750718.0,9755 Wang River Apt. 016,Portsmouth,England,84040.0,UK,21.0,Female,High,Regular,8/17/2023,2023.0,August,14:22:08,7.0,409.7124126,2867.986888,Electronics,Apple,Smartphone,Good,Standard,PayPal,Pending,4.0,Motorola Moto,2023-08-17,2025-11-15 14:22:08,Missing values; 
5622395.0,39518.0,Patricia Patel,Sandra38@gmail.com,9022686522.0,19711 Mullins Course,Portsmouth,England,66146.0,UK,21.0,Male,High,Regular,10/30/2023,2023.0,October,4:55:43,,316.9841376,316.9841376,Home Decor,IKEA,Lighting,Excellent,Same-Day,Cash,Delivered,4.0,Wall sconces,2023-10-30,2025-11-15 04:55:43,Missing values; 
8544160.0,39705.0,Chad Murray,Larry62@gmail.com,5845633604.0,2739 Rowe Flat,Portsmouth,England,74670.0,UK,21.0,Male,High,Regular,3/27/2023,2023.0,March,9:23:38,3.0,226.6630911,679.9892733,Books,,Non-Fiction,Excellent,Standard,Cash,Pending,5.0,Psychology,2023-03-27,2025-11-15 09:23:38,Missing values; 
9605449.0,83943.0,Jeffrey Ward,Derek90@gmail.com,8222172187.0,76648 Brittany Ramp,Portsmouth,England,14807.0,UK,21.0,Male,High,Regular,4/19/2023,2023.0,April,19:55:29,3.0,181.0590031,543.1770094,Electronics,Samsung,Television,Good,,Credit Card,Delivered,3.0,Smart TV,2023-04-19,2025-11-15 19:55:29,Missing values; 
1568860.0,44798.0,Stacey Holden,Leah19@gmail.com,2031251839.0,64966 Steven Fords,Portsmouth,England,20363.0,UK,21.0,Female,High,Regular,07-07-23,2023.0,July,17:24:23,6.0,339.1226447,,Clothing,Nike,T-shirt,Good,Same-Day,Debit Card,Delivered,3.0,Henley tee,2023-07-07,2025-11-15 17:24:23,Missing values; 
8081130.0,20075.0,Nathan Jordan,Jessica24@gmail.com,1998777888.0,7693 Burgess Harbors,Portsmouth,England,34471.0,UK,21.0,Female,High,Regular,5/13/2023,2023.0,May,11:53:28,2.0,430.0008167,,Home Decor,IKEA,Decorations,Excellent,Standard,Cash,Delivered,5.0,Wall art,2023-05-13,2025-11-15 11:53:28,Missing values; 
4281330.0,46723.0,Scott Brock,Stephen71@gmail.com,5921486401.0,03708 Holmes Court Apt. 109,Portsmouth,England,86091.0,UK,21.0,Male,High,Regular,8/31/2023,,August,11:06:31,3.0,279.3066524,837.9199573,Grocery,Pepsi,Soft Drink,Good,Standard,Cash,Processing,4.0,Fruit punch,2023-08-31,2025-11-15 11:06:31,Missing values; 
4623314.0,29941.0,Jessica Gordon,Nicole18@gmail.com,1857862272.0,8829 Jimenez Mills Suite 798,Portsmouth,England,2856.0,UK,21.0,Male,High,Regular,05-03-23,2023.0,May,14:48:12,1.0,462.0271788,462.0271788,Home Decor,Home Depot,Decorations,Average,Express,,Delivered,2.0,Rugs,2023-05-03,2025-11-15 14:48:12,Missing values; 
4013900.0,66992.0,Carolyn Little,Alicia76@gmail.com,6234076129.0,857 Nicholas Ranch Suite 454,Portsmouth,England,59702.0,UK,21.0,,High,Regular,7/16/2023,2023.0,July,10:06:48,10.0,16.46252375,164.6252375,Home Decor,IKEA,Lighting,Average,Express,PayPal,Pending,2.0,Chandeliers,2023-07-16,2025-11-15 10:06:48,Missing values; 
1763921.0,65477.0,Benjamin Mitchell,Cathy43@gmail.com,8612047660.0,23608 Watson Trace,Portsmouth,England,47391.0,UK,21.0,Female,Medium,Regular,12/15/2023,2023.0,December,16:44:51,3.0,150.0828255,450.2484766,Home Decor,Bed Bath & Beyond,Kitchen,Average,Same-Day,,Processing,2.0,Refrigerator,2023-12-15,2025-11-15 16:44:51,Missing values; 
8190326.0,18666.0,Anthony Copeland,Connie34@gmail.com,5449092610.0,97228 Andrea Lodge Suite 727,Portsmouth,England,33507.0,UK,21.0,Male,Medium,Regular,10/22/2023,,October,15:09:26,6.0,328.9902351,1973.94141,Electronics,Sony,Headphones,Excellent,Express,Debit Card,Shipped,4.0,Gaming headphones,2023-10-22,2025-11-15 15:09:26,Missing values; 
6757060.0,30690.0,Cameron Winters,Christina28@gmail.com,9914851708.0,374 Pham Walks Suite 603,Portsmouth,England,36616.0,UK,21.0,Female,Medium,Regular,06-05-23,2023.0,June,8:27:30,8.0,69.83664621,558.6931696,Books,Random House,Fiction,Average,,Credit Card,Shipped,2.0,Historical fiction,2023-06-05,2025-11-15 08:27:30,Missing values; 
6431740.0,88987.0,Jennifer Wheeler,Michael61@gmail.com,2628075191.0,458 Douglas Drive Suite 155,Portsmouth,England,54938.0,UK,21.0,Female,Medium,Regular,6/26/2023,2023.0,June,3:46:13,5.0,304.1477288,1520.738644,Clothing,Nike,T-shirt,Bad,Express,,Pending,1.0,V-neck tee,2023-06-26,2025-11-15 03:46:13,Missing values; 
,99112.0,Angela Jones,Scott14@gmail.com,3860773933.0,5287 Harris Junctions Suite 995,Portsmouth,England,35356.0,UK,21.0,Male,Medium,Regular,02-07-24,2024.0,February,16:50:24,5.0,311.49641,1557.48205,Books,HarperCollins,Thriller,Bad,Same-Day,Debit Card,Pending,1.0,Psychological thriller,2024-02-07,2025-11-15 16:50:24,Missing values; 
8804504.0,92493.0,Jamie Walton,,8007150154.0,12645 Tran Mews Apt. 751,Portsmouth,England,65554.0,UK,21.0,Female,Medium,Regular,09-01-23,2023.0,September,5:24:02,7.0,150.3125929,1052.18815,Books,Penguin Books,Non-Fiction,Bad,Express,Credit Card,Delivered,1.0,Business,2023-09-01,2025-11-15 05:24:02,Missing values; 
9107423.0,49519.0,Christian Martinez,Megan58@gmail.com,5542483639.0,5359 Rhodes Garden,Portsmouth,England,81954.0,UK,21.0,Male,Medium,Regular,11/19/2023,2023.0,November,20:28:47,,102.4567431,204.9134862,Home Decor,IKEA,Lighting,Excellent,Express,Debit Card,Shipped,5.0,Table lamps,2023-11-19,2025-11-15 20:28:47,Missing values; 
1125458.0,,Kimberly Summers,James24@gmail.com,2432281725.0,0887 Goodwin Dale Apt. 043,Portsmouth,England,44430.0,UK,21.0,Male,Medium,Regular,06-10-23,2023.0,June,19:17:31,5.0,421.3813392,2106.906696,Grocery,Nestle,Chocolate,Good,Express,Credit Card,Delivered,3.0,Chocolate-covered fruits,2023-06-10,2025-11-15 19:17:31,Missing values; 
1289629.0,55706.0,Carl Ortiz,Chad90@gmail.com,8437195492.0,519 Thomas Expressway Apt. 203,Portsmouth,England,29102.0,UK,21.0,Female,Medium,Regular,03-01-23,2023.0,March,19:14:19,,472.6482811,1890.593124,Electronics,Samsung,Television,Excellent,Same-Day,Cash,Shipped,4.0,QLED TV,2023-03-01,2025-11-15 19:14:19,Missing values; 
6139774.0,,Robin Fisher,Tanner80@gmail.com,9338869550.0,5723 Rojas Viaduct,Portsmouth,England,58549.0,UK,21.0,Male,Medium,Regular,03-05-23,2023.0,March,10:09:01,7.0,409.7504577,2868.253204,Home Decor,Bed Bath & Beyond,Bathroom,Average,Standard,Credit Card,Pending,2.0,Sink,2023-03-05,2025-11-15 10:09:01,Missing values; 
6872181.0,17962.0,William Moore,,1711546170.0,097 Paula Lodge Suite 538,Portsmouth,England,59437.0,UK,21.0,Male,Medium,Regular,5/24/2023,2023.0,May,17:06:41,2.0,412.5434998,825.0869997,Home Decor,Bed Bath & Beyond,Bathroom,Bad,Same-Day,Credit Card,Pending,1.0,Towel rack,2023-05-24,2025-11-15 17:06:41,Missing values; 
,68894.0,Yvonne Huerta,Peter51@gmail.com,4987322346.0,10237 Deborah Pass Suite 259,Portsmouth,England,13681.0,UK,21.0,Female,Medium,Regular,02-01-24,2024.0,February,4:22:01,2.0,49.08341167,98.16682333,Home Decor,IKEA,Lighting,Bad,Standard,Cash,Shipped,1.0,Track lighting,2024-02-01,2025-11-15 04:22:01,Missing values; 
2969295.0,44159.0,Alexander Lewis,John75@gmail.com,6610477191.0,414 Thomas Trail Suite 405,Portsmouth,England,2210.0,UK,21.0,Male,Medium,Regular,12/19/2023,2023.0,December,3:34:49,6.0,171.577009,,Electronics,Sony,Television,Average,Standard,Cash,Delivered,2.0,LCD TV,2023-12-19,2025-11-15 03:34:49,Missing values; 
5157785.0,,Alexander Stark,Tabitha81@gmail.com,4236125581.0,27403 Bennett Inlet,Portsmouth,England,4229.0,UK,21.0,Male,Medium,Regular,1/25/2024,2024.0,January,20:39:09,1.0,273.7501912,273.7501912,Grocery,Nestle,Coffee,Excellent,Express,Debit Card,Pending,4.0,Americano,2024-01-25,2025-11-15 20:39:09,Missing values; 
1651569.0,52495.0,Wanda Miller,Matthew83@gmail.com,2035389650.0,652 Butler Knoll Apt. 268,Portsmouth,England,2538.0,UK,21.0,Male,Medium,Regular,8/14/2023,2023.0,,13:06:37,10.0,328.6306411,3286.306411,Clothing,Nike,Shoes,Excellent,Express,Cash,Processing,4.0,Espadrilles,2023-08-14,2025-11-15 13:06:37,Missing values; 
7141421.0,90811.0,Linda Brown,Jamie33@gmail.com,5371271266.0,0415 Amy Land,Portsmouth,England,33974.0,UK,21.0,Male,Medium,Regular,7/31/2023,2023.0,July,,9.0,344.4179342,3099.761408,Clothing,Adidas,T-shirt,Bad,Express,PayPal,Processing,1.0,Henley tee,2023-07-31,,Missing values; 
9668849.0,,Diana Sawyer,Alex49@gmail.com,9955698897.0,15739 Courtney Drives Apt. 939,Portsmouth,England,77383.0,UK,21.0,Female,Medium,Regular,2/14/2024,2024.0,February,14:42:32,9.0,336.6290776,3029.661699,Electronics,Apple,Tablet,Average,Same-Day,Cash,Delivered,2.0,Acer Iconia Tab,2024-02-14,2025-11-15 14:42:32,Missing values; 
1242390.0,89696.0,Kirsten Gomez,Laura91@gmail.com,7897396855.0,5151 Stewart Divide,Portsmouth,England,2108.0,UK,21.0,Male,Medium,Regular,10/16/2023,2023.0,October,9:03:36,3.0,197.5216574,592.5649723,Clothing,Nike,Shoes,Excellent,Express,,Processing,4.0,Sneakers,2023-10-16,2025-11-15 09:03:36,Missing values; 
1468656.0,34317.0,Nicole Carroll,Katherine93@gmail.com,3127480148.0,902 Watts Drive,Portsmouth,England,26169.0,UK,21.0,Male,Medium,Regular,11/25/2023,2023.0,November,6:07:16,9.0,136.7653076,1230.887768,Home Decor,Home Depot,Decorations,Excellent,,Debit Card,Processing,5.0,Picture frames,2023-11-25,2025-11-15 06:07:16,Missing values; 
9709957.0,10470.0,Donald Blankenship,Megan67@gmail.com,5194558510.0,3551 Jackson Crossroad,Portsmouth,England,84876.0,UK,21.0,Female,Medium,Regular,2/16/2024,2024.0,February,,4.0,329.0974594,1316.389838,Grocery,Nestle,Snacks,Average,Standard,PayPal,Processing,2.0,Fruit snacks,2024-02-16,,Missing values; 
3861640.0,20941.0,Kenneth Arias,Mark28@gmail.com,7078625961.0,904 Laura Drives Apt. 072,Portsmouth,England,53927.0,UK,21.0,Male,Medium,Regular,09-08-23,2023.0,,16:37:50,7.0,238.0243416,1666.170391,Electronics,Sony,Smartphone,Excellent,Same-Day,Debit Card,Processing,4.0,Xiaomi Mi,2023-09-08,2025-11-15 16:37:50,Missing values; 
6738962.0,88683.0,Daniel Carter,Kristi32@gmail.com,8770427665.0,574 Samantha Stream,Portsmouth,England,,UK,21.0,Male,Medium,Regular,12/29/2023,2023.0,December,0:41:50,6.0,310.8466997,1865.080198,Books,Random House,Literature,Good,Same-Day,Credit Card,Shipped,3.0,Anthologies,2023-12-29,2025-11-15 00:41:50,Missing values; 
5465214.0,94081.0,Luis Torres,Jeremy33@gmail.com,8840799649.0,8939 Gordon Cove,Portsmouth,England,75676.0,UK,21.0,Male,Medium,Regular,11/26/2023,2023.0,November,3:31:16,5.0,187.0274709,935.1373547,Home Decor,,Bathroom,Good,Standard,Debit Card,Delivered,4.0,Toilet paper holder,2023-11-26,2025-11-15 03:31:16,Missing values; 
3927823.0,34353.0,Mallory Mitchell,Karen70@gmail.com,1450934799.0,73951 Natasha Grove Suite 719,Portsmouth,England,71163.0,UK,21.0,Male,Medium,Regular,1/24/2024,2024.0,January,18:35:18,6.0,,823.6171554,Home Decor,Home Depot,Decorations,Average,Same-Day,Credit Card,Shipped,2.0,Curtains,2024-01-24,2025-11-15 18:35:18,Missing values; 
6393848.0,13201.0,Samuel Mcdonald,John93@gmail.com,1254508096.0,32239 Mary Lodge Suite 921,Portsmouth,England,9565.0,UK,21.0,Female,Medium,Regular,10-11-23,2023.0,October,17:48:47,3.0,384.2207979,1152.662394,Electronics,Sony,Smartphone,,Same-Day,PayPal,Pending,,Google Pixel,2023-10-11,2025-11-15 17:48:47,Missing values; 
4587519.0,56157.0,Randy Trevino,Dawn95@gmail.com,8474506404.0,6824 Jessica Road Apt. 712,Portsmouth,England,21851.0,UK,21.0,Male,Medium,Regular,02-06-24,2024.0,,13:19:54,3.0,496.4993103,1489.497931,Grocery,Coca-Cola,Soft Drink,Good,Same-Day,Cash,Delivered,3.0,Orange soda,2024-02-06,2025-11-15 13:19:54,Missing values; 
9250920.0,95139.0,Jacqueline Miller,,9839756649.0,38654 Darlene Streets,Portsmouth,England,79767.0,UK,21.0,Female,Medium,Regular,04-12-23,2023.0,April,4:58:30,10.0,272.5085895,2725.085895,Electronics,Sony,Headphones,Excellent,Express,Credit Card,Delivered,5.0,Gaming headphones,2023-04-12,2025-11-15 04:58:30,Missing values; 
1816800.0,53211.0,Allison Gonzalez,Kristina48@gmail.com,8771188011.0,2013 Michele Motorway,Portsmouth,England,52055.0,UK,21.0,Male,Medium,Regular,7/22/2023,2023.0,July,,2.0,426.5693044,853.1386088,Home Decor,Bed Bath & Beyond,Bedding,Bad,Same-Day,Cash,Pending,1.0,Throw pillow,2023-07-22,,Missing values; 
,42747.0,Daniel Smith,Ashley88@gmail.com,8582474175.0,64688 Walters Ford Suite 079,Portsmouth,England,50429.0,UK,21.0,Female,Medium,Regular,08-06-23,2023.0,August,7:14:12,2.0,303.9558383,607.9116766,Grocery,Pepsi,Water,Bad,Express,Credit Card,Pending,1.0,Artesian water,2023-08-06,2025-11-15 07:14:12,Missing values; 
4925972.0,29061.0,Ryan Griffin,Jessica48@gmail.com,7226386274.0,529 Alexis Green Apt. 191,Portsmouth,England,41774.0,UK,21.0,Female,Medium,Regular,9/29/2023,2023.0,September,18:44:50,1.0,489.2718523,489.2718523,Books,Random House,Literature,Good,Standard,Credit Card,,3.0,Modern literature,2023-09-29,2025-11-15 18:44:50,Missing values; 
2575977.0,65490.0,Scott Garrison,Janice88@gmail.com,4155287798.0,8733 Smith Rue Suite 732,Portsmouth,England,21271.0,UK,21.0,,Medium,Regular,10/30/2023,2023.0,October,16:56:02,5.0,409.0674515,2045.337257,Clothing,Zara,Jeans,Good,Standard,Credit Card,Pending,3.0,Low-rise jeans,2023-10-30,2025-11-15 16:56:02,Missing values; 
,52484.0,Joseph Clarke,Rodney77@gmail.com,2865819933.0,0035 Joan Drives,Portsmouth,England,88391.0,UK,21.0,Female,Medium,Regular,3/15/2023,2023.0,March,15:44:18,4.0,58.07385263,232.2954105,Grocery,Coca-Cola,Juice,Bad,Same-Day,Debit Card,Pending,1.0,Grapefruit juice,2023-03-15,2025-11-15 15:44:18,Missing values; 
5074217.0,59283.0,Charlotte Cox,Holly38@gmail.com,4918337392.0,19248 Kenneth Stravenue Apt. 915,Portsmouth,England,50130.0,UK,21.0,Male,Medium,Regular,02-08-24,2024.0,February,2:22:44,8.0,244.7139658,1957.711726,Home Decor,Home Depot,Furniture,Average,Express,Debit Card,,2.0,Dining table,2024-02-08,2025-11-15 02:22:44,Missing values; 
6387517.0,90094.0,Robert Davidson,Juan44@gmail.com,9912489479.0,627 Martinez Rue,Portsmouth,England,11343.0,UK,21.0,Female,Medium,Regular,9/28/2023,2023.0,September,13:06:41,,48.39122878,483.9122878,Grocery,Nestle,Snacks,Excellent,Express,Debit Card,Pending,4.0,Cheese snacks,2023-09-28,2025-11-15 13:06:41,Missing values; 
5829921.0,79163.0,Carol Malone,Cindy9@gmail.com,4926272386.0,6934 Hamilton Forge,Portsmouth,England,27593.0,UK,21.0,Female,Medium,Regular,08-11-23,2023.0,August,22:12:38,9.0,356.0073452,3204.066107,,Samsung,Television,Excellent,Express,PayPal,Processing,4.0,Smart TV,2023-08-11,2025-11-15 22:12:38,Missing values; 
5669002.0,18908.0,Timothy Walton,Angel26@gmail.com,4232838334.0,644 Morgan Union Apt. 901,Portsmouth,England,63034.0,UK,21.0,Female,Medium,Regular,10/29/2023,2023.0,,17:57:51,6.0,434.4410311,2606.646187,Grocery,Pepsi,Water,Excellent,Same-Day,Credit Card,Pending,4.0,Artesian water,2023-10-29,2025-11-15 17:57:51,Missing values; 
2195256.0,85037.0,Todd Howell,Gina33@gmail.com,,180 Wilcox Well Apt. 378,Portsmouth,England,35689.0,UK,21.0,Female,Medium,Regular,11-06-23,2023.0,November,19:25:50,5.0,310.547664,1552.73832,Home Decor,Bed Bath & Beyond,Kitchen,Excellent,Standard,Cash,Processing,4.0,Stove,2023-11-06,2025-11-15 19:25:50,Missing values; 
3123103.0,45940.0,,Natalie62@gmail.com,7059169045.0,257 Nicholas Roads Apt. 801,Portsmouth,England,81481.0,UK,21.0,Male,Medium,Regular,2/13/2024,2024.0,February,2:01:32,3.0,311.6438271,934.9314814,Electronics,Apple,Tablet,Bad,Express,Credit Card,Delivered,1.0,Asus ZenPad,2024-02-13,2025-11-15 02:01:32,Missing values; 
6895025.0,90617.0,Kaitlyn Pruitt,Lynn70@gmail.com,3920683485.0,573 Fletcher View Apt. 646,Portsmouth,England,44017.0,UK,21.0,Male,Medium,Regular,11-06-23,2023.0,November,0:43:38,10.0,147.5326314,1475.326314,,Adidas,Jacket,Bad,Same-Day,PayPal,Processing,1.0,Blazer,2023-11-06,2025-11-15 00:43:38,Missing values; 
9429324.0,20513.0,Dr. Marie Hernandez,Jerome74@gmail.com,3813014592.0,43124 Melissa Run Suite 509,Portsmouth,England,93008.0,UK,21.0,Female,Medium,Regular,4/22/2023,2023.0,April,2:03:40,1.0,58.57690179,58.57690179,Books,Random House,Literature,Average,Standard,PayPal,,2.0,Classic literature,2023-04-22,2025-11-15 02:03:40,Missing values; 
9396347.0,24702.0,,Ashley53@gmail.com,3172745478.0,37738 Andrew Lane,Portsmouth,England,85759.0,UK,21.0,Female,Medium,Regular,7/29/2023,2023.0,July,2:20:16,5.0,301.9951261,1509.97563,Electronics,Apple,Laptop,Bad,Express,Cash,Pending,1.0,Acer Swift,2023-07-29,2025-11-15 02:20:16,Missing values; 
6985999.0,66715.0,Julie Harvey,Erika10@gmail.com,5733497743.0,98460 Matthew Rue Suite 695,Portsmouth,England,30013.0,UK,21.0,Female,Medium,Regular,3/15/2023,2023.0,March,,2.0,91.86501635,183.7300327,Electronics,Samsung,Smartphone,Bad,Express,Cash,Pending,1.0,Huawei P,2023-03-15,,Missing values; 
9307123.0,42452.0,Kimberly Woods,Joshua96@gmail.com,9286242900.0,8448 April Glen,Portsmouth,England,16121.0,UK,21.0,Female,Medium,Regular,12/19/2023,2023.0,December,3:51:05,2.0,137.4294083,274.8588167,Books,Random House,Literature,Average,,PayPal,Processing,2.0,Short stories,2023-12-19,2025-11-15 03:51:05,Missing values; 
6563929.0,96993.0,Gregg Duke,James83@gmail.com,4384924921.0,3829 Christine Drives Suite 248,Portsmouth,England,33040.0,UK,21.0,Female,Medium,Regular,06-06-23,2023.0,June,13:05:36,3.0,448.5136204,1345.540861,Grocery,Pepsi,Water,Bad,Standard,Credit Card,,1.0,Flavored water,2023-06-06,2025-11-15 13:05:36,Missing values; 
5436360.0,57722.0,Bradley Moreno,Samantha72@gmail.com,9577488763.0,969 Melissa Inlet Apt. 118,Portsmouth,England,88503.0,UK,21.0,Male,Medium,Regular,3/20/2023,2023.0,,5:57:46,7.0,16.26343692,113.8440585,Electronics,Apple,Laptop,Good,Same-Day,PayPal,Delivered,4.0,Microsoft Surface Laptop,2023-03-20,2025-11-15 05:57:46,Missing values; 
2436586.0,18128.0,Joshua Medina,Adrian93@gmail.com,4216866149.0,587 Murray Underpass Suite 486,Portsmouth,England,32343.0,UK,21.0,Female,Medium,Regular,12/16/2023,2023.0,December,,2.0,32.59310804,65.18621607,Electronics,Sony,Television,Average,Standard,Cash,Delivered,2.0,Android TV,2023-12-16,,Missing values; 
7429644.0,41009.0,Marie Norton,Zachary50@gmail.com,4614905069.0,0967 Brandy Summit Apt. 968,Portsmouth,England,24231.0,UK,21.0,Male,Medium,Regular,10-07-23,2023.0,October,3:59:58,3.0,233.2437944,699.7313831,,Home Depot,Decorations,Good,Express,PayPal,Shipped,4.0,Wall art,2023-10-07,2025-11-15 03:59:58,Missing values; 
1292006.0,12107.0,Pamela Marshall PhD,Ashley76@gmail.com,9957280398.0,32237 Courtney Green,Portsmouth,England,70567.0,UK,21.0,Male,Medium,Regular,9/20/2023,2023.0,September,12:12:53,,184.5316772,738.1267088,Clothing,Zara,Shirt,Average,Same-Day,Credit Card,Processing,2.0,Blouse,2023-09-20,2025-11-15 12:12:53,Missing values; 
7063254.0,30357.0,Tara Rios,Beth80@gmail.com,9876802255.0,00531 Ford River,Portsmouth,England,55803.0,UK,21.0,Male,Medium,Regular,08-11-23,2023.0,,0:31:42,3.0,240.8481148,722.5443444,Clothing,Nike,T-shirt,Excellent,Same-Day,PayPal,Delivered,4.0,Crew neck tee,2023-08-11,2025-11-15 00:31:42,Missing values; 
2771549.0,59548.0,Rachel Smith,Mario81@gmail.com,5263579807.0,35832 Karen Mountain Apt. 286,Portsmouth,England,68989.0,UK,21.0,Female,Medium,Regular,,2023.0,November,18:14:15,1.0,292.0316754,292.0316754,Home Decor,Home Depot,Furniture,Average,Standard,Credit Card,Delivered,2.0,Dining table,,2025-11-15 18:14:15,Missing values; 
9338987.0,32128.0,Daniel Hancock,Tiffany82@gmail.com,1303156243.0,13776 Pamela Roads,Portsmouth,England,34517.0,UK,21.0,Female,Medium,Regular,04-11-23,,April,6:28:34,9.0,186.0231858,1674.208672,Electronics,Apple,Tablet,Excellent,Standard,Debit Card,Processing,4.0,Amazon Fire Tablet,2023-04-11,2025-11-15 06:28:34,Missing values; 
8364269.0,24216.0,Joshua Cowan,Eric53@gmail.com,6907513827.0,06039 Daniel Forges Suite 074,Portsmouth,England,,UK,21.0,Female,Medium,Regular,12-07-23,2023.0,December,5:12:50,2.0,389.7506995,779.5013991,Electronics,Samsung,Smartphone,Bad,Same-Day,PayPal,Delivered,1.0,Nokia,2023-12-07,2025-11-15 05:12:50,Missing values; 
1022498.0,43658.0,Sophia Austin,Frances61@gmail.com,8799750601.0,90419 Karen Stream Suite 294,Portsmouth,England,97795.0,UK,24.0,Male,Medium,Regular,7/13/2023,2023.0,July,20:11:13,9.0,326.8383413,2941.545072,Clothing,Nike,Shoes,Good,Express,PayPal,,3.0,Running shoes,2023-07-13,2025-11-15 20:11:13,Missing values; 
2661183.0,18453.0,Derek Torres,Jonathan32@gmail.com,6257920541.0,8380 John Island,Portsmouth,England,93336.0,UK,24.0,Male,Medium,Regular,9/17/2023,2023.0,September,0:19:42,3.0,,99.98796277,Clothing,Nike,Shoes,Good,Express,Credit Card,Processing,3.0,Espadrilles,2023-09-17,2025-11-15 00:19:42,Missing values; 
4970685.0,97791.0,Sandra Jordan,,4145964641.0,499 Young Cliffs,Portsmouth,England,88006.0,UK,24.0,Male,Medium,Regular,04-08-23,2023.0,April,19:55:00,5.0,259.5590392,1297.795196,Electronics,Sony,Headphones,Good,Express,PayPal,Processing,3.0,Bluetooth headphones,2023-04-08,2025-11-15 19:55:00,Missing values; 
9304405.0,75928.0,Heather Mahoney,David12@gmail.com,4877685046.0,7679 Lewis View,Portsmouth,England,69373.0,UK,24.0,Male,Medium,Regular,04-07-23,2023.0,April,2:54:28,1.0,16.36772799,16.36772799,,Apple,Tablet,Good,Express,Debit Card,Shipped,3.0,Sony Xperia Tablet,2023-04-07,2025-11-15 02:54:28,Missing values; 
9299705.0,15811.0,,Brad10@gmail.com,5997109357.0,424 Greg Passage Suite 762,Portsmouth,England,5068.0,UK,24.0,Male,Medium,Regular,8/29/2023,2023.0,August,0:34:52,1.0,72.05993992,72.05993992,Electronics,Apple,Smartphone,Excellent,Same-Day,PayPal,Shipped,4.0,iPhone,2023-08-29,2025-11-15 00:34:52,Missing values; 
8755087.0,72612.0,Timothy Cruz,Tammy38@gmail.com,8302567227.0,40118 Paula Ports Apt. 277,Portsmouth,England,63549.0,UK,24.0,Female,Medium,Regular,8/13/2023,2023.0,,14:35:55,7.0,117.5934307,823.1540152,Clothing,Zara,Jeans,Bad,Standard,Credit Card,Delivered,1.0,Bootcut jeans,2023-08-13,2025-11-15 14:35:55,Missing values; 
2632074.0,93647.0,Christopher Newman,Rebecca45@gmail.com,4636922069.0,53773 Stewart Mission Suite 837,Portsmouth,England,24000.0,UK,24.0,Male,Medium,Regular,,2023.0,July,3:05:25,7.0,338.715576,2371.009032,Books,HarperCollins,Non-Fiction,Bad,Express,Debit Card,Pending,1.0,Psychology,,2025-11-15 03:05:25,Missing values; 
6482819.0,66860.0,Megan Hicks,Angela96@gmail.com,5048075565.0,8302 Fields Circle,Portsmouth,England,18836.0,UK,24.0,Female,Medium,Regular,6/27/2023,2023.0,June,13:05:28,2.0,266.8119604,533.6239208,Home Decor,IKEA,Lighting,Excellent,Same-Day,,Delivered,5.0,Pendant lights,2023-06-27,2025-11-15 13:05:28,Missing values; 
7058730.0,,Dr. Sylvia Colon,Caitlyn30@gmail.com,6868002254.0,81956 Cannon Shore Suite 820,Portsmouth,England,82528.0,UK,24.0,Male,Medium,Regular,08-09-23,2023.0,August,19:20:34,4.0,65.96229562,263.8491825,Clothing,Nike,T-shirt,Good,Same-Day,PayPal,Delivered,4.0,Henley tee,2023-08-09,2025-11-15 19:20:34,Missing values; 
1369038.0,45128.0,Adam Morales,Patrick27@gmail.com,4689676060.0,11615 Dawson Key,Portsmouth,England,25789.0,UK,24.0,Male,Medium,Regular,9/30/2023,2023.0,September,14:00:07,8.0,256.3687369,,Clothing,Nike,Shorts,Average,Express,PayPal,Pending,2.0,Swim trunks,2023-09-30,2025-11-15 14:00:07,Missing values; 
8949630.0,67800.0,,Tonya22@gmail.com,3640584065.0,5981 Daniel Spur Apt. 152,Portsmouth,England,58127.0,UK,24.0,Female,Medium,Regular,4/28/2023,2023.0,April,14:02:42,9.0,209.0160628,1881.144565,Electronics,Samsung,Television,Average,Same-Day,PayPal,Processing,2.0,Plasma TV,2023-04-28,2025-11-15 14:02:42,Missing values; 
5167001.0,48776.0,Robert Williams,Jason48@gmail.com,8415726077.0,146 Jackson Turnpike Apt. 331,Portsmouth,England,97571.0,UK,24.0,Male,Medium,Regular,6/16/2023,,June,15:12:11,7.0,153.3326773,1073.328741,Clothing,Adidas,Shoes,Excellent,Same-Day,Cash,Delivered,4.0,Sneakers,2023-06-16,2025-11-15 15:12:11,Missing values; 
3265692.0,56300.0,Andrew Key,Amber9@gmail.com,5940797382.0,3220 Bailey Manor,Portsmouth,England,60228.0,UK,24.0,,Medium,Regular,11-01-23,2023.0,November,23:02:33,6.0,453.8787665,2723.272599,Grocery,Coca-Cola,Soft Drink,Good,Same-Day,PayPal,Delivered,4.0,Lemon-lime soda,2023-11-01,2025-11-15 23:02:33,Missing values; 
5616720.0,,Amy Abbott,Sharon12@gmail.com,3526776925.0,17100 Robin Cove,Portsmouth,England,52624.0,UK,24.0,Male,Medium,Regular,11/18/2023,2023.0,November,1:34:54,2.0,13.53163261,27.06326521,Books,Penguin Books,Children's,Excellent,Standard,Debit Card,Processing,4.0,Educational kits,2023-11-18,2025-11-15 01:34:54,Missing values; 
8920767.0,99038.0,Maria Brown,James99@gmail.com,3803768585.0,805 Scott Gardens Apt. 415,Portsmouth,England,27497.0,UK,24.0,Male,Medium,Regular,2/17/2024,2024.0,,4:57:17,8.0,110.7737587,886.1900697,Electronics,Sony,Headphones,Good,Standard,Cash,Shipped,4.0,Noise-cancelling headphones,2024-02-17,2025-11-15 04:57:17,Missing values; 
3483623.0,58234.0,Nicholas Williams,Daisy68@gmail.com,7081706810.0,718 Darryl Run Apt. 999,Portsmouth,England,94106.0,UK,24.0,,Medium,Regular,1/23/2024,2024.0,January,9:30:26,10.0,491.1437589,4911.437589,Electronics,Sony,Headphones,Bad,Standard,PayPal,Processing,1.0,Sports headphones,2024-01-23,2025-11-15 09:30:26,Missing values; 
6311685.0,71036.0,Elizabeth Watson,Anne91@gmail.com,8385002051.0,,Portsmouth,England,7536.0,UK,24.0,Male,Medium,Regular,03-11-23,2023.0,March,6:43:48,6.0,450.6176946,2703.706168,Clothing,Zara,Dress,Good,Standard,Credit Card,Processing,4.0,Fit and flare dress,2023-03-11,2025-11-15 06:43:48,Missing values; 
6568091.0,,Jay Carter,Tara97@gmail.com,7551523102.0,762 Alejandro Station,Portsmouth,England,33892.0,UK,24.0,Male,Medium,Regular,1/20/2024,2024.0,January,18:04:28,10.0,307.9950047,3079.950047,Grocery,Pepsi,Water,Bad,Standard,Debit Card,Delivered,1.0,Purified water,2024-01-20,2025-11-15 18:04:28,Missing values; 
6949314.0,17562.0,Donald Porter,Valerie85@gmail.com,3413039460.0,2740 Stacie Ranch Suite 055,Portsmouth,England,,UK,24.0,Male,Medium,Regular,07-05-23,2023.0,July,10:52:52,10.0,226.4008849,2264.008849,Grocery,Nestle,Chocolate,Bad,Express,PayPal,Shipped,1.0,Dark chocolate,2023-07-05,2025-11-15 10:52:52,Missing values; 
2522783.0,65211.0,Yvonne Cooper,Ariel11@gmail.com,1379320617.0,644 Nicholas Union Suite 963,Portsmouth,England,14262.0,UK,24.0,Female,Medium,Regular,9/26/2023,2023.0,September,12:59:08,,473.5449999,947.0899998,Home Decor,Home Depot,Tools,Excellent,Same-Day,Credit Card,Shipped,4.0,Wrench,2023-09-26,2025-11-15 12:59:08,Missing values; 
7460821.0,58492.0,Kathryn Taylor,Richard61@gmail.com,1756571971.0,15250 Henderson Crossroad Apt. 365,Portsmouth,England,32728.0,UK,24.0,Female,Medium,Regular,8/25/2023,2023.0,August,5:47:33,1.0,254.862308,254.862308,Electronics,Apple,Smartphone,,Standard,PayPal,Processing,,Huawei P,2023-08-25,2025-11-15 05:47:33,Missing values; 
2480948.0,76668.0,Kelly Phillips,,2999434738.0,3957 Murphy Stravenue,Portsmouth,England,73078.0,UK,24.0,Female,Medium,Regular,7/22/2023,2023.0,July,16:53:42,3.0,83.55888727,250.6766618,Grocery,Nestle,Coffee,Excellent,Standard,Cash,Shipped,5.0,Instant coffee,2023-07-22,2025-11-15 16:53:42,Missing values; 
3613498.0,,Kristopher Hill,Jaime24@gmail.com,1770393508.0,49279 Jesse Wells,Portsmouth,England,4551.0,UK,24.0,Male,Medium,Regular,5/15/2023,2023.0,May,15:51:53,10.0,113.8840133,1138.840133,Home Decor,IKEA,Decorations,Average,Standard,Debit Card,Processing,2.0,Picture frames,2023-05-15,2025-11-15 15:51:53,Missing values; 
8949134.0,63914.0,Ashley Bennett,Jeanette33@gmail.com,4772031217.0,469 Johnathan Circles,Portsmouth,England,57303.0,UK,24.0,,Medium,Regular,5/29/2023,2023.0,May,3:47:43,7.0,251.9962626,1763.973838,Grocery,Nestle,Chocolate,Bad,Express,Cash,Shipped,1.0,Chocolate-covered fruits,2023-05-29,2025-11-15 03:47:43,Missing values; 
3349514.0,71021.0,Courtney Ward,Marie49@gmail.com,6009269635.0,4428 Howell Ports,Portsmouth,England,47239.0,UK,24.0,Female,Medium,Regular,,2023.0,July,14:01:47,7.0,249.6795236,1747.756665,Clothing,Nike,Shorts,Bad,Standard,PayPal,Shipped,1.0,Cargo shorts,,2025-11-15 14:01:47,Missing values; 
3806293.0,39738.0,Jennifer Kaufman,Mary64@gmail.com,8961904836.0,394 Nelson Roads,Portsmouth,England,12031.0,UK,24.0,Male,Medium,Regular,3/24/2023,2023.0,March,21:54:32,8.0,363.2685415,,Home Decor,Bed Bath & Beyond,Bathroom,Good,Standard,Debit Card,Pending,3.0,Bathtub,2023-03-24,2025-11-15 21:54:32,Missing values; 
1428804.0,70241.0,William Jefferson,Eric77@gmail.com,6960968998.0,514 Holden Keys Suite 621,Portsmouth,England,,UK,24.0,Female,Medium,Regular,8/19/2023,2023.0,August,20:49:09,9.0,138.995587,1250.960283,Books,Random House,Literature,Average,Express,PayPal,Pending,2.0,Drama,2023-08-19,2025-11-15 20:49:09,Missing values; 
7498783.0,59302.0,Evan Ray,Angela22@gmail.com,6373592181.0,396 Mayo Skyway Apt. 561,Portsmouth,England,40068.0,UK,24.0,,Medium,Regular,6/22/2023,2023.0,June,2:55:37,5.0,37.45179618,187.2589809,Grocery,Coca-Cola,Water,Bad,Same-Day,Credit Card,Shipped,1.0,Coconut water,2023-06-22,2025-11-15 02:55:37,Missing values; 
4043499.0,17605.0,Jennifer Gibson MD,Robert16@gmail.com,8567891093.0,273 Tracy Trail,Portsmouth,England,36062.0,UK,24.0,Male,Medium,Regular,,2023.0,June,6:13:33,7.0,302.0738049,2114.516634,Home Decor,IKEA,Lighting,Bad,Standard,Credit Card,Pending,1.0,Recessed lighting,,2025-11-15 06:13:33,Missing values; 
1254988.0,17972.0,Felicia Lewis,Michael45@gmail.com,5851378874.0,438 Dawn Ramp,Portsmouth,England,63467.0,UK,24.0,Male,Medium,Regular,11/30/2023,2023.0,November,,10.0,300.9124618,3009.124618,Books,Random House,Fiction,Good,Standard,PayPal,Processing,4.0,Dystopian,2023-11-30,,Missing values; 
3691096.0,36435.0,Rachel Delgado,Randall57@gmail.com,8268299854.0,89770 Larry Path Apt. 735,Portsmouth,England,51254.0,UK,24.0,Male,Medium,Regular,08-07-23,2023.0,,0:12:40,7.0,19.36062915,135.524404,Electronics,Sony,Headphones,Bad,Standard,Cash,Processing,1.0,Sports headphones,2023-08-07,2025-11-15 00:12:40,Missing values; 
4346053.0,33357.0,Barbara Martin,Raymond38@gmail.com,1007951273.0,34879 Camacho Village Apt. 941,Portsmouth,England,54740.0,UK,24.0,Male,Medium,Regular,11-03-23,2023.0,November,17:25:30,5.0,326.0467229,1630.233615,Grocery,Coca-Cola,Water,Excellent,Standard,Cash,,5.0,Flavored water,2023-11-03,2025-11-15 17:25:30,Missing values; 
2919457.0,59777.0,Kayla Jackson,Mark60@gmail.com,3435384679.0,025 Pace Spur,Portsmouth,England,,UK,24.0,Male,Medium,Regular,5/31/2023,2023.0,May,8:02:27,8.0,374.9299872,2999.439898,Clothing,Adidas,Jacket,Average,Express,Cash,Pending,2.0,Peacoat,2023-05-31,2025-11-15 08:02:27,Missing values; 
4619851.0,41540.0,Claudia Silva,Derek44@gmail.com,4034258961.0,73214 Debbie Lodge Suite 038,Portsmouth,England,76891.0,UK,24.0,Male,Medium,Regular,06-11-23,,June,9:03:21,1.0,192.7765957,192.7765957,Books,Random House,Non-Fiction,Average,Express,Debit Card,Pending,2.0,Self-help,2023-06-11,2025-11-15 09:03:21,Missing values; 
2793548.0,55889.0,Troy Pierce,David10@gmail.com,5256101848.0,352 King Prairie,Portsmouth,England,52325.0,UK,24.0,Male,Medium,Regular,04-05-23,2023.0,April,,4.0,235.5987913,942.3951652,Books,Penguin Books,Children's,Excellent,Standard,Cash,Delivered,5.0,Books,2023-04-05,,Missing values; 
3556171.0,,Beverly Rivera,Cheryl91@gmail.com,5524057840.0,8394 Boyd Glens Apt. 425,Portsmouth,England,61314.0,UK,24.0,Female,Medium,Regular,11/24/2023,2023.0,November,1:33:46,10.0,325.789816,3257.89816,Electronics,Apple,Tablet,Bad,Standard,Credit Card,Shipped,1.0,Amazon Fire Tablet,2023-11-24,2025-11-15 01:33:46,Missing values; 
2845729.0,64693.0,Chad Oconnor,Peter25@gmail.com,4915527799.0,67445 Ashley Well,Portsmouth,England,38239.0,UK,24.0,Female,Medium,Regular,9/15/2023,2023.0,September,12:00:47,5.0,277.0350834,1385.175417,,Zara,Dress,Good,Standard,Cash,Delivered,3.0,Sheath dress,2023-09-15,2025-11-15 12:00:47,Missing values; 
5021563.0,28646.0,Terri Vargas,Brenda8@gmail.com,8745207521.0,002 Kelley Trail Apt. 330,Portsmouth,England,11796.0,UK,24.0,Male,Medium,Regular,3/28/2023,2023.0,March,2:09:38,7.0,126.7286873,887.100811,,Nike,Shoes,Bad,Express,Debit Card,Processing,1.0,Flip flops,2023-03-28,2025-11-15 02:09:38,Missing values; 
9870231.0,43684.0,Donald Montgomery,Chad64@gmail.com,8960946591.0,6618 Christopher Passage Apt. 270,Portsmouth,England,47014.0,UK,24.0,Male,Medium,Regular,5/24/2023,2023.0,May,4:25:27,7.0,86.91032053,,Books,Penguin Books,Fiction,Good,Same-Day,Cash,Pending,4.0,Science fiction,2023-05-24,2025-11-15 04:25:27,Missing values; 
2804397.0,50838.0,Maria Holland,Karen70@gmail.com,4732378227.0,96485 Cynthia Brooks Apt. 778,Portsmouth,England,58029.0,UK,24.0,,Medium,Regular,12-07-23,2023.0,December,14:22:04,6.0,85.21705852,511.3023511,Books,Random House,Non-Fiction,Average,Express,Cash,Pending,2.0,Biography,2023-12-07,2025-11-15 14:22:04,Missing values; 
4741944.0,,Jeffrey Henry,Melanie32@gmail.com,9851877108.0,019 Curry Harbors Apt. 387,Portsmouth,England,1996.0,UK,24.0,Male,Medium,Regular,7/31/2023,2023.0,July,16:21:51,6.0,392.6315976,2355.789586,Home Decor,IKEA,Decorations,Excellent,Same-Day,Cash,Delivered,4.0,Rugs,2023-07-31,2025-11-15 16:21:51,Missing values; 
8281921.0,27026.0,Gabriel Coleman,Ryan20@gmail.com,9935062448.0,5165 Francis Mountain Suite 028,Portsmouth,England,69610.0,UK,24.0,Female,Medium,Regular,10/30/2023,,October,23:52:26,2.0,377.5176323,755.0352646,Electronics,Samsung,Television,Bad,Express,PayPal,Pending,1.0,QLED TV,2023-10-30,2025-11-15 23:52:26,Missing values; 
8605457.0,67447.0,Jared Lyons,Natalie27@gmail.com,1535541276.0,,Portsmouth,England,7148.0,UK,24.0,Male,Medium,Regular,12/29/2023,2023.0,December,21:05:17,1.0,52.5425272,52.5425272,Electronics,Apple,Smartphone,Good,Same-Day,Debit Card,Delivered,3.0,Sony Xperia,2023-12-29,2025-11-15 21:05:17,Missing values; 
2685404.0,33515.0,Jennifer Harrell,Danny48@gmail.com,9617415101.0,77375 Jones Tunnel Suite 917,Portsmouth,England,25427.0,UK,24.0,Male,Medium,Regular,11/15/2023,2023.0,November,14:41:03,3.0,71.46360156,214.3908047,Books,Random House,Non-Fiction,Excellent,Standard,Credit Card,,4.0,Science,2023-11-15,2025-11-15 14:41:03,Missing values; 
9388922.0,87611.0,Mary Reed,Elizabeth15@gmail.com,8893920309.0,248 Curtis Burgs,Portsmouth,England,7814.0,UK,24.0,Female,Medium,Regular,09-03-23,2023.0,September,6:50:02,3.0,108.4398618,325.3195853,Electronics,Apple,Smartphone,Excellent,Standard,,Processing,5.0,LG G,2023-09-03,2025-11-15 06:50:02,Missing values; 
3008969.0,68091.0,Frank Johnson,Andrea45@gmail.com,9220542429.0,6893 Paul Center Suite 805,Portsmouth,England,70550.0,UK,24.0,,Medium,Regular,9/18/2023,2023.0,September,3:37:26,2.0,474.3730905,948.7461809,Electronics,Sony,Smartphone,Excellent,Express,Cash,Shipped,4.0,OnePlus,2023-09-18,2025-11-15 03:37:26,Missing values; 
2489818.0,15539.0,Timothy Smith,Steven35@gmail.com,8981640217.0,93895 Michael Corners Suite 816,Portsmouth,England,46229.0,UK,24.0,Female,Medium,Regular,10/19/2023,2023.0,,5:03:00,4.0,228.0775962,912.3103847,Books,Random House,Non-Fiction,Excellent,Standard,Debit Card,Shipped,4.0,Biography,2023-10-19,2025-11-15 05:03:00,Missing values; 
6997134.0,93391.0,Peggy Miller,Tamara12@gmail.com,8652072217.0,79786 Kathleen Spring Suite 119,Portsmouth,England,24678.0,UK,24.0,Male,Medium,Regular,12-04-23,2023.0,December,0:39:40,6.0,277.3193432,1663.916059,,Pepsi,Water,Average,Standard,Credit Card,Processing,2.0,Distilled water,2023-12-04,2025-11-15 00:39:40,Missing values; 
4484716.0,59624.0,Jennifer Roberts DDS,Ryan28@gmail.com,4321803087.0,8894 Perez Mount Apt. 540,Portsmouth,England,27260.0,UK,24.0,Male,Medium,Regular,4/30/2023,2023.0,April,1:51:46,4.0,390.0965183,1560.386073,Home Decor,Bed Bath & Beyond,Kitchen,Average,Standard,Debit Card,,2.0,Food processor,2023-04-30,2025-11-15 01:51:46,Missing values; 
4760069.0,84327.0,Michael Ortega,Sabrina37@gmail.com,3866750908.0,37219 Wright Square,Portsmouth,England,45368.0,UK,24.0,Male,Medium,Regular,8/25/2023,2023.0,August,17:10:23,9.0,480.8871711,4327.98454,Home Decor,Home Depot,Decorations,Average,,PayPal,Pending,2.0,Curtains,2023-08-25,2025-11-15 17:10:23,Missing values; 
4356674.0,95641.0,Rebecca Byrd,Michael78@gmail.com,9010902637.0,17913 Thomas Ville Apt. 394,Portsmouth,England,50654.0,UK,24.0,Male,Medium,Regular,9/27/2023,2023.0,,7:07:01,6.0,162.5701299,975.4207792,Clothing,Nike,T-shirt,Average,Standard,PayPal,Delivered,2.0,Plain tee,2023-09-27,2025-11-15 07:07:01,Missing values; 
2067810.0,22093.0,Sara Oneal,Richard65@gmail.com,7389419991.0,576 Hughes Lakes Suite 040,Portsmouth,England,58375.0,UK,24.0,,Medium,Regular,1/13/2024,2024.0,January,14:32:02,6.0,12.95636335,77.73818011,Home Decor,Bed Bath & Beyond,Bathroom,Good,Standard,PayPal,Processing,4.0,Soap dispenser,2024-01-13,2025-11-15 14:32:02,Missing values; 
3504063.0,46881.0,Angela Sutton,Kelli22@gmail.com,2245146228.0,528 Martinez Manors Apt. 734,Portsmouth,England,80531.0,UK,24.0,,Medium,Regular,05-02-23,2023.0,May,22:27:30,2.0,202.9133362,405.8266724,Electronics,Samsung,Smartphone,Bad,Same-Day,Cash,Shipped,1.0,Google Pixel,2023-05-02,2025-11-15 22:27:30,Missing values; 
6928082.0,21201.0,Andrew Barnes,Carl51@gmail.com,7425164945.0,074 Michelle Dale,Portsmouth,England,43032.0,UK,24.0,Male,Medium,Regular,03-06-23,2023.0,March,5:24:26,3.0,373.2585226,1119.775568,Grocery,Coca-Cola,Soft Drink,Good,,Debit Card,Shipped,3.0,Cola,2023-03-06,2025-11-15 05:24:26,Missing values; 
1089109.0,,Jay Rodriguez,Caleb62@gmail.com,1220521779.0,364 Kenneth Street Apt. 766,Portsmouth,England,68586.0,UK,24.0,Male,Medium,Regular,11/29/2023,2023.0,November,22:46:12,4.0,468.0429424,1872.17177,Home Decor,IKEA,Furniture,Average,Same-Day,Credit Card,Processing,2.0,Nightstand,2023-11-29,2025-11-15 22:46:12,Missing values; 
8262159.0,31297.0,,Janice34@gmail.com,2557521339.0,1512 Colin Fort,Portsmouth,England,9594.0,UK,24.0,Male,Medium,Regular,10-08-23,2023.0,October,23:43:42,6.0,76.80312474,460.8187484,Books,Random House,Literature,Good,Express,Debit Card,Pending,3.0,Drama,2023-10-08,2025-11-15 23:43:42,Missing values; 
7927926.0,27323.0,Stephen Johnson,Joseph32@gmail.com,3072204073.0,52906 Michelle Plain,Portsmouth,England,40521.0,UK,24.0,Male,Medium,Regular,5/31/2023,2023.0,May,0:50:38,9.0,305.9246886,2753.322198,Clothing,,Shoes,Excellent,Standard,Cash,Delivered,5.0,Oxfords,2023-05-31,2025-11-15 00:50:38,Missing values; 
5877228.0,62068.0,Barbara Smith,Amy22@gmail.com,6368501938.0,820 Tammy Lock Suite 211,Portsmouth,England,10820.0,UK,24.0,Male,Medium,Regular,12/17/2023,2023.0,December,22:48:40,,327.1919549,1635.959774,Grocery,Coca-Cola,Soft Drink,Average,Express,PayPal,Delivered,2.0,Orange soda,2023-12-17,2025-11-15 22:48:40,Missing values; 
8748490.0,37011.0,Aaron Diaz,James55@gmail.com,7804846647.0,364 Susan Vista Apt. 212,Portsmouth,England,23912.0,UK,24.0,Female,Medium,Regular,3/25/2023,,March,2:47:49,10.0,260.0404615,2600.404615,Grocery,Nestle,Coffee,Bad,Standard,Debit Card,Pending,1.0,Coffee beans,2023-03-25,2025-11-15 02:47:49,Missing values; 
3984067.0,42996.0,Eric Snow,Andrew53@gmail.com,7968924564.0,8521 Ronald Wall,Portsmouth,England,67911.0,UK,24.0,Male,Medium,Regular,7/29/2023,2023.0,July,7:08:22,10.0,265.785963,2657.85963,Grocery,Nestle,Snacks,Good,Express,Debit Card,,4.0,Trail mix,2023-07-29,2025-11-15 07:08:22,Missing values; 
,90979.0,Thomas Calhoun,Wesley45@gmail.com,9399289137.0,688 Daniel Square Suite 080,Portsmouth,England,43826.0,UK,24.0,Male,Medium,Regular,2/29/2024,2024.0,February,2:37:33,10.0,490.759851,4907.59851,Home Decor,Bed Bath & Beyond,Bathroom,Bad,Standard,PayPal,Processing,1.0,Sink,2024-02-29,2025-11-15 02:37:33,Missing values; 
8605500.0,86795.0,Kristina Mason,Mikayla61@gmail.com,7925410992.0,766 Donald Harbor Apt. 232,Portsmouth,England,36988.0,UK,24.0,Female,Medium,Regular,5/30/2023,2023.0,May,19:26:10,8.0,213.1499228,1705.199382,,Nestle,Chocolate,Bad,Standard,Debit Card,Delivered,1.0,Chocolate-covered fruits,2023-05-30,2025-11-15 19:26:10,Missing values; 
5672547.0,13976.0,Steven Brooks,Lisa38@gmail.com,,347 Schmitt Trace,Portsmouth,England,19910.0,UK,24.0,Male,Medium,Regular,5/15/2023,2023.0,May,12:35:43,2.0,294.3955931,588.7911863,Books,HarperCollins,Non-Fiction,Excellent,Standard,Credit Card,Delivered,5.0,Self-help,2023-05-15,2025-11-15 12:35:43,Missing values; 
9964355.0,48208.0,Robert Kramer,Jennifer80@gmail.com,4846434776.0,029 Brooks Forks Suite 564,Portsmouth,England,95863.0,UK,24.0,Female,Medium,Regular,10-11-23,2023.0,October,20:40:57,6.0,452.727002,2716.362012,Home Decor,Home Depot,Tools,Bad,Standard,Credit Card,,1.0,Utility knife,2023-10-11,2025-11-15 20:40:57,Missing values; 
9398912.0,39829.0,Lynn Soto,Eric8@gmail.com,5761998312.0,672 Cassandra Rest,Portsmouth,England,42618.0,UK,24.0,Male,Medium,Regular,9/16/2023,2023.0,,5:35:54,9.0,15.06226096,135.5603486,Books,Penguin Books,Non-Fiction,Bad,Express,Credit Card,Pending,1.0,Memoir,2023-09-16,2025-11-15 05:35:54,Missing values; 
2159854.0,37626.0,Paul Garcia,Joseph42@gmail.com,3029210301.0,263 Brent Lock Suite 647,Portsmouth,England,35893.0,UK,24.0,Female,Medium,Regular,05-11-23,2023.0,May,1:58:25,2.0,435.7272654,871.4545308,Books,HarperCollins,Non-Fiction,,Same-Day,Debit Card,Shipped,,Travel,2023-05-11,2025-11-15 01:58:25,Missing values; 
9558107.0,50515.0,Joshua Lane,Nicholas80@gmail.com,8563148556.0,4517 Estrada Key Apt. 358,Portsmouth,England,63512.0,UK,24.0,,Medium,Regular,12/28/2023,2023.0,December,12:22:06,8.0,126.1030292,1008.824233,Home Decor,Home Depot,Tools,Bad,Standard,Debit Card,Shipped,1.0,Tape measure,2023-12-28,2025-11-15 12:22:06,Missing values; 
5486505.0,,Daniel Rogers,James9@gmail.com,5241286791.0,218 Bauer Tunnel,Portsmouth,England,39145.0,UK,24.0,Male,Medium,Regular,4/24/2023,2023.0,April,20:31:14,7.0,146.9475994,1028.633196,Clothing,Nike,T-shirt,Excellent,Same-Day,PayPal,Processing,4.0,Plain tee,2023-04-24,2025-11-15 20:31:14,Missing values; 
4538929.0,52457.0,Tammy Ford,John95@gmail.com,3204574856.0,1229 Miller Ford,Portsmouth,England,76917.0,UK,24.0,,Medium,Regular,5/26/2023,2023.0,May,22:40:03,9.0,499.7669226,4497.902304,Clothing,Zara,Shirt,Bad,Standard,Cash,Shipped,1.0,Dress shirt,2023-05-26,2025-11-15 22:40:03,Missing values; 
8721462.0,26989.0,,Jason75@gmail.com,7610317297.0,5088 William Ports Apt. 733,Portsmouth,England,71985.0,UK,24.0,Male,Medium,Regular,7/31/2023,2023.0,July,22:44:26,4.0,13.42147331,53.68589322,Electronics,Samsung,Television,Excellent,Same-Day,Credit Card,Pending,4.0,Android TV,2023-07-31,2025-11-15 22:44:26,Missing values; 
7463376.0,99444.0,Kathleen Woods,Amanda77@gmail.com,1557190965.0,13109 Stephen Burg,Portsmouth,England,1559.0,UK,24.0,Male,Medium,Regular,3/15/2023,2023.0,March,10:56:44,3.0,213.5299015,640.5897046,Clothing,Adidas,Jacket,Average,Standard,Debit Card,,2.0,Puffer jacket,2023-03-15,2025-11-15 10:56:44,Missing values; 
8289555.0,18520.0,Jose Brewer,Mary68@gmail.com,7317613543.0,93740 Flores Lane Suite 277,Portsmouth,England,60219.0,UK,24.0,Male,Medium,Regular,5/29/2023,2023.0,May,,8.0,365.9759714,2927.807771,,Nestle,Chocolate,Good,Express,PayPal,Processing,3.0,Chocolate-covered nuts,2023-05-29,,Missing values; 
3317645.0,99091.0,Edward Joseph,Zachary47@gmail.com,3091901082.0,51377 Phillips Harbor,Portsmouth,England,,UK,24.0,Male,Medium,Regular,07-01-23,2023.0,July,23:44:38,9.0,177.6694266,1599.024839,Clothing,Adidas,Jacket,Excellent,Same-Day,Cash,Shipped,4.0,Peacoat,2023-07-01,2025-11-15 23:44:38,Missing values; 
5076117.0,43849.0,Alexis Donaldson,Beverly72@gmail.com,9814888841.0,5729 Valerie Rest Suite 940,Portsmouth,England,53085.0,UK,24.0,Female,Medium,Regular,06-06-23,2023.0,June,21:29:03,3.0,318.0721429,954.2164287,Home Decor,IKEA,Decorations,,Standard,Credit Card,Delivered,,Curtains,2023-06-06,2025-11-15 21:29:03,Missing values; 
6237710.0,73545.0,James Hoffman,Carla13@gmail.com,7918317416.0,9356 Huff Motorway Apt. 444,Portsmouth,England,39344.0,UK,24.0,Male,Medium,Regular,9/29/2023,2023.0,September,3:20:23,2.0,448.3917664,896.7835329,Grocery,Nestle,Chocolate,Average,Same-Day,Debit Card,,2.0,Chocolate-covered fruits,2023-09-29,2025-11-15 03:20:23,Missing values; 
9686043.0,16259.0,Alexander Mejia,Jennifer90@gmail.com,3363551702.0,822 Chan Meadows,Portsmouth,England,72778.0,UK,24.0,Male,Medium,Regular,,2023.0,October,14:08:34,5.0,231.7269476,1158.634738,Electronics,Apple,Tablet,Good,Express,Debit Card,Delivered,4.0,Sony Xperia Tablet,,2025-11-15 14:08:34,Missing values; 
2670951.0,15882.0,Lauren Mendez,Andrea36@gmail.com,5232557141.0,142 Robinson Inlet Suite 463,Portsmouth,England,40747.0,UK,24.0,Male,Medium,Regular,11-05-23,2023.0,November,13:16:22,6.0,,282.8488501,Grocery,Nestle,Snacks,Good,Same-Day,Debit Card,Shipped,4.0,Crackers,2023-11-05,2025-11-15 13:16:22,Missing values; 
4730131.0,21580.0,Michael Miranda,Brooke58@gmail.com,7031686815.0,32351 Hardy Crescent Apt. 295,Portsmouth,England,42527.0,UK,24.0,,Medium,Regular,5/19/2023,2023.0,May,22:19:59,9.0,416.7228958,3750.506062,Electronics,Apple,Smartphone,Excellent,Same-Day,Debit Card,Pending,4.0,Google Pixel,2023-05-19,2025-11-15 22:19:59,Missing values; 
1117664.0,96474.0,David Suarez,Ashley42@gmail.com,1105273721.0,137 Laura Junctions Apt. 432,Portsmouth,England,36741.0,UK,24.0,Male,Medium,Regular,10/25/2023,2023.0,October,11:59:00,2.0,75.63968381,,Electronics,Apple,Tablet,Average,Express,Cash,Delivered,2.0,Huawei MediaPad,2023-10-25,2025-11-15 11:59:00,Missing values; 
3136674.0,69294.0,Jason Jimenez,Nicholas54@gmail.com,1677384021.0,77809 Cox Court,Portsmouth,England,34246.0,UK,24.0,Female,Medium,Regular,12-09-23,,December,17:25:48,4.0,54.87752693,219.5101077,Books,HarperCollins,Non-Fiction,Bad,Standard,Credit Card,Pending,1.0,Health,2023-12-09,2025-11-15 17:25:48,Missing values; 
6511491.0,87942.0,Christina Robinson,Michele5@gmail.com,3917558126.0,5774 Aaron Square Apt. 358,Portsmouth,England,95601.0,UK,24.0,Male,Medium,Regular,08-07-23,2023.0,August,18:55:25,1.0,210.7743293,210.7743293,Clothing,Adidas,Shoes,Excellent,Standard,Debit Card,,4.0,Running shoes,2023-08-07,2025-11-15 18:55:25,Missing values; 
3376048.0,19044.0,Darren Fernandez,Victoria32@gmail.com,7587184595.0,964 Mathew Points,Portsmouth,England,39007.0,UK,24.0,Male,Medium,Regular,,2023.0,April,19:38:26,2.0,394.5548255,789.1096511,Home Decor,Bed Bath & Beyond,Bathroom,Average,Express,Cash,Pending,2.0,Mirror,,2025-11-15 19:38:26,Missing values; 
8669154.0,12249.0,Dr. Stephen Ballard,Lacey17@gmail.com,5164231811.0,6029 Charles Estates,Portsmouth,England,98176.0,UK,24.0,Female,Medium,Regular,1/14/2024,2024.0,January,16:54:48,,148.1275138,1036.892596,Home Decor,IKEA,Lighting,Excellent,Express,PayPal,Pending,4.0,Track lighting,2024-01-14,2025-11-15 16:54:48,Missing values; 
2793783.0,38821.0,Stephanie Price,Alyssa76@gmail.com,1547374188.0,92372 Mario Ports,Portsmouth,England,51952.0,UK,24.0,Male,Medium,Regular,7/30/2023,2023.0,July,2:50:48,5.0,380.5451085,1902.725543,Home Decor,IKEA,Lighting,,Standard,Cash,Delivered,,Recessed lighting,2023-07-30,2025-11-15 02:50:48,Missing values; 
4531591.0,36983.0,Anthony Moran,Robert51@gmail.com,4396462658.0,1130 Jimenez Isle Suite 467,Portsmouth,England,82396.0,UK,24.0,Female,Medium,Regular,6/28/2023,2023.0,June,13:15:56,,232.4141041,1626.898729,Home Decor,IKEA,Decorations,Good,Standard,PayPal,Delivered,3.0,Picture frames,2023-06-28,2025-11-15 13:15:56,Missing values; 
,40747.0,Robert Rivera,Christopher41@gmail.com,3303060194.0,924 Miller Station Apt. 819,Portsmouth,England,23291.0,UK,24.0,Female,Medium,Regular,12-06-23,2023.0,December,9:41:04,10.0,378.1789967,3781.789967,Home Decor,Bed Bath & Beyond,Bedding,Average,Express,Credit Card,Pending,2.0,Bed skirt,2023-12-06,2025-11-15 09:41:04,Missing values; 
8547784.0,10061.0,,Courtney92@gmail.com,6243265723.0,43446 Stevens Brook Apt. 246,Portsmouth,England,16360.0,UK,24.0,Male,Medium,Regular,04-12-23,2023.0,April,10:30:37,7.0,161.3766841,1129.636789,Grocery,Nestle,Chocolate,Good,Same-Day,PayPal,Delivered,3.0,Chocolate-covered nuts,2023-04-12,2025-11-15 10:30:37,Missing values; 
1237402.0,12127.0,Richard Marquez,Heather86@gmail.com,3647750814.0,071 Cynthia Lane,Portsmouth,England,24395.0,UK,24.0,Male,Medium,Regular,,2023.0,April,12:33:14,4.0,374.1295403,1496.518161,Clothing,Zara,Shirt,Bad,Same-Day,PayPal,Pending,1.0,Button-down shirt,,2025-11-15 12:33:14,Missing values; 
3035450.0,84486.0,Rachel Dickson,Darren61@gmail.com,,87855 Allison Square,Portsmouth,England,72173.0,UK,24.0,Male,Medium,Regular,10-02-23,2023.0,October,8:35:51,7.0,34.66470832,242.6529582,Electronics,Samsung,Television,Excellent,Express,Debit Card,Shipped,4.0,Android TV,2023-10-02,2025-11-15 08:35:51,Missing values; 
2246561.0,67579.0,Kenneth Cuevas,Megan56@gmail.com,4910872447.0,353 Hawkins Forge Apt. 429,Portsmouth,England,18805.0,UK,24.0,Male,Medium,Regular,6/24/2023,2023.0,June,0:27:49,7.0,206.2205115,1443.543581,Grocery,Nestle,Snacks,Good,Standard,,Pending,3.0,Beef jerky,2023-06-24,2025-11-15 00:27:49,Missing values; 
8522789.0,97850.0,Patricia Riggs,Heather38@gmail.com,,20815 Dustin Trail,Portsmouth,England,48147.0,UK,24.0,Female,Medium,Regular,10/15/2023,2023.0,October,21:45:07,7.0,62.69869027,438.8908319,Clothing,Zara,Shirt,Average,Express,Debit Card,Pending,2.0,Polo shirt,2023-10-15,2025-11-15 21:45:07,Missing values; 
6668537.0,47362.0,Claudia Butler,William94@gmail.com,3633640817.0,6725 Smith Streets Suite 799,Portsmouth,England,73002.0,UK,24.0,Male,Medium,Regular,6/25/2023,,June,23:30:28,3.0,226.9662374,680.8987123,Grocery,Coca-Cola,Soft Drink,Excellent,Same-Day,PayPal,Shipped,4.0,Root beer,2023-06-25,2025-11-15 23:30:28,Missing values; 
5212322.0,89375.0,Chelsea Wood,Bryce79@gmail.com,,84047 Pam Plains,Portsmouth,England,48457.0,UK,24.0,Female,Medium,Regular,11/14/2023,2023.0,November,2:22:00,10.0,372.4452575,3724.452575,Books,Random House,Non-Fiction,Good,Same-Day,Cash,Shipped,3.0,Biography,2023-11-14,2025-11-15 02:22:00,Missing values; 
4598659.0,94996.0,Brad Johnson,Christine29@gmail.com,6909906035.0,04080 Chavez Streets,Portsmouth,England,58741.0,UK,24.0,Male,Medium,Regular,01-03-24,2024.0,January,,9.0,312.2771294,2810.494165,Electronics,Sony,Headphones,Average,Same-Day,Cash,Processing,2.0,Wireless headphones,2024-01-03,,Missing values; 
3997489.0,89681.0,Jordan Hernandez,Glen58@gmail.com,7177732044.0,943 Dickerson Summit Apt. 185,Portsmouth,England,94466.0,UK,24.0,Female,Medium,Regular,8/29/2023,2023.0,,0:14:01,4.0,228.8566064,915.4264254,Books,Random House,Literature,Good,Same-Day,Cash,Processing,3.0,Non-fiction literature,2023-08-29,2025-11-15 00:14:01,Missing values; 
,47797.0,Aaron Henderson,Richard71@gmail.com,4565397069.0,3308 Craig Drive Suite 662,Portsmouth,England,37974.0,UK,24.0,Male,Medium,Regular,5/30/2023,2023.0,May,8:02:00,3.0,228.2898738,684.8696213,Grocery,Pepsi,Soft Drink,Bad,Express,Credit Card,Pending,1.0,Iced tea,2023-05-30,2025-11-15 08:02:00,Missing values; 
7064437.0,,Eric Cook,Russell20@gmail.com,8213783555.0,3185 Joseph Dale Suite 850,Portsmouth,England,57661.0,UK,24.0,Male,Medium,Regular,09-09-23,2023.0,September,0:45:32,4.0,294.2376531,1176.950612,Grocery,Nestle,Coffee,Bad,Express,PayPal,Processing,1.0,Americano,2023-09-09,2025-11-15 00:45:32,Missing values; 
8032950.0,39357.0,,Denise50@gmail.com,8043611007.0,258 Lopez Valleys Apt. 252,Portsmouth,England,87482.0,UK,24.0,Female,Medium,Regular,04-01-23,2023.0,April,16:05:44,2.0,290.0378406,580.0756813,Books,HarperCollins,Non-Fiction,Bad,Express,Cash,Delivered,1.0,Cooking,2023-04-01,2025-11-15 16:05:44,Missing values; 
8169375.0,87680.0,William Hunt,Daniel67@gmail.com,9260324979.0,393 David River Apt. 920,Portsmouth,England,58791.0,UK,24.0,Male,Medium,Regular,06-01-23,2023.0,June,17:27:50,9.0,,3880.184291,Grocery,Coca-Cola,Soft Drink,Good,Express,Credit Card,Shipped,3.0,Cream soda,2023-06-01,2025-11-15 17:27:50,Missing values; 
5974919.0,57920.0,Daniel Johnson,Karen84@gmail.com,9036155648.0,18315 Daniel Shoals Apt. 774,Portsmouth,England,10279.0,UK,24.0,Female,Medium,Regular,,2023.0,October,0:23:30,2.0,214.6813955,429.362791,Grocery,Nestle,Snacks,Bad,Express,Debit Card,Pending,1.0,Fruit snacks,,2025-11-15 00:23:30,Missing values; 
2725872.0,24634.0,Richard Morris,,9734826570.0,32198 Sims Corners Suite 118,Portsmouth,England,59230.0,UK,24.0,Male,Medium,Regular,6/18/2023,2023.0,June,19:15:07,1.0,247.1708458,247.1708458,Home Decor,IKEA,Decorations,Excellent,Same-Day,Cash,Pending,5.0,Wall art,2023-06-18,2025-11-15 19:15:07,Missing values; 
1404255.0,12050.0,Erika Williams,Justin26@gmail.com,1745736182.0,9362 Thomas Trail Apt. 553,Portsmouth,England,15393.0,UK,24.0,Female,Medium,Regular,7/28/2023,2023.0,,12:52:07,1.0,197.2792538,197.2792538,Books,Random House,Fiction,Excellent,Same-Day,Debit Card,Shipped,5.0,Mystery,2023-07-28,2025-11-15 12:52:07,Missing values; 
4742083.0,55543.0,Cristian Mayer,Steven57@gmail.com,7232954366.0,8209 Schroeder Walks,Portsmouth,England,99589.0,UK,24.0,Male,Medium,Regular,02-08-24,2024.0,February,8:50:32,10.0,26.9922653,269.922653,,Random House,Non-Fiction,Good,Same-Day,PayPal,Processing,3.0,Biography,2024-02-08,2025-11-15 08:50:32,Missing values; 
7776707.0,15615.0,Jennifer Huerta,Jared14@gmail.com,4476365121.0,5395 Juan Landing,Portsmouth,England,27396.0,UK,70.0,Male,Medium,Regular,5/29/2023,2023.0,May,8:37:08,4.0,225.6906969,902.7627875,Books,,Non-Fiction,Bad,Express,Credit Card,Delivered,1.0,History,2023-05-29,2025-11-15 08:37:08,Missing values; 
8423283.0,18817.0,Melissa Leach,Scott22@gmail.com,9506543541.0,02417 George Locks Suite 742,Portsmouth,England,57108.0,UK,47.0,Male,Medium,Regular,09-03-23,2023.0,September,21:27:12,3.0,299.9945954,899.9837863,Grocery,Pepsi,Juice,Good,Express,Cash,,3.0,Cranberry juice,2023-09-03,2025-11-15 21:27:12,Missing values; 
7846374.0,54651.0,Kathy Moreno,Ruben21@gmail.com,5420698155.0,88508 Jones Cliffs,Portsmouth,England,41077.0,UK,54.0,Male,Medium,Regular,11/13/2023,,November,8:45:31,9.0,41.1271762,370.1445858,Clothing,Nike,Shorts,Average,Express,Cash,Pending,2.0,Denim shorts,2023-11-13,2025-11-15 08:45:31,Missing values; 
9026334.0,37179.0,Tiffany Carney DDS,Samantha60@gmail.com,9607451272.0,4560 Connie Mills Apt. 706,Portsmouth,England,46946.0,UK,19.0,Female,Medium,Regular,02-12-24,2024.0,February,6:48:38,2.0,419.3028157,,Clothing,Nike,Shorts,Good,Same-Day,Cash,Processing,4.0,Cycling shorts,2024-02-12,2025-11-15 06:48:38,Missing values; 
7844999.0,34433.0,Robert Salinas,Amanda84@gmail.com,4908363583.0,60379 Andre Lake,Portsmouth,England,6205.0,UK,19.0,Male,Medium,Regular,07-12-23,2023.0,July,15:47:15,9.0,74.18801117,,Grocery,Pepsi,Water,Bad,Standard,Credit Card,Shipped,1.0,Flavored water,2023-07-12,2025-11-15 15:47:15,Missing values; 
4098643.0,14411.0,Thomas Velazquez,Joel87@gmail.com,3971690693.0,20201 Mcbride Isle,Portsmouth,England,74886.0,UK,19.0,,Medium,Regular,6/21/2023,2023.0,June,14:38:19,4.0,404.6817699,1618.727079,Clothing,Nike,Shorts,Excellent,Standard,PayPal,Processing,5.0,Skorts,2023-06-21,2025-11-15 14:38:19,Missing values; 
7520496.0,80249.0,Mario Maxwell,Craig86@gmail.com,8148765734.0,759 Anthony Walks Suite 163,Portsmouth,England,15799.0,UK,19.0,Female,Medium,Regular,04-10-23,2023.0,April,16:09:11,2.0,,279.8278983,Clothing,Zara,Dress,Bad,Same-Day,PayPal,Delivered,1.0,Maxi dress,2023-04-10,2025-11-15 16:09:11,Missing values; 
5579876.0,12436.0,Hector Mccann,Lisa9@gmail.com,9539954663.0,342 Henry Motorway Apt. 315,Portsmouth,England,46666.0,UK,19.0,Male,Medium,Regular,8/15/2023,2023.0,August,15:15:45,10.0,492.1891923,4921.891923,Grocery,Nestle,Coffee,Average,,Credit Card,Shipped,2.0,Cappuccino,2023-08-15,2025-11-15 15:15:45,Missing values; 
1396755.0,15665.0,Christopher Williams,Brittney56@gmail.com,2663368539.0,782 Cannon Well,Portsmouth,England,74432.0,UK,19.0,Female,Medium,Regular,11/21/2023,2023.0,November,11:59:37,1.0,372.6370025,372.6370025,Home Decor,,Furniture,Average,Express,PayPal,Pending,2.0,Sofa,2023-11-21,2025-11-15 11:59:37,Missing values; 
4213083.0,46655.0,Susan Molina,Robert36@gmail.com,3240271345.0,721 Doyle Pass,Portsmouth,England,,UK,19.0,Male,Medium,Regular,07-06-23,2023.0,July,8:12:49,10.0,297.65181,2976.5181,Electronics,Apple,Smartphone,Bad,Express,Debit Card,Delivered,1.0,LG G,2023-07-06,2025-11-15 08:12:49,Missing values; 
7198722.0,58278.0,Debra Miller,Amanda40@gmail.com,3055558117.0,3005 Barker Forks,Portsmouth,England,58223.0,UK,19.0,Female,Medium,Regular,12-09-23,2023.0,December,4:19:55,3.0,274.4012325,823.2036974,Clothing,Zara,Shirt,,Standard,Cash,Pending,,Hoodie,2023-12-09,2025-11-15 04:19:55,Missing values; 
4254412.0,44228.0,Kyle Davila,Jennifer95@gmail.com,9463561298.0,302 Lori Ranch Suite 897,Portsmouth,England,59316.0,UK,19.0,Male,Medium,Regular,10/16/2023,2023.0,October,,2.0,120.5893942,241.1787885,Clothing,Zara,Shirt,Average,Standard,Debit Card,Processing,2.0,Dress shirt,2023-10-16,,Missing values; 
8619278.0,64434.0,Rachel Torres,Maria33@gmail.com,3089348564.0,6478 Bell Walk Suite 440,Portsmouth,England,55573.0,UK,19.0,Male,Medium,Regular,09-05-23,,September,2:16:53,5.0,102.9422213,514.7111065,Books,Penguin Books,Children's,Bad,Express,Credit Card,Processing,1.0,Plush toys,2023-09-05,2025-11-15 02:16:53,Missing values; 
6699770.0,34482.0,Paul Lopez,Ebony45@gmail.com,6870527540.0,025 Tran Junction,Portsmouth,England,80960.0,UK,19.0,Male,Medium,Regular,05-02-23,2023.0,May,5:53:58,4.0,57.57203678,,Electronics,Samsung,Tablet,Bad,Standard,PayPal,Delivered,1.0,Huawei MediaPad,2023-05-02,2025-11-15 05:53:58,Missing values; 
2406143.0,,Michelle Gonzalez,Sean55@gmail.com,7007010178.0,807 Daniel Ranch,Portsmouth,England,54500.0,UK,19.0,Male,Medium,Regular,03-09-23,2023.0,March,2:18:08,4.0,229.7877795,919.1511178,Electronics,Samsung,Tablet,Average,Standard,Debit Card,Processing,2.0,Asus ZenPad,2023-03-09,2025-11-15 02:18:08,Missing values; 
6523136.0,81125.0,Miss Amy Johnson,Laura63@gmail.com,1240778551.0,0603 Marquez Loop Suite 114,Portsmouth,England,61681.0,UK,19.0,Male,Medium,Regular,07-12-23,2023.0,July,13:51:59,9.0,376.9079801,3392.171821,Electronics,,Laptop,Good,Standard,Debit Card,Delivered,3.0,Razer Blade,2023-07-12,2025-11-15 13:51:59,Missing values; 
9489186.0,63986.0,Elizabeth White,Kimberly28@gmail.com,,29040 Michael Gardens Apt. 891,Portsmouth,England,60448.0,UK,19.0,Female,Medium,Regular,11/22/2023,2023.0,November,17:52:45,6.0,435.7349852,2614.409911,Grocery,Coca-Cola,Water,Excellent,Express,Credit Card,Delivered,4.0,Distilled water,2023-11-22,2025-11-15 17:52:45,Missing values; 
6948809.0,47658.0,Carrie Wright,Megan49@gmail.com,7553990327.0,32168 James Glen Suite 952,Portsmouth,England,89361.0,UK,19.0,Female,Medium,Regular,8/14/2023,2023.0,August,2:48:33,10.0,45.1979066,451.979066,Home Decor,,Bedding,Average,Same-Day,Debit Card,Processing,2.0,Duvet cover,2023-08-14,2025-11-15 02:48:33,Missing values; 
3753025.0,83026.0,Scott Barnes,Mark100@gmail.com,4462052837.0,798 Bennett Mall Apt. 590,Portsmouth,England,22905.0,UK,19.0,Female,Medium,Regular,12/22/2023,2023.0,,16:00:22,7.0,409.9251956,2869.476369,Books,Penguin Books,Children's,Average,Same-Day,Credit Card,Delivered,2.0,Games,2023-12-22,2025-11-15 16:00:22,Missing values; 
2364491.0,57086.0,David Pennington,Christopher36@gmail.com,3862352461.0,124 Summers Crescent Apt. 016,Portsmouth,England,69688.0,UK,19.0,Male,Medium,Regular,8/31/2023,2023.0,August,5:11:02,4.0,243.4765837,973.9063347,Grocery,Pepsi,Water,Excellent,,Debit Card,Pending,4.0,Artesian water,2023-08-31,2025-11-15 05:11:02,Missing values; 
7724535.0,49307.0,Bryan Shaw,Eric54@gmail.com,3260917066.0,092 Combs Rue Apt. 631,Portsmouth,England,26340.0,UK,19.0,Female,Medium,Regular,03-07-23,2023.0,March,16:54:30,10.0,167.066954,1670.66954,Books,Penguin Books,Fiction,Good,Express,Cash,,3.0,Mystery,2023-03-07,2025-11-15 16:54:30,Missing values; 
3089244.0,93580.0,Steven Larson,Deborah87@gmail.com,,824 Nelson Route Apt. 172,Portsmouth,England,96333.0,UK,19.0,Male,Medium,Regular,3/27/2023,2023.0,March,2:12:09,9.0,452.2832645,4070.54938,Electronics,Apple,Tablet,Excellent,Same-Day,PayPal,Pending,5.0,Huawei MediaPad,2023-03-27,2025-11-15 02:12:09,Missing values; 
2008221.0,38121.0,John Jones,Sara96@gmail.com,3225627032.0,4212 Levi Ranch Apt. 616,Portsmouth,England,16153.0,UK,19.0,Male,Medium,Regular,10-06-23,2023.0,October,11:47:39,5.0,49.90051629,249.5025815,,Bed Bath & Beyond,Bathroom,Average,Same-Day,Debit Card,Pending,2.0,Soap dispenser,2023-10-06,2025-11-15 11:47:39,Missing values; 
2435703.0,44292.0,Marissa Duncan,Edward41@gmail.com,,582 Christopher Burg Apt. 645,Portsmouth,England,99362.0,UK,19.0,Male,Medium,Regular,04-11-23,2023.0,April,15:31:56,4.0,31.1808414,124.7233656,Electronics,Apple,Tablet,Bad,Same-Day,Credit Card,Delivered,1.0,Google Pixel Slate,2023-04-11,2025-11-15 15:31:56,Missing values; 
2411564.0,15123.0,,Anna28@gmail.com,8193880016.0,5709 Daniel Junction Apt. 633,Portsmouth,England,72247.0,UK,19.0,Male,Medium,Regular,5/31/2023,2023.0,May,8:36:52,6.0,221.7868256,1330.720954,Clothing,Nike,T-shirt,Excellent,Standard,Credit Card,Delivered,4.0,Crop top,2023-05-31,2025-11-15 08:36:52,Missing values; 
9427220.0,87898.0,Vincent Hanson,Laura39@gmail.com,7129031937.0,227 Jonathan Knoll,Portsmouth,England,42584.0,UK,19.0,Female,Medium,Regular,4/14/2023,2023.0,April,2:46:10,4.0,19.04928443,76.19713774,Home Decor,,Bathroom,Excellent,Standard,Credit Card,Processing,5.0,Toilet,2023-04-14,2025-11-15 02:46:10,Missing values; 
3305361.0,53676.0,Emily Bennett,Thomas79@gmail.com,4166608516.0,08552 Emily Mountains Apt. 480,Portsmouth,England,99563.0,UK,19.0,Male,Medium,Regular,09-07-23,2023.0,September,3:31:05,9.0,476.9384966,4292.446469,Books,Penguin Books,Children's,Average,Same-Day,Debit Card,,2.0,Plush toys,2023-09-07,2025-11-15 03:31:05,Missing values; 
5573787.0,64744.0,Kathryn Powell,Mark66@gmail.com,4052479910.0,78423 Keller Flat Apt. 720,Portsmouth,England,67805.0,UK,19.0,Female,Medium,Regular,8/24/2023,2023.0,August,7:33:10,,188.1742475,1693.568228,Home Decor,Home Depot,Tools,Average,Express,Credit Card,,2.0,Caulking gun,2023-08-24,2025-11-15 07:33:10,Missing values; 
4887313.0,55835.0,Amy West,Austin57@gmail.com,5614297929.0,7597 Lisa Island,Portsmouth,England,22745.0,UK,19.0,Female,Medium,Regular,05-05-23,2023.0,May,8:32:24,,126.6597248,759.9583488,Clothing,Nike,Shorts,Good,Express,Debit Card,Processing,4.0,Swim trunks,2023-05-05,2025-11-15 08:32:24,Missing values; 
7477969.0,37397.0,Thomas Robles,Becky87@gmail.com,8367589966.0,8975 Denise Coves,Portsmouth,England,67196.0,UK,19.0,Male,Medium,Regular,12-03-23,2023.0,December,23:10:38,7.0,,558.4548775,Electronics,Sony,Headphones,Excellent,Same-Day,PayPal,Shipped,4.0,Wireless headphones,2023-12-03,2025-11-15 23:10:38,Missing values; 
7137072.0,14436.0,Molly Greene,Cody38@gmail.com,6429069521.0,499 Sean Ridge Suite 392,Portsmouth,England,69874.0,UK,19.0,Female,Medium,Regular,3/22/2023,2023.0,March,20:07:10,,385.9801335,3859.801335,Books,Penguin Books,Fiction,Excellent,Standard,PayPal,Shipped,5.0,Thriller,2023-03-22,2025-11-15 20:07:10,Missing values; 
5544128.0,20661.0,Trevor Cameron,Ashley80@gmail.com,4690136523.0,903 John Mountain Apt. 318,Portsmouth,England,5174.0,UK,19.0,Female,Medium,Regular,2/28/2024,2024.0,February,20:58:14,1.0,492.1958054,,Grocery,Coca-Cola,Water,Excellent,Same-Day,PayPal,Pending,4.0,Mineral water,2024-02-28,2025-11-15 20:58:14,Missing values; 
3757802.0,94084.0,Joseph Simmons,Jimmy78@gmail.com,4682972315.0,498 Erika Dale,Portsmouth,England,92151.0,UK,19.0,Female,Medium,Regular,07-07-23,2023.0,July,,9.0,84.44732107,760.0258896,Clothing,Zara,Dress,Bad,Express,Cash,Delivered,1.0,Shift dress,2023-07-07,,Missing values; 
6753237.0,95546.0,Carolyn Smith,Garrett27@gmail.com,3395528253.0,634 Daniel Loaf,Portsmouth,England,70285.0,UK,19.0,Female,Medium,Regular,8/16/2023,2023.0,August,12:40:12,5.0,87.9598778,,Books,HarperCollins,Fiction,Excellent,Express,Credit Card,Delivered,4.0,Thriller,2023-08-16,2025-11-15 12:40:12,Missing values; 
5183639.0,21113.0,Karen Stone,Cody92@gmail.com,9499697881.0,99965 Christopher Haven,Portsmouth,England,89396.0,UK,19.0,Male,Medium,Regular,5/17/2023,2023.0,,2:43:53,8.0,101.2472915,809.9783319,Books,Penguin Books,Children's,Average,Standard,PayPal,Delivered,2.0,Sports equipment,2023-05-17,2025-11-15 02:43:53,Missing values; 
1710724.0,89988.0,William Smith,Anthony23@gmail.com,9379978610.0,06081 Romero Forest,Portsmouth,England,97782.0,UK,19.0,Male,Medium,Regular,6/17/2023,2023.0,June,18:14:30,1.0,378.5261507,378.5261507,Books,Random House,Non-Fiction,,Standard,Credit Card,Delivered,,Travel,2023-06-17,2025-11-15 18:14:30,Missing values; 
1547035.0,25009.0,Lisa Maynard,Danielle64@gmail.com,,165 Alexandria Union Suite 352,Portsmouth,England,54411.0,UK,19.0,Male,Medium,Regular,03-11-23,2023.0,March,17:29:41,7.0,36.80346597,257.6242618,Clothing,Adidas,Shoes,Excellent,Standard,Debit Card,Delivered,4.0,Slippers,2023-03-11,2025-11-15 17:29:41,Missing values; 
1149807.0,71002.0,Robert Wyatt,Kathy50@gmail.com,4799934904.0,4827 Young Prairie Apt. 475,Portsmouth,England,,UK,19.0,Male,Medium,Regular,12-11-23,2023.0,December,1:31:25,5.0,428.7731226,2143.865613,Electronics,Samsung,Tablet,Average,Same-Day,Credit Card,Delivered,2.0,Google Pixel Slate,2023-12-11,2025-11-15 01:31:25,Missing values; 
4566947.0,37189.0,Christina Scott,Rachel27@gmail.com,6344082385.0,7614 William Springs Suite 984,Portsmouth,England,91380.0,UK,19.0,Female,Medium,Regular,03-02-23,2023.0,March,22:04:04,7.0,116.9313679,818.5195755,Home Decor,Home Depot,Decorations,Average,Standard,,Delivered,2.0,Picture frames,2023-03-02,2025-11-15 22:04:04,Missing values; 
1900672.0,24018.0,Jamie Martin,Kevin70@gmail.com,7400633340.0,92803 Michelle Vista Apt. 301,Portsmouth,England,,UK,19.0,Female,Medium,Regular,6/30/2023,2023.0,June,3:45:40,3.0,239.1151985,717.3455954,Electronics,Sony,Headphones,Bad,Standard,PayPal,Delivered,1.0,Studio headphones,2023-06-30,2025-11-15 03:45:40,Missing values; 
2902805.0,33341.0,Nicole Powell,,9555026607.0,1660 Richardson Squares Suite 145,Portsmouth,England,58188.0,UK,19.0,Male,Medium,Regular,11/21/2023,2023.0,November,0:39:55,7.0,204.7487038,1433.240927,Grocery,Pepsi,Soft Drink,Average,Standard,PayPal,Delivered,2.0,Cream soda,2023-11-21,2025-11-15 00:39:55,Missing values; 
8887661.0,21238.0,Danielle Chavez,Hannah42@gmail.com,1792755561.0,469 Cynthia Pine Suite 984,Portsmouth,England,17484.0,UK,19.0,Female,Medium,Regular,9/30/2023,2023.0,September,,7.0,155.3074362,1087.152053,Grocery,Nestle,Chocolate,Good,Express,Debit Card,Delivered,4.0,Dark chocolate,2023-09-30,,Missing values; 
,75193.0,Matthew Vang,Heather48@gmail.com,6545375244.0,53976 William Overpass,Portsmouth,England,59613.0,UK,19.0,Male,Medium,Regular,6/27/2023,2023.0,June,10:09:46,2.0,132.0121289,264.0242579,Grocery,,Soft Drink,Good,Express,Debit Card,Delivered,4.0,Ginger ale,2023-06-27,2025-11-15 10:09:46,Missing values; 
,98435.0,Lisa Barrett,Amanda88@gmail.com,1459051850.0,553 Danielle Well,Portsmouth,England,33223.0,UK,19.0,Male,Medium,Regular,3/15/2023,2023.0,March,8:11:09,5.0,449.3574289,2246.787144,Grocery,Pepsi,Soft Drink,Good,Same-Day,Cash,Delivered,3.0,Iced tea,2023-03-15,2025-11-15 08:11:09,Missing values; 
3350179.0,80022.0,Debra Hill,Johnny12@gmail.com,8890332626.0,676 Michelle Prairie,Portsmouth,England,16855.0,UK,19.0,Female,Medium,Regular,06-02-23,2023.0,,2:20:50,1.0,420.4743943,420.4743943,Grocery,Coca-Cola,Juice,Good,Express,Debit Card,Delivered,4.0,Pineapple juice,2023-06-02,2025-11-15 02:20:50,Missing values; 
5008961.0,29927.0,,Brian82@gmail.com,8018258173.0,486 Williams Ridges Apt. 545,Portsmouth,England,94522.0,UK,19.0,Male,Medium,Regular,5/28/2023,2023.0,May,19:54:29,10.0,401.6618506,4016.618506,Electronics,Apple,Laptop,Average,Express,PayPal,Delivered,2.0,Samsung Notebook,2023-05-28,2025-11-15 19:54:29,Missing values; 
6946563.0,12252.0,Deborah Harris,Cassandra27@gmail.com,7095855683.0,68055 Moore Circles Suite 381,Portsmouth,England,37666.0,UK,19.0,Female,Medium,Regular,6/24/2023,2023.0,,19:28:45,7.0,255.9068327,1791.347829,Books,HarperCollins,Fiction,Bad,Express,PayPal,Delivered,1.0,Horror,2023-06-24,2025-11-15 19:28:45,Missing values; 
2350906.0,99053.0,Alexander Clarke,Jennifer23@gmail.com,7462780976.0,30307 Stanley Plains,Portsmouth,England,24078.0,UK,19.0,Female,Medium,Regular,06-02-23,2023.0,June,8:00:56,6.0,186.2117911,1117.270746,,IKEA,Furniture,Excellent,Express,PayPal,Delivered,5.0,TV stand,2023-06-02,2025-11-15 08:00:56,Missing values; 
3884293.0,45627.0,Frederick Cox,Joseph60@gmail.com,6647350926.0,0295 Sanchez Spurs,Portsmouth,England,95612.0,UK,19.0,Female,Medium,Regular,1/19/2024,,January,4:13:40,3.0,196.322379,588.967137,Books,HarperCollins,Thriller,Bad,Express,Cash,Delivered,1.0,Detective,2024-01-19,2025-11-15 04:13:40,Missing values; 
,94548.0,Karen Davidson,Robert49@gmail.com,5650883339.0,863 Roth Throughway Suite 346,Portsmouth,England,22323.0,UK,19.0,Male,Medium,Regular,8/14/2023,2023.0,August,19:23:22,7.0,319.4722832,2236.305983,Clothing,Adidas,Jacket,Excellent,Express,Credit Card,Delivered,5.0,Trench coat,2023-08-14,2025-11-15 19:23:22,Missing values; 
7604868.0,61253.0,Amy Ross,Brian54@gmail.com,8173119750.0,608 Wagner Port,Portsmouth,England,72093.0,UK,19.0,Male,Medium,Regular,10/25/2023,2023.0,October,23:30:37,6.0,58.43602061,350.6161236,Grocery,Coca-Cola,Soft Drink,,Standard,Cash,Delivered,,Lemon-lime soda,2023-10-25,2025-11-15 23:30:37,Missing values; 
1472687.0,11637.0,James Zamora,Christian15@gmail.com,6932451645.0,06936 Harvey Trace,Portsmouth,England,1510.0,UK,19.0,Male,Medium,Regular,,2023.0,March,13:09:09,1.0,309.4435975,309.4435975,Clothing,Nike,Shorts,Excellent,Same-Day,PayPal,Delivered,4.0,Board shorts,,2025-11-15 13:09:09,Missing values; 
2369357.0,73973.0,James Melendez,Justin65@gmail.com,5350315043.0,242 Michael Underpass,Portsmouth,England,24102.0,UK,19.0,Female,Medium,Regular,12/15/2023,2023.0,December,21:51:22,2.0,244.4768706,488.9537412,Books,,Non-Fiction,Bad,Same-Day,Debit Card,Delivered,1.0,Cooking,2023-12-15,2025-11-15 21:51:22,Missing values; 
6798106.0,85671.0,James Hickman,Jessica94@gmail.com,4961575895.0,36284 Garcia Drives Apt. 927,Portsmouth,England,47294.0,UK,19.0,Male,Medium,Regular,11/17/2023,2023.0,November,10:12:37,,249.1169227,249.1169227,Clothing,Zara,Dress,Good,Same-Day,PayPal,Delivered,3.0,Casual dress,2023-11-17,2025-11-15 10:12:37,Missing values; 
7401773.0,89633.0,Dr. Eugene Branch,Mary40@gmail.com,,05398 Mark Land,Portsmouth,England,62138.0,UK,19.0,Female,Medium,Regular,08-09-23,2023.0,August,12:01:19,3.0,242.1403646,726.4210939,Grocery,Nestle,Chocolate,Bad,Standard,PayPal,Delivered,1.0,Dark chocolate,2023-08-09,2025-11-15 12:01:19,Missing values; 
3480981.0,57468.0,Cassandra White,Angela31@gmail.com,7515151740.0,283 Brown Extensions Apt. 430,Portsmouth,England,73329.0,UK,19.0,Male,Medium,Regular,2/23/2024,2024.0,,20:44:57,2.0,456.69947,913.3989401,Electronics,Apple,Tablet,Average,Standard,PayPal,Delivered,2.0,Microsoft Surface,2024-02-23,2025-11-15 20:44:57,Missing values; 
3933051.0,,Robert Mann,Megan68@gmail.com,2394316802.0,801 Velasquez Viaduct,Portsmouth,England,21280.0,UK,19.0,Female,Medium,Regular,06-08-23,2023.0,June,18:16:28,1.0,230.2443239,230.2443239,Grocery,Coca-Cola,Soft Drink,Average,Same-Day,Credit Card,Delivered,2.0,Energy drink,2023-06-08,2025-11-15 18:16:28,Missing values; 
2563160.0,15115.0,Kevin Poole,Paula44@gmail.com,8951422789.0,291 Walker Meadows Suite 882,Portsmouth,England,79690.0,UK,19.0,Female,Medium,Regular,8/22/2023,,August,15:01:00,5.0,240.3193001,1201.5965,Books,Random House,Literature,Excellent,Standard,PayPal,Delivered,4.0,Contemporary literature,2023-08-22,2025-11-15 15:01:00,Missing values; 
4188301.0,51811.0,Jennifer Barker,Misty18@gmail.com,2962207589.0,086 Marshall Land,Portsmouth,England,94411.0,UK,19.0,Male,Medium,Regular,05-12-23,2023.0,May,,1.0,82.67803668,82.67803668,Clothing,Zara,Shirt,Good,Standard,Cash,Delivered,4.0,Sweatshirt,2023-05-12,,Missing values; 
6837943.0,73186.0,Charles Guerrero,,6962597263.0,912 Stevens Bridge,Portsmouth,England,7120.0,UK,19.0,Male,Medium,Regular,11/25/2023,2023.0,November,7:52:17,4.0,134.6175202,538.4700808,Books,Penguin Books,Non-Fiction,Bad,Same-Day,Cash,Delivered,1.0,Psychology,2023-11-25,2025-11-15 07:52:17,Missing values; 
7693563.0,79097.0,Joseph Lloyd,,3449658689.0,126 Tina Knolls Suite 590,Portsmouth,England,65567.0,UK,19.0,Female,Medium,Regular,08-10-23,2023.0,August,11:27:12,2.0,309.2283473,618.4566946,Clothing,Adidas,Jacket,Good,Express,Debit Card,Delivered,4.0,Windbreaker,2023-08-10,2025-11-15 11:27:12,Missing values; 
1377193.0,45263.0,Sylvia White,Rachel62@gmail.com,6767972532.0,78313 Joshua Course,Portsmouth,England,98936.0,UK,19.0,Male,Medium,Regular,2/29/2024,2024.0,February,1:13:29,,403.0581107,3627.522996,Grocery,Coca-Cola,Water,Good,Standard,Debit Card,Delivered,3.0,Sparkling water,2024-02-29,2025-11-15 01:13:29,Missing values; 
3926323.0,28866.0,Mr. Brian Coleman,Brenda72@gmail.com,8102531058.0,91048 Maria Square Apt. 687,Portsmouth,England,30205.0,UK,19.0,Male,Medium,Regular,05-03-23,2023.0,May,22:04:01,,302.8190081,1211.276032,Clothing,Adidas,T-shirt,Bad,Standard,Credit Card,Delivered,1.0,Crop top,2023-05-03,2025-11-15 22:04:01,Missing values; 
,92403.0,Christopher Blackburn,Nicole97@gmail.com,3717144472.0,8286 Karen Cliffs,Portsmouth,England,75661.0,UK,19.0,Female,Medium,Regular,11/16/2023,2023.0,November,21:42:19,10.0,245.8457321,2458.457321,Books,Penguin Books,Children's,Average,Same-Day,Credit Card,Delivered,2.0,Sports equipment,2023-11-16,2025-11-15 21:42:19,Missing values; 
9017473.0,72939.0,Thomas Martinez,Antonio18@gmail.com,8614111831.0,778 Sarah Estate,Portsmouth,England,65774.0,UK,19.0,Male,Medium,Regular,9/21/2023,,September,8:07:09,1.0,494.0661578,494.0661578,Grocery,Pepsi,Soft Drink,Good,Standard,Credit Card,Delivered,4.0,Root beer,2023-09-21,2025-11-15 08:07:09,Missing values; 
4835635.0,28629.0,Laura Moss,Brandi52@gmail.com,8997567093.0,479 Matthew Overpass Apt. 328,Portsmouth,England,46899.0,UK,19.0,Male,Medium,Regular,7/26/2023,2023.0,July,18:20:18,4.0,372.927414,1491.709656,Clothing,Nike,Shorts,,Standard,Credit Card,Delivered,,Cycling shorts,2023-07-26,2025-11-15 18:20:18,Missing values; 
6183428.0,49455.0,Timothy Gilbert,Rhonda76@gmail.com,6362395473.0,659 Lisa Island,Portsmouth,England,12714.0,UK,19.0,Male,Medium,Regular,2/29/2024,2024.0,February,,1.0,246.6063509,246.6063509,Clothing,Adidas,Jacket,Bad,Standard,Debit Card,Delivered,1.0,Leather jacket,2024-02-29,,Missing values; 
2857332.0,79049.0,Todd Rodriguez,Justin94@gmail.com,4953698668.0,393 Horn Pass Suite 907,Portsmouth,England,87998.0,UK,19.0,Female,Medium,Regular,2/26/2024,2024.0,February,21:47:36,5.0,27.95005493,139.7502746,Electronics,Samsung,Smartphone,Good,Same-Day,,Delivered,3.0,iPhone,2024-02-26,2025-11-15 21:47:36,Missing values; 
1815327.0,54912.0,Gregg Benson,Jennifer32@gmail.com,8288189264.0,8955 Anderson Plains Suite 144,Portsmouth,England,,UK,19.0,Male,Medium,Regular,8/25/2023,2023.0,August,23:23:24,2.0,266.3220012,532.6440025,Clothing,Adidas,Jacket,Excellent,Express,Cash,Delivered,4.0,Peacoat,2023-08-25,2025-11-15 23:23:24,Missing values; 
6307647.0,82122.0,Brandon Manning,Margaret43@gmail.com,6535125653.0,991 Monroe Village,Portsmouth,England,,UK,19.0,Male,Medium,Regular,08-10-23,2023.0,August,13:01:55,8.0,24.20655283,193.6524226,Home Decor,IKEA,Furniture,Excellent,Express,Cash,Delivered,4.0,Sofa,2023-08-10,2025-11-15 13:01:55,Missing values; 
9726294.0,,Allison Moore,Corey40@gmail.com,1866944422.0,938 Henry Parkway Suite 517,Portsmouth,England,44187.0,UK,19.0,Male,Medium,Regular,5/21/2023,2023.0,May,20:42:56,8.0,395.5530158,3164.424126,Grocery,Coca-Cola,Water,Bad,Same-Day,PayPal,Delivered,1.0,Spring water,2023-05-21,2025-11-15 20:42:56,Missing values; 
9663927.0,92235.0,Jeffrey Silva,Kiara27@gmail.com,2669963084.0,73295 Wendy Loop Apt. 952,Portsmouth,England,77895.0,UK,19.0,,Medium,Regular,11/14/2023,2023.0,November,16:17:34,9.0,40.00089863,360.0080877,Grocery,Nestle,Coffee,Bad,Same-Day,Debit Card,Delivered,1.0,Affogato,2023-11-14,2025-11-15 16:17:34,Missing values; 
9819280.0,,Austin Duran,Patricia77@gmail.com,4300328279.0,52727 Jacobs Mountain Suite 108,Portsmouth,England,46023.0,UK,19.0,Female,Medium,Regular,02-10-24,2024.0,February,12:59:35,2.0,150.4123512,300.8247024,Home Decor,Bed Bath & Beyond,Bathroom,Bad,Express,Credit Card,Delivered,1.0,Mirror,2024-02-10,2025-11-15 12:59:35,Missing values; 
8351032.0,70931.0,Michael Fitzpatrick,Angela5@gmail.com,7067135037.0,74190 Martin Trace Suite 361,Portsmouth,England,24954.0,UK,19.0,Female,Medium,Regular,4/24/2023,2023.0,April,19:50:34,,384.679504,3077.436032,Clothing,Nike,T-shirt,Good,Same-Day,Cash,Delivered,3.0,Raglan tee,2023-04-24,2025-11-15 19:50:34,Missing values; 
4690790.0,95146.0,Alison Stevens,Thomas35@gmail.com,1964204872.0,9637 Hoover Summit Suite 449,Portsmouth,England,66616.0,UK,19.0,Female,Medium,Regular,5/18/2023,2023.0,May,18:52:51,6.0,280.8645104,1685.187062,Home Decor,,Bedding,Bad,Standard,Cash,Delivered,1.0,Pillowcase set,2023-05-18,2025-11-15 18:52:51,Missing values; 
9341561.0,85756.0,Peter Valenzuela,Erin90@gmail.com,,97152 Conner Isle Apt. 440,Portsmouth,England,8097.0,UK,19.0,Female,Medium,Regular,05-10-23,2023.0,May,12:00:08,5.0,332.7490894,1663.745447,Home Decor,Bed Bath & Beyond,Bedding,Average,Same-Day,Cash,Delivered,2.0,Quilt,2023-05-10,2025-11-15 12:00:08,Missing values; 
6702970.0,21870.0,Michael Monroe,Amanda46@gmail.com,9288061489.0,7823 Rodriguez Summit Suite 149,Portsmouth,England,55886.0,UK,19.0,Male,Medium,Regular,6/20/2023,2023.0,June,6:43:19,8.0,72.43421802,579.4737442,Electronics,Samsung,Television,,Same-Day,Credit Card,Delivered,,LCD TV,2023-06-20,2025-11-15 06:43:19,Missing values; 
,77661.0,Tammy Jenkins,Eric97@gmail.com,1867437385.0,5099 Kim Junctions,Portsmouth,England,4690.0,UK,19.0,Female,Medium,Regular,04-08-23,2023.0,April,6:21:50,10.0,454.7652845,4547.652845,Home Decor,Home Depot,Furniture,Excellent,Standard,Credit Card,Delivered,4.0,Nightstand,2023-04-08,2025-11-15 06:21:50,Missing values; 
9447753.0,59786.0,John Lee,Richard44@gmail.com,2639425308.0,75367 Jason Glen Suite 394,Portsmouth,England,38491.0,UK,19.0,Male,Medium,Regular,,2023.0,November,1:42:11,10.0,339.8548673,3398.548673,Grocery,Coca-Cola,Soft Drink,Good,Same-Day,Credit Card,Delivered,3.0,Energy drink,,2025-11-15 01:42:11,Missing values; 
4111503.0,62302.0,Sherri Cooper,Gregory35@gmail.com,2609312637.0,2942 Tammy Run Suite 606,Portsmouth,England,87183.0,UK,19.0,Male,Medium,Regular,3/23/2023,2023.0,March,3:10:00,9.0,,4331.760803,Electronics,Samsung,Television,Good,Express,Cash,Delivered,3.0,OLED TV,2023-03-23,2025-11-15 03:10:00,Missing values; 
8578125.0,,Kimberly Nguyen,Danielle65@gmail.com,3799553413.0,816 Perez Ferry,Portsmouth,England,72203.0,UK,19.0,Female,Medium,Regular,6/16/2023,2023.0,June,19:44:50,1.0,333.7058247,333.7058247,Grocery,Pepsi,Juice,Excellent,Standard,Credit Card,Delivered,4.0,Cranberry juice,2023-06-16,2025-11-15 19:44:50,Missing values; 
9282735.0,71678.0,Carolyn Stewart,Victoria2@gmail.com,1104617814.0,,Portsmouth,England,22364.0,UK,19.0,Female,Medium,Regular,09-06-23,2023.0,September,11:00:36,7.0,31.2534925,218.7744475,Electronics,Sony,Television,Excellent,Same-Day,PayPal,Delivered,4.0,HDR TV,2023-09-06,2025-11-15 11:00:36,Missing values; 
1163419.0,12906.0,Shane Wolf,Ann74@gmail.com,5527077217.0,,Portsmouth,England,38580.0,UK,19.0,Female,Medium,Regular,6/24/2023,2023.0,June,4:51:08,9.0,68.87534528,619.8781075,Books,Penguin Books,Children's,Bad,Same-Day,Cash,Delivered,1.0,Building blocks,2023-06-24,2025-11-15 04:51:08,Missing values; 
2079427.0,19875.0,Sherry Kerr,Matthew7@gmail.com,2376297706.0,,Portsmouth,England,44279.0,UK,19.0,Male,Medium,Regular,1/25/2024,2024.0,January,13:35:22,5.0,192.5584041,962.7920206,Electronics,Apple,Smartphone,Average,Standard,Debit Card,Delivered,2.0,LG G,2024-01-25,2025-11-15 13:35:22,Missing values; 
7095053.0,55583.0,Ian Wright,,7029535415.0,703 Sullivan Parks Apt. 903,Portsmouth,England,64107.0,UK,19.0,Male,Medium,Regular,07-07-23,2023.0,July,14:38:14,2.0,357.4463048,714.8926097,Electronics,Sony,Smartphone,Excellent,Same-Day,Cash,Delivered,4.0,Motorola Moto,2023-07-07,2025-11-15 14:38:14,Missing values; 
8027291.0,,Jerry Allen,Larry88@gmail.com,5536312129.0,2938 Debbie Terrace,Portsmouth,England,27496.0,UK,19.0,Female,Medium,Regular,11/27/2023,2023.0,November,19:43:13,3.0,383.2422953,1149.726886,Clothing,Zara,Jeans,Excellent,Same-Day,Debit Card,Delivered,4.0,Cropped jeans,2023-11-27,2025-11-15 19:43:13,Missing values; 
9970840.0,56879.0,Jay Snow,Kari73@gmail.com,7763445658.0,6983 Nunez Mission,Portsmouth,England,73489.0,UK,19.0,Male,Medium,Regular,,2023.0,September,22:58:43,10.0,203.6483666,2036.483666,Clothing,Nike,T-shirt,Average,Same-Day,Cash,Delivered,2.0,Raglan tee,,2025-11-15 22:58:43,Missing values; 
3045963.0,66085.0,Joshua Schmidt,,3987255740.0,8001 Ward Crescent,Portsmouth,England,98859.0,UK,19.0,Male,Medium,Regular,1/22/2024,2024.0,January,0:06:09,9.0,362.1905906,3259.715315,Grocery,Coca-Cola,Soft Drink,Good,Standard,PayPal,Delivered,3.0,Root beer,2024-01-22,2025-11-15 00:06:09,Missing values; 
2512075.0,47517.0,Blake Haley,Taylor3@gmail.com,6400926749.0,,Portsmouth,England,48227.0,UK,19.0,Male,Medium,Regular,9/28/2023,2023.0,September,17:10:20,4.0,88.90585571,355.6234229,Electronics,Apple,Laptop,Excellent,Express,Cash,Delivered,4.0,Samsung Notebook,2023-09-28,2025-11-15 17:10:20,Missing values; 
4476298.0,39591.0,Adam Smith,Bryan17@gmail.com,,956 Vasquez Plaza Suite 194,Portsmouth,England,47184.0,UK,19.0,Female,Medium,Regular,6/30/2023,2023.0,June,10:29:49,9.0,405.2417435,3647.175691,Electronics,Apple,Laptop,Bad,Standard,Cash,Delivered,1.0,Microsoft Surface Laptop,2023-06-30,2025-11-15 10:29:49,Missing values; 
2485970.0,94395.0,Lauren Mejia,Michelle65@gmail.com,4581457120.0,79637 Steven Meadows,Portsmouth,England,74126.0,UK,19.0,Female,Medium,Regular,8/28/2023,2023.0,,6:14:28,4.0,58.59593853,234.3837541,Clothing,Zara,Dress,Excellent,Same-Day,Credit Card,Delivered,5.0,Sundress,2023-08-28,2025-11-15 06:14:28,Missing values; 
,98078.0,Steven Kane,Philip4@gmail.com,1801144193.0,58287 Jackson Brook Apt. 287,Portsmouth,England,86352.0,UK,19.0,Male,Medium,Regular,1/25/2024,2024.0,January,9:08:28,4.0,224.6333942,898.5335768,Clothing,Zara,Shirt,Good,Express,Credit Card,Delivered,4.0,T-shirt,2024-01-25,2025-11-15 09:08:28,Missing values; 
2232366.0,42107.0,Amber Gonzalez,Katherine81@gmail.com,2548968594.0,3129 Joy Highway,Portsmouth,England,23688.0,UK,19.0,Male,Medium,Regular,5/13/2023,2023.0,May,22:54:04,6.0,282.2015986,1693.209592,,Zara,Shirt,Bad,Same-Day,Credit Card,Delivered,1.0,Button-down shirt,2023-05-13,2025-11-15 22:54:04,Missing values; 
8097251.0,26549.0,Rebecca Shaw,Mark7@gmail.com,5247958327.0,3390 Smith Fall Apt. 536,Portsmouth,England,22741.0,UK,19.0,Male,Medium,Regular,,2023.0,May,16:05:29,1.0,259.7956029,259.7956029,Home Decor,Bed Bath & Beyond,Bedding,Bad,Express,Debit Card,Delivered,1.0,Quilt,,2025-11-15 16:05:29,Missing values; 
1703492.0,16624.0,Warren Porter,William37@gmail.com,6351826401.0,421 Kaiser Grove Apt. 305,Portsmouth,England,45179.0,UK,19.0,Female,Medium,Regular,2/24/2024,2024.0,February,16:08:17,,256.4023031,256.4023031,Home Decor,Home Depot,Decorations,Excellent,Express,Credit Card,Delivered,5.0,Curtains,2024-02-24,2025-11-15 16:08:17,Missing values; 
6059051.0,63724.0,Christopher Torres,Scott48@gmail.com,4601332357.0,66784 Henry Plaza,Portsmouth,England,90648.0,UK,19.0,Female,Medium,Regular,5/17/2023,2023.0,May,21:50:35,8.0,,2114.635967,Electronics,Samsung,Tablet,Bad,Same-Day,Cash,Delivered,1.0,Google Pixel Slate,2023-05-17,2025-11-15 21:50:35,Missing values; 
3355234.0,65270.0,Thomas Hernandez,Heather68@gmail.com,6687284814.0,380 Clayton Pike Apt. 416,Portsmouth,England,99841.0,UK,19.0,Female,Medium,Regular,07-02-23,2023.0,July,3:11:49,10.0,25.65034883,256.5034883,Books,Random House,Non-Fiction,Good,,Debit Card,Delivered,4.0,Science,2023-07-02,2025-11-15 03:11:49,Missing values; 
6662436.0,71788.0,Christopher Jones,Christopher56@gmail.com,8727937811.0,067 Mack Mills,Portsmouth,England,9818.0,UK,19.0,Female,Medium,Regular,10-09-23,2023.0,,2:48:32,9.0,77.82344894,700.4110405,Grocery,Pepsi,Juice,Average,Standard,PayPal,Delivered,2.0,Grapefruit juice,2023-10-09,2025-11-15 02:48:32,Missing values; 
9822125.0,15171.0,Destiny Reed,Steven76@gmail.com,1078277076.0,8553 William Hills,Portsmouth,England,76032.0,UK,19.0,Male,Medium,Regular,02-11-24,,February,12:22:07,9.0,477.7357771,4299.621994,Grocery,Pepsi,Juice,Average,Express,Debit Card,Delivered,2.0,Apple juice,2024-02-11,2025-11-15 12:22:07,Missing values; 
7549247.0,39266.0,Alexandria Thompson,Robin30@gmail.com,2701070043.0,71684 Kyle Junction,Portsmouth,England,23077.0,UK,19.0,Female,Medium,Regular,11-08-23,2023.0,November,17:34:25,1.0,44.44867488,44.44867488,Home Decor,Home Depot,Decorations,Average,,PayPal,Delivered,2.0,Decorative pillows,2023-11-08,2025-11-15 17:34:25,Missing values; 
6510022.0,29223.0,Michael Holmes PhD,Brent59@gmail.com,2990472644.0,4043 Scott Crest,Portsmouth,England,93368.0,UK,19.0,Male,Medium,Regular,01-10-24,2024.0,January,17:08:20,8.0,188.3778133,1507.022506,Grocery,Pepsi,Soft Drink,Average,Same-Day,,Delivered,2.0,Ginger ale,2024-01-10,2025-11-15 17:08:20,Missing values; 
8889102.0,51763.0,Daniel Smith,Brandon36@gmail.com,7696934514.0,665 Flowers Street,Portsmouth,England,56699.0,UK,19.0,Male,Medium,Regular,1/20/2024,2024.0,January,15:31:05,10.0,349.3834937,3493.834937,Electronics,Samsung,Smartphone,Bad,,Credit Card,Delivered,1.0,LG G,2024-01-20,2025-11-15 15:31:05,Missing values; 
7775266.0,69153.0,Kyle Villa,Emily100@gmail.com,9468296956.0,59799 Caleb Hollow,Portsmouth,England,46945.0,UK,19.0,Male,Medium,Regular,6/25/2023,2023.0,June,22:24:44,9.0,,2233.876721,Grocery,Pepsi,Juice,Bad,Same-Day,PayPal,Delivered,1.0,Tomato juice,2023-06-25,2025-11-15 22:24:44,Missing values; 
7857696.0,46634.0,William Roy,Lisa51@gmail.com,9201625232.0,4662 James Knoll Apt. 927,Portsmouth,England,49571.0,UK,19.0,Male,Medium,Regular,,2023.0,October,7:32:52,5.0,33.74231528,168.7115764,Home Decor,Home Depot,Furniture,Good,Standard,Cash,Delivered,3.0,Sofa,,2025-11-15 07:32:52,Missing values; 
2264559.0,37165.0,David Hernandez,Wesley81@gmail.com,,869 Brewer Junction,Portsmouth,England,36051.0,UK,19.0,Female,Medium,Regular,10/19/2023,2023.0,October,6:25:03,3.0,493.8832234,1481.64967,Clothing,Nike,Shoes,Excellent,Standard,Cash,Delivered,4.0,Flip flops,2023-10-19,2025-11-15 06:25:03,Missing values; 
9665092.0,89391.0,Sarah Bass,Angela36@gmail.com,5511581576.0,17961 Harrison Camp Apt. 666,Portsmouth,England,11131.0,UK,19.0,Male,Medium,Regular,07-11-23,2023.0,July,10:04:28,1.0,13.16737398,13.16737398,Home Decor,Home Depot,Furniture,Average,,Cash,Delivered,2.0,Dresser,2023-07-11,2025-11-15 10:04:28,Missing values; 
9752707.0,16388.0,Barbara Weber,Janet59@gmail.com,9421002816.0,266 Joel Plains,Portsmouth,England,71752.0,UK,19.0,Female,Medium,Regular,11/21/2023,2023.0,November,23:41:58,9.0,250.5815104,2255.233593,,IKEA,Lighting,Average,Same-Day,Debit Card,Delivered,2.0,Recessed lighting,2023-11-21,2025-11-15 23:41:58,Missing values; 
6094241.0,57915.0,Shawn Snyder,Ricardo6@gmail.com,3925173580.0,8973 Sean Forest,Portsmouth,England,48580.0,UK,19.0,Male,Medium,Regular,,2023.0,April,23:20:37,1.0,159.8672982,159.8672982,Grocery,Coca-Cola,Water,Good,Same-Day,Cash,Delivered,4.0,Sparkling water,,2025-11-15 23:20:37,Missing values; 
5564697.0,81789.0,Elizabeth Palmer,Jennifer60@gmail.com,6374440647.0,10427 Stein Road,Portsmouth,England,51417.0,UK,19.0,Male,Medium,Regular,01-01-24,2024.0,January,22:19:02,10.0,52.00458976,520.0458976,Home Decor,IKEA,Furniture,Average,Standard,,Delivered,2.0,Dining table,2024-01-01,2025-11-15 22:19:02,Missing values; 
6723409.0,,Jared Evans,Russell97@gmail.com,8380491292.0,3252 Brian Knoll,Portsmouth,England,51376.0,UK,19.0,Female,Medium,Regular,09-12-23,2023.0,September,21:20:49,7.0,435.5493474,3048.845432,Home Decor,IKEA,Lighting,Good,Same-Day,PayPal,Delivered,4.0,Floor lamps,2023-09-12,2025-11-15 21:20:49,Missing values; 
6557285.0,92238.0,Mary Brooks,Jeffrey45@gmail.com,7347981187.0,67026 Brandon Cape,Portsmouth,England,72940.0,UK,19.0,Male,Medium,Regular,03-12-23,2023.0,March,18:57:54,,93.43081575,280.2924473,Electronics,Sony,Smartphone,Good,Standard,Debit Card,Delivered,3.0,Xiaomi Mi,2023-03-12,2025-11-15 18:57:54,Missing values; 
9440397.0,53839.0,Kathryn Torres,Lindsay80@gmail.com,6262531672.0,7779 Meyers Plain,Portsmouth,England,34430.0,UK,19.0,Male,Medium,Regular,6/18/2023,2023.0,,19:55:08,2.0,423.4696175,846.939235,Home Decor,Bed Bath & Beyond,Kitchen,Excellent,Standard,Cash,Delivered,5.0,Blender,2023-06-18,2025-11-15 19:55:08,Missing values; 
6614665.0,73308.0,,Mariah42@gmail.com,9386078790.0,50205 Randy Junctions Suite 653,Portsmouth,England,92013.0,UK,19.0,Male,Medium,Regular,5/19/2023,2023.0,May,6:17:43,2.0,430.1815518,860.3631037,Home Decor,IKEA,Lighting,Excellent,Same-Day,Cash,Delivered,5.0,Table lamps,2023-05-19,2025-11-15 06:17:43,Missing values; 
6006634.0,22212.0,Hector Brown,Luke90@gmail.com,3574354037.0,73375 Kyle Court Apt. 023,Portsmouth,England,45757.0,UK,19.0,Male,Medium,Regular,8/18/2023,2023.0,August,23:31:34,1.0,103.9136998,103.9136998,Electronics,Sony,Television,Bad,,Debit Card,Delivered,1.0,HDR TV,2023-08-18,2025-11-15 23:31:34,Missing values; 
9406293.0,75047.0,Chris Zuniga,Stephanie55@gmail.com,2635468261.0,9742 Robert Camp,Portsmouth,England,73649.0,UK,19.0,Male,Medium,Regular,06-03-23,2023.0,June,4:30:35,3.0,191.2948777,,Books,HarperCollins,Fiction,Bad,Standard,Debit Card,Delivered,1.0,Dystopian,2023-06-03,2025-11-15 04:30:35,Missing values; 
1959385.0,26296.0,Christopher Espinoza,Elizabeth22@gmail.com,7468949789.0,412 King Hills Suite 347,Portsmouth,England,2856.0,UK,19.0,Male,Medium,Regular,3/13/2023,2023.0,March,10:25:55,10.0,346.8915554,,Clothing,Nike,Shoes,Average,Standard,Debit Card,Delivered,2.0,Loafers,2023-03-13,2025-11-15 10:25:55,Missing values; 
6131113.0,32200.0,Mr. Joe Salinas,Daniel82@gmail.com,4086011105.0,455 Johnson Ford,Portsmouth,England,90078.0,UK,19.0,,Medium,Regular,03-05-23,2023.0,March,6:12:58,9.0,284.4143307,2559.728977,Home Decor,Bed Bath & Beyond,Bathroom,Average,Express,Credit Card,Delivered,2.0,Shower curtain,2023-03-05,2025-11-15 06:12:58,Missing values; 
8228064.0,91246.0,Jamie Morales,,8845189330.0,02285 Jacob Views,Portsmouth,England,24000.0,UK,19.0,Female,Medium,Regular,12-02-23,2023.0,December,17:55:59,6.0,182.5502568,1095.301541,Clothing,Zara,Dress,Excellent,Same-Day,Credit Card,Delivered,5.0,Casual dress,2023-12-02,2025-11-15 17:55:59,Missing values; 
9369292.0,81139.0,Jamie Reed,Anthony60@gmail.com,7846078399.0,66414 Peterson Crest,Portsmouth,England,31879.0,UK,19.0,Male,Medium,Regular,11/24/2023,2023.0,November,12:42:50,6.0,155.2980231,931.7881388,Home Decor,Bed Bath & Beyond,Bedding,Average,Express,,Delivered,2.0,Dust ruffle,2023-11-24,2025-11-15 12:42:50,Missing values; 
7840795.0,77127.0,Nicole Cox,Michelle60@gmail.com,9697175714.0,143 Eric Pine Apt. 416,Portsmouth,England,21581.0,UK,19.0,Female,Medium,Regular,02-03-24,2024.0,February,14:31:42,,486.9691004,973.9382007,Clothing,Nike,Shorts,Excellent,Express,Cash,Delivered,5.0,Swim trunks,2024-02-03,2025-11-15 14:31:42,Missing values; 
3282214.0,35549.0,David Norris,Rachel27@gmail.com,5246774953.0,18161 Andrew Corners,Portsmouth,England,54537.0,UK,19.0,Female,Medium,Regular,10/27/2023,2023.0,October,4:13:38,7.0,195.5244706,1368.671294,Books,,Children's,Excellent,Express,Cash,Delivered,4.0,Sports equipment,2023-10-27,2025-11-15 04:13:38,Missing values; 
,91391.0,Jacqueline Peters,Rachel25@gmail.com,6895460902.0,6000 Gomez Radial,Portsmouth,England,26325.0,UK,19.0,Male,Medium,Regular,04-02-23,,April,23:19:37,6.0,38.76576915,232.5946149,Clothing,Zara,Shirt,Excellent,Express,Cash,Delivered,5.0,Blouse,2023-04-02,2025-11-15 23:19:37,Missing values; 
3436363.0,87875.0,Annette Wood DDS,Alan37@gmail.com,4508959033.0,2688 Johnson Lane Apt. 858,Portsmouth,England,46630.0,UK,19.0,Female,Medium,Regular,,2023.0,October,18:38:12,10.0,468.6885767,4686.885767,Home Decor,Bed Bath & Beyond,Bathroom,Bad,Standard,Debit Card,Delivered,1.0,Mirror,,2025-11-15 18:38:12,Missing values; 
9134639.0,12438.0,Jill Vega,Jack3@gmail.com,,3386 Natasha Rest Suite 575,Portsmouth,England,87667.0,UK,19.0,Male,Medium,Regular,11/26/2023,2023.0,November,14:34:27,9.0,411.8099878,3706.28989,Clothing,Nike,T-shirt,Excellent,Express,Credit Card,Delivered,4.0,Raglan tee,2023-11-26,2025-11-15 14:34:27,Missing values; 
2828201.0,85267.0,Andrea Hanna,Stephen55@gmail.com,6964767131.0,2630 Todd Knolls,Portsmouth,England,,UK,19.0,Male,Medium,Regular,4/14/2023,2023.0,April,15:03:01,3.0,387.9711535,1163.91346,Books,HarperCollins,Fiction,Average,Express,Credit Card,Delivered,2.0,Horror,2023-04-14,2025-11-15 15:03:01,Missing values; 
9611828.0,96319.0,Janet Parker,Samantha60@gmail.com,3717978257.0,6076 Daniel Rest,Portsmouth,England,82512.0,UK,19.0,Female,Medium,Regular,6/22/2023,2023.0,June,13:07:53,6.0,81.74575137,490.4745082,,Samsung,Smartphone,Bad,Standard,Credit Card,Delivered,1.0,Nokia,2023-06-22,2025-11-15 13:07:53,Missing values; 
9090164.0,73912.0,Samantha Nelson,John51@gmail.com,8229745669.0,95903 Stone Valleys Apt. 928,Portsmouth,England,28689.0,UK,19.0,Male,Medium,Regular,08-11-23,2023.0,August,3:02:22,,222.8938,1114.469,Books,Random House,Fiction,Bad,Same-Day,PayPal,Delivered,1.0,Adventure,2023-08-11,2025-11-15 03:02:22,Missing values; 
5654558.0,84653.0,Dr. Olivia Smith MD,James71@gmail.com,,751 Leslie Crest,Portsmouth,England,75285.0,UK,19.0,Male,Medium,Regular,5/23/2023,2023.0,May,20:35:00,8.0,184.1440081,1473.152064,Clothing,Adidas,Jacket,Average,Same-Day,Debit Card,Delivered,2.0,Bomber jacket,2023-05-23,2025-11-15 20:35:00,Missing values; 
1914066.0,94478.0,Christopher Torres,Amanda63@gmail.com,7304916551.0,826 Simon Corner,Portsmouth,England,31781.0,UK,19.0,Male,Medium,Regular,10/14/2023,2023.0,October,10:55:54,4.0,490.8551403,,Grocery,Nestle,Coffee,Good,Standard,PayPal,Delivered,3.0,Instant coffee,2023-10-14,2025-11-15 10:55:54,Missing values; 
3723659.0,50229.0,Joanna Erickson,Becky44@gmail.com,2856435415.0,82458 Snyder Islands,Portsmouth,England,59358.0,UK,19.0,Male,Medium,Regular,9/14/2023,2023.0,September,5:59:28,5.0,267.0572748,1335.286374,Home Decor,IKEA,Furniture,Excellent,Same-Day,,Delivered,5.0,Coffee table,2023-09-14,2025-11-15 05:59:28,Missing values; 
7006945.0,13034.0,Kathy Garcia,Jessica63@gmail.com,2121189834.0,84318 Juarez Turnpike Apt. 689,Portsmouth,England,20327.0,UK,19.0,Female,Medium,Regular,7/25/2023,2023.0,July,21:18:46,9.0,480.6214844,4325.59336,Grocery,Pepsi,Juice,,Standard,PayPal,Delivered,,Pineapple juice,2023-07-25,2025-11-15 21:18:46,Missing values; 
3860348.0,18736.0,Sheryl Higgins,Sharon96@gmail.com,9939146174.0,255 Steven Plains,Portsmouth,England,37906.0,UK,19.0,Male,Medium,Regular,7/29/2023,2023.0,,4:43:27,1.0,163.6597718,163.6597718,Clothing,Nike,Shoes,Average,Same-Day,PayPal,Delivered,2.0,Oxfords,2023-07-29,2025-11-15 04:43:27,Missing values; 
8553835.0,95595.0,Jennifer Wood,Dawn12@gmail.com,,23641 Scott Orchard,Portsmouth,England,68050.0,UK,19.0,Male,Medium,Regular,5/25/2023,2023.0,May,7:44:40,6.0,46.95738453,281.7443072,Grocery,Coca-Cola,Soft Drink,Good,Standard,Debit Card,Delivered,3.0,Energy drink,2023-05-25,2025-11-15 07:44:40,Missing values; 
4258109.0,14741.0,Jose Odonnell,Bryan99@gmail.com,8135697324.0,61427 Caitlyn Spurs,Portsmouth,England,27665.0,UK,19.0,Female,Medium,Regular,,2023.0,October,23:08:32,4.0,292.3764902,1169.505961,Electronics,Sony,Television,Excellent,Same-Day,Cash,Delivered,4.0,HDR TV,,2025-11-15 23:08:32,Missing values; 
8925797.0,26847.0,Heidi Arias,Jennifer82@gmail.com,,733 Matthew Drive Apt. 411,Portsmouth,England,12011.0,UK,19.0,Male,Medium,Regular,9/21/2023,2023.0,September,8:44:16,3.0,98.78798032,296.3639409,Books,HarperCollins,Fiction,Good,Express,Credit Card,Delivered,4.0,Romance,2023-09-21,2025-11-15 08:44:16,Missing values; 
7442342.0,24774.0,John Norris,Veronica9@gmail.com,4729494914.0,,Portsmouth,England,93658.0,UK,19.0,Male,Medium,Regular,08-06-23,2023.0,August,20:52:54,6.0,320.706984,1924.241904,Clothing,Nike,Shoes,Bad,Same-Day,PayPal,Delivered,1.0,Flip flops,2023-08-06,2025-11-15 20:52:54,Missing values; 
9181719.0,,Dwayne Harris,Karen41@gmail.com,6926646206.0,16777 Michael Key,Portsmouth,England,75212.0,UK,19.0,Male,Medium,Regular,7/16/2023,2023.0,July,2:34:50,5.0,263.6392876,1318.196438,Books,Random House,Non-Fiction,Bad,Express,Debit Card,Delivered,1.0,Self-help,2023-07-16,2025-11-15 02:34:50,Missing values; 
7269056.0,,Christopher Patrick,Antonio34@gmail.com,5884778714.0,655 Serrano Glens Suite 274,Portsmouth,England,64221.0,UK,19.0,Female,Medium,Regular,11/27/2023,2023.0,November,9:53:00,4.0,40.74815053,162.9926021,Grocery,Pepsi,Juice,Bad,Express,Cash,Delivered,1.0,Pineapple juice,2023-11-27,2025-11-15 09:53:00,Missing values; 
3912385.0,90796.0,,Carol98@gmail.com,6969608432.0,7899 Sherri Loop,Portsmouth,England,94200.0,UK,19.0,Female,Medium,Regular,12/17/2023,2023.0,December,21:50:56,10.0,408.3118645,4083.118645,Home Decor,Bed Bath & Beyond,Bedding,Excellent,Standard,Cash,Delivered,4.0,Duvet cover,2023-12-17,2025-11-15 21:50:56,Missing values; 
1427426.0,63594.0,Curtis Munoz,Suzanne15@gmail.com,4968381321.0,556 Rhonda Street,Portsmouth,England,66997.0,UK,19.0,Male,Medium,Regular,04-06-23,2023.0,April,23:34:15,7.0,456.3877567,3194.714297,Books,HarperCollins,Fiction,,Same-Day,Cash,Delivered,,Thriller,2023-04-06,2025-11-15 23:34:15,Missing values; 
2986488.0,59493.0,Frank Bowman,Laura51@gmail.com,9404372908.0,508 Lori Oval,Portsmouth,England,84238.0,UK,19.0,Male,Medium,Regular,3/21/2023,2023.0,March,18:13:17,8.0,201.5824127,,Home Decor,IKEA,Furniture,Good,Same-Day,Credit Card,Delivered,4.0,TV stand,2023-03-21,2025-11-15 18:13:17,Missing values; 
7869364.0,62263.0,Jennifer Thornton,Leah37@gmail.com,7294170783.0,89915 Kennedy Glens Apt. 068,Portsmouth,England,50219.0,UK,19.0,Female,Medium,Regular,12-12-23,2023.0,December,2:47:11,1.0,402.9707708,402.9707708,Electronics,Samsung,Smartphone,,Same-Day,Credit Card,Delivered,,Motorola Moto,2023-12-12,2025-11-15 02:47:11,Missing values; 
4531692.0,70752.0,Barbara Smith,Patrick97@gmail.com,9677145171.0,658 Casey Shoals Suite 758,Portsmouth,England,51698.0,UK,19.0,Male,Medium,Regular,9/18/2023,2023.0,September,11:15:09,1.0,151.4341795,151.4341795,Grocery,Coca-Cola,Juice,,Standard,Debit Card,Delivered,,Mango juice,2023-09-18,2025-11-15 11:15:09,Missing values; 
4269259.0,80812.0,Sara Robles,Melinda45@gmail.com,6689128659.0,289 Amber Walks Suite 823,Portsmouth,England,,UK,19.0,Male,Medium,Regular,07-10-23,2023.0,July,11:45:34,10.0,27.07697801,270.7697801,Home Decor,IKEA,Lighting,Bad,Express,Credit Card,Delivered,1.0,Wall sconces,2023-07-10,2025-11-15 11:45:34,Missing values; 
4398060.0,77756.0,Kenneth Turner,Lisa42@gmail.com,,4725 Donald Path Suite 854,Portsmouth,England,24303.0,UK,19.0,Female,Medium,Regular,12/28/2023,2023.0,December,4:48:26,7.0,33.32242315,233.2569621,Books,HarperCollins,Non-Fiction,Excellent,Express,Debit Card,Delivered,5.0,Science,2023-12-28,2025-11-15 04:48:26,Missing values; 
6624575.0,74652.0,Melanie Henderson,Herbert19@gmail.com,2754702807.0,25575 Oconnor Valleys,Portsmouth,England,69691.0,UK,19.0,,Medium,Regular,8/23/2023,2023.0,August,9:01:30,3.0,143.9618585,431.8855755,Grocery,Coca-Cola,Juice,Average,Express,PayPal,Delivered,2.0,Cranberry juice,2023-08-23,2025-11-15 09:01:30,Missing values; 
5017712.0,24930.0,Cassandra Durham,Francisco59@gmail.com,9491740784.0,75765 Smith Union,Portsmouth,England,24141.0,UK,19.0,Female,Medium,Regular,3/29/2023,2023.0,March,12:25:40,9.0,79.12374276,712.1136848,Grocery,,Soft Drink,Good,Express,PayPal,Delivered,3.0,Cream soda,2023-03-29,2025-11-15 12:25:40,Missing values; 
4726802.0,96789.0,Michael Casey,Regina26@gmail.com,,8532 Christine Rapid Suite 239,Portsmouth,England,99427.0,UK,19.0,Male,Medium,Regular,7/22/2023,2023.0,July,16:29:04,9.0,408.8512696,3679.661427,Clothing,Adidas,T-shirt,Good,Same-Day,Credit Card,Delivered,4.0,Long-sleeve tee,2023-07-22,2025-11-15 16:29:04,Missing values; 
9561163.0,15107.0,Kenneth Harper,Kimberly3@gmail.com,4352168344.0,631 Curtis Route,Portsmouth,England,13359.0,UK,19.0,Male,Medium,Regular,03-07-23,2023.0,March,13:58:04,,139.8328062,419.4984186,Clothing,Adidas,Jacket,Average,Standard,Credit Card,Delivered,2.0,Leather jacket,2023-03-07,2025-11-15 13:58:04,Missing values; 
,46175.0,Amanda Gardner,Bobby11@gmail.com,9409382477.0,98229 Martin Square,Portsmouth,England,99728.0,UK,19.0,Female,Medium,Regular,05-08-23,2023.0,May,22:54:24,10.0,204.5771241,2045.771241,Books,HarperCollins,Fiction,Average,Express,Debit Card,Delivered,2.0,Dystopian,2023-05-08,2025-11-15 22:54:24,Missing values; 
6019013.0,52278.0,Robert Ross,Anne98@gmail.com,3133873669.0,01870 Porter Mission,Portsmouth,England,89200.0,UK,19.0,Female,Medium,Regular,11-01-23,2023.0,November,22:28:09,10.0,258.6593448,,Books,HarperCollins,Fiction,Good,Standard,Cash,Delivered,3.0,Mystery,2023-11-01,2025-11-15 22:28:09,Missing values; 
2634037.0,40208.0,Robert Hayes,Lindsay75@gmail.com,3740191926.0,2120 Pham Points Apt. 849,Portsmouth,England,73122.0,UK,19.0,Female,Medium,Regular,07-06-23,2023.0,July,4:30:15,5.0,174.7409242,873.7046208,Electronics,Samsung,Tablet,,Same-Day,Credit Card,Delivered,,Samsung Galaxy Tab,2023-07-06,2025-11-15 04:30:15,Missing values; 
8250837.0,44965.0,William Davis,Maureen41@gmail.com,8602973844.0,2220 James Estate,Portsmouth,England,31584.0,UK,19.0,Male,Medium,Regular,,2023.0,July,9:18:13,7.0,412.3989878,2886.792914,Clothing,Adidas,T-shirt,Good,Same-Day,Debit Card,Delivered,4.0,Off-the-shoulder tee,,2025-11-15 09:18:13,Missing values; 
1409596.0,30751.0,Jill Wagner,Sabrina81@gmail.com,1498366467.0,939 Mark Crossroad Suite 854,Portsmouth,England,7577.0,UK,19.0,Male,Medium,Regular,07-11-23,2023.0,July,3:22:51,3.0,98.70326507,296.1097952,Home Decor,Bed Bath & Beyond,Kitchen,Average,Express,,Delivered,2.0,Dishwasher,2023-07-11,2025-11-15 03:22:51,Missing values; 
1019014.0,,Carrie Medina,Jonathan55@gmail.com,7845687754.0,73319 Morrow View Apt. 394,Portsmouth,England,33089.0,UK,19.0,Male,Medium,Regular,1/21/2024,2024.0,January,16:00:13,7.0,341.703392,2391.923744,Home Decor,Bed Bath & Beyond,Bathroom,Average,Same-Day,PayPal,Delivered,2.0,Soap dispenser,2024-01-21,2025-11-15 16:00:13,Missing values; 
6850814.0,99002.0,Marilyn Wiggins,Mary53@gmail.com,6477411514.0,204 Jennifer Lake Suite 146,Portsmouth,England,52080.0,UK,19.0,Female,Medium,Regular,12-07-23,2023.0,December,4:53:23,7.0,266.1516034,1863.061224,Books,Random House,Non-Fiction,,Express,Cash,Delivered,,Self-help,2023-12-07,2025-11-15 04:53:23,Missing values; 
3209540.0,33720.0,Joseph Bowen,Kristin55@gmail.com,7053094597.0,457 Matthew Rapid,Portsmouth,England,94881.0,UK,19.0,Male,Medium,Regular,5/23/2023,2023.0,May,0:11:39,9.0,266.406035,2397.654315,Electronics,Apple,Tablet,Average,Express,,Delivered,2.0,Google Pixel Slate,2023-05-23,2025-11-15 00:11:39,Missing values; 
9364535.0,70234.0,Ashley Ramirez,Angel67@gmail.com,6599463361.0,062 Hart Manor Apt. 769,Portsmouth,England,80113.0,UK,19.0,Male,Medium,Regular,09-12-23,2023.0,September,4:30:37,8.0,,1184.558837,Clothing,Adidas,Jacket,Bad,Same-Day,Cash,Delivered,1.0,Varsity jacket,2023-09-12,2025-11-15 04:30:37,Missing values; 
5147035.0,21076.0,Christopher Pineda,Jillian91@gmail.com,7992883187.0,,Portsmouth,England,16314.0,UK,19.0,Male,Medium,Regular,10-07-23,2023.0,October,1:10:12,9.0,49.14714298,442.3242868,Home Decor,IKEA,Furniture,Bad,Express,Cash,Delivered,1.0,TV stand,2023-10-07,2025-11-15 01:10:12,Missing values; 
9698944.0,33761.0,Austin Brown,Philip55@gmail.com,1621525129.0,232 Logan Tunnel Apt. 758,Portsmouth,England,98077.0,UK,19.0,Male,Medium,Regular,08-06-23,2023.0,,14:37:29,10.0,365.0796084,3650.796084,Home Decor,IKEA,Decorations,Good,Same-Day,Cash,Delivered,4.0,Rugs,2023-08-06,2025-11-15 14:37:29,Missing values; 
7942410.0,16416.0,Tara Guerrero,Robert97@gmail.com,1458045888.0,35526 Beasley Club,Portsmouth,England,85131.0,UK,19.0,Female,Medium,Regular,11/15/2023,2023.0,November,4:36:55,8.0,163.2638298,1306.110639,Books,HarperCollins,Fiction,Excellent,Same-Day,,Delivered,4.0,Literary fiction,2023-11-15,2025-11-15 04:36:55,Missing values; 
2939211.0,93646.0,Amy Robertson,Jennifer78@gmail.com,,88194 Martinez Locks Suite 040,Portsmouth,England,87628.0,UK,19.0,Male,Medium,Regular,03-12-23,2023.0,March,22:00:31,5.0,252.998722,1264.99361,Books,HarperCollins,Fiction,Excellent,Same-Day,Debit Card,Delivered,5.0,Historical fiction,2023-03-12,2025-11-15 22:00:31,Missing values; 
4277716.0,85114.0,Roger Alvarez,Kimberly34@gmail.com,9600049718.0,94733 Michael Branch,Portsmouth,England,48427.0,UK,19.0,Male,Medium,Regular,8/14/2023,2023.0,,0:32:17,10.0,256.0204078,2560.204078,Clothing,Zara,Dress,Average,Standard,PayPal,Delivered,2.0,Casual dress,2023-08-14,2025-11-15 00:32:17,Missing values; 
5589593.0,11130.0,Adam Perez,Ronald56@gmail.com,6620468050.0,308 Shawn Stream Suite 853,Portsmouth,England,6981.0,UK,19.0,Male,Medium,Regular,11-03-23,2023.0,November,14:59:44,7.0,11.14411198,78.00878383,Grocery,Coca-Cola,Water,Average,Standard,,Delivered,2.0,Mineral water,2023-11-03,2025-11-15 14:59:44,Missing values; 
9640144.0,,Mark Henderson,Anne48@gmail.com,5155520633.0,2371 Davis Avenue,Portsmouth,England,76089.0,UK,19.0,Male,Medium,Regular,1/17/2024,2024.0,January,13:24:53,1.0,209.5337085,209.5337085,Clothing,Adidas,T-shirt,Bad,Same-Day,PayPal,Delivered,1.0,Crew neck tee,2024-01-17,2025-11-15 13:24:53,Missing values; 
6533451.0,88689.0,James Johnson,Douglas85@gmail.com,9916205308.0,,Portsmouth,England,3780.0,UK,19.0,Male,Medium,Regular,9/26/2023,2023.0,September,21:41:12,9.0,240.4451409,2164.006268,Grocery,Coca-Cola,Water,Bad,Express,Cash,Delivered,1.0,Spring water,2023-09-26,2025-11-15 21:41:12,Missing values; 
6100948.0,68350.0,Robert Russell,Matthew90@gmail.com,5061913941.0,69260 Tammy Turnpike Apt. 953,Portsmouth,England,62293.0,UK,19.0,Female,Medium,Regular,05-09-23,2023.0,May,15:49:54,3.0,380.5359655,1141.607897,Books,HarperCollins,Thriller,Good,,Credit Card,Delivered,4.0,Techno-thriller,2023-05-09,2025-11-15 15:49:54,Missing values; 
4186699.0,80899.0,Stephanie Ramos,Mary87@gmail.com,1597751704.0,83760 Wolfe Forge,Portsmouth,England,59665.0,UK,19.0,Female,Medium,Regular,,2023.0,October,1:35:08,5.0,121.4015757,607.0078784,Grocery,Pepsi,Soft Drink,Average,Standard,Cash,Delivered,2.0,Iced tea,,2025-11-15 01:35:08,Missing values; 
7719196.0,61250.0,Jose Ross,Willie95@gmail.com,6565734576.0,9758 Janet Unions Apt. 082,Portsmouth,England,31870.0,UK,19.0,,Medium,Regular,12-04-23,2023.0,December,13:42:12,1.0,89.84381196,89.84381196,Books,HarperCollins,Thriller,Bad,Standard,Cash,Delivered,1.0,Mystery,2023-12-04,2025-11-15 13:42:12,Missing values; 
3880565.0,15429.0,Lori Acosta,,7830616629.0,96225 Michelle Fork,Portsmouth,England,88817.0,UK,19.0,Male,Medium,Regular,7/27/2023,2023.0,July,11:26:43,2.0,271.9580111,543.9160223,Home Decor,Bed Bath & Beyond,Bedding,Good,Express,PayPal,Delivered,3.0,Comforter,2023-07-27,2025-11-15 11:26:43,Missing values; 
3046003.0,18813.0,Kimberly Jones,Laura63@gmail.com,6227089364.0,581 Brown Station Apt. 830,Portsmouth,England,23574.0,UK,19.0,Male,Medium,Regular,5/26/2023,2023.0,May,16:36:26,6.0,499.7609199,2998.565519,Clothing,,Dress,Average,Standard,Cash,Delivered,2.0,Shift dress,2023-05-26,2025-11-15 16:36:26,Missing values; 
,37028.0,Kathryn Moore,Thomas58@gmail.com,8404188278.0,3369 Ortiz Garden,Portsmouth,England,33987.0,UK,19.0,Male,Medium,Regular,02-01-24,2024.0,February,9:10:27,10.0,479.9048491,4799.048491,Electronics,Sony,Television,Excellent,Standard,Debit Card,Delivered,5.0,OLED TV,2024-02-01,2025-11-15 09:10:27,Missing values; 
4120450.0,66604.0,Allison Williams,Christopher98@gmail.com,9079692510.0,41270 Davis Inlet,Portsmouth,England,2832.0,UK,19.0,Female,Medium,Regular,11-06-23,2023.0,November,23:12:39,1.0,374.3171979,374.3171979,Electronics,Samsung,Smartphone,Good,Express,,Delivered,3.0,Samsung Galaxy,2023-11-06,2025-11-15 23:12:39,Missing values; 
3881928.0,99342.0,David Cross MD,Jennifer77@gmail.com,3162981634.0,7854 Ochoa Centers Apt. 373,Portsmouth,England,41687.0,UK,19.0,Male,Medium,Regular,08-04-23,2023.0,August,15:23:28,,150.1257114,1351.131402,Grocery,Pepsi,Water,Bad,Standard,Debit Card,Delivered,1.0,Flavored water,2023-08-04,2025-11-15 15:23:28,Missing values; 
3113557.0,79931.0,Donna Taylor,Mary72@gmail.com,4647613709.0,400 Valdez Motorway,Portsmouth,England,81047.0,UK,19.0,Female,Medium,Regular,9/13/2023,2023.0,September,3:10:36,2.0,,555.5019055,Electronics,Apple,Smartphone,Good,Express,Credit Card,Delivered,4.0,Google Pixel,2023-09-13,2025-11-15 03:10:36,Missing values; 
5727819.0,57794.0,Diane Rodriguez,Carlos85@gmail.com,8056139030.0,2655 Young Vista Suite 001,Portsmouth,England,69571.0,UK,19.0,Female,Medium,Regular,12-07-23,2023.0,December,23:44:18,3.0,210.4151162,631.2453487,Home Decor,,Kitchen,Average,Same-Day,Cash,Delivered,2.0,Dishwasher,2023-12-07,2025-11-15 23:44:18,Missing values; 
2804480.0,40457.0,Charles Graham,Robert31@gmail.com,4447824887.0,,Portsmouth,England,91911.0,UK,19.0,Male,Medium,Regular,06-01-23,2023.0,June,17:39:01,6.0,195.9681008,1175.808605,Grocery,Pepsi,Juice,Excellent,Standard,PayPal,Delivered,5.0,Apple juice,2023-06-01,2025-11-15 17:39:01,Missing values; 
7242581.0,30065.0,Scott Cox,Marvin87@gmail.com,6253789871.0,0419 Robinson Spur,Portsmouth,England,20534.0,UK,19.0,Female,Medium,Regular,4/15/2023,2023.0,April,14:08:25,1.0,,53.77186399,Home Decor,Home Depot,Furniture,Bad,Standard,Cash,Delivered,1.0,Desk,2023-04-15,2025-11-15 14:08:25,Missing values; 
5677781.0,40032.0,Gloria Contreras,Julie82@gmail.com,1655998195.0,747 Bradley Common,Portsmouth,England,5854.0,UK,19.0,Female,Medium,Regular,9/22/2023,2023.0,September,,1.0,387.9953875,387.9953875,Clothing,Adidas,Jacket,Excellent,Express,Debit Card,Delivered,4.0,Varsity jacket,2023-09-22,,Missing values; 
6170361.0,34832.0,Jesus Hudson,Jesus77@gmail.com,6760127621.0,5000 Alyssa Glens Apt. 454,Portsmouth,England,32737.0,UK,19.0,Female,Medium,Regular,12-03-23,2023.0,,13:04:07,8.0,268.1669649,2145.335719,Books,HarperCollins,Thriller,Excellent,Standard,PayPal,Delivered,5.0,Political thriller,2023-12-03,2025-11-15 13:04:07,Missing values; 
8393857.0,62734.0,Charles Vargas,Nicholas24@gmail.com,8412895667.0,13042 Alvarez Extension Suite 544,Portsmouth,England,62429.0,UK,19.0,Male,Medium,Regular,5/15/2023,2023.0,May,,4.0,367.1301427,1468.520571,Electronics,Samsung,Smartphone,Average,Standard,Credit Card,Delivered,2.0,Samsung Galaxy,2023-05-15,,Missing values; 
8007532.0,57545.0,Lauren Hughes PhD,Nicholas88@gmail.com,6723395761.0,8439 Pamela Locks Apt. 067,Portsmouth,England,13130.0,UK,19.0,Male,Medium,Regular,11-08-23,2023.0,November,16:19:25,6.0,365.8705185,2195.223111,Clothing,Nike,Shoes,,Standard,Debit Card,Delivered,,Flip flops,2023-11-08,2025-11-15 16:19:25,Missing values; 
4764390.0,57125.0,Michael Henry,Mary51@gmail.com,,8594 Benjamin Flats,Portsmouth,England,20846.0,UK,19.0,Female,Medium,Regular,11-12-23,2023.0,November,14:11:44,5.0,227.2750377,1136.375189,Home Decor,Home Depot,Furniture,Average,Same-Day,Cash,Delivered,2.0,Wardrobe,2023-11-12,2025-11-15 14:11:44,Missing values; 
6713060.0,46210.0,Christopher Guzman,Alice32@gmail.com,2773799812.0,7542 Thomas Pine Suite 291,Portsmouth,England,55836.0,UK,19.0,Male,Medium,Regular,05-10-23,,May,21:26:12,6.0,237.863948,1427.183688,Books,Penguin Books,Non-Fiction,Bad,Same-Day,Credit Card,Delivered,1.0,Travel,2023-05-10,2025-11-15 21:26:12,Missing values; 
1066387.0,19592.0,,Brandon47@gmail.com,4697825992.0,993 Boyd Springs Suite 946,Portsmouth,England,98492.0,UK,19.0,Female,Medium,Regular,9/24/2023,2023.0,September,21:27:05,2.0,23.02652958,46.05305915,Grocery,Coca-Cola,Soft Drink,Bad,Standard,PayPal,Delivered,1.0,Energy drink,2023-09-24,2025-11-15 21:27:05,Missing values; 
1380162.0,76751.0,,John91@gmail.com,9467036186.0,693 Smith Mountain Suite 272,Portsmouth,England,19818.0,UK,19.0,Male,Medium,Regular,6/26/2023,2023.0,June,18:05:55,8.0,40.39752627,323.1802102,Electronics,Samsung,Television,Excellent,Same-Day,Credit Card,Delivered,5.0,LCD TV,2023-06-26,2025-11-15 18:05:55,Missing values; 
9503363.0,64988.0,Karen Price,Ashley55@gmail.com,,42898 Bryan Squares Suite 088,Portsmouth,England,30553.0,UK,19.0,Male,Medium,Regular,06-10-23,2023.0,June,17:26:29,1.0,192.9628195,192.9628195,Home Decor,Home Depot,Furniture,Average,Express,Credit Card,Delivered,2.0,Sofa,2023-06-10,2025-11-15 17:26:29,Missing values; 
4627191.0,40193.0,John Bird,Larry57@gmail.com,,74795 Rachel Summit,Portsmouth,England,53008.0,UK,19.0,Male,Medium,Regular,7/23/2023,2023.0,July,7:42:12,4.0,307.3361014,1229.344405,Electronics,Sony,Smartphone,Excellent,Standard,Cash,Delivered,4.0,Nokia,2023-07-23,2025-11-15 07:42:12,Missing values; 
1477981.0,84475.0,Richard Ingram,Natalie25@gmail.com,5279604022.0,3175 Robertson Curve,Portsmouth,England,95178.0,UK,19.0,Female,Medium,Regular,10/25/2023,2023.0,October,18:45:38,4.0,173.7235886,694.8943543,Electronics,,Tablet,Average,Same-Day,Credit Card,Delivered,2.0,Samsung Galaxy Tab,2023-10-25,2025-11-15 18:45:38,Missing values; 
3372546.0,64717.0,Brian Hernandez,Allison70@gmail.com,,47580 Chan Curve Suite 411,Portsmouth,England,96165.0,UK,19.0,Female,Medium,Regular,11-06-23,2023.0,November,18:18:55,3.0,320.1832382,960.5497147,Clothing,Nike,T-shirt,Bad,Standard,Debit Card,Delivered,1.0,V-neck tee,2023-11-06,2025-11-15 18:18:55,Missing values; 
7490349.0,17574.0,Julia Garcia,Cristina33@gmail.com,3992137965.0,133 David Landing,Portsmouth,England,99806.0,UK,19.0,Male,Medium,Regular,08-05-23,2023.0,August,,8.0,471.6800066,3773.440053,Clothing,Zara,Shirt,Average,Standard,PayPal,Delivered,2.0,Henley shirt,2023-08-05,,Missing values; 
6260004.0,41340.0,Elizabeth Lopez,Kirk70@gmail.com,7133030339.0,87823 Sarah Lake,Portsmouth,England,45041.0,UK,19.0,Male,Medium,Regular,3/29/2023,2023.0,,16:45:19,9.0,265.5922368,2390.330131,Home Decor,Home Depot,Decorations,Excellent,Express,Debit Card,Delivered,5.0,Sculptures,2023-03-29,2025-11-15 16:45:19,Missing values; 
3081669.0,62713.0,Amber Wu,Brenda39@gmail.com,2856691471.0,9601 Graves Knoll Apt. 956,Portsmouth,England,2765.0,UK,19.0,Female,Medium,Regular,03-01-23,2023.0,March,18:13:31,,410.0325984,1230.097795,Books,Penguin Books,Children's,Excellent,Same-Day,PayPal,Delivered,4.0,Puzzles,2023-03-01,2025-11-15 18:13:31,Missing values; 
3029270.0,82184.0,Rachel Bryan,Daniel92@gmail.com,4521215094.0,0453 Wendy Estate Apt. 180,Portsmouth,England,13655.0,UK,19.0,Female,Medium,Regular,12/18/2023,2023.0,December,,7.0,112.3527231,786.4690617,Home Decor,Home Depot,Tools,Bad,Standard,Cash,Delivered,1.0,Wrench,2023-12-18,,Missing values; 
6980385.0,13895.0,Jeffrey Mcintosh,Jessica3@gmail.com,8564617816.0,622 Perry Fall Apt. 697,Portsmouth,England,79024.0,UK,19.0,Female,Medium,Regular,03-07-23,2023.0,March,5:23:57,8.0,33.06068838,264.4855071,,Coca-Cola,Juice,Bad,Standard,PayPal,Delivered,1.0,Pomegranate juice,2023-03-07,2025-11-15 05:23:57,Missing values; 
4848624.0,32389.0,Victor King,Jessica97@gmail.com,2972212671.0,684 Davidson Stravenue Apt. 548,Portsmouth,England,54106.0,UK,19.0,Male,Medium,Regular,1/21/2024,2024.0,January,9:09:49,4.0,366.059447,1464.237788,,Apple,Laptop,Excellent,Standard,Cash,Delivered,4.0,LG Gram,2024-01-21,2025-11-15 09:09:49,Missing values; 
9520526.0,18575.0,Luke Farmer,Amy89@gmail.com,3806019395.0,221 Bobby Groves,Portsmouth,England,32590.0,UK,19.0,Male,Medium,Regular,03-08-23,2023.0,,20:03:10,5.0,19.22174723,96.10873615,Books,Penguin Books,Non-Fiction,Bad,Express,PayPal,Delivered,1.0,History,2023-03-08,2025-11-15 20:03:10,Missing values; 
2024121.0,86221.0,Joseph Nunez,James5@gmail.com,7757350314.0,131 Stacy Curve,Portsmouth,England,68024.0,UK,19.0,Male,Medium,Regular,6/23/2023,2023.0,,3:34:42,4.0,398.8575567,1595.430227,Grocery,Nestle,Chocolate,Bad,Standard,Credit Card,Delivered,1.0,Chocolate fondue,2023-06-23,2025-11-15 03:34:42,Missing values; 
2358227.0,47524.0,Lindsey Estrada,Billy16@gmail.com,5276273962.0,46203 Herring Cliffs Suite 120,Portsmouth,England,,UK,19.0,Male,Medium,Regular,12/26/2023,2023.0,December,16:49:29,8.0,471.9843036,3775.874429,Electronics,Samsung,Smartphone,Average,Same-Day,Debit Card,Delivered,2.0,iPhone,2023-12-26,2025-11-15 16:49:29,Missing values; 
2388533.0,61180.0,Jessica Haney,Rebecca68@gmail.com,9712594622.0,217 Malone Meadows,Portsmouth,England,,UK,19.0,Male,Medium,Regular,4/21/2023,2023.0,April,10:07:49,3.0,327.4980414,982.4941243,Books,Penguin Books,Fiction,Average,Same-Day,PayPal,Delivered,2.0,Literary fiction,2023-04-21,2025-11-15 10:07:49,Missing values; 
4809532.0,35621.0,John Cooper,Kyle73@gmail.com,5666222725.0,438 Michelle Mountain Apt. 804,Portsmouth,England,30256.0,UK,19.0,Female,Medium,Regular,12/14/2023,2023.0,December,23:07:14,5.0,360.8969337,1804.484668,Home Decor,,Furniture,Bad,Same-Day,Cash,Delivered,1.0,Coffee table,2023-12-14,2025-11-15 23:07:14,Missing values; 
6336622.0,34692.0,Edward Espinoza,Amber50@gmail.com,3484155196.0,3973 Park Mount Apt. 641,Portsmouth,England,,UK,19.0,Male,Medium,Regular,12/14/2023,2023.0,December,16:44:10,4.0,135.119151,540.476604,Clothing,Nike,T-shirt,Excellent,Express,Cash,Delivered,5.0,V-neck tee,2023-12-14,2025-11-15 16:44:10,Missing values; 
8232936.0,42538.0,Gary Murillo,James26@gmail.com,1100387899.0,4781 Jared Prairie,Portsmouth,England,97374.0,UK,19.0,Male,Medium,Regular,02-07-24,2024.0,February,22:12:43,8.0,291.7709316,2334.167453,Books,Penguin Books,Non-Fiction,,Express,Cash,Delivered,,Self-help,2024-02-07,2025-11-15 22:12:43,Missing values; 
6111905.0,91811.0,George Perkins,Kenneth28@gmail.com,8518258372.0,5194 Martin Track Apt. 587,Portsmouth,England,20290.0,UK,19.0,Female,Medium,Regular,12/28/2023,2023.0,December,9:32:05,8.0,,1983.771942,Home Decor,IKEA,Lighting,Excellent,Standard,Cash,Delivered,4.0,Track lighting,2023-12-28,2025-11-15 09:32:05,Missing values; 
8106576.0,67268.0,Tanner Peters,Crystal88@gmail.com,,84677 John Parkways,Portsmouth,England,79745.0,UK,19.0,Male,Medium,Regular,2/22/2024,2024.0,February,13:28:06,4.0,16.74148645,66.96594578,Home Decor,Bed Bath & Beyond,Bathroom,Excellent,Express,PayPal,Delivered,4.0,Toilet,2024-02-22,2025-11-15 13:28:06,Missing values; 
5151778.0,68576.0,Michelle Ross,Michael44@gmail.com,4656176476.0,8693 Molina Village Apt. 225,Portsmouth,England,28502.0,UK,19.0,Male,Medium,Regular,05-06-23,2023.0,May,,6.0,166.8788317,1001.27299,Clothing,Zara,Jeans,Excellent,Standard,Debit Card,Delivered,5.0,Bootcut jeans,2023-05-06,,Missing values; 
5869755.0,22557.0,Kimberly Clark MD,Chad5@gmail.com,1555363780.0,4001 Kathryn Flats Suite 560,Portsmouth,England,54633.0,UK,19.0,Male,Medium,Regular,8/29/2023,2023.0,August,13:47:50,1.0,,334.8602351,Clothing,Zara,Shirt,Excellent,Same-Day,PayPal,Delivered,5.0,Button-down shirt,2023-08-29,2025-11-15 13:47:50,Missing values; 
8324096.0,21939.0,Terri Walker,Dana56@gmail.com,6876839025.0,99723 Victoria Union,Portsmouth,England,44130.0,UK,19.0,Male,Medium,Regular,8/19/2023,2023.0,August,16:32:25,3.0,313.4880571,940.4641712,Books,,Children's,Excellent,Standard,Credit Card,Delivered,5.0,Clothing,2023-08-19,2025-11-15 16:32:25,Missing values; 
1870423.0,73883.0,,Gregory88@gmail.com,5664300269.0,714 Perry Pine,Portsmouth,England,74574.0,UK,19.0,Male,Medium,Regular,05-12-23,2023.0,May,5:44:15,8.0,302.3118527,2418.494822,Books,Penguin Books,Non-Fiction,Excellent,Same-Day,Debit Card,Delivered,4.0,Psychology,2023-05-12,2025-11-15 05:44:15,Missing values; 
2906456.0,54021.0,Valerie Arnold,Barbara2@gmail.com,8183042282.0,783 Jacqueline Pine,Portsmouth,England,4844.0,UK,19.0,Female,Medium,Regular,8/15/2023,2023.0,August,8:10:19,5.0,447.8716581,2239.358291,Electronics,Sony,Headphones,Bad,,Debit Card,Delivered,1.0,Over-ear headphones,2023-08-15,2025-11-15 08:10:19,Missing values; 
9686747.0,26322.0,Catherine Griffith,Brittany36@gmail.com,7328295022.0,525 Victor Greens Suite 078,Portsmouth,England,96615.0,UK,19.0,Male,Medium,Regular,05-09-23,2023.0,May,9:51:16,,391.5199005,3915.199005,Home Decor,Bed Bath & Beyond,Kitchen,Excellent,Standard,Debit Card,Delivered,4.0,Coffee maker,2023-05-09,2025-11-15 09:51:16,Missing values; 
8640274.0,62905.0,Nicole Williams,Laura46@gmail.com,6327553875.0,5098 Mclean Stravenue Suite 657,Portsmouth,England,31015.0,UK,19.0,Female,Medium,Regular,,2023.0,September,6:17:05,4.0,300.5433865,1202.173546,Electronics,Sony,Headphones,Excellent,Standard,Debit Card,Delivered,5.0,In-ear headphones,,2025-11-15 06:17:05,Missing values; 
6514782.0,81198.0,Gregory Neal,Anthony73@gmail.com,8349892933.0,493 Julie Mission,Portsmouth,England,42655.0,UK,19.0,Male,Medium,Regular,8/20/2023,2023.0,,22:40:47,1.0,274.8892847,274.8892847,Books,Penguin Books,Non-Fiction,Bad,Express,Debit Card,Delivered,1.0,Memoir,2023-08-20,2025-11-15 22:40:47,Missing values; 
8678522.0,59742.0,Christine Johnson,Mary31@gmail.com,8919605346.0,6107 Drake Rapid,Portsmouth,England,57664.0,UK,19.0,Male,Medium,New,4/27/2023,2023.0,April,12:30:54,5.0,132.2830602,661.415301,Home Decor,,Kitchen,Bad,Standard,Cash,Delivered,1.0,Blender,2023-04-27,2025-11-15 12:30:54,Missing values; 
4487255.0,83834.0,David Fields,Samuel100@gmail.com,4508024108.0,143 Russell Spur,Portsmouth,England,83546.0,UK,19.0,Male,Medium,New,8/18/2023,2023.0,August,,1.0,69.77818532,69.77818532,Clothing,Adidas,Jacket,Bad,Standard,Cash,Delivered,1.0,Denim jacket,2023-08-18,,Missing values; 
7425662.0,15968.0,Daniel Cruz,Jamie55@gmail.com,3692311288.0,8286 Jill Corner Apt. 935,Portsmouth,England,15196.0,UK,19.0,Female,Medium,New,12/14/2023,2023.0,,22:22:21,6.0,72.05700092,432.3420055,Electronics,Apple,Smartphone,Average,Same-Day,PayPal,Delivered,2.0,OnePlus,2023-12-14,2025-11-15 22:22:21,Missing values; 
3033501.0,61412.0,Norma Johnson,Dana22@gmail.com,3144239767.0,9111 Jones Center,Portsmouth,England,61022.0,UK,19.0,Male,Medium,New,06-07-23,2023.0,,18:34:36,2.0,483.855886,967.711772,Books,Random House,Fiction,Excellent,Express,Credit Card,Delivered,5.0,Romance,2023-06-07,2025-11-15 18:34:36,Missing values; 
1679131.0,70034.0,Ryan Morgan,Amber86@gmail.com,9072599201.0,858 Joshua Plains Suite 058,Portsmouth,England,88152.0,UK,19.0,Male,Medium,New,3/18/2023,2023.0,March,4:40:35,9.0,135.1240124,1216.116111,,Bed Bath & Beyond,Bathroom,Bad,Express,Credit Card,Delivered,1.0,Shower curtain,2023-03-18,2025-11-15 04:40:35,Missing values; 
6699138.0,31162.0,Rachel Pearson,Rodney12@gmail.com,8740360078.0,90094 Jackson Turnpike Apt. 444,Portsmouth,England,3631.0,UK,19.0,Female,Medium,New,06-09-23,,June,3:51:45,8.0,224.15771,1793.26168,Clothing,Zara,Jeans,Average,Express,Credit Card,Delivered,2.0,Boyfriend jeans,2023-06-09,2025-11-15 03:51:45,Missing values; 
9461128.0,59912.0,William Leonard,Jessica96@gmail.com,7090972877.0,,Portsmouth,England,19796.0,UK,19.0,Male,Medium,New,11/17/2023,2023.0,November,23:21:44,9.0,284.0010381,2556.009343,Electronics,Apple,Laptop,Bad,Standard,Cash,Delivered,1.0,Lenovo ThinkPad,2023-11-17,2025-11-15 23:21:44,Missing values; 
9445304.0,26743.0,James Mclean,Jennifer57@gmail.com,2329426081.0,392 Turner Forge Suite 859,Portsmouth,England,80575.0,UK,19.0,Male,Medium,New,10-09-23,2023.0,October,4:07:44,6.0,448.7633928,2692.580357,Home Decor,IKEA,Decorations,Average,,Debit Card,Delivered,2.0,Candles,2023-10-09,2025-11-15 04:07:44,Missing values; 
7168093.0,61860.0,Timothy Snyder,Mark31@gmail.com,8758670159.0,022 Scott Well,Portsmouth,England,22820.0,UK,19.0,Female,Medium,New,,2023.0,April,23:42:50,4.0,460.368192,1841.472768,Books,Penguin Books,Children's,Average,Standard,Credit Card,Delivered,2.0,Educational kits,,2025-11-15 23:42:50,Missing values; 
9734882.0,54248.0,Barbara Roberts,Ryan83@gmail.com,3087983012.0,736 Higgins Points,Portsmouth,England,59790.0,UK,19.0,Male,Medium,New,9/15/2023,,September,15:39:36,7.0,182.444255,1277.109785,Home Decor,Home Depot,Tools,Average,Same-Day,Cash,Delivered,2.0,Caulking gun,2023-09-15,2025-11-15 15:39:36,Missing values; 
5953206.0,70509.0,Stephen West,Zachary63@gmail.com,6856800054.0,34351 Simpson Port Suite 884,Portsmouth,England,78808.0,UK,19.0,Female,Medium,New,01-04-24,2024.0,January,20:06:57,7.0,,3410.641268,Home Decor,IKEA,Lighting,Excellent,Standard,Debit Card,Delivered,4.0,Ceiling lights,2024-01-04,2025-11-15 20:06:57,Missing values; 
6957575.0,82566.0,Carolyn Perkins,Cynthia17@gmail.com,3011970438.0,87826 Adrian Port Apt. 736,Cleveland,Nevada,89413.0,USA,19.0,Female,Medium,New,2/27/2024,2024.0,February,19:20:44,9.0,93.55234773,841.9711296,,Random House,Non-Fiction,Excellent,Standard,PayPal,Delivered,4.0,Psychology,2024-02-27,2025-11-15 19:20:44,Missing values; 
6591284.0,53125.0,Jordan Miller,Ralph22@gmail.com,4538840115.0,546 Johnson Ville Apt. 886,Barrie,Ontario,43151.0,Canada,19.0,Male,Medium,New,10/31/2023,,October,0:36:32,1.0,154.7661319,154.7661319,Books,HarperCollins,Thriller,Average,Standard,Credit Card,Delivered,2.0,Crime,2023-10-31,2025-11-15 00:36:32,Missing values; 
5283762.0,39108.0,Anthony Lee,Brett97@gmail.com,6737970026.0,83535 Nancy Coves Apt. 057,Vancouver,Ontario,38449.0,Canada,19.0,Female,Medium,New,7/14/2023,2023.0,July,10:19:17,8.0,123.5427595,988.3420758,Books,,Thriller,Good,Same-Day,Credit Card,Delivered,3.0,Psychological thriller,2023-07-14,2025-11-15 10:19:17,Missing values; 
4102869.0,94763.0,Hayley Chen,Laurie95@gmail.com,5833200577.0,85708 Erika Inlet Suite 548,Newcastle upon Tyne,England,63720.0,UK,19.0,Female,Medium,New,12-01-23,2023.0,December,5:44:53,8.0,48.64358813,,Clothing,Nike,Shoes,Good,Standard,Credit Card,Delivered,3.0,Slippers,2023-12-01,2025-11-15 05:44:53,Missing values; 
2901792.0,75014.0,Kayla Jensen MD,Toni48@gmail.com,1936803074.0,547 Charles Ways Suite 797,Berlin,,85954.0,Germany,19.0,Male,Medium,New,03-12-23,2023.0,March,21:40:21,4.0,49.52341024,198.093641,Home Decor,Home Depot,Tools,Average,Same-Day,PayPal,Delivered,2.0,Drill,2023-03-12,2025-11-15 21:40:21,Missing values; 
9173557.0,44566.0,Michael Barron,Hector23@gmail.com,7992939729.0,61411 James Mill,Leeds,England,30271.0,UK,19.0,Male,Medium,New,1/26/2024,2024.0,January,23:39:41,3.0,43.48719552,130.4615866,Books,HarperCollins,Non-Fiction,Bad,,Cash,Delivered,1.0,Biography,2024-01-26,2025-11-15 23:39:41,Missing values; 
8698774.0,61794.0,Mark Martinez,Karen11@gmail.com,1951726907.0,6180 Simpson Mission,Launceston,New South Wales,91986.0,Australia,19.0,Male,Medium,New,7/14/2023,2023.0,July,2:53:32,8.0,152.4014741,,Electronics,Apple,Tablet,Excellent,Express,Cash,Delivered,5.0,Google Pixel Slate,2023-07-14,2025-11-15 02:53:32,Missing values; 
8633844.0,52052.0,Jessica Cain,James30@gmail.com,4988955019.0,327 Rowland Tunnel,Hobart,New South Wales,27901.0,Australia,19.0,Male,Medium,New,6/21/2023,2023.0,June,17:28:18,7.0,251.7445773,1762.212041,Electronics,Apple,Smartphone,,Same-Day,PayPal,Delivered,,LG G,2023-06-21,2025-11-15 17:28:18,Missing values; 
8686902.0,28869.0,Mr. Richard Bates,Casey29@gmail.com,2424686385.0,34875 Tracy Green,Bremen,Berlin,67178.0,Germany,19.0,Female,Medium,New,10/13/2023,2023.0,,10:28:18,6.0,67.42130823,404.5278494,Electronics,Apple,Smartphone,Bad,Same-Day,Cash,Delivered,1.0,Sony Xperia,2023-10-13,2025-11-15 10:28:18,Missing values; 
2722858.0,65715.0,Jesus Miller,Steve5@gmail.com,1191570500.0,7073 Kelly Pines,Fort Worth,New Mexico,84807.0,USA,19.0,Female,Medium,New,12/31/2023,2023.0,December,,4.0,326.8208713,1307.283485,Grocery,Coca-Cola,Soft Drink,Average,Same-Day,Debit Card,Delivered,2.0,Iced tea,2023-12-31,,Missing values; 
8381889.0,86710.0,Jacob Sanchez,Pedro43@gmail.com,6989232836.0,93649 Tim Walk,Fort Worth,New Mexico,90501.0,USA,19.0,Male,Medium,New,01-03-24,2024.0,January,14:31:30,2.0,316.4945619,,Clothing,Zara,Dress,Excellent,Same-Day,Debit Card,Delivered,5.0,Maxi dress,2024-01-03,2025-11-15 14:31:30,Missing values; 
3368396.0,60092.0,Crystal Wall,Brent7@gmail.com,2780696826.0,8442 Frazier Freeway Apt. 337,Fort Worth,New Mexico,23815.0,USA,19.0,,Medium,New,11-03-23,2023.0,November,10:12:06,6.0,440.9166052,2645.499631,Home Decor,Home Depot,Furniture,Bad,Standard,Credit Card,Delivered,1.0,Desk,2023-11-03,2025-11-15 10:12:06,Missing values; 
3800559.0,37419.0,Shane Vargas,Dylan84@gmail.com,3667013831.0,06751 Jennifer Ridge,Fort Worth,New Mexico,91446.0,USA,19.0,,Medium,New,12-05-23,2023.0,December,6:59:36,9.0,493.2737808,4439.464027,Clothing,Nike,T-shirt,Average,Same-Day,Credit Card,Delivered,2.0,V-neck tee,2023-12-05,2025-11-15 06:59:36,Missing values; 
9665112.0,39082.0,Melissa Downs,Sandra39@gmail.com,6461771955.0,75750 James Branch,Fort Worth,New Mexico,96756.0,USA,19.0,Female,Medium,New,,2023.0,April,12:04:58,3.0,13.00110906,39.00332719,Grocery,Coca-Cola,Juice,Excellent,Express,PayPal,Delivered,5.0,Pineapple juice,,2025-11-15 12:04:58,Missing values; 
9724050.0,76560.0,Stephanie Smith,Jessica80@gmail.com,5338519928.0,51525 Maxwell Mill Apt. 879,Fort Worth,New Mexico,88338.0,USA,19.0,,Medium,New,11/13/2023,2023.0,November,3:41:50,6.0,316.7529667,1900.5178,Electronics,Sony,Television,Good,Standard,Debit Card,Delivered,4.0,HDR TV,2023-11-13,2025-11-15 03:41:50,Missing values; 
3698876.0,28099.0,Patricia Rodriguez,Christopher31@gmail.com,6415278758.0,,Fort Worth,New Mexico,77077.0,USA,19.0,Female,Medium,New,06-01-23,2023.0,June,23:35:24,5.0,288.5524237,1442.762119,Clothing,Nike,Shoes,Good,Same-Day,Credit Card,Delivered,3.0,Espadrilles,2023-06-01,2025-11-15 23:35:24,Missing values; 
7709605.0,20080.0,Chad Baker,Andrea64@gmail.com,3873320416.0,7508 Shelley Ports Apt. 320,Fort Worth,New Mexico,78321.0,USA,19.0,Male,Medium,New,5/24/2023,2023.0,May,18:03:40,10.0,,1066.006768,Home Decor,Home Depot,Decorations,Excellent,Standard,Cash,Delivered,4.0,Vases,2023-05-24,2025-11-15 18:03:40,Missing values; 
9245346.0,95522.0,Laura Smith,Joseph48@gmail.com,2213345541.0,0447 Cole Gardens,Fort Worth,New Mexico,86459.0,USA,19.0,Male,Medium,New,3/26/2023,2023.0,March,19:57:20,9.0,,343.8574228,Home Decor,Bed Bath & Beyond,Bedding,Average,Same-Day,PayPal,Delivered,2.0,Bed skirt,2023-03-26,2025-11-15 19:57:20,Missing values; 
8826053.0,27967.0,James Gentry,Ricardo23@gmail.com,2630427187.0,267 Peterson Pike,Fort Worth,New Mexico,14256.0,USA,19.0,Male,Medium,New,9/17/2023,2023.0,September,4:03:33,9.0,286.2593673,2576.334305,Grocery,Nestle,Coffee,Average,Express,,Delivered,2.0,Macchiato,2023-09-17,2025-11-15 04:03:33,Missing values; 
1371841.0,18840.0,Jennifer Johnson,Patrick70@gmail.com,8793209052.0,557 Brittany Rapid Suite 433,Fort Worth,New Mexico,16898.0,USA,19.0,Male,Medium,New,,2023.0,November,11:52:55,5.0,161.4752685,807.3763427,Electronics,Samsung,Television,Excellent,Same-Day,PayPal,Delivered,4.0,LCD TV,,2025-11-15 11:52:55,Missing values; 
4402707.0,39927.0,Meghan Yang,Edward54@gmail.com,9525529790.0,7517 Smith Glen Apt. 004,Fort Worth,New Mexico,5222.0,USA,19.0,Female,Medium,New,11-07-23,2023.0,November,15:56:44,5.0,48.90840945,244.5420472,Books,HarperCollins,Thriller,,Same-Day,Debit Card,Delivered,,Psychological thriller,2023-11-07,2025-11-15 15:56:44,Missing values; 
4280499.0,87389.0,,Sarah63@gmail.com,1992729934.0,938 Vargas Trail,Fort Worth,New Mexico,46971.0,USA,19.0,Female,Medium,New,6/30/2023,2023.0,June,14:14:53,7.0,361.3945,2529.7615,Clothing,Nike,Shorts,Excellent,Standard,Credit Card,Delivered,5.0,Denim shorts,2023-06-30,2025-11-15 14:14:53,Missing values; 
5839179.0,16750.0,Rebecca Salazar,Aaron59@gmail.com,4296406403.0,7279 David Spring Suite 747,Fort Worth,New Mexico,77483.0,USA,19.0,Male,Medium,New,06-06-23,2023.0,June,22:07:03,8.0,,3237.923776,Clothing,Zara,Jeans,Bad,Express,PayPal,Delivered,1.0,Flare jeans,2023-06-06,2025-11-15 22:07:03,Missing values; 
1028474.0,64154.0,Shelly Mccarthy,Michelle98@gmail.com,,980 Hood View Suite 610,Fort Worth,New Mexico,12727.0,USA,19.0,Female,Medium,New,1/18/2024,2024.0,January,11:22:32,2.0,199.5644115,399.128823,Books,Random House,Non-Fiction,Average,Express,PayPal,Delivered,2.0,Health,2024-01-18,2025-11-15 11:22:32,Missing values; 
6928759.0,31351.0,Calvin Suarez,Kevin85@gmail.com,2900493519.0,94691 Fuller Glens Apt. 067,Fort Worth,New Mexico,16628.0,USA,19.0,Male,Medium,New,8/28/2023,2023.0,,0:00:06,4.0,77.9119675,311.64787,Electronics,Samsung,Television,Good,Standard,Debit Card,Delivered,3.0,QLED TV,2023-08-28,2025-11-15 00:00:06,Missing values; 
3183172.0,63322.0,Katie Smith,Brett79@gmail.com,6500550430.0,93576 Maria Well Apt. 608,Fort Worth,New Mexico,94987.0,USA,19.0,Male,Medium,New,4/22/2023,2023.0,April,19:45:49,6.0,378.0640335,2268.384201,,Home Depot,Tools,Average,Same-Day,Credit Card,Delivered,2.0,Level,2023-04-22,2025-11-15 19:45:49,Missing values; 
7435434.0,56037.0,Michael Patton,Tyler32@gmail.com,4278529312.0,4935 White Parkways Suite 343,Fort Worth,New Mexico,31000.0,USA,19.0,Male,Medium,New,12/13/2023,2023.0,December,2:10:43,3.0,459.9142215,1379.742664,,Bed Bath & Beyond,Bedding,Excellent,Express,Debit Card,Delivered,5.0,Bed sheet set,2023-12-13,2025-11-15 02:10:43,Missing values; 
4028251.0,56675.0,Christopher Pittman,Brandon80@gmail.com,1412230966.0,74765 Alexander Light,Fort Worth,New Mexico,17454.0,USA,19.0,Female,Medium,New,6/22/2023,2023.0,June,7:41:56,1.0,461.0181398,,Electronics,Samsung,Smartphone,Bad,Same-Day,Cash,Delivered,1.0,iPhone,2023-06-22,2025-11-15 07:41:56,Missing values; 
,41214.0,Kimberly Jacobs,Margaret59@gmail.com,2988558737.0,72676 Valdez Plaza,Fort Worth,New Mexico,19914.0,USA,19.0,Female,Medium,New,09-09-23,2023.0,September,19:33:39,4.0,465.9732095,1863.892838,Clothing,Nike,Shoes,Bad,Express,Debit Card,Delivered,1.0,Oxfords,2023-09-09,2025-11-15 19:33:39,Missing values; 
6617325.0,11669.0,Nicole Gaines,,9176510362.0,455 Cindy Road Apt. 362,Fort Worth,New Mexico,47201.0,USA,19.0,Male,Medium,New,1/29/2024,2024.0,January,20:15:39,4.0,134.3346043,537.3384173,Clothing,Nike,Shorts,Excellent,Same-Day,Cash,Delivered,5.0,Chino shorts,2024-01-29,2025-11-15 20:15:39,Missing values; 
,44677.0,Crystal Reid,John77@gmail.com,7640265311.0,0922 Russell Street Apt. 589,Fort Worth,New Mexico,33954.0,USA,19.0,Male,Medium,New,04-07-23,2023.0,April,18:53:28,3.0,145.7946095,437.3838285,Grocery,Pepsi,Juice,Bad,Standard,Cash,Delivered,1.0,Cranberry juice,2023-04-07,2025-11-15 18:53:28,Missing values; 
1777151.0,80451.0,Tina Rich,Kevin48@gmail.com,9644975600.0,90831 Nolan Light Apt. 279,Fort Worth,New Mexico,71541.0,USA,19.0,Female,Medium,New,02-12-24,2024.0,,7:59:48,10.0,359.009611,3590.09611,Grocery,Nestle,Snacks,Bad,Standard,Debit Card,Delivered,1.0,Granola bars,2024-02-12,2025-11-15 07:59:48,Missing values; 
2596250.0,47705.0,Victoria Carroll,,1774098239.0,3097 Sanders Points,Fort Worth,New Mexico,41728.0,USA,19.0,Male,Medium,New,08-07-23,2023.0,August,19:28:55,5.0,183.4610212,917.3051062,Electronics,Samsung,Tablet,Good,Same-Day,Cash,Delivered,4.0,Lenovo Tab,2023-08-07,2025-11-15 19:28:55,Missing values; 
8656139.0,27229.0,Dr. Tracy Taylor,Heather80@gmail.com,1642789522.0,0678 David Harbor Suite 785,Fort Worth,New Mexico,23078.0,USA,19.0,,Medium,New,09-02-23,2023.0,September,5:21:13,3.0,148.331018,444.9930541,Home Decor,Home Depot,Furniture,Average,Express,Cash,Delivered,2.0,Bed,2023-09-02,2025-11-15 05:21:13,Missing values; 
2577112.0,17115.0,Sarah Stevenson,Cynthia76@gmail.com,6751063490.0,,Fort Worth,New Mexico,6647.0,USA,19.0,Female,Medium,New,08-04-23,2023.0,August,10:29:05,6.0,76.89606838,461.3764103,Books,Penguin Books,Children's,Bad,Express,PayPal,Delivered,1.0,Sports equipment,2023-08-04,2025-11-15 10:29:05,Missing values; 
9429176.0,21410.0,Alexandria Miller,Keith88@gmail.com,3834784444.0,17048 Michael Alley Suite 974,Fort Worth,New Mexico,31245.0,USA,19.0,Male,Medium,New,7/13/2023,2023.0,July,2:50:01,,437.8016637,1751.206655,Books,Penguin Books,Non-Fiction,Good,Standard,Debit Card,Delivered,3.0,Science,2023-07-13,2025-11-15 02:50:01,Missing values; 
3752969.0,99703.0,Amy Williams,,1717084081.0,518 Rocha Springs,Fort Worth,New Mexico,6069.0,USA,19.0,Female,Medium,New,03-02-23,2023.0,March,3:17:58,3.0,345.335659,1036.006977,Clothing,Nike,Shorts,Bad,Standard,Credit Card,Delivered,1.0,Skorts,2023-03-02,2025-11-15 03:17:58,Missing values; 
7134731.0,77256.0,Kristen Adams,Lauren2@gmail.com,1413391128.0,5114 Wendy Inlet,Fort Worth,New Mexico,21175.0,USA,19.0,Male,Medium,New,8/15/2023,2023.0,August,4:14:44,6.0,,2201.276207,Electronics,Apple,Laptop,Good,Same-Day,PayPal,Delivered,4.0,Lenovo ThinkPad,2023-08-15,2025-11-15 04:14:44,Missing values; 
4528331.0,33278.0,Paul Phillips,David58@gmail.com,6865292303.0,6672 Key Plaza,Fort Worth,New Mexico,,USA,19.0,Male,Medium,New,10/29/2023,2023.0,October,11:41:05,9.0,153.3482398,1380.134159,Books,Penguin Books,Children's,Average,Express,Cash,Delivered,2.0,Sports equipment,2023-10-29,2025-11-15 11:41:05,Missing values; 
7582937.0,20229.0,Adam Smith,Mary91@gmail.com,3237656832.0,0164 Russell Pass Suite 891,Fort Worth,New Mexico,9385.0,USA,19.0,,Medium,New,6/15/2023,2023.0,June,22:46:41,2.0,234.8513101,469.7026201,Home Decor,IKEA,Furniture,Excellent,Express,Credit Card,Delivered,4.0,Desk,2023-06-15,2025-11-15 22:46:41,Missing values; 
7098051.0,,Jacob Edwards,Stanley40@gmail.com,1257055756.0,54161 Justin Prairie Apt. 124,Fort Worth,New Mexico,43470.0,USA,19.0,Male,Medium,New,12/15/2023,2023.0,December,2:39:58,3.0,18.37226062,55.11678187,Home Decor,Home Depot,Tools,Excellent,Same-Day,Cash,Delivered,4.0,Screwdriver set,2023-12-15,2025-11-15 02:39:58,Missing values; 
8469188.0,98065.0,Michael Lin,Donna79@gmail.com,8610855783.0,02446 Kayla Coves,Fort Worth,New Mexico,77362.0,USA,19.0,Male,Medium,New,10/27/2023,2023.0,,11:07:51,10.0,270.0142823,2700.142823,Grocery,Pepsi,Soft Drink,Good,Same-Day,PayPal,Delivered,3.0,Orange soda,2023-10-27,2025-11-15 11:07:51,Missing values; 
6982036.0,26782.0,Danielle Smith,Stephanie35@gmail.com,3229076941.0,207 Barnett Stream Suite 873,Fort Worth,New Mexico,15446.0,USA,19.0,Male,Medium,New,10-02-23,2023.0,October,,4.0,108.4652943,433.8611772,Grocery,Coca-Cola,Juice,Average,Standard,Cash,Delivered,2.0,Cranberry juice,2023-10-02,,Missing values; 
5549150.0,76898.0,Valerie Bailey,Brian55@gmail.com,3147555760.0,,Fort Worth,New Mexico,32814.0,USA,19.0,Female,Medium,New,1/27/2024,2024.0,January,2:41:12,5.0,496.5490179,2482.745089,Clothing,Zara,Shirt,Good,Standard,PayPal,Delivered,4.0,Henley shirt,2024-01-27,2025-11-15 02:41:12,Missing values; 
6427368.0,38742.0,,Jason51@gmail.com,9810150653.0,50572 Sarah Passage,Fort Worth,New Mexico,7861.0,USA,19.0,Male,Medium,New,5/18/2023,2023.0,May,14:35:43,6.0,479.1982334,2875.1894,Books,Random House,Fiction,Excellent,Standard,Debit Card,Delivered,5.0,Literary fiction,2023-05-18,2025-11-15 14:35:43,Missing values; 
5208539.0,51171.0,Megan Colon,Stephanie34@gmail.com,5969849407.0,4479 Hodges Rapids Apt. 375,Fort Worth,New Mexico,63795.0,USA,19.0,Female,Medium,New,10/14/2023,2023.0,,2:57:43,8.0,162.4656564,1299.725251,Home Decor,Bed Bath & Beyond,Bedding,Good,Express,Credit Card,Delivered,4.0,Duvet cover,2023-10-14,2025-11-15 02:57:43,Missing values; 
5461694.0,38891.0,Darlene Washington,Daniel59@gmail.com,8979828190.0,3997 Morgan Knolls Suite 366,Fort Worth,New Mexico,2850.0,USA,19.0,Female,Medium,New,10-09-23,2023.0,,22:34:03,5.0,302.5552636,1512.776318,Clothing,Adidas,Shoes,Bad,Standard,Credit Card,Delivered,1.0,Boots,2023-10-09,2025-11-15 22:34:03,Missing values; 
6671718.0,10174.0,David Green,Stacey87@gmail.com,3905147678.0,82158 Hunter Forks Suite 311,Fort Worth,New Mexico,1749.0,USA,19.0,Female,High,New,11-12-23,2023.0,November,15:42:42,1.0,385.2380409,385.2380409,Electronics,Sony,Smartphone,Good,Standard,,Delivered,4.0,Xiaomi Mi,2023-11-12,2025-11-15 15:42:42,Missing values; 
8818241.0,,Francisco Becker,George50@gmail.com,3796929669.0,6673 Grant Via,Fort Worth,New Mexico,70359.0,USA,19.0,Male,High,New,08-04-23,2023.0,August,9:05:39,7.0,177.0682653,1239.477857,Books,HarperCollins,Fiction,Good,Same-Day,PayPal,Delivered,4.0,Adventure,2023-08-04,2025-11-15 09:05:39,Missing values; 
2929953.0,62055.0,William Love,Michelle69@gmail.com,5485207380.0,,Fort Worth,New Mexico,71652.0,USA,19.0,Female,High,New,8/15/2023,2023.0,August,5:05:56,5.0,280.7479953,1403.739977,Books,HarperCollins,Thriller,Good,Express,Cash,Delivered,4.0,Suspense,2023-08-15,2025-11-15 05:05:56,Missing values; 
6435962.0,,Gloria Fuller,Philip15@gmail.com,9785632402.0,76362 Matthews Views,Fort Worth,New Mexico,8745.0,USA,19.0,Female,High,New,12/15/2023,2023.0,December,19:56:40,10.0,334.5168022,3345.168022,Clothing,Zara,Shirt,Bad,Standard,Cash,Delivered,1.0,Hoodie,2023-12-15,2025-11-15 19:56:40,Missing values; 
,48407.0,Chase Brown,Todd98@gmail.com,5558832324.0,30742 Maria Rest Apt. 508,Fort Worth,New Mexico,90056.0,USA,19.0,Male,High,New,6/13/2023,2023.0,June,13:54:41,5.0,189.1702566,945.8512829,Books,Random House,Non-Fiction,Excellent,Standard,Credit Card,Delivered,4.0,Cooking,2023-06-13,2025-11-15 13:54:41,Missing values; 
7814757.0,85783.0,Sandra Landry,Joseph31@gmail.com,4269748723.0,,Fort Worth,New Mexico,73189.0,USA,19.0,Female,High,New,07-11-23,2023.0,July,9:38:30,8.0,421.3342166,3370.673733,Home Decor,Bed Bath & Beyond,Bathroom,Average,Express,PayPal,Delivered,2.0,Toilet,2023-07-11,2025-11-15 09:38:30,Missing values; 
8294811.0,29279.0,Dr. Michael Evans,Kristen87@gmail.com,1194966395.0,2212 Long Street,Fort Worth,New Mexico,40382.0,USA,19.0,Male,High,New,12-07-23,2023.0,December,19:48:33,1.0,178.0623358,178.0623358,Clothing,Adidas,T-shirt,Excellent,Standard,,Delivered,4.0,Crop top,2023-12-07,2025-11-15 19:48:33,Missing values; 
7000917.0,57219.0,Ruth Peters,Brittany16@gmail.com,9450773743.0,6922 Ashley Alley,Fort Worth,New Mexico,,USA,19.0,Female,High,New,8/13/2023,2023.0,August,16:03:12,1.0,165.7541132,165.7541132,Electronics,Sony,Headphones,Bad,Standard,Credit Card,Delivered,1.0,Studio headphones,2023-08-13,2025-11-15 16:03:12,Missing values; 
1309261.0,53382.0,Melvin Newman,Sherry35@gmail.com,1479736932.0,5802 Smith Street Apt. 156,Fort Worth,New Mexico,50467.0,USA,19.0,Male,High,New,4/28/2023,2023.0,April,19:22:19,2.0,447.3475293,894.6950587,Home Decor,Home Depot,Tools,,Same-Day,PayPal,Delivered,,Caulking gun,2023-04-28,2025-11-15 19:22:19,Missing values; 
3961123.0,23404.0,Eric Reynolds,Susan29@gmail.com,1266909808.0,823 Santos Fort Suite 163,Fort Worth,New Mexico,88141.0,USA,19.0,Male,High,New,6/27/2023,2023.0,June,15:13:09,8.0,124.5578696,,Grocery,Coca-Cola,Water,Average,Same-Day,Debit Card,Delivered,2.0,Sparkling water,2023-06-27,2025-11-15 15:13:09,Missing values; 
1550261.0,32767.0,Christina Quinn,Rachel62@gmail.com,6495064577.0,356 Elizabeth Green,Fort Worth,New Mexico,29869.0,USA,19.0,,High,New,12/17/2023,2023.0,December,8:46:32,7.0,452.6922022,3168.845416,Electronics,Apple,Tablet,Average,Same-Day,Credit Card,Delivered,2.0,Asus ZenPad,2023-12-17,2025-11-15 08:46:32,Missing values; 
3412155.0,22649.0,Brett Wilkins,Sara94@gmail.com,5295392491.0,8138 Sullivan Gardens Apt. 502,Fort Worth,New Mexico,77213.0,USA,19.0,Male,High,New,10/22/2023,2023.0,October,13:43:46,10.0,306.7751077,3067.751077,Home Decor,Bed Bath & Beyond,Kitchen,Bad,,Cash,Delivered,1.0,Refrigerator,2023-10-22,2025-11-15 13:43:46,Missing values; 
8727295.0,14254.0,Madison Peterson,Sandra49@gmail.com,5303546538.0,44546 Tamara Cape,Fort Worth,New Mexico,68640.0,USA,19.0,Male,High,New,10/27/2023,2023.0,,8:46:50,8.0,485.6180833,3884.944667,Home Decor,IKEA,Lighting,Bad,Standard,Credit Card,Delivered,1.0,Recessed lighting,2023-10-27,2025-11-15 08:46:50,Missing values; 
9724287.0,74492.0,,Amanda61@gmail.com,3803639977.0,655 Adams Falls,Fort Worth,New Mexico,33037.0,USA,19.0,Male,High,New,2/23/2024,2024.0,February,23:11:39,3.0,380.297166,1140.891498,Electronics,Samsung,Television,Average,Express,PayPal,Delivered,2.0,Plasma TV,2024-02-23,2025-11-15 23:11:39,Missing values; 
5093485.0,85283.0,Vincent Le,Marcus22@gmail.com,4592538773.0,170 Norma Locks,Fort Worth,New Mexico,75257.0,USA,19.0,Male,High,New,05-04-23,2023.0,May,,10.0,50.89007923,508.9007923,Clothing,Nike,Shoes,Good,Standard,Cash,Delivered,4.0,Slippers,2023-05-04,,Missing values; 
4721514.0,57665.0,Randall Cox,Denise92@gmail.com,1495952158.0,36442 Brian Loaf,Fort Worth,New Mexico,62925.0,USA,19.0,Male,High,New,8/13/2023,2023.0,August,19:46:56,6.0,80.26162311,481.5697387,Home Decor,IKEA,Decorations,Good,Standard,,Delivered,3.0,Rugs,2023-08-13,2025-11-15 19:46:56,Missing values; 
1512071.0,99556.0,Wesley Russo,Jared41@gmail.com,7226094259.0,57741 Michael Park Apt. 015,Fort Worth,New Mexico,90075.0,USA,19.0,Male,High,New,01-10-24,2024.0,January,,3.0,347.2364447,1041.709334,Electronics,Apple,Laptop,Average,Standard,PayPal,Delivered,2.0,HP Spectre,2024-01-10,,Missing values; 
3645960.0,20462.0,Lisa Martin,Lorraine40@gmail.com,3729224673.0,5115 Daniel Highway Apt. 776,Fort Worth,New Mexico,70889.0,USA,19.0,Female,High,New,6/14/2023,2023.0,June,5:53:01,7.0,254.5892973,1782.125081,Home Decor,Home Depot,Tools,Good,Same-Day,,Delivered,3.0,Screwdriver set,2023-06-14,2025-11-15 05:53:01,Missing values; 
5192997.0,68711.0,Corey Gutierrez,Ann67@gmail.com,4381110700.0,542 Chandler Villages Apt. 538,Fort Worth,New Mexico,79722.0,USA,19.0,,High,New,9/17/2023,2023.0,September,16:24:15,3.0,409.7762181,1229.328654,Grocery,Pepsi,Soft Drink,Bad,Standard,Cash,Delivered,1.0,Grape soda,2023-09-17,2025-11-15 16:24:15,Missing values; 
7909628.0,13899.0,Terry Johnston,Cynthia62@gmail.com,5438781376.0,6536 Brown Cliffs,Fort Worth,New Mexico,97274.0,USA,19.0,Male,High,New,10/22/2023,,October,14:03:46,10.0,374.6093694,3746.093694,Electronics,Apple,Tablet,Excellent,Express,Credit Card,Delivered,4.0,Acer Iconia Tab,2023-10-22,2025-11-15 14:03:46,Missing values; 
7798536.0,32096.0,Nicole Martin,Larry69@gmail.com,6408891436.0,5777 Collins Alley,Fort Worth,New Mexico,78003.0,USA,19.0,Female,High,New,,2023.0,July,18:57:11,8.0,398.0435519,3184.348415,Home Decor,Bed Bath & Beyond,Bathroom,Good,Same-Day,Cash,Delivered,4.0,Shower curtain,,2025-11-15 18:57:11,Missing values; 
,66007.0,Jennifer Carter,Deborah41@gmail.com,5471550117.0,105 Macdonald Throughway,Fort Worth,New Mexico,10490.0,USA,19.0,Male,High,New,1/19/2024,2024.0,January,17:59:19,6.0,274.5915833,1647.5495,Clothing,Zara,Shirt,Average,Express,Credit Card,Delivered,2.0,T-shirt,2024-01-19,2025-11-15 17:59:19,Missing values; 
1124457.0,86117.0,Roberta Friedman,Anthony24@gmail.com,8913026715.0,39053 Bradshaw Ville,Fort Worth,New Mexico,58447.0,USA,19.0,Male,High,New,9/22/2023,2023.0,September,9:53:31,5.0,327.7004278,1638.502139,Grocery,Coca-Cola,Water,Good,,Credit Card,Delivered,3.0,Bottled water,2023-09-22,2025-11-15 09:53:31,Missing values; 
,49952.0,Timothy Steele,Danielle92@gmail.com,3320521928.0,83314 Stephanie Lights Apt. 045,Fort Worth,New Mexico,65258.0,USA,19.0,Female,High,New,5/21/2023,2023.0,May,13:10:20,4.0,216.8718647,867.4874587,Electronics,Apple,Tablet,Average,Standard,Credit Card,Delivered,2.0,Huawei MediaPad,2023-05-21,2025-11-15 13:10:20,Missing values; 
8082159.0,69045.0,Shelley Harrison,Tammy13@gmail.com,8672356541.0,11665 David Plaza Apt. 276,Fort Worth,New Mexico,35056.0,USA,19.0,,High,New,5/29/2023,2023.0,May,8:57:34,3.0,165.3840695,496.1522085,Books,HarperCollins,Thriller,Excellent,Standard,Debit Card,Delivered,5.0,Adventure,2023-05-29,2025-11-15 08:57:34,Missing values; 
4945456.0,72108.0,Ryan Burton,Jacqueline67@gmail.com,9148050506.0,6227 Taylor Wells Apt. 175,Fort Worth,New Mexico,74318.0,USA,19.0,Male,High,New,10/18/2023,2023.0,October,8:16:59,8.0,363.8909513,2911.12761,Electronics,Sony,Smartphone,Average,,Debit Card,Delivered,2.0,Huawei P,2023-10-18,2025-11-15 08:16:59,Missing values; 
2417883.0,33268.0,Joseph Murphy,Sarah66@gmail.com,5240857707.0,73638 Harrison Corner,Fort Worth,New Mexico,37825.0,USA,19.0,Female,High,New,,2023.0,October,11:11:03,5.0,217.0791084,1085.395542,Electronics,Samsung,Television,Bad,Express,PayPal,Delivered,1.0,Android TV,,2025-11-15 11:11:03,Missing values; 
6774834.0,38592.0,Katrina Weaver,Janice73@gmail.com,3377055649.0,950 David Junction,Fort Worth,New Mexico,37951.0,USA,19.0,Male,High,New,05-03-23,2023.0,May,1:04:16,10.0,,1495.694583,Clothing,Adidas,T-shirt,Good,Standard,Credit Card,Delivered,4.0,Plain tee,2023-05-03,2025-11-15 01:04:16,Missing values; 
7181868.0,33227.0,Thomas Hanson,Robert4@gmail.com,9193015914.0,18484 Robles Stravenue,Fort Worth,New Mexico,51652.0,USA,19.0,Female,High,New,8/28/2023,2023.0,August,7:39:47,5.0,,1268.096027,Electronics,Sony,Smartphone,Excellent,Same-Day,PayPal,Delivered,5.0,Nokia,2023-08-28,2025-11-15 07:39:47,Missing values; 
,32862.0,William Mitchell,Wendy3@gmail.com,1399970700.0,2510 Watkins Curve Suite 316,Fort Worth,New Mexico,78839.0,USA,19.0,Female,High,New,1/23/2024,2024.0,January,20:38:13,8.0,369.4778558,2955.822847,Home Decor,Home Depot,Decorations,Bad,Express,PayPal,Delivered,1.0,Picture frames,2024-01-23,2025-11-15 20:38:13,Missing values; 
6203026.0,36807.0,Timothy Rhodes,Tony55@gmail.com,,3729 Martinez Well,Fort Worth,New Mexico,32811.0,USA,19.0,Female,High,New,1/14/2024,2024.0,January,4:39:39,1.0,345.7077041,345.7077041,Home Decor,IKEA,Decorations,Excellent,Same-Day,Credit Card,Delivered,4.0,Rugs,2024-01-14,2025-11-15 04:39:39,Missing values; 
9004942.0,13587.0,Shelby Lucero,Ryan11@gmail.com,3989546024.0,55375 Rivera Street,Fort Worth,New Mexico,45247.0,USA,19.0,Female,Low,New,10/23/2023,2023.0,October,8:58:36,5.0,358.2962038,,Clothing,Zara,Dress,Excellent,Same-Day,Debit Card,Delivered,5.0,Maxi dress,2023-10-23,2025-11-15 08:58:36,Missing values; 
4001674.0,30185.0,,Jesse90@gmail.com,1306780643.0,87654 Velasquez Village Suite 202,Fort Worth,New Mexico,10716.0,USA,19.0,Male,Low,New,04-12-23,2023.0,April,21:35:13,5.0,82.9503794,414.751897,Grocery,Nestle,Coffee,Good,Express,Debit Card,Delivered,4.0,Latte,2023-04-12,2025-11-15 21:35:13,Missing values; 
8085716.0,,Julia White,Joshua19@gmail.com,2231729581.0,098 Elizabeth Pine Apt. 707,Fort Worth,New Mexico,69991.0,USA,19.0,Female,Low,New,09-12-23,2023.0,September,0:34:21,5.0,72.91118406,364.5559203,Clothing,Zara,Dress,Bad,Standard,Credit Card,Delivered,1.0,Bodycon dress,2023-09-12,2025-11-15 00:34:21,Missing values; 
2335423.0,39877.0,Allison Dominguez,Miranda79@gmail.com,7213667022.0,,Fort Worth,New Mexico,24951.0,USA,19.0,Male,Low,New,01-09-24,2024.0,January,11:36:43,4.0,296.5194984,1186.077994,Books,Penguin Books,Children's,Good,Express,Debit Card,Delivered,4.0,Clothing,2024-01-09,2025-11-15 11:36:43,Missing values; 
7081282.0,55340.0,Michele Clay,Brian13@gmail.com,1495903765.0,31513 Bailey Fords,Fort Worth,New Mexico,77806.0,USA,19.0,Female,Low,New,6/18/2023,2023.0,June,4:11:22,1.0,13.64994403,13.64994403,,Random House,Non-Fiction,Bad,Same-Day,PayPal,Delivered,1.0,Cooking,2023-06-18,2025-11-15 04:11:22,Missing values; 
3864477.0,50962.0,Amanda Reed,,9975132051.0,9649 Anthony Parkway,Fort Worth,New Mexico,50682.0,USA,19.0,Female,Low,New,05-09-23,2023.0,May,14:34:24,2.0,80.1703532,160.3407064,Electronics,Samsung,Television,Bad,Same-Day,Debit Card,Delivered,1.0,Android TV,2023-05-09,2025-11-15 14:34:24,Missing values; 
5053241.0,30495.0,Kyle Robinson,Amanda18@gmail.com,,591 Mcintyre Island Suite 195,Fort Worth,New Mexico,72382.0,USA,19.0,Male,Low,New,03-04-23,2023.0,March,10:05:34,3.0,336.4324635,1009.297391,Clothing,Nike,Shorts,Bad,Express,Debit Card,Delivered,1.0,Skorts,2023-03-04,2025-11-15 10:05:34,Missing values; 
5683748.0,44935.0,Eric Dominguez,John44@gmail.com,2247278213.0,63945 Brent Hills,Fort Worth,New Mexico,92463.0,USA,19.0,Male,Low,New,3/31/2023,2023.0,March,,10.0,366.9560441,3669.560441,Clothing,Zara,Dress,Excellent,Same-Day,Cash,Delivered,5.0,A-line dress,2023-03-31,,Missing values; 
2165415.0,48490.0,Doris Miller,Michael98@gmail.com,3173013370.0,7216 Claire Ville Suite 582,Fort Worth,New Mexico,87981.0,USA,19.0,Female,Low,New,8/13/2023,2023.0,August,6:38:51,6.0,320.9955332,1925.973199,,Random House,Non-Fiction,Bad,Express,Cash,Delivered,1.0,History,2023-08-13,2025-11-15 06:38:51,Missing values; 
1450110.0,29488.0,Ashley Hansen,Katelyn99@gmail.com,4897349599.0,16234 Juan Greens,Fort Worth,New Mexico,37818.0,USA,19.0,Male,Low,New,2/29/2024,2024.0,February,9:28:01,1.0,208.6358651,208.6358651,Electronics,Samsung,Tablet,,Same-Day,Debit Card,Delivered,,iPad,2024-02-29,2025-11-15 09:28:01,Missing values; 
9194063.0,38987.0,Justin Robinson,Amanda87@gmail.com,,3637 Young Estates Apt. 213,Fort Worth,New Mexico,68431.0,USA,19.0,Male,Low,New,06-06-23,2023.0,June,3:35:28,4.0,183.753096,735.012384,Home Decor,Bed Bath & Beyond,Kitchen,Bad,Express,Credit Card,Delivered,1.0,Microwave,2023-06-06,2025-11-15 03:35:28,Missing values; 
7724288.0,55925.0,Thomas Arnold,Amanda1@gmail.com,5782621803.0,565 Mike Centers Suite 390,Fort Worth,New Mexico,88189.0,USA,19.0,Male,Low,New,,2023.0,August,15:50:22,1.0,177.2755303,177.2755303,Books,HarperCollins,Thriller,Good,Standard,Cash,Delivered,4.0,Crime,,2025-11-15 15:50:22,Missing values; 
1752394.0,,Patricia Rivera,David53@gmail.com,7416321901.0,3778 Jessica Canyon,Fort Worth,New Mexico,29021.0,USA,19.0,Male,Low,New,5/22/2023,2023.0,May,15:55:29,8.0,343.466051,2747.728408,Electronics,Samsung,Television,Average,Express,Debit Card,Delivered,2.0,HDR TV,2023-05-22,2025-11-15 15:55:29,Missing values; 
5284182.0,84521.0,Kiara Rios,Sara27@gmail.com,7342504849.0,75485 Richard Lakes,Fort Worth,New Mexico,32347.0,USA,19.0,Female,Low,New,05-04-23,2023.0,May,17:35:38,10.0,241.9227019,2419.227019,,Nestle,Snacks,Excellent,Express,PayPal,Delivered,4.0,Chips,2023-05-04,2025-11-15 17:35:38,Missing values; 
7571854.0,95033.0,Kathleen Nguyen,Rachel22@gmail.com,1202069893.0,056 Jeffrey Mews,Fort Worth,New Mexico,72334.0,USA,19.0,Female,Low,New,,2024.0,February,13:06:00,6.0,201.2544786,1207.526872,Clothing,Adidas,T-shirt,Bad,Same-Day,PayPal,Delivered,1.0,Henley tee,,2025-11-15 13:06:00,Missing values; 
8543565.0,25162.0,Margaret Davis,John50@gmail.com,1052746408.0,045 Bowman Ferry Suite 840,Fort Worth,New Mexico,68044.0,USA,19.0,Male,Low,New,4/29/2023,2023.0,April,2:42:29,2.0,,161.7826249,Clothing,Adidas,Shoes,Good,Express,Debit Card,Delivered,4.0,Running shoes,2023-04-29,2025-11-15 02:42:29,Missing values; 
6944119.0,28186.0,Craig Taylor,,6449572075.0,03764 Caleb Isle Apt. 523,Fort Worth,New Mexico,7288.0,USA,19.0,Male,Low,New,7/14/2023,2023.0,July,18:09:39,10.0,174.9213143,1749.213143,Books,HarperCollins,Fiction,Excellent,Express,Credit Card,Delivered,4.0,Fantasy,2023-07-14,2025-11-15 18:09:39,Missing values; 
3552208.0,,Kevin Davis,Adam88@gmail.com,8840844233.0,328 Roberta Forge Apt. 824,Fort Worth,New Mexico,11282.0,USA,19.0,Female,Low,New,11/27/2023,2023.0,November,14:15:54,3.0,236.8250226,710.4750677,Home Decor,Bed Bath & Beyond,Kitchen,Average,Same-Day,PayPal,Delivered,2.0,Food processor,2023-11-27,2025-11-15 14:15:54,Missing values; 
1570393.0,78898.0,Mary Cruz,Haley68@gmail.com,6440063370.0,,Fort Worth,New Mexico,90020.0,USA,19.0,Female,Low,New,8/14/2023,2023.0,August,12:27:31,3.0,362.4560143,1087.368043,Clothing,Adidas,Jacket,Excellent,Same-Day,Cash,Delivered,5.0,Bomber jacket,2023-08-14,2025-11-15 12:27:31,Missing values; 
8990974.0,14212.0,Benjamin Brown,Christopher69@gmail.com,,6428 Clark Harbor Apt. 365,Fort Worth,New Mexico,13286.0,USA,19.0,Female,Low,New,10/22/2023,2023.0,October,0:30:14,10.0,50.25690856,502.5690856,Clothing,Nike,Shoes,Excellent,Express,Debit Card,Delivered,5.0,Boots,2023-10-22,2025-11-15 00:30:14,Missing values; 
1422835.0,82582.0,Sheryl Shah,Lauren87@gmail.com,2063580035.0,5867 Cynthia Motorway,Fort Worth,New Mexico,29877.0,USA,19.0,Male,Low,New,09-08-23,2023.0,September,2:53:09,2.0,168.6441748,337.2883496,Electronics,Apple,Laptop,,Express,Debit Card,Delivered,,MacBook,2023-09-08,2025-11-15 02:53:09,Missing values; 
9577427.0,87551.0,Jimmy Miller,Tyler33@gmail.com,8310395008.0,916 Thompson Ferry,Fort Worth,New Mexico,39123.0,USA,19.0,Female,Low,New,8/14/2023,2023.0,August,21:56:54,6.0,292.5928869,1755.557322,Clothing,Nike,Shoes,,Standard,Credit Card,Delivered,,Flip flops,2023-08-14,2025-11-15 21:56:54,Missing values; 
8753480.0,42555.0,Melissa Smith,Jason44@gmail.com,9703657003.0,19172 Davis Wall,Fort Worth,New Mexico,55958.0,USA,19.0,Male,Low,New,,2023.0,April,4:30:04,5.0,82.98328151,414.9164076,Home Decor,IKEA,Furniture,Average,Standard,Debit Card,Delivered,2.0,Bed,,2025-11-15 04:30:04,Missing values; 
3589142.0,17168.0,Selena Lewis,Michele57@gmail.com,8797208197.0,13799 Lawrence Club Suite 480,Fort Worth,New Mexico,57548.0,USA,19.0,Female,Low,New,09-05-23,2023.0,September,,8.0,181.7140051,1453.712041,Books,Penguin Books,Children's,Average,Express,Cash,Delivered,2.0,Clothing,2023-09-05,,Missing values; 
1644383.0,57223.0,Ryan Kemp,Alexis40@gmail.com,5027668480.0,310 Todd Road Apt. 876,Fort Worth,New Mexico,27814.0,USA,19.0,Male,Low,New,3/18/2023,2023.0,March,8:00:50,6.0,401.458407,2408.750442,Clothing,Zara,Shirt,Excellent,,Credit Card,Delivered,5.0,Flannel shirt,2023-03-18,2025-11-15 08:00:50,Missing values; 
9362348.0,29503.0,Gerald Nelson,Lisa57@gmail.com,1858316015.0,5684 David Drives Apt. 167,Fort Worth,New Mexico,,USA,19.0,Male,Low,New,03-03-23,2023.0,March,23:56:36,9.0,116.3921006,1047.528906,Electronics,Sony,Smartphone,Bad,Standard,Credit Card,Delivered,1.0,iPhone,2023-03-03,2025-11-15 23:56:36,Missing values; 
1602908.0,71392.0,Catherine Mathews,Kristopher2@gmail.com,2378723963.0,6213 Sarah Burg Apt. 788,Fort Worth,New Mexico,14111.0,USA,19.0,Male,Low,New,12-02-23,2023.0,December,22:53:41,,459.4775732,3675.820586,Clothing,Zara,Shirt,Bad,Same-Day,Cash,Delivered,1.0,Flannel shirt,2023-12-02,2025-11-15 22:53:41,Missing values; 
6802527.0,35947.0,Corey Brown,Elizabeth82@gmail.com,3965052607.0,,Fort Worth,New Mexico,24861.0,USA,19.0,Male,Low,New,12/27/2023,2023.0,December,6:37:26,8.0,124.1208216,992.9665725,Electronics,Sony,Smartphone,Excellent,Standard,Debit Card,Delivered,5.0,Huawei P,2023-12-27,2025-11-15 06:37:26,Missing values; 
2884333.0,12559.0,Jessica Mcintyre,James88@gmail.com,3510294575.0,623 James Landing Apt. 524,Fort Worth,New Mexico,88084.0,USA,19.0,Male,Low,New,,2023.0,August,20:04:56,1.0,269.7534467,269.7534467,Grocery,Coca-Cola,Juice,Good,Standard,PayPal,Delivered,4.0,Grapefruit juice,,2025-11-15 20:04:56,Missing values; 
6552442.0,76811.0,Timothy Hawkins,David66@gmail.com,1873390687.0,421 Elizabeth Oval Apt. 048,Fort Worth,New Mexico,52047.0,USA,19.0,Male,Low,New,6/13/2023,,June,5:02:27,4.0,302.2501426,1209.00057,Clothing,Nike,Shoes,Excellent,Standard,Debit Card,Delivered,4.0,Sandals,2023-06-13,2025-11-15 05:02:27,Missing values; 
4440666.0,64326.0,Brian Brooks,Antonio34@gmail.com,8149477447.0,90655 Suzanne Shores,Fort Worth,New Mexico,45290.0,USA,19.0,Female,Low,New,01-07-24,2024.0,January,0:57:41,4.0,487.7738115,1951.095246,Electronics,Apple,Smartphone,Good,Express,,Delivered,4.0,LG G,2024-01-07,2025-11-15 00:57:41,Missing values; 
7799231.0,,Jennifer Nichols,Cody34@gmail.com,2629796388.0,180 David Ridges Suite 820,Fort Worth,New Mexico,96514.0,USA,53.0,Male,Low,New,6/24/2023,2023.0,June,7:05:53,6.0,280.5593428,1683.356057,Grocery,Nestle,Snacks,Excellent,Standard,Cash,Delivered,4.0,Fruit snacks,2023-06-24,2025-11-15 07:05:53,Missing values; 
3565814.0,32816.0,Rebecca Harrison,Robert11@gmail.com,7963057756.0,14024 Emily Expressway,Frankfurt,Berlin,4787.0,Germany,,Female,Low,New,8/16/2023,2023.0,August,18:33:56,1.0,84.57257529,84.57257529,Clothing,Nike,Shoes,Good,Same-Day,PayPal,Delivered,4.0,High heels,2023-08-16,2025-11-15 18:33:56,Missing values; 
7869340.0,56254.0,Heather Berger,Isaac49@gmail.com,5812216353.0,63604 Virginia Lodge,Frankfurt,Berlin,76000.0,Germany,48.0,Female,Low,New,01-03-24,2024.0,,16:45:55,1.0,413.4181211,413.4181211,Clothing,Zara,Jeans,Average,Same-Day,PayPal,Delivered,2.0,Straight-leg jeans,2024-01-03,2025-11-15 16:45:55,Missing values; 
8370830.0,95082.0,Bruce Shields,Dylan92@gmail.com,6818161543.0,031 Lisa Road,Frankfurt,Berlin,57735.0,Germany,47.0,Male,Low,New,06-03-23,2023.0,June,17:10:57,5.0,447.5709479,2237.854739,Electronics,Apple,Laptop,Excellent,,Cash,Delivered,4.0,Acer Swift,2023-06-03,2025-11-15 17:10:57,Missing values; 
9758291.0,91872.0,Leslie Aguilar,Jon36@gmail.com,8626147327.0,69539 William Ford,Frankfurt,Berlin,,Germany,26.0,Male,Low,New,1/29/2024,2024.0,January,8:05:42,10.0,59.2442789,592.442789,Electronics,Samsung,Smartphone,Good,Same-Day,Debit Card,Delivered,4.0,Sony Xperia,2024-01-29,2025-11-15 08:05:42,Missing values; 
3787893.0,21900.0,Tiffany Collins,Austin53@gmail.com,8454867469.0,774 Veronica Pike Apt. 334,Frankfurt,Berlin,76045.0,Germany,22.0,,Low,New,7/25/2023,2023.0,July,9:01:33,7.0,156.1611268,1093.127888,Grocery,Coca-Cola,Juice,Excellent,Standard,Cash,Delivered,5.0,Tomato juice,2023-07-25,2025-11-15 09:01:33,Missing values; 
3426938.0,91670.0,Zachary Baker,Lisa74@gmail.com,9903089332.0,7607 Morgan Flat,Frankfurt,Berlin,85352.0,Germany,22.0,Male,Low,New,1/20/2024,2024.0,January,14:04:57,2.0,271.7235023,543.4470046,Home Decor,Bed Bath & Beyond,Kitchen,,Express,PayPal,Delivered,,Dishwasher,2024-01-20,2025-11-15 14:04:57,Missing values; 
4411113.0,42905.0,Cathy White,Lisa91@gmail.com,7616065470.0,4784 Casey Trafficway Apt. 244,Frankfurt,Berlin,55275.0,Germany,22.0,Male,Low,New,1/14/2024,2024.0,January,13:40:02,1.0,185.0849329,185.0849329,Clothing,Adidas,Jacket,Good,,Debit Card,Delivered,3.0,Blazer,2024-01-14,2025-11-15 13:40:02,Missing values; 
8675262.0,70275.0,Eric Smith,Victoria63@gmail.com,6591502381.0,6907 Clark Ports Apt. 768,Frankfurt,Berlin,90545.0,Germany,22.0,Female,Medium,New,01-11-24,2024.0,January,3:45:34,9.0,243.6668105,,Grocery,Nestle,Coffee,Good,Same-Day,Cash,Delivered,4.0,Macchiato,2024-01-11,2025-11-15 03:45:34,Missing values; 
4843345.0,45150.0,Nancy Nelson,Matthew86@gmail.com,7609385249.0,977 Perez Loaf Suite 362,Frankfurt,Berlin,80547.0,Germany,22.0,Male,Medium,New,07-06-23,2023.0,July,13:55:37,,257.4462495,514.892499,Clothing,Zara,Dress,Good,Express,Cash,Delivered,3.0,Casual dress,2023-07-06,2025-11-15 13:55:37,Missing values; 
4032229.0,87190.0,Garrett Bishop,Zachary15@gmail.com,1764568562.0,59043 John Views Suite 914,Frankfurt,Berlin,50616.0,Germany,22.0,Female,Medium,New,11-04-23,2023.0,November,18:01:42,6.0,172.1865302,,Books,HarperCollins,Fiction,Average,Standard,Credit Card,Delivered,2.0,Mystery,2023-11-04,2025-11-15 18:01:42,Missing values; 
4677638.0,92528.0,Thomas Stone,Daniel2@gmail.com,3749291775.0,1176 Vanessa Inlet,Frankfurt,Berlin,36283.0,Germany,22.0,Female,Medium,New,8/29/2023,2023.0,August,20:08:35,,271.7470106,1086.988042,Electronics,Apple,Smartphone,Bad,Same-Day,Credit Card,Delivered,1.0,Xiaomi Mi,2023-08-29,2025-11-15 20:08:35,Missing values; 
8258013.0,48062.0,Scott Fitzgerald,Anna75@gmail.com,7162416914.0,5260 Wu Shores,Frankfurt,Berlin,62502.0,Germany,22.0,Male,Medium,New,3/26/2023,2023.0,March,16:41:43,,397.8204014,2784.74281,Clothing,Nike,Shoes,Bad,Same-Day,Cash,Delivered,1.0,Running shoes,2023-03-26,2025-11-15 16:41:43,Missing values; 
1281932.0,88098.0,Lauren Howard,Diana92@gmail.com,6704611301.0,579 Todd Tunnel Suite 254,Frankfurt,Berlin,96719.0,Germany,22.0,Male,Medium,Regular,04-04-23,2023.0,April,19:45:11,,496.5028239,496.5028239,Books,Penguin Books,Non-Fiction,Good,Express,Cash,Delivered,4.0,Memoir,2023-04-04,2025-11-15 19:45:11,Missing values; 
7688942.0,93533.0,Jacob Hawkins,Randy77@gmail.com,3355664740.0,21968 David Locks Suite 192,Frankfurt,Berlin,48884.0,Germany,22.0,Female,Medium,Regular,7/30/2023,2023.0,July,14:22:23,5.0,66.70141077,,Electronics,Sony,Television,Excellent,Express,Credit Card,Delivered,4.0,OLED TV,2023-07-30,2025-11-15 14:22:23,Missing values; 
5867072.0,17317.0,Stephen Young,Brittney71@gmail.com,8775341128.0,7866 Rosales Hills Suite 761,Frankfurt,Berlin,77336.0,Germany,22.0,Female,Medium,Regular,8/27/2023,2023.0,August,4:26:42,3.0,223.0626807,669.1880422,Home Decor,IKEA,Lighting,Excellent,Express,,Delivered,4.0,Floor lamps,2023-08-27,2025-11-15 04:26:42,Missing values; 
8878897.0,93967.0,Brendan Ballard,Joseph81@gmail.com,8099212915.0,8187 Jeffrey Path,Frankfurt,Berlin,61954.0,Germany,22.0,Male,Medium,Regular,1/26/2024,2024.0,,15:18:24,9.0,106.4338237,957.9044134,Home Decor,IKEA,Lighting,Average,Express,Credit Card,Delivered,2.0,Under cabinet lighting,2024-01-26,2025-11-15 15:18:24,Missing values; 
9371455.0,58606.0,Ashley Chen,Terri60@gmail.com,7971290518.0,540 Catherine Underpass,Frankfurt,Berlin,44890.0,Germany,22.0,Female,Medium,Regular,8/24/2023,2023.0,August,,10.0,154.2894605,1542.894605,Grocery,Coca-Cola,Water,Average,Same-Day,Credit Card,Delivered,2.0,Bottled water,2023-08-24,,Missing values; 
7528877.0,86295.0,,Morgan42@gmail.com,3570236201.0,455 Katelyn Park,Frankfurt,Berlin,25999.0,Germany,22.0,Female,Medium,Regular,9/16/2023,2023.0,September,13:23:41,7.0,261.066224,1827.463568,Clothing,Zara,Dress,Excellent,Express,PayPal,Delivered,5.0,Maxi dress,2023-09-16,2025-11-15 13:23:41,Missing values; 
3791165.0,25267.0,Dennis Oconnor,Vincent94@gmail.com,5986966704.0,52669 Kyle Spur Suite 174,Frankfurt,Berlin,35760.0,Germany,22.0,Female,Medium,Regular,5/14/2023,2023.0,,14:15:43,2.0,208.4325787,416.8651575,Books,Penguin Books,Non-Fiction,Bad,Standard,Debit Card,Delivered,1.0,Business,2023-05-14,2025-11-15 14:15:43,Missing values; 
5227598.0,58378.0,Robert Mendoza,Carrie15@gmail.com,1811506489.0,148 Michael Corner,Frankfurt,Berlin,2314.0,Germany,22.0,Male,Medium,Regular,5/26/2023,2023.0,May,12:58:32,6.0,143.909691,863.4581459,Home Decor,IKEA,Furniture,Excellent,Express,,Delivered,5.0,Coffee table,2023-05-26,2025-11-15 12:58:32,Missing values; 
8115352.0,39814.0,Kelly Harris,,7135190512.0,10028 Jordan Fork,Frankfurt,Berlin,55587.0,Germany,22.0,Female,Medium,Regular,10/22/2023,2023.0,October,13:45:50,8.0,328.4760206,2627.808165,Clothing,Adidas,Shoes,Good,Express,Debit Card,Delivered,3.0,Espadrilles,2023-10-22,2025-11-15 13:45:50,Missing values; 
2362950.0,,Cynthia Owen,Amy19@gmail.com,4756585427.0,541 Wade Village,Frankfurt,Berlin,78633.0,Germany,22.0,Male,Medium,Regular,12-03-23,2023.0,December,0:30:42,9.0,61.81821625,556.3639462,Electronics,Sony,Headphones,Excellent,Standard,Debit Card,Delivered,4.0,Bluetooth headphones,2023-12-03,2025-11-15 00:30:42,Missing values; 
1531509.0,90380.0,John Phillips,Corey34@gmail.com,,1658 Shannon Burg Suite 675,Frankfurt,Berlin,66972.0,Germany,22.0,Female,Medium,Regular,07-11-23,2023.0,July,8:16:14,1.0,70.55666134,70.55666134,Electronics,Samsung,Tablet,Excellent,Standard,Cash,Delivered,5.0,Microsoft Surface,2023-07-11,2025-11-15 08:16:14,Missing values; 
4054394.0,37101.0,Zachary Cunningham,George15@gmail.com,,5400 Sawyer Mountains Apt. 820,Frankfurt,Berlin,29672.0,Germany,22.0,Female,Medium,Regular,12-09-23,2023.0,December,14:47:11,9.0,11.80066504,106.2059854,Grocery,Coca-Cola,Water,Good,Express,Debit Card,Delivered,4.0,Spring water,2023-12-09,2025-11-15 14:47:11,Missing values; 
6785636.0,98894.0,Richard Garcia,Alexis11@gmail.com,1412120084.0,99006 Jerry Estates Apt. 642,Frankfurt,Berlin,17378.0,Germany,22.0,Male,Medium,Regular,03-05-23,2023.0,March,10:21:28,,171.6861988,686.7447953,Clothing,Zara,Dress,Excellent,Express,Credit Card,Delivered,5.0,Maxi dress,2023-03-05,2025-11-15 10:21:28,Missing values; 
6867000.0,25246.0,Lori Skinner,Steven92@gmail.com,,29388 Katie Crossroad,Frankfurt,Berlin,89736.0,Germany,22.0,Male,Medium,Regular,10/30/2023,2023.0,October,21:06:45,6.0,89.98456744,539.9074047,Books,HarperCollins,Fiction,Average,Express,Cash,Delivered,2.0,Mystery,2023-10-30,2025-11-15 21:06:45,Missing values; 
4816416.0,64785.0,Tyler Robinson,Tiffany61@gmail.com,7233817059.0,1701 Williams Run Suite 727,Frankfurt,Berlin,45677.0,Germany,22.0,Male,Medium,Regular,12-03-23,2023.0,December,6:18:42,,486.6422106,973.2844212,Home Decor,Home Depot,Furniture,Bad,Standard,Credit Card,Delivered,1.0,Sofa,2023-12-03,2025-11-15 06:18:42,Missing values; 
6831515.0,15055.0,,Tammy83@gmail.com,5656377232.0,83191 Quinn Well,Frankfurt,Berlin,66779.0,Germany,22.0,Male,Medium,Regular,07-04-23,2023.0,July,7:09:41,9.0,211.0035651,1899.032086,Books,Penguin Books,Non-Fiction,Excellent,Standard,Cash,Delivered,5.0,Health,2023-07-04,2025-11-15 07:09:41,Missing values; 
1584189.0,96054.0,Bethany Diaz,Joseph39@gmail.com,3819957478.0,55915 Keith Oval,Frankfurt,Berlin,67915.0,Germany,22.0,Female,Medium,Regular,11/19/2023,2023.0,,19:04:48,4.0,429.4408559,1717.763424,Books,Penguin Books,Non-Fiction,Good,Standard,Credit Card,Delivered,3.0,Memoir,2023-11-19,2025-11-15 19:04:48,Missing values; 
3588366.0,72312.0,Jenna Hammond,Jennifer80@gmail.com,3038461988.0,9950 Good Course,Frankfurt,Berlin,35681.0,Germany,22.0,Male,Medium,Regular,11-04-23,2023.0,November,11:14:00,4.0,250.7076842,1002.830737,Grocery,Nestle,Coffee,Good,Express,,Delivered,4.0,Macchiato,2023-11-04,2025-11-15 11:14:00,Missing values; 
5615977.0,23568.0,Crystal Martin,Elijah92@gmail.com,2360267115.0,2840 Fernandez Corners Suite 932,Frankfurt,Berlin,11793.0,Germany,22.0,Male,Medium,Regular,05-12-23,,May,11:14:51,5.0,247.6077727,1238.038863,Electronics,Sony,Television,Excellent,Express,Debit Card,Delivered,5.0,LED TV,2023-05-12,2025-11-15 11:14:51,Missing values; 
2502801.0,38773.0,Dr. Chloe Navarro DDS,Jeffrey93@gmail.com,7425406869.0,2597 Cooley Forge,Frankfurt,Berlin,39192.0,Germany,22.0,,Medium,Regular,3/14/2023,2023.0,March,16:04:21,3.0,304.7652615,914.2957845,Books,Penguin Books,Fiction,Good,Express,Cash,Delivered,3.0,Thriller,2023-03-14,2025-11-15 16:04:21,Missing values; 
8318824.0,66787.0,Zachary Rice,Chad10@gmail.com,8558691698.0,40221 Joshua Avenue,Frankfurt,Berlin,94177.0,Germany,22.0,Male,Medium,Regular,1/29/2024,,January,6:30:13,2.0,450.4780161,900.9560322,Electronics,Apple,Tablet,Average,Same-Day,Debit Card,Delivered,2.0,Amazon Fire Tablet,2024-01-29,2025-11-15 06:30:13,Missing values; 
5037344.0,,Mr. Richard Norton Jr.,Ryan18@gmail.com,2240298086.0,54648 Kevin Glen Apt. 587,Frankfurt,Berlin,71605.0,Germany,22.0,Female,Medium,Regular,06-03-23,2023.0,June,20:35:11,7.0,193.2718081,1352.902656,Grocery,Coca-Cola,Water,Excellent,Express,PayPal,Delivered,5.0,Sparkling water,2023-06-03,2025-11-15 20:35:11,Missing values; 
9539358.0,94255.0,Larry Kaufman,Carla58@gmail.com,8244530057.0,612 Katrina Turnpike,Frankfurt,Berlin,60950.0,Germany,22.0,Male,Medium,Regular,9/22/2023,2023.0,September,9:56:56,9.0,373.4299784,3360.869806,,IKEA,Lighting,Good,Same-Day,PayPal,Delivered,4.0,Track lighting,2023-09-22,2025-11-15 09:56:56,Missing values; 
5602098.0,38070.0,Michael Jackson,Kayla19@gmail.com,6550948268.0,372 Bell Key Apt. 719,Frankfurt,Berlin,84082.0,Germany,22.0,Male,Medium,Regular,7/27/2023,2023.0,July,9:27:07,9.0,205.9469446,1853.522501,Electronics,Samsung,Television,,Same-Day,PayPal,Delivered,,Curved TV,2023-07-27,2025-11-15 09:27:07,Missing values; 
1980099.0,49056.0,Holly Green,Lindsey69@gmail.com,5369886981.0,345 Delacruz Path Apt. 051,Frankfurt,Berlin,89833.0,Germany,22.0,Male,Medium,Regular,,2023.0,October,8:34:19,8.0,443.8736018,3550.988814,Clothing,Adidas,Shoes,Bad,Express,Debit Card,Delivered,1.0,Espadrilles,,2025-11-15 08:34:19,Missing values; 
2324158.0,90436.0,Heather Williams,,5913689783.0,4572 Snyder Mountains Apt. 045,Frankfurt,Berlin,50953.0,Germany,22.0,Female,Medium,Regular,10/21/2023,2023.0,October,4:10:01,8.0,338.099061,2704.792488,Home Decor,Bed Bath & Beyond,Kitchen,Excellent,Express,Debit Card,Delivered,4.0,Dishwasher,2023-10-21,2025-11-15 04:10:01,Missing values; 
1470270.0,94804.0,Sarah Shepherd,Stacy64@gmail.com,4841904279.0,5008 David Islands,Frankfurt,Berlin,14897.0,Germany,22.0,Male,Medium,Regular,7/18/2023,2023.0,July,6:04:51,7.0,336.0289324,2352.202527,Home Decor,Home Depot,Decorations,Good,,PayPal,Delivered,3.0,Decorative pillows,2023-07-18,2025-11-15 06:04:51,Missing values; 
9266715.0,79275.0,Douglas Rivera,James37@gmail.com,3158604554.0,1807 Taylor Track,Frankfurt,Berlin,87045.0,Germany,22.0,Female,Medium,Regular,07-11-23,2023.0,July,13:47:55,1.0,117.1631039,,Clothing,Zara,Shirt,Average,Same-Day,Debit Card,Delivered,2.0,Sweatshirt,2023-07-11,2025-11-15 13:47:55,Missing values; 
9763769.0,41462.0,Christian Miller,Desiree42@gmail.com,5089843328.0,659 Patterson Lake Apt. 998,Frankfurt,Berlin,,Germany,22.0,Female,Medium,Regular,06-12-23,2023.0,June,12:07:48,10.0,467.0578615,4670.578615,Books,Penguin Books,Non-Fiction,Good,Standard,Cash,Delivered,3.0,Self-help,2023-06-12,2025-11-15 12:07:48,Missing values; 
9906684.0,72351.0,George Douglas,Justin16@gmail.com,,58160 Mcknight Gateway Suite 643,Frankfurt,Berlin,15207.0,Germany,22.0,Female,Medium,Regular,09-11-23,2023.0,September,12:39:49,6.0,355.6329504,2133.797703,Home Decor,Bed Bath & Beyond,Bathroom,Average,Express,Cash,Delivered,2.0,Toilet paper holder,2023-09-11,2025-11-15 12:39:49,Missing values; 
6290414.0,47347.0,Michael Allen,Morgan36@gmail.com,8519122156.0,8723 Jeffrey Highway,Frankfurt,Berlin,58298.0,Germany,22.0,Male,Medium,Regular,12/16/2023,2023.0,December,6:30:30,6.0,274.2922623,1645.753574,Home Decor,Bed Bath & Beyond,Bathroom,Bad,Express,,Delivered,1.0,Toilet paper holder,2023-12-16,2025-11-15 06:30:30,Missing values; 
,43948.0,Erin Walker,Brandon32@gmail.com,4981534909.0,70798 Lori Cape,Frankfurt,Berlin,2014.0,Germany,22.0,Female,Medium,Regular,3/22/2023,2023.0,March,19:36:23,6.0,94.01508537,564.0905122,Books,HarperCollins,Thriller,Good,Express,Credit Card,Delivered,4.0,Detective,2023-03-22,2025-11-15 19:36:23,Missing values; 
,99528.0,Matthew Davis,Amy55@gmail.com,3092203559.0,911 Carrie Estate,Frankfurt,Berlin,72182.0,Germany,22.0,Female,Medium,Regular,09-10-23,2023.0,September,13:43:45,3.0,92.29459577,276.8837873,Books,Penguin Books,Fiction,Good,Same-Day,Cash,Delivered,4.0,Dystopian,2023-09-10,2025-11-15 13:43:45,Missing values; 
8120218.0,24878.0,Nicole Hill,Paul19@gmail.com,9000637417.0,0241 Anderson Plains,Frankfurt,Berlin,62965.0,Germany,22.0,Female,Medium,Regular,12-02-23,,December,15:38:56,8.0,85.5179765,684.143812,Home Decor,Home Depot,Tools,Average,Same-Day,Credit Card,Delivered,2.0,Hammer,2023-12-02,2025-11-15 15:38:56,Missing values; 
7151660.0,58932.0,Madeline Thomas,Garrett21@gmail.com,1337656715.0,119 Gutierrez Burg Apt. 626,Frankfurt,Berlin,58354.0,Germany,22.0,Female,Medium,Regular,06-03-23,2023.0,June,5:33:22,4.0,444.7813093,1779.125237,Books,Random House,Non-Fiction,Excellent,,Debit Card,Delivered,4.0,Cooking,2023-06-03,2025-11-15 05:33:22,Missing values; 
2356582.0,47224.0,Jessica Hutchinson,Timothy79@gmail.com,5902742443.0,86689 Potter Freeway Suite 891,Frankfurt,Berlin,34189.0,Germany,22.0,Male,Medium,Regular,09-09-23,2023.0,September,6:51:14,8.0,,1217.60267,Grocery,Coca-Cola,Water,Average,Standard,Credit Card,Delivered,2.0,Flavored water,2023-09-09,2025-11-15 06:51:14,Missing values; 
4921093.0,,Rebecca Meadows,Audrey12@gmail.com,1087962813.0,79625 Patrick Lakes Apt. 586,Frankfurt,Berlin,50395.0,Germany,22.0,Male,Medium,Regular,11/18/2023,2023.0,November,14:22:16,8.0,398.9306296,3191.445037,Grocery,Pepsi,Water,Bad,Same-Day,Debit Card,Delivered,1.0,Distilled water,2023-11-18,2025-11-15 14:22:16,Missing values; 
2461071.0,31382.0,Karen Hamilton MD,Christopher42@gmail.com,,061 Boyle Lane Suite 895,Frankfurt,Berlin,55948.0,Germany,22.0,Female,Medium,Regular,2/14/2024,2024.0,February,13:32:27,9.0,394.7452629,3552.707366,Home Decor,Home Depot,Decorations,Excellent,Same-Day,Cash,Delivered,5.0,Vases,2024-02-14,2025-11-15 13:32:27,Missing values; 
5879049.0,74696.0,Brooke Allen,Renee30@gmail.com,8334311907.0,865 Arnold Estates,Frankfurt,Berlin,47345.0,Germany,22.0,Female,Medium,Regular,8/14/2023,2023.0,August,10:05:11,8.0,290.8154695,2326.523756,,HarperCollins,Fiction,Excellent,Same-Day,Debit Card,Delivered,5.0,Dystopian,2023-08-14,2025-11-15 10:05:11,Missing values; 
1300359.0,12630.0,Charles Cross,Brittany81@gmail.com,5280526654.0,989 Rebecca Parks,Frankfurt,Berlin,46608.0,Germany,22.0,,Medium,Regular,04-02-23,2023.0,April,0:38:27,5.0,185.1032395,925.5161974,Electronics,Samsung,Tablet,Bad,Same-Day,Debit Card,Delivered,1.0,Amazon Fire Tablet,2023-04-02,2025-11-15 00:38:27,Missing values; 
2074781.0,58715.0,Suzanne Flowers,Kristin31@gmail.com,9754772582.0,1566 Stephanie Orchard,Frankfurt,Berlin,39593.0,Germany,22.0,Male,Medium,Regular,5/18/2023,2023.0,May,10:24:54,7.0,292.1141622,2044.799136,Clothing,Zara,Shirt,Bad,Standard,,Delivered,1.0,Henley shirt,2023-05-18,2025-11-15 10:24:54,Missing values; 
1868714.0,11205.0,Thomas Yates,Gina26@gmail.com,2313553656.0,77560 Adams Villages Suite 903,Frankfurt,Berlin,45233.0,Germany,22.0,Male,Medium,Regular,5/23/2023,2023.0,May,16:17:48,9.0,313.9904245,,Grocery,Nestle,Chocolate,Bad,,Debit Card,Delivered,1.0,Chocolate cookies,2023-05-23,2025-11-15 16:17:48,Missing values; 
1881603.0,24841.0,Victoria Buck,Mercedes61@gmail.com,5502102846.0,395 Miranda Ports,Frankfurt,Berlin,3992.0,Germany,22.0,Male,Medium,Regular,11-05-23,2023.0,,13:58:26,6.0,294.6027219,1767.616332,Home Decor,Home Depot,Decorations,Average,Same-Day,Cash,Delivered,2.0,Sculptures,2023-11-05,2025-11-15 13:58:26,Missing values; 
3436095.0,54629.0,Melissa Smith,Jack39@gmail.com,9014995444.0,29844 James Ridge,Frankfurt,Berlin,52507.0,Germany,22.0,Female,Medium,Regular,10-04-23,2023.0,October,22:44:38,5.0,,339.911118,Books,Random House,Literature,Bad,Same-Day,Cash,Delivered,1.0,Short stories,2023-10-04,2025-11-15 22:44:38,Missing values; 
4505928.0,13843.0,Jessica Wood,Natasha35@gmail.com,8505548972.0,7874 Anthony Plaza Apt. 981,Frankfurt,Berlin,30838.0,Germany,22.0,Female,Medium,Regular,10/24/2023,,October,11:20:56,7.0,492.0118103,3444.082672,Books,Penguin Books,Non-Fiction,Bad,Express,Credit Card,Delivered,1.0,Self-help,2023-10-24,2025-11-15 11:20:56,Missing values; 
6237047.0,27875.0,Derek Preston,Natalie78@gmail.com,2285048904.0,4072 Humphrey Park Suite 087,Frankfurt,Berlin,90487.0,Germany,22.0,Male,Medium,Regular,,2023.0,June,11:25:42,6.0,121.0784272,726.4705631,Electronics,Samsung,Tablet,Excellent,Standard,Cash,Delivered,4.0,Samsung Galaxy Tab,,2025-11-15 11:25:42,Missing values; 
2999318.0,26709.0,Robert Hanson,Johnny36@gmail.com,9745732442.0,01796 Shane Shore,Frankfurt,Berlin,85805.0,Germany,22.0,Male,Medium,Regular,12-03-23,2023.0,December,18:43:10,4.0,259.9450453,1039.780181,Electronics,Samsung,Smartphone,Bad,,PayPal,Delivered,1.0,Sony Xperia,2023-12-03,2025-11-15 18:43:10,Missing values; 
6801542.0,39071.0,Michael Hernandez,Lynn7@gmail.com,8308166406.0,23514 Combs Streets Suite 747,Frankfurt,Berlin,25256.0,Germany,22.0,Male,Medium,Regular,04-06-23,2023.0,April,1:02:33,4.0,19.6014042,,Home Decor,Home Depot,Tools,Good,Standard,Cash,Delivered,4.0,Caulking gun,2023-04-06,2025-11-15 01:02:33,Missing values; 
1587910.0,40630.0,Sarah Chavez,Jeremy3@gmail.com,4159707607.0,48828 Kelly Parkway Suite 564,Frankfurt,Berlin,18981.0,Germany,22.0,Female,Medium,Regular,11/14/2023,2023.0,November,17:35:12,,62.12982033,621.2982033,Grocery,Nestle,Coffee,Average,Same-Day,PayPal,Delivered,2.0,Ground coffee,2023-11-14,2025-11-15 17:35:12,Missing values; 
6424758.0,88664.0,Rachel Frazier,Rebecca94@gmail.com,8740676146.0,860 Jason Dam,Frankfurt,Berlin,19496.0,Germany,22.0,Female,Medium,Regular,11/27/2023,,November,10:01:59,1.0,130.5560091,130.5560091,Home Decor,Bed Bath & Beyond,Kitchen,Excellent,Same-Day,Credit Card,Delivered,4.0,Food processor,2023-11-27,2025-11-15 10:01:59,Missing values; 
6496423.0,44851.0,Amber Banks,Joanne97@gmail.com,9010355855.0,23941 Eric Summit,Frankfurt,Berlin,37900.0,Germany,22.0,Female,Medium,Regular,,2023.0,November,5:10:12,1.0,378.9795389,378.9795389,Home Decor,Home Depot,Furniture,Bad,Same-Day,Cash,Delivered,1.0,Bookshelf,,2025-11-15 05:10:12,Missing values; 
1210172.0,96970.0,Tina Smith,Jesse90@gmail.com,8215383262.0,58733 Joshua Rapid Suite 042,Frankfurt,Berlin,50433.0,Germany,22.0,Female,Medium,Regular,1/19/2024,2024.0,,14:12:40,3.0,33.05044006,99.15132018,Home Decor,IKEA,Furniture,Excellent,Express,PayPal,Delivered,4.0,Bookshelf,2024-01-19,2025-11-15 14:12:40,Missing values; 
1947556.0,58305.0,Karen Esparza,Robin49@gmail.com,2283293195.0,2861 Yolanda Lock,Frankfurt,Berlin,8117.0,Germany,22.0,Female,Medium,Regular,01-09-24,2024.0,,2:08:19,10.0,218.7623365,2187.623365,Books,Random House,Literature,Bad,Express,PayPal,Delivered,1.0,Literary fiction,2024-01-09,2025-11-15 02:08:19,Missing values; 
3189538.0,75587.0,Peter Perry,Brenda66@gmail.com,7984714540.0,5670 Steele Plain Apt. 717,Frankfurt,Berlin,28997.0,Germany,22.0,Male,Medium,Regular,2/18/2024,2024.0,February,13:55:33,7.0,280.1383626,1960.968538,,HarperCollins,Thriller,Good,Same-Day,PayPal,Delivered,4.0,Action,2024-02-18,2025-11-15 13:55:33,Missing values; 
6873595.0,16771.0,Timothy Simmons,,8661268832.0,20690 Ricky Rapids,Frankfurt,Berlin,69316.0,Germany,22.0,Male,Medium,Regular,5/29/2023,2023.0,May,18:00:39,3.0,59.99842632,179.995279,Home Decor,Home Depot,Decorations,Average,Same-Day,Cash,Delivered,2.0,Picture frames,2023-05-29,2025-11-15 18:00:39,Missing values; 
5046272.0,39825.0,Kelsey Butler,Richard66@gmail.com,3268128368.0,27614 Mcintyre Mills Suite 257,Frankfurt,Berlin,,Germany,22.0,Male,Medium,Regular,11-09-23,2023.0,November,0:11:30,3.0,326.5349674,979.6049022,Books,Penguin Books,Non-Fiction,Good,Same-Day,Debit Card,Delivered,4.0,Travel,2023-11-09,2025-11-15 00:11:30,Missing values; 
5786359.0,56741.0,Jill Gibbs,John94@gmail.com,8243375027.0,8464 Max Stravenue Suite 896,Frankfurt,Berlin,92613.0,Germany,22.0,Female,Medium,Regular,3/27/2023,2023.0,March,18:05:48,8.0,372.7798151,2982.238521,,Nike,Shorts,Good,Express,Credit Card,Delivered,4.0,Denim shorts,2023-03-27,2025-11-15 18:05:48,Missing values; 
1485629.0,32188.0,John Silva,Jill23@gmail.com,9716519768.0,765 Marshall Parkways,Frankfurt,Berlin,18723.0,Germany,22.0,Male,Medium,Regular,7/16/2023,2023.0,July,4:36:24,3.0,31.96705855,95.90117566,Home Decor,IKEA,Lighting,Good,,Debit Card,Delivered,3.0,Floor lamps,2023-07-16,2025-11-15 04:36:24,Missing values; 
1296433.0,46353.0,Marvin Francis,Michael29@gmail.com,5939437332.0,838 Lee Track Suite 553,Frankfurt,Berlin,19482.0,Germany,22.0,Male,Medium,Regular,3/23/2023,2023.0,March,,9.0,162.1370865,1459.233779,Home Decor,IKEA,Decorations,Bad,Same-Day,PayPal,Delivered,1.0,Candles,2023-03-23,,Missing values; 
2948093.0,28641.0,Chelsea Cameron,,8026495388.0,1092 John Circle,Frankfurt,Berlin,79831.0,Germany,22.0,Male,Medium,Regular,8/14/2023,2023.0,August,1:05:19,7.0,42.41628129,296.9139691,Home Decor,Home Depot,Tools,Good,Same-Day,PayPal,Delivered,4.0,Drill,2023-08-14,2025-11-15 01:05:19,Missing values; 
2121761.0,48761.0,,Jason14@gmail.com,6962960897.0,072 Ryan Hills Apt. 609,Frankfurt,Berlin,5124.0,Germany,22.0,Female,Medium,Regular,03-12-23,2023.0,March,13:19:58,9.0,399.5052284,3595.547056,Books,Random House,Fiction,Bad,Same-Day,Debit Card,Delivered,1.0,Thriller,2023-03-12,2025-11-15 13:19:58,Missing values; 
9898553.0,11944.0,Dr. Elizabeth Thomas,Crystal15@gmail.com,2352604909.0,8807 Miranda Parkways,Frankfurt,Berlin,92930.0,Germany,22.0,Male,Medium,Regular,,2023.0,October,5:12:39,10.0,129.966783,1299.66783,Grocery,Nestle,Snacks,Bad,Standard,PayPal,Delivered,1.0,Nuts,,2025-11-15 05:12:39,Missing values; 
9898899.0,97294.0,Tara Wilkins,Donna23@gmail.com,2524908720.0,3905 White Locks,Frankfurt,Berlin,52581.0,Germany,22.0,,Medium,Regular,10/21/2023,2023.0,October,0:58:14,2.0,137.5655743,275.1311486,Home Decor,IKEA,Furniture,Average,Express,Credit Card,Delivered,2.0,Dining table,2023-10-21,2025-11-15 00:58:14,Missing values; 
4402434.0,83898.0,Sandra Fernandez,David10@gmail.com,5459279498.0,354 Horn Mall Suite 926,Frankfurt,Berlin,45812.0,Germany,22.0,Female,Medium,Regular,3/17/2023,2023.0,March,15:43:34,2.0,100.4704778,200.9409556,Books,Penguin Books,Non-Fiction,Good,,Credit Card,Delivered,3.0,Health,2023-03-17,2025-11-15 15:43:34,Missing values; 
8909858.0,52601.0,Amanda Barnes,Paul67@gmail.com,7797277545.0,449 Stevenson Station Suite 110,Frankfurt,Berlin,56568.0,Germany,22.0,Male,Medium,Regular,,2023.0,December,3:24:09,1.0,281.82601,281.82601,Grocery,Pepsi,Water,Average,Standard,PayPal,Delivered,2.0,Coconut water,,2025-11-15 03:24:09,Missing values; 
3674520.0,21765.0,David Goodwin,Phillip56@gmail.com,4312485519.0,3873 Williams Circle Apt. 875,Frankfurt,Berlin,99386.0,Germany,22.0,,Medium,Regular,2/25/2024,2024.0,February,11:51:45,2.0,439.6722116,879.3444233,Home Decor,Bed Bath & Beyond,Bedding,Bad,Express,PayPal,Delivered,1.0,Throw pillow,2024-02-25,2025-11-15 11:51:45,Missing values; 
7457994.0,98932.0,Tiffany Roberts,Darin47@gmail.com,6580468197.0,6001 Williams Point Apt. 697,Frankfurt,Berlin,89734.0,Germany,22.0,Male,Medium,Regular,08-04-23,,August,19:47:26,2.0,492.970286,985.9405721,Home Decor,Home Depot,Tools,Good,Standard,Debit Card,Delivered,3.0,Utility knife,2023-08-04,2025-11-15 19:47:26,Missing values; 
1395234.0,79025.0,Sophia Lara,Derek80@gmail.com,4321409279.0,12740 Nicholas Port Apt. 774,Frankfurt,Berlin,34762.0,Germany,22.0,Female,Medium,Regular,04-11-23,2023.0,April,8:25:16,5.0,242.3783691,1211.891846,Electronics,Sony,Television,Average,Standard,,Delivered,2.0,4K TV,2023-04-11,2025-11-15 08:25:16,Missing values; 
1060187.0,55609.0,David Doyle,Stephanie97@gmail.com,,7773 David Drive,Frankfurt,Berlin,69320.0,Germany,22.0,Male,Medium,Regular,3/23/2023,2023.0,March,5:38:43,5.0,205.6113935,1028.056968,Books,Penguin Books,Non-Fiction,Good,Standard,PayPal,Delivered,4.0,Self-help,2023-03-23,2025-11-15 05:38:43,Missing values; 
5130529.0,94009.0,Amber Forbes,Damon68@gmail.com,8487707305.0,1045 Luis Lakes Apt. 006,Frankfurt,Berlin,48237.0,Germany,22.0,Male,Medium,Regular,,2023.0,April,6:14:42,10.0,428.0288243,4280.288243,Electronics,Sony,Smartphone,Excellent,Standard,Debit Card,Delivered,5.0,Motorola Moto,,2025-11-15 06:14:42,Missing values; 
7789964.0,18725.0,Gina Gray,Jerome76@gmail.com,4919977588.0,,Frankfurt,Berlin,6305.0,Germany,22.0,Male,Medium,Regular,11-07-23,2023.0,November,2:10:02,6.0,313.8428842,1883.057305,Clothing,Zara,Dress,Good,Same-Day,Debit Card,Delivered,4.0,Wrap dress,2023-11-07,2025-11-15 02:10:02,Missing values; 
7404646.0,31464.0,Regina Charles,Sarah69@gmail.com,6854214621.0,61917 Contreras Throughway Suite 229,Frankfurt,Berlin,52773.0,Germany,22.0,Male,Medium,Regular,11/23/2023,2023.0,November,,8.0,325.2797972,2602.238377,Grocery,Nestle,Coffee,Average,Standard,Debit Card,Delivered,2.0,Macchiato,2023-11-23,,Missing values; 
9945492.0,36252.0,Matthew Young,Kevin92@gmail.com,6937157843.0,789 Duran Lodge,Frankfurt,Berlin,4808.0,Germany,22.0,Male,Medium,Regular,9/20/2023,2023.0,September,2:47:44,1.0,273.1659708,273.1659708,Grocery,Pepsi,Juice,,Same-Day,Debit Card,Delivered,,Pineapple juice,2023-09-20,2025-11-15 02:47:44,Missing values; 
9772668.0,56818.0,Christy Russo,Sherri47@gmail.com,4944152635.0,7061 Hood Tunnel Suite 998,Frankfurt,Berlin,72497.0,Germany,22.0,Male,Medium,Regular,9/17/2023,2023.0,September,18:28:20,1.0,276.0579148,,Clothing,Zara,Jeans,Average,Standard,Debit Card,Delivered,2.0,Straight-leg jeans,2023-09-17,2025-11-15 18:28:20,Missing values; 
9361610.0,48194.0,Vickie Lutz,Mary44@gmail.com,5964770170.0,0102 Mcbride Gateway,Frankfurt,Berlin,38069.0,Germany,22.0,Female,Medium,Regular,03-01-23,2023.0,March,,3.0,206.6706786,620.0120358,Home Decor,IKEA,Furniture,Good,Express,PayPal,Delivered,3.0,Bookshelf,2023-03-01,,Missing values; 
1339027.0,91548.0,Brandon Davis,Martin15@gmail.com,1671973339.0,327 Chambers Inlet Suite 039,Frankfurt,Berlin,,Germany,22.0,Male,Medium,Regular,6/13/2023,2023.0,June,5:24:03,9.0,265.521806,2389.696254,Electronics,Samsung,Smartphone,Excellent,Same-Day,PayPal,Delivered,4.0,Motorola Moto,2023-06-13,2025-11-15 05:24:03,Missing values; 
9424538.0,31457.0,Dean Johnson,Lori8@gmail.com,6340747330.0,5177 Franco Meadow,Frankfurt,Berlin,92042.0,Germany,22.0,Male,Medium,Regular,9/28/2023,2023.0,September,10:06:02,,180.1092536,1260.764775,Clothing,Adidas,T-shirt,Bad,Standard,PayPal,Delivered,1.0,Long-sleeve tee,2023-09-28,2025-11-15 10:06:02,Missing values; 
9496214.0,95317.0,Gilbert Hernandez,Cassandra98@gmail.com,7757557210.0,515 Mueller Valley Suite 259,Frankfurt,Berlin,31212.0,Germany,22.0,Male,Medium,Regular,11/20/2023,2023.0,November,6:29:50,1.0,,118.4456333,Electronics,Samsung,Tablet,Good,Express,Debit Card,Delivered,3.0,Lenovo Tab,2023-11-20,2025-11-15 06:29:50,Missing values; 
8129674.0,57629.0,Veronica Horton,Amy36@gmail.com,1025323674.0,261 Stephanie Viaduct,Frankfurt,Berlin,26272.0,Germany,22.0,,Medium,Regular,2/25/2024,2024.0,February,20:03:48,5.0,205.818458,1029.09229,Books,Penguin Books,Fiction,Excellent,Standard,Cash,Delivered,4.0,Literary fiction,2024-02-25,2025-11-15 20:03:48,Missing values; 
3844383.0,79334.0,Lisa Williams,,2542417491.0,009 Wade Viaduct,Frankfurt,Berlin,3634.0,Germany,22.0,Male,Medium,Regular,10-04-23,2023.0,October,12:56:45,10.0,26.84812222,268.4812222,Electronics,Apple,Smartphone,Average,Standard,PayPal,Delivered,2.0,LG G,2023-10-04,2025-11-15 12:56:45,Missing values; 
,48898.0,Diana Ramsey,Barbara59@gmail.com,5894237068.0,77413 Crawford Street Apt. 448,Frankfurt,Berlin,1320.0,Germany,22.0,Male,Medium,Regular,7/27/2023,2023.0,July,19:32:41,3.0,115.8617993,347.585398,Books,HarperCollins,Thriller,Excellent,Express,Cash,Delivered,5.0,Detective,2023-07-27,2025-11-15 19:32:41,Missing values; 
6553567.0,91316.0,Brian Clay,Heather61@gmail.com,8083965684.0,01477 Rebecca Crescent,Frankfurt,Berlin,60858.0,Germany,22.0,Male,Medium,Regular,12/19/2023,,December,22:42:32,10.0,257.815983,2578.15983,Electronics,Sony,Smartphone,Excellent,Express,Debit Card,Delivered,5.0,Huawei P,2023-12-19,2025-11-15 22:42:32,Missing values; 
7169276.0,33185.0,James Ramirez,Mark66@gmail.com,1952097731.0,512 Jackson Circle Apt. 758,Frankfurt,Berlin,87054.0,Germany,22.0,Male,Medium,Regular,04-09-23,2023.0,April,3:34:21,10.0,369.2121408,,Books,HarperCollins,Thriller,Good,Same-Day,PayPal,Delivered,3.0,Psychological thriller,2023-04-09,2025-11-15 03:34:21,Missing values; 
,52741.0,Victoria Miller,Jared7@gmail.com,7991876529.0,91869 Melvin Springs,Frankfurt,Berlin,83300.0,Germany,22.0,Male,Medium,Regular,5/27/2023,2023.0,May,12:42:03,10.0,72.00988707,720.0988707,Home Decor,Home Depot,Furniture,Average,Same-Day,Credit Card,Delivered,2.0,Coffee table,2023-05-27,2025-11-15 12:42:03,Missing values; 
8566621.0,64496.0,Sean Waller,Olivia20@gmail.com,7813035655.0,8719 Estes Mountains,Frankfurt,Berlin,45493.0,Germany,22.0,Male,Medium,Regular,05-12-23,2023.0,May,0:50:19,1.0,167.4015728,167.4015728,Books,Penguin Books,Children's,,Standard,PayPal,Delivered,,Clothing,2023-05-12,2025-11-15 00:50:19,Missing values; 
9014843.0,97359.0,Randy Chandler,Joel8@gmail.com,6676919203.0,5070 Selena Pass,Frankfurt,Berlin,14318.0,Germany,22.0,Male,Medium,Regular,,2023.0,May,11:38:14,2.0,236.1504803,472.3009606,Clothing,Nike,Shoes,Good,Express,Credit Card,Delivered,4.0,Flip flops,,2025-11-15 11:38:14,Missing values; 
9901948.0,68175.0,John Scott,Linda49@gmail.com,5943383611.0,8076 Park Turnpike Apt. 452,Frankfurt,Berlin,31794.0,Germany,22.0,Female,Medium,Regular,03-03-23,2023.0,March,5:38:33,10.0,267.7674265,2677.674265,,Nestle,Chocolate,Bad,Standard,PayPal,Delivered,1.0,Chocolate fondue,2023-03-03,2025-11-15 05:38:33,Missing values; 
3663906.0,84412.0,Richard Parsons,Joshua1@gmail.com,9929040178.0,,Frankfurt,Berlin,38429.0,Germany,22.0,Male,Medium,Regular,02-10-24,2024.0,February,16:18:06,5.0,226.6009999,1133.004999,Books,Penguin Books,Non-Fiction,Bad,Standard,Cash,Delivered,1.0,Self-help,2024-02-10,2025-11-15 16:18:06,Missing values; 
5213606.0,28365.0,Amanda Baker,Jacqueline68@gmail.com,6834162997.0,5746 Torres Parkways Suite 656,Frankfurt,Berlin,26395.0,Germany,22.0,Male,Medium,Regular,5/26/2023,2023.0,May,23:12:22,9.0,361.7530864,3255.777777,Clothing,Adidas,Shoes,Excellent,,Debit Card,Delivered,5.0,Loafers,2023-05-26,2025-11-15 23:12:22,Missing values; 
,29618.0,Gabrielle Curtis,Allen90@gmail.com,4081125121.0,962 Lindsey Manor,Frankfurt,Berlin,92911.0,Germany,22.0,Male,Medium,Regular,10-09-23,2023.0,October,9:18:58,4.0,469.2803935,1877.121574,Home Decor,Bed Bath & Beyond,Bathroom,Good,Express,Credit Card,Delivered,3.0,Toilet,2023-10-09,2025-11-15 09:18:58,Missing values; 
2519827.0,50038.0,Cindy Butler,,1787868796.0,64533 Mathews Harbors,Frankfurt,Berlin,70797.0,Germany,22.0,Male,Medium,Regular,09-06-23,2023.0,September,15:48:24,8.0,492.0906726,3936.725381,Electronics,Sony,Television,Good,Same-Day,Credit Card,Delivered,4.0,Android TV,2023-09-06,2025-11-15 15:48:24,Missing values; 
8015906.0,97002.0,Dorothy Morris,Shannon57@gmail.com,9081184362.0,560 Bradley Fort,Frankfurt,Berlin,37978.0,Germany,22.0,Male,Medium,Regular,11/14/2023,2023.0,November,9:11:35,5.0,146.0391474,730.195737,Home Decor,Bed Bath & Beyond,Bathroom,Average,Same-Day,,Delivered,2.0,Sink,2023-11-14,2025-11-15 09:11:35,Missing values; 
4800302.0,83230.0,Thomas Schultz,Margaret79@gmail.com,8829640130.0,45404 Thomas Landing,Frankfurt,Berlin,95460.0,Germany,22.0,,Medium,Regular,10/18/2023,2023.0,October,7:00:25,5.0,15.85128901,79.25644506,Grocery,Pepsi,Water,Excellent,Same-Day,PayPal,Delivered,5.0,Mineral water,2023-10-18,2025-11-15 07:00:25,Missing values; 
3201883.0,86529.0,Karen Collins,Christina31@gmail.com,7740109635.0,,Frankfurt,Berlin,47231.0,Germany,22.0,Male,Medium,Regular,3/23/2023,2023.0,March,22:45:42,5.0,389.732307,1948.661535,Electronics,Sony,Smartphone,Bad,Express,Debit Card,Delivered,1.0,LG G,2023-03-23,2025-11-15 22:45:42,Missing values; 
4193210.0,42299.0,Sara Zimmerman,,4488367559.0,41252 Haley Crossroad,Frankfurt,Berlin,75965.0,Germany,22.0,Male,Medium,Regular,12-08-23,2023.0,December,0:42:37,4.0,302.3806204,1209.522482,Grocery,Coca-Cola,Soft Drink,Average,Express,Debit Card,Delivered,2.0,Cream soda,2023-12-08,2025-11-15 00:42:37,Missing values; 
9589500.0,24052.0,Eric Sanchez,Chris40@gmail.com,1202421774.0,709 Anderson Hollow,Frankfurt,Berlin,68340.0,Germany,22.0,Male,Medium,Regular,04-04-23,2023.0,April,21:16:27,4.0,269.3705394,1077.482157,Home Decor,Home Depot,Furniture,,Same-Day,Credit Card,Delivered,,TV stand,2023-04-04,2025-11-15 21:16:27,Missing values; 
4785444.0,88962.0,Teresa Carr,Kathleen33@gmail.com,8414831694.0,,Frankfurt,Berlin,74632.0,Germany,22.0,Male,Medium,Regular,06-02-23,2023.0,June,16:45:06,5.0,156.0813376,780.406688,Home Decor,Bed Bath & Beyond,Bathroom,Excellent,Express,PayPal,Delivered,5.0,Towel rack,2023-06-02,2025-11-15 16:45:06,Missing values; 
2745910.0,66836.0,Michael Cooke,Daniel63@gmail.com,9040886802.0,637 Harper Harbors Apt. 528,Frankfurt,Berlin,22325.0,Germany,22.0,Male,Medium,Regular,10/17/2023,2023.0,October,8:58:47,3.0,,934.0741082,Clothing,Nike,T-shirt,Bad,Standard,Cash,Delivered,1.0,Henley tee,2023-10-17,2025-11-15 08:58:47,Missing values; 
1711754.0,55726.0,Cindy Hawkins,Daniel6@gmail.com,4959410838.0,89462 Susan Pines,Frankfurt,Berlin,80566.0,Germany,22.0,Male,Medium,Regular,4/15/2023,2023.0,April,20:14:00,9.0,60.53033191,544.7729872,Electronics,Apple,Laptop,Good,,Debit Card,Delivered,4.0,Dell XPS,2023-04-15,2025-11-15 20:14:00,Missing values; 
4046716.0,56171.0,Carol Alexander,Christopher43@gmail.com,3835483103.0,0643 Lee Divide,Frankfurt,Berlin,56211.0,Germany,22.0,Male,Medium,Regular,5/28/2023,,May,16:35:51,8.0,343.8337268,2750.669815,Clothing,Adidas,Jacket,Bad,Standard,Credit Card,Delivered,1.0,Varsity jacket,2023-05-28,2025-11-15 16:35:51,Missing values; 
6884126.0,75642.0,Brittany Wise,Jennifer26@gmail.com,8711543216.0,18131 Mcintosh Center,Frankfurt,Berlin,16408.0,Germany,22.0,Female,Medium,Regular,02-11-24,2024.0,February,16:21:09,9.0,379.7063578,3417.35722,Home Decor,Home Depot,Tools,,Express,Cash,Delivered,,Level,2024-02-11,2025-11-15 16:21:09,Missing values; 
8778077.0,58616.0,Sara James,Carrie60@gmail.com,3769931667.0,818 Brenda Ways,Frankfurt,Berlin,65051.0,Germany,22.0,Male,Medium,Regular,1/24/2024,2024.0,January,2:05:10,1.0,436.8732362,,Grocery,Coca-Cola,Water,Bad,Express,Credit Card,Delivered,1.0,Distilled water,2024-01-24,2025-11-15 02:05:10,Missing values; 
1150835.0,83392.0,Chelsea Lamb,Ana52@gmail.com,,217 Johnson Bypass,Frankfurt,Berlin,82312.0,Germany,22.0,Male,Medium,Regular,1/26/2024,2024.0,January,4:43:03,4.0,250.0166966,1000.066786,Grocery,Nestle,Snacks,Good,Standard,Credit Card,Delivered,3.0,Fruit snacks,2024-01-26,2025-11-15 04:43:03,Missing values; 
9520430.0,59521.0,Jennifer Lucas,Virginia77@gmail.com,8880254870.0,513 Brian Springs Apt. 453,Frankfurt,Berlin,72020.0,Germany,22.0,Male,Medium,Regular,05-03-23,2023.0,May,7:44:01,,253.359341,2026.874728,Grocery,Nestle,Coffee,Average,Standard,Cash,Delivered,2.0,Coffee beans,2023-05-03,2025-11-15 07:44:01,Missing values; 
5291162.0,40065.0,Michael Moore,Rebecca51@gmail.com,8734336775.0,46325 Sawyer Turnpike Suite 829,Frankfurt,Berlin,36242.0,Germany,22.0,Male,Medium,Regular,,2023.0,August,18:28:37,10.0,362.5607277,3625.607277,Clothing,Zara,Shirt,Good,Express,Cash,Delivered,4.0,Flannel shirt,,2025-11-15 18:28:37,Missing values; 
4056833.0,74652.0,Valerie Smith,Michelle90@gmail.com,7487539320.0,209 James Neck,Frankfurt,Berlin,43789.0,Germany,22.0,Female,Medium,Regular,07-01-23,2023.0,July,,1.0,320.7500125,320.7500125,Books,Penguin Books,Fiction,Average,Standard,Debit Card,Delivered,2.0,Horror,2023-07-01,,Missing values; 
8256497.0,50418.0,Teresa Coleman,Jeffrey66@gmail.com,7151298895.0,832 Harrison Mountain Apt. 744,Frankfurt,Berlin,65143.0,Germany,22.0,Female,Medium,Regular,,2024.0,January,17:41:42,6.0,403.0035219,2418.021131,Grocery,Nestle,Coffee,Average,Same-Day,Debit Card,Delivered,2.0,Espresso,,2025-11-15 17:41:42,Missing values; 
5157904.0,33279.0,Judy Monroe,Nancy20@gmail.com,1905910314.0,487 Brandon Land,Frankfurt,Berlin,73896.0,Germany,22.0,Female,Medium,Regular,11-03-23,2023.0,November,8:43:23,10.0,439.8537713,4398.537713,Home Decor,IKEA,Decorations,,Express,Credit Card,Delivered,,Picture frames,2023-11-03,2025-11-15 08:43:23,Missing values; 
3150087.0,29969.0,Stephen White,Ryan50@gmail.com,8893954854.0,373 Anthony Burg Suite 014,Frankfurt,Berlin,35751.0,Germany,22.0,Male,Medium,Regular,,2023.0,October,4:19:28,2.0,95.91198644,191.8239729,Electronics,Apple,Smartphone,Excellent,Standard,Debit Card,Delivered,5.0,iPhone,,2025-11-15 04:19:28,Missing values; 
6951316.0,73788.0,,David62@gmail.com,3315266694.0,46186 Morris Lake,Frankfurt,Berlin,38860.0,Germany,22.0,Male,Medium,Regular,08-09-23,2023.0,August,15:16:40,2.0,182.7090894,365.4181788,Books,,Literature,Bad,Same-Day,PayPal,Delivered,1.0,Short stories,2023-08-09,2025-11-15 15:16:40,Missing values; 
8175721.0,99838.0,Stephen Garcia,Zachary58@gmail.com,9453062719.0,069 Foster Mills Suite 352,Frankfurt,Berlin,31707.0,Germany,22.0,Male,Medium,Regular,7/13/2023,2023.0,July,13:17:59,5.0,38.96758441,194.8379221,Electronics,,Television,Average,Standard,Cash,Delivered,2.0,Plasma TV,2023-07-13,2025-11-15 13:17:59,Missing values; 
4763067.0,56281.0,Richard Smith,Troy55@gmail.com,3292302347.0,0630 Jones Land Apt. 640,Frankfurt,Berlin,15104.0,Germany,22.0,Female,Medium,Regular,5/27/2023,2023.0,May,2:06:30,3.0,237.9913936,713.9741809,Electronics,,Tablet,Good,Express,Cash,Delivered,4.0,iPad,2023-05-27,2025-11-15 02:06:30,Missing values; 
2993747.0,54341.0,Melissa Webb,Patrick10@gmail.com,9270213483.0,9457 Tiffany Ranch Apt. 074,Frankfurt,Berlin,36363.0,Germany,22.0,Female,Medium,Regular,06-11-23,2023.0,June,21:29:38,8.0,384.2344858,3073.875887,Home Decor,Home Depot,Furniture,Average,,PayPal,Delivered,2.0,Dresser,2023-06-11,2025-11-15 21:29:38,Missing values; 
9806602.0,37867.0,Patrick Pearson,Cristina22@gmail.com,,0451 Wayne Falls,Frankfurt,Berlin,29189.0,Germany,45.0,Female,Medium,Regular,4/22/2023,2023.0,April,1:27:06,5.0,254.3186549,1271.593275,Grocery,Nestle,Coffee,Excellent,Express,PayPal,Delivered,4.0,Affogato,2023-04-22,2025-11-15 01:27:06,Missing values; 
1736705.0,80369.0,Michael Oneal,,9461268404.0,57045 Morgan Key,Frankfurt,Berlin,5618.0,Germany,58.0,Male,Medium,Regular,12/24/2023,2023.0,December,20:20:31,4.0,408.414873,1633.659492,Grocery,Nestle,Coffee,Average,Express,PayPal,Delivered,2.0,Espresso,2023-12-24,2025-11-15 20:20:31,Missing values; 
8574990.0,82052.0,Clayton Suarez,James100@gmail.com,7883509012.0,7720 Bass Terrace,Frankfurt,Berlin,82358.0,Germany,42.0,Male,Medium,Regular,09-04-23,2023.0,September,19:44:20,,372.4830886,372.4830886,Clothing,Nike,T-shirt,Excellent,Standard,PayPal,Delivered,4.0,Long-sleeve tee,2023-09-04,2025-11-15 19:44:20,Missing values; 
3979432.0,19814.0,Andrew Ryan,Belinda45@gmail.com,3175080798.0,978 Guerrero Prairie,Frankfurt,Berlin,,Germany,64.0,Female,Medium,Regular,12/22/2023,2023.0,December,11:23:15,4.0,35.05416045,140.2166418,Electronics,Samsung,Tablet,Good,Same-Day,Debit Card,Delivered,3.0,Samsung Galaxy Tab,2023-12-22,2025-11-15 11:23:15,Missing values; 
3069421.0,18241.0,Tracy Parker,Brian83@gmail.com,6138240945.0,91837 Berger Rue Apt. 086,Frankfurt,Berlin,1275.0,Germany,31.0,Male,Medium,Regular,09-04-23,2023.0,September,,2.0,285.1615291,570.3230583,Electronics,Sony,Headphones,Bad,Express,Debit Card,Delivered,1.0,Sports headphones,2023-09-04,,Missing values; 
6103398.0,95021.0,Patricia Nichols,Amy52@gmail.com,2533734995.0,736 Turner Lake Apt. 509,Frankfurt,Berlin,1999.0,Germany,65.0,Male,Medium,Regular,5/19/2023,2023.0,May,1:19:29,8.0,87.05626471,696.4501177,Books,,Non-Fiction,Good,Express,Cash,Delivered,4.0,Science,2023-05-19,2025-11-15 01:19:29,Missing values; 
3582894.0,81598.0,Brandon Howard,John89@gmail.com,7947661825.0,4700 Michelle Points Apt. 039,Frankfurt,Berlin,29355.0,Germany,51.0,Male,Medium,Regular,11/19/2023,2023.0,November,13:48:15,8.0,27.1547466,217.2379728,Electronics,Sony,Headphones,Good,,Credit Card,Delivered,4.0,Noise-cancelling headphones,2023-11-19,2025-11-15 13:48:15,Missing values; 
7208681.0,52786.0,James Castillo,Stacy41@gmail.com,,18608 Meyers Meadow,Frankfurt,Berlin,82963.0,Germany,38.0,Female,Medium,Regular,4/19/2023,2023.0,April,23:53:11,2.0,336.04276,672.08552,Home Decor,Bed Bath & Beyond,Bathroom,Average,Standard,Cash,Delivered,2.0,Mirror,2023-04-19,2025-11-15 23:53:11,Missing values; 
2702973.0,66283.0,Darlene White,Jerry43@gmail.com,2531211344.0,2322 Thomas Point,Frankfurt,Berlin,72818.0,Germany,22.0,Male,Medium,Regular,11/20/2023,2023.0,November,13:56:35,9.0,352.6031792,3173.428613,Books,HarperCollins,Fiction,,Standard,PayPal,Delivered,,Science fiction,2023-11-20,2025-11-15 13:56:35,Missing values; 
1237118.0,72210.0,Travis Irwin,Anthony30@gmail.com,4986062414.0,88862 Ryan Forge,Frankfurt,Berlin,49660.0,Germany,22.0,Male,Medium,Regular,4/18/2023,,April,2:55:03,6.0,412.466387,2474.798322,Electronics,Apple,Tablet,Bad,Standard,Debit Card,Delivered,1.0,Acer Iconia Tab,2023-04-18,2025-11-15 02:55:03,Missing values; 
6894327.0,13161.0,Douglas Perez,Jorge50@gmail.com,3183454616.0,664 Neal Grove,Frankfurt,Berlin,4290.0,Germany,22.0,Male,Medium,Regular,12-10-23,2023.0,December,17:54:10,8.0,138.7850299,1110.280239,,Coca-Cola,Juice,Bad,Express,Cash,Delivered,1.0,Mango juice,2023-12-10,2025-11-15 17:54:10,Missing values; 
4018164.0,,Timothy Taylor,Sandra57@gmail.com,1887683224.0,249 Roth Trace Apt. 237,Frankfurt,Berlin,46711.0,Germany,22.0,Female,Medium,Regular,12/19/2023,2023.0,December,23:01:41,4.0,140.699888,562.7995522,Electronics,Sony,Television,Good,Express,PayPal,Delivered,3.0,HDR TV,2023-12-19,2025-11-15 23:01:41,Missing values; 
4578703.0,,Todd Hernandez,Michael53@gmail.com,5381667499.0,4180 Lewis Point Apt. 013,Frankfurt,Berlin,77752.0,Germany,22.0,Male,Medium,Regular,10/30/2023,2023.0,October,17:53:25,9.0,296.4056263,2667.650636,Clothing,Adidas,Jacket,Good,Standard,Cash,Delivered,3.0,Denim jacket,2023-10-30,2025-11-15 17:53:25,Missing values; 
2650964.0,50132.0,Brian Miller,David80@gmail.com,5511189430.0,95113 Jacobs Ferry Suite 527,Frankfurt,Berlin,50574.0,Germany,22.0,Male,Medium,Regular,2/13/2024,2024.0,February,,5.0,273.6028967,1368.014484,Home Decor,Home Depot,Tools,Good,Same-Day,PayPal,Delivered,4.0,Caulking gun,2024-02-13,,Missing values; 
5855931.0,66644.0,Jeanette Smith,Kenneth8@gmail.com,3937252940.0,705 Gregory Station Suite 652,Frankfurt,Berlin,66113.0,Germany,22.0,Female,Medium,Regular,9/28/2023,2023.0,September,16:18:18,8.0,67.32149538,538.571963,Electronics,,Television,Excellent,Express,PayPal,Delivered,4.0,Plasma TV,2023-09-28,2025-11-15 16:18:18,Missing values; 
5082749.0,,Catherine Weaver,Melissa100@gmail.com,9693777820.0,90027 Mary Station Suite 726,Frankfurt,Berlin,70811.0,Germany,22.0,Male,Medium,Regular,9/30/2023,2023.0,September,2:57:02,4.0,388.442689,1553.770756,Clothing,Nike,T-shirt,Good,Standard,Cash,Delivered,3.0,Scoop neck tee,2023-09-30,2025-11-15 02:57:02,Missing values; 
8060256.0,31035.0,James Trujillo,Tammy98@gmail.com,,28156 Sandoval Gateway,Frankfurt,Berlin,28425.0,Germany,22.0,Male,Medium,Regular,1/24/2024,2024.0,January,14:32:37,1.0,421.3387165,421.3387165,Books,Penguin Books,Non-Fiction,Bad,Express,Cash,Delivered,1.0,Biography,2024-01-24,2025-11-15 14:32:37,Missing values; 
6646763.0,94129.0,Jennifer Acosta,Dennis79@gmail.com,2563701125.0,26058 Dennis Knolls Suite 068,Frankfurt,Berlin,44199.0,Germany,22.0,Male,Medium,Regular,10-12-23,,October,19:53:54,7.0,252.8459326,1769.921528,Grocery,Pepsi,Juice,Bad,Express,Cash,Delivered,1.0,Apple juice,2023-10-12,2025-11-15 19:53:54,Missing values; 
8795378.0,18395.0,Brian Cross,Charles7@gmail.com,6029629685.0,69673 Webb Island,Frankfurt,Berlin,99521.0,Germany,22.0,Female,Medium,Regular,9/16/2023,2023.0,September,5:55:47,4.0,423.5903532,1694.361413,Clothing,Zara,Shirt,Bad,Express,,Delivered,1.0,Dress shirt,2023-09-16,2025-11-15 05:55:47,Missing values; 
4492771.0,66579.0,David Jacobs,Peggy92@gmail.com,1878365595.0,186 Torres Unions Suite 652,Frankfurt,Berlin,74302.0,Germany,22.0,Male,Medium,Regular,4/28/2023,2023.0,April,1:33:22,4.0,365.6097312,1462.438925,Electronics,Sony,Headphones,Average,,Cash,Delivered,2.0,Studio headphones,2023-04-28,2025-11-15 01:33:22,Missing values; 
1558897.0,61565.0,Dawn Huang,Shannon74@gmail.com,4614704841.0,41663 Booker Cliffs,Frankfurt,Berlin,73596.0,Germany,22.0,Male,Medium,Regular,5/13/2023,2023.0,May,9:28:12,6.0,387.9986613,2327.991968,Grocery,Coca-Cola,Water,,Standard,Debit Card,Delivered,,Purified water,2023-05-13,2025-11-15 09:28:12,Missing values; 
4044932.0,47942.0,Nicole Chang MD,Morgan72@gmail.com,8022505727.0,61856 Bell Villages,Frankfurt,Berlin,94216.0,Germany,22.0,Female,Medium,Regular,2/21/2024,2024.0,February,12:46:16,7.0,21.2333539,148.6334773,Books,HarperCollins,Thriller,,Express,Credit Card,Delivered,,Psychological thriller,2024-02-21,2025-11-15 12:46:16,Missing values; 
2916553.0,21183.0,Melissa Henderson,John66@gmail.com,,032 Phillips Junction,Frankfurt,Berlin,73480.0,Germany,22.0,Male,Medium,Regular,11/14/2023,2023.0,November,0:41:01,6.0,211.2279146,1267.367487,Home Decor,IKEA,Decorations,Bad,Same-Day,Debit Card,Delivered,1.0,Vases,2023-11-14,2025-11-15 00:41:01,Missing values; 
,45421.0,Julie Cook,Edwin40@gmail.com,1232076282.0,31592 Benjamin Pine Apt. 464,Frankfurt,Berlin,68379.0,Germany,22.0,Female,Medium,Regular,7/13/2023,2023.0,July,12:06:44,9.0,323.6694976,2913.025478,Books,Penguin Books,Fiction,Average,Standard,Cash,Delivered,2.0,Thriller,2023-07-13,2025-11-15 12:06:44,Missing values; 
9781221.0,64855.0,Daniel Martinez,Amy21@gmail.com,1946360309.0,09955 William Lodge Apt. 613,Frankfurt,Berlin,46091.0,Germany,22.0,Male,Medium,Regular,9/25/2023,2023.0,September,11:41:58,9.0,99.23899778,893.15098,Electronics,Sony,Headphones,Excellent,,Credit Card,Delivered,4.0,Over-ear headphones,2023-09-25,2025-11-15 11:41:58,Missing values; 
8478603.0,18750.0,Carla Peterson,Regina26@gmail.com,8727678371.0,3663 Roach Oval Suite 730,Frankfurt,Berlin,2852.0,Germany,22.0,,Medium,Regular,02-10-24,2024.0,February,16:22:48,2.0,383.1149781,766.2299561,Electronics,Sony,Smartphone,Good,Express,Debit Card,Delivered,3.0,Sony Xperia,2024-02-10,2025-11-15 16:22:48,Missing values; 
,54748.0,Megan Freeman,Rhonda10@gmail.com,8060513652.0,14002 Nicole Unions Suite 406,Frankfurt,Berlin,29487.0,Germany,22.0,Female,Medium,Regular,10/21/2023,2023.0,October,2:27:32,3.0,417.7489127,1253.246738,Electronics,Sony,Headphones,Excellent,Express,Credit Card,Delivered,5.0,Studio headphones,2023-10-21,2025-11-15 02:27:32,Missing values; 
5069861.0,42246.0,Angela Duran,Vicki3@gmail.com,5644997687.0,705 Michelle Meadows,Frankfurt,Berlin,35990.0,Germany,22.0,Male,Medium,Regular,6/26/2023,2023.0,,18:03:03,10.0,59.82814342,598.2814342,Grocery,Nestle,Chocolate,Good,Express,Debit Card,Delivered,3.0,Chocolate-covered nuts,2023-06-26,2025-11-15 18:03:03,Missing values; 
4089251.0,76319.0,Andrea Holmes,Julian62@gmail.com,6370985761.0,41965 Lisa Lodge,Frankfurt,Berlin,35428.0,Germany,22.0,Male,Medium,Regular,1/30/2024,2024.0,January,,3.0,344.8268871,1034.480661,Books,Random House,Literature,Excellent,Same-Day,Cash,Delivered,5.0,Classic literature,2024-01-30,,Missing values; 
5337004.0,33128.0,Allison Gilbert,John49@gmail.com,5786087576.0,791 Jacob Island,Frankfurt,Berlin,96712.0,Germany,22.0,Male,Medium,Regular,7/28/2023,2023.0,July,6:39:45,10.0,39.05670485,,Electronics,Sony,Television,Bad,Same-Day,Cash,Delivered,1.0,OLED TV,2023-07-28,2025-11-15 06:39:45,Missing values; 
,39171.0,Tammy Richardson,Emily67@gmail.com,9101304936.0,19940 Hernandez Mountains Apt. 671,Frankfurt,Berlin,66786.0,Germany,22.0,Female,Medium,Regular,7/17/2023,2023.0,July,17:21:53,6.0,37.22646888,223.3588133,Books,HarperCollins,Thriller,Bad,Standard,PayPal,Delivered,1.0,Psychological thriller,2023-07-17,2025-11-15 17:21:53,Missing values; 
7242798.0,97715.0,Erin Pace,Kristen43@gmail.com,8410386408.0,67948 Cynthia Fort Apt. 923,Frankfurt,Berlin,39015.0,Germany,22.0,,Medium,Regular,07-03-23,2023.0,July,9:29:58,10.0,83.24813895,832.4813895,Home Decor,Bed Bath & Beyond,Bathroom,Bad,Same-Day,Debit Card,Delivered,1.0,Toilet,2023-07-03,2025-11-15 09:29:58,Missing values; 
6411325.0,99736.0,Melody Brown,Donna66@gmail.com,3906923488.0,18039 Williams Fork Suite 148,Frankfurt,Berlin,58664.0,Germany,22.0,Male,High,Regular,11-06-23,2023.0,November,23:56:20,3.0,,743.8049223,Grocery,Nestle,Snacks,Good,Same-Day,Credit Card,Delivered,4.0,Crackers,2023-11-06,2025-11-15 23:56:20,Missing values; 
,58426.0,Angela Contreras,Brandon25@gmail.com,4683203194.0,9000 Gwendolyn Pine,Frankfurt,Berlin,13891.0,Germany,22.0,Male,High,Regular,7/30/2023,2023.0,July,4:59:48,9.0,309.305618,2783.750562,Grocery,Coca-Cola,Juice,Average,Same-Day,Debit Card,Delivered,2.0,Orange juice,2023-07-30,2025-11-15 04:59:48,Missing values; 
4847559.0,16582.0,Ronnie Jenkins,Linda16@gmail.com,4306918421.0,642 Darren Street Apt. 858,Frankfurt,Berlin,50997.0,Germany,22.0,,High,Regular,04-05-23,2023.0,April,14:45:16,4.0,267.5337159,1070.134864,Home Decor,Bed Bath & Beyond,Bathroom,Average,Same-Day,Cash,Delivered,2.0,Mirror,2023-04-05,2025-11-15 14:45:16,Missing values; 
2818477.0,17308.0,Jennifer Phillips,,9213367245.0,3154 Atkins Pike,Frankfurt,Berlin,24947.0,Germany,22.0,Male,High,Regular,09-08-23,2023.0,September,1:39:39,8.0,268.7505711,2150.004569,Books,Penguin Books,Fiction,Good,Standard,Debit Card,Delivered,4.0,Adventure,2023-09-08,2025-11-15 01:39:39,Missing values; 
5610120.0,,Joshua Robertson,Chelsea92@gmail.com,5482424676.0,9366 Mark Rapids Apt. 138,Frankfurt,Berlin,7682.0,Germany,22.0,Female,High,Regular,05-03-23,2023.0,May,18:50:09,7.0,488.674536,3420.721752,Grocery,Nestle,Chocolate,Average,Express,Cash,Delivered,2.0,Truffles,2023-05-03,2025-11-15 18:50:09,Missing values; 
9771947.0,16034.0,David Collins,Thomas45@gmail.com,,45532 Jennifer Court Apt. 311,Frankfurt,Berlin,58630.0,Germany,22.0,Male,High,Regular,11/27/2023,2023.0,November,20:21:13,7.0,461.9478147,3233.634703,Grocery,Pepsi,Water,Excellent,Standard,Cash,Delivered,4.0,Sparkling water,2023-11-27,2025-11-15 20:21:13,Missing values; 
8881003.0,93254.0,James Grant,Sarah25@gmail.com,5785142142.0,36211 Brown Pike Suite 530,Frankfurt,Berlin,40786.0,Germany,22.0,Male,High,Regular,9/22/2023,2023.0,September,21:24:19,7.0,447.6220665,3133.354466,Home Decor,IKEA,Decorations,Good,,PayPal,Delivered,4.0,Curtains,2023-09-22,2025-11-15 21:24:19,Missing values; 
3505378.0,17574.0,Brandon Cowan,Joel8@gmail.com,4197669582.0,0025 Howell Circles Apt. 719,Frankfurt,Berlin,64138.0,Germany,22.0,Female,High,Regular,10-11-23,2023.0,October,22:20:08,,68.67182897,206.0154869,Clothing,Zara,Shirt,Average,Express,Credit Card,Delivered,2.0,Dress shirt,2023-10-11,2025-11-15 22:20:08,Missing values; 
,57848.0,Erin Sutton,Danielle49@gmail.com,5548907687.0,1715 Nicholas Estate,Frankfurt,Berlin,32452.0,Germany,22.0,Male,High,Regular,6/16/2023,2023.0,June,14:09:27,7.0,333.6295288,2335.406702,Home Decor,Bed Bath & Beyond,Bathroom,Average,Same-Day,Debit Card,Delivered,2.0,Toothbrush holder,2023-06-16,2025-11-15 14:09:27,Missing values; 
5596799.0,97324.0,Ann Ball,Allison93@gmail.com,,379 Natasha Village Suite 600,Frankfurt,Berlin,44089.0,Germany,22.0,Female,High,Regular,2/21/2024,2024.0,February,20:35:31,5.0,388.2202267,1941.101133,Home Decor,Bed Bath & Beyond,Kitchen,Average,Express,PayPal,Delivered,2.0,Refrigerator,2024-02-21,2025-11-15 20:35:31,Missing values; 
8329957.0,38443.0,Julie Beasley,Gabriel45@gmail.com,8769069615.0,976 Mckee Flat Suite 619,Frankfurt,Berlin,98961.0,Germany,22.0,Female,High,Regular,12/21/2023,,December,19:13:53,6.0,234.102814,1404.616884,Clothing,Adidas,T-shirt,Bad,Standard,Debit Card,Delivered,1.0,V-neck tee,2023-12-21,2025-11-15 19:13:53,Missing values; 
7548929.0,93252.0,April Ward,Kenneth55@gmail.com,3588480732.0,1666 Diana Ford,Bristol,England,48384.0,UK,22.0,Male,High,Regular,04-10-23,2023.0,April,5:52:51,10.0,225.3694221,2253.694221,Electronics,Apple,Laptop,Bad,,PayPal,Delivered,1.0,Asus ZenBook,2023-04-10,2025-11-15 05:52:51,Missing values; 
7353547.0,24576.0,Michelle Cunningham,Tonya66@gmail.com,4929201056.0,93038 Santiago Rest,Toronto,Ontario,52880.0,Canada,22.0,Male,High,Regular,01-02-24,2024.0,,0:44:32,6.0,38.40314369,230.4188622,Electronics,Samsung,Smartphone,Good,Standard,Cash,Delivered,3.0,Nokia,2024-01-02,2025-11-15 00:44:32,Missing values; 
9547074.0,59930.0,Richard Dixon,Daniel77@gmail.com,7182309036.0,,Newcastle upon Tyne,England,12930.0,UK,22.0,Female,High,Regular,3/27/2023,2023.0,March,13:37:16,4.0,332.5288264,1330.115305,Grocery,Pepsi,Water,Bad,Standard,Cash,Delivered,1.0,Sparkling water,2023-03-27,2025-11-15 13:37:16,Missing values; 
1191687.0,40061.0,Sean Pena,Harry36@gmail.com,8951704531.0,17196 Johnston Village,Plymouth,,,UK,22.0,Male,High,Regular,11/29/2023,2023.0,November,20:57:23,2.0,280.3937388,560.7874775,Grocery,Pepsi,Soft Drink,Average,Standard,PayPal,Delivered,2.0,Energy drink,2023-11-29,2025-11-15 20:57:23,Missing values; 
1749026.0,81339.0,Nathan Rice,Lonnie80@gmail.com,5512608631.0,5980 Williams Wall,Louisville,Louisiana,70878.0,USA,22.0,Male,High,Regular,06-12-23,2023.0,June,23:32:56,4.0,382.2140128,1528.856051,Clothing,,Shirt,Bad,Express,Debit Card,Delivered,1.0,Flannel shirt,2023-06-12,2025-11-15 23:32:56,Missing values; 
8303454.0,35954.0,Jennifer Woodward,William24@gmail.com,5777162441.0,5181 Corey Harbor,Stuttgart,Berlin,75077.0,Germany,22.0,Male,High,Regular,5/25/2023,2023.0,May,23:42:04,5.0,298.415032,1492.07516,Books,HarperCollins,Fiction,,Express,Cash,Delivered,,Mystery,2023-05-25,2025-11-15 23:42:04,Missing values; 
5329382.0,19893.0,Theodore Ellis,Monica100@gmail.com,7161816545.0,504 Brown Mountain Suite 752,Austin,Alabama,35772.0,USA,22.0,Female,High,Regular,6/26/2023,2023.0,June,23:59:24,4.0,243.6820986,974.7283944,Books,Penguin Books,Children's,Excellent,Same-Day,,Delivered,5.0,Building blocks,2023-06-26,2025-11-15 23:59:24,Missing values; 
6295836.0,54280.0,Meagan Patel,Kevin87@gmail.com,9240228019.0,05578 Keller Well,Brighton,England,54684.0,UK,22.0,Male,High,Regular,,2024.0,February,10:16:04,9.0,94.37079805,849.3371824,Clothing,Adidas,Shoes,Good,Standard,Debit Card,Delivered,4.0,Oxfords,,2025-11-15 10:16:04,Missing values; 
5467779.0,55089.0,Lisa Hoffman,,5723900905.0,094 Mcintyre Shoals,Oxford,England,97259.0,UK,22.0,Male,High,Regular,2/18/2024,2024.0,February,1:03:12,3.0,104.0062643,312.0187928,Clothing,Zara,Dress,Average,Express,Cash,Delivered,2.0,Maxi dress,2024-02-18,2025-11-15 01:03:12,Missing values; 
1608246.0,53552.0,Christopher Green,William61@gmail.com,4963464633.0,7111 Lucas Street Suite 004,Winnipeg,Ontario,33748.0,Canada,22.0,Female,High,Regular,2/25/2024,,February,21:24:20,2.0,267.4862646,534.9725292,Grocery,Coca-Cola,Water,Bad,Same-Day,PayPal,Delivered,1.0,Coconut water,2024-02-25,2025-11-15 21:24:20,Missing values; 
7383253.0,39508.0,Eric Meyers MD,Michael72@gmail.com,7548938238.0,562 Jessica Dale,Canberra,New South Wales,47549.0,Australia,22.0,Male,High,Regular,10/16/2023,2023.0,October,13:46:39,2.0,406.1525668,812.3051336,Electronics,,Smartphone,Excellent,Same-Day,Cash,Delivered,5.0,Sony Xperia,2023-10-16,2025-11-15 13:46:39,Missing values; 
3641348.0,83303.0,Angela Bailey,Kristin79@gmail.com,2865333852.0,,Tulsa,Delaware,19969.0,USA,22.0,Female,High,Regular,12/31/2023,2023.0,December,1:36:03,6.0,405.192154,2431.152924,Grocery,Pepsi,Juice,Excellent,Express,Cash,Delivered,4.0,Apple juice,2023-12-31,2025-11-15 01:36:03,Missing values; 
7640536.0,54116.0,Ann Holmes,Ricky89@gmail.com,6585230415.0,164 Bryan Street,Munich,Berlin,26952.0,Germany,22.0,,High,Regular,9/30/2023,2023.0,September,8:32:15,2.0,155.8104594,311.6209188,Clothing,Adidas,Jacket,Bad,Express,PayPal,Delivered,1.0,Parka,2023-09-30,2025-11-15 08:32:15,Missing values; 
2090096.0,38163.0,,Sara98@gmail.com,1919930043.0,384 Holmes Garden Suite 285,Oshawa,Ontario,64678.0,Canada,22.0,Female,High,Regular,11/30/2023,2023.0,November,21:30:52,6.0,25.83503562,155.0102137,Electronics,Apple,Tablet,Bad,Standard,Credit Card,Delivered,1.0,Google Pixel Slate,2023-11-30,2025-11-15 21:30:52,Missing values; 
3773285.0,39961.0,Robin Dudley,David36@gmail.com,9990491677.0,5305 Angela Forest,Hamburg,Berlin,13748.0,Germany,22.0,Male,High,Regular,04-05-23,2023.0,April,,3.0,228.4637478,685.3912433,Home Decor,Home Depot,Decorations,Excellent,Same-Day,PayPal,Delivered,5.0,Curtains,2023-04-05,,Missing values; 
7424198.0,,Mallory Irwin,Erik30@gmail.com,8108881446.0,3073 Munoz Estate Suite 054,Minneapolis,Tennessee,37216.0,USA,22.0,Female,High,Regular,3/28/2023,2023.0,March,6:37:51,3.0,469.9377288,1409.813186,Clothing,Adidas,T-shirt,Bad,Express,Debit Card,Delivered,1.0,Long-sleeve tee,2023-03-28,2025-11-15 06:37:51,Missing values; 
8498800.0,19510.0,Robert Cruz,Phillip67@gmail.com,4728856107.0,79393 Angela Burg,Brighton,England,50435.0,UK,22.0,Female,High,Regular,02-01-24,2024.0,,1:45:11,10.0,92.29732804,922.9732804,Home Decor,Bed Bath & Beyond,Kitchen,Good,Standard,Credit Card,Delivered,4.0,Oven,2024-02-01,2025-11-15 01:45:11,Missing values; 
3994759.0,33978.0,Erica Carter,Cheryl64@gmail.com,2686706759.0,17482 Steven Fork Apt. 599,Birmingham,England,14434.0,UK,22.0,Female,High,Regular,5/17/2023,2023.0,May,23:49:50,10.0,478.0321063,4780.321063,Grocery,Coca-Cola,Juice,Average,,Cash,Delivered,2.0,Pomegranate juice,2023-05-17,2025-11-15 23:49:50,Missing values; 
4024336.0,47751.0,Gary Anderson,Crystal69@gmail.com,5485201228.0,717 Jordan Streets,Milwaukee,Rhode Island,2913.0,USA,22.0,Male,High,Regular,12/16/2023,2023.0,December,18:23:53,3.0,136.8389513,410.516854,Home Decor,Home Depot,Decorations,,Same-Day,Cash,Delivered,,Vases,2023-12-16,2025-11-15 18:23:53,Missing values; 
8487850.0,93252.0,Deanna Lee,Sheila61@gmail.com,5191947571.0,913 Wilson Crossing Suite 731,Townsville,New South Wales,22676.0,Australia,22.0,Male,High,Regular,7/28/2023,2023.0,July,5:43:54,4.0,116.5664332,466.2657328,Grocery,Pepsi,Juice,Average,,Debit Card,Delivered,2.0,Cranberry juice,2023-07-28,2025-11-15 05:43:54,Missing values; 
6849873.0,10040.0,Ashley Clark,Jean56@gmail.com,3670190092.0,67459 Cooley Freeway Apt. 318,Nottingham,England,69419.0,UK,22.0,Male,High,Regular,12-06-23,2023.0,December,11:44:35,8.0,370.0097001,,Grocery,Pepsi,Water,Good,Standard,PayPal,Delivered,4.0,Mineral water,2023-12-06,2025-11-15 11:44:35,Missing values; 
5044630.0,79537.0,Thomas Scott,Colleen88@gmail.com,3107425673.0,806 Micheal Plaza,Winnipeg,Ontario,25016.0,Canada,22.0,Male,High,Regular,11-07-23,2023.0,November,1:38:39,3.0,131.1107638,393.3322913,,Nestle,Chocolate,Excellent,Express,PayPal,Delivered,5.0,Milk chocolate,2023-11-07,2025-11-15 01:38:39,Missing values; 
2213061.0,60773.0,Drew Carpenter,Marcus16@gmail.com,6446878817.0,704 Sellers Trail Apt. 160,Milwaukee,Minnesota,56014.0,USA,22.0,Male,High,Regular,02-02-24,2024.0,February,,4.0,234.9085787,939.6343147,Books,Penguin Books,Fiction,Bad,Express,PayPal,Delivered,1.0,Adventure,2024-02-02,,Missing values; 
5695172.0,65712.0,Nathan Gardner,Michelle80@gmail.com,5098276425.0,422 David Streets Suite 704,,England,67730.0,UK,22.0,Male,High,Regular,4/13/2023,2023.0,April,20:56:39,6.0,28.18512488,169.1107493,Clothing,Adidas,Jacket,Average,Standard,PayPal,Delivered,2.0,Peacoat,2023-04-13,2025-11-15 20:56:39,Missing values; 
6537012.0,91218.0,Kevin Peck,Taylor77@gmail.com,4711684385.0,801 Gilbert Viaduct Apt. 792,Sydney,New South Wales,80527.0,Australia,22.0,Male,High,Regular,2/24/2024,2024.0,February,14:12:57,8.0,376.7734689,3014.187751,Grocery,Nestle,Snacks,Excellent,,PayPal,Delivered,4.0,Nuts,2024-02-24,2025-11-15 14:12:57,Missing values; 
6790681.0,11623.0,Matthew Spencer,Lacey94@gmail.com,7093657125.0,,Newcastle,New South Wales,33794.0,Australia,22.0,Male,High,Regular,3/18/2023,2023.0,March,9:58:35,8.0,435.155333,3481.242664,Home Decor,IKEA,Lighting,Good,Express,Credit Card,Delivered,3.0,Wall sconces,2023-03-18,2025-11-15 09:58:35,Missing values; 
6324322.0,59220.0,Brian Thompson,Brady27@gmail.com,7425922048.0,14078 Nicholas Well,Hobart,New South Wales,85755.0,Australia,22.0,,High,Regular,11/18/2023,2023.0,November,10:53:56,5.0,453.9276538,2269.638269,Clothing,Zara,Shirt,Good,Standard,Credit Card,Delivered,3.0,Dress shirt,2023-11-18,2025-11-15 10:53:56,Missing values; 
7587945.0,15770.0,Ann Frank,Kathryn85@gmail.com,4908971647.0,75042 Osborne Terrace,Toronto,Ontario,69790.0,Canada,22.0,Male,High,Regular,12/22/2023,2023.0,December,14:23:43,2.0,,608.6165791,Grocery,Pepsi,Soft Drink,Average,Standard,Debit Card,Delivered,2.0,Iced tea,2023-12-22,2025-11-15 14:23:43,Missing values; 
9123742.0,34722.0,Sarah Wheeler,,3780874709.0,98388 Fowler Burg Apt. 505,Brisbane,New South Wales,25632.0,Australia,22.0,Female,High,Regular,12-11-23,2023.0,December,13:40:17,9.0,198.9073188,1790.165869,Electronics,Samsung,Television,Bad,Same-Day,PayPal,Delivered,1.0,QLED TV,2023-12-11,2025-11-15 13:40:17,Missing values; 
6211450.0,36266.0,Jason Foster,Juan60@gmail.com,,114 Katherine Mall Suite 553,Liverpool,England,56475.0,UK,22.0,Female,High,Regular,1/17/2024,2024.0,January,13:51:52,9.0,50.60745665,455.4671099,Books,Random House,Non-Fiction,Excellent,Same-Day,PayPal,Delivered,4.0,Biography,2024-01-17,2025-11-15 13:51:52,Missing values; 
1929864.0,95067.0,Madeline Estes,Michael28@gmail.com,4153073677.0,07613 Henson Throughway Suite 052,Dallas,Texas,77045.0,USA,22.0,Male,High,Regular,5/15/2023,2023.0,,19:01:45,3.0,405.1924684,1215.577405,Grocery,Nestle,Coffee,Excellent,Same-Day,Debit Card,Delivered,4.0,Instant coffee,2023-05-15,2025-11-15 19:01:45,Missing values; 
1800413.0,59155.0,Henry Lynch,Richard51@gmail.com,4334181639.0,0748 Thomas Stravenue,Oxford,England,82852.0,UK,22.0,Female,High,Regular,10-04-23,,October,20:34:23,2.0,106.7525366,213.5050733,Clothing,Nike,Shorts,Bad,Express,PayPal,Delivered,1.0,Khaki shorts,2023-10-04,2025-11-15 20:34:23,Missing values; 
5249594.0,26020.0,Jennifer Peters,Alexander57@gmail.com,8874013206.0,7785 Daniel Forks,Glasgow,England,75127.0,UK,22.0,Male,High,Regular,12/23/2023,2023.0,,15:14:21,8.0,94.99186763,759.9349411,Books,HarperCollins,Thriller,Excellent,Standard,Credit Card,Delivered,5.0,Detective,2023-12-23,2025-11-15 15:14:21,Missing values; 
9738630.0,38532.0,Rachel Perry,Anthony38@gmail.com,4104912688.0,06721 Durham Landing Suite 449,Seattle,Montana,59019.0,USA,22.0,Male,High,Regular,5/24/2023,2023.0,May,1:04:00,6.0,496.6627178,2979.976307,Home Decor,IKEA,Decorations,,Same-Day,Credit Card,Delivered,,Wall art,2023-05-24,2025-11-15 01:04:00,Missing values; 
5089266.0,24753.0,Donna Marshall,Anthony31@gmail.com,4562805115.0,051 Stephanie Knolls,Victoria,Ontario,8176.0,Canada,22.0,Male,High,Regular,11/26/2023,2023.0,November,15:28:38,8.0,40.79006714,326.3205372,Home Decor,Bed Bath & Beyond,Bedding,Good,Express,,Delivered,3.0,Duvet cover,2023-11-26,2025-11-15 15:28:38,Missing values; 
9194475.0,61845.0,Scott Scott,Jason73@gmail.com,1229333546.0,1645 Rebecca Radial Suite 524,Indianapolis,West Virginia,25670.0,USA,22.0,Male,High,Regular,4/16/2023,2023.0,April,19:15:59,2.0,422.8591586,845.7183172,Books,Random House,Fiction,Average,Same-Day,,Delivered,2.0,Fantasy,2023-04-16,2025-11-15 19:15:59,Missing values; 
,96035.0,Barbara Mcgee,Heather14@gmail.com,4827329529.0,9970 Christopher Throughway Suite 412,Albury-Wodonga,New South Wales,28497.0,Australia,22.0,Male,High,Regular,3/16/2023,2023.0,March,4:21:46,5.0,260.0186588,1300.093294,Grocery,Coca-Cola,Water,Excellent,Express,Cash,Delivered,5.0,Distilled water,2023-03-16,2025-11-15 04:21:46,Missing values; 
2604731.0,52560.0,Sarah Jordan,Adam5@gmail.com,3832998530.0,,London,England,79095.0,UK,22.0,Male,High,Regular,4/13/2023,2023.0,April,8:40:02,8.0,310.3451541,2482.761233,Books,Penguin Books,Fiction,Excellent,Same-Day,Credit Card,Delivered,5.0,Romance,2023-04-13,2025-11-15 08:40:02,Missing values; 
7600049.0,44027.0,John Jones,Ashley87@gmail.com,7686509661.0,04224 Andrea Island,Plymouth,England,41999.0,UK,22.0,Female,High,Regular,8/14/2023,2023.0,August,8:33:51,2.0,406.1099883,812.2199766,,Zara,Jeans,Excellent,Standard,PayPal,Delivered,4.0,Straight-leg jeans,2023-08-14,2025-11-15 08:33:51,Missing values; 
1335760.0,57989.0,Christopher Lopez,Lindsey42@gmail.com,9476381488.0,383 Hays Pass,Liverpool,England,,UK,22.0,Female,High,Regular,05-06-23,2023.0,May,19:23:42,7.0,218.7717153,1531.402007,Electronics,Samsung,Television,Excellent,Express,PayPal,Delivered,5.0,LED TV,2023-05-06,2025-11-15 19:23:42,Missing values; 
4099856.0,,Arthur White,Elizabeth89@gmail.com,8165203988.0,262 Benjamin Mills,Stuttgart,Berlin,50010.0,Germany,22.0,Female,High,Regular,05-06-23,2023.0,May,8:23:48,7.0,60.79315109,425.5520576,Home Decor,Home Depot,Furniture,Good,Same-Day,PayPal,Delivered,4.0,Coffee table,2023-05-06,2025-11-15 08:23:48,Missing values; 
2667237.0,73738.0,Ashley Cline,Abigail28@gmail.com,8095072999.0,890 Adkins Inlet,Ballarat,New South Wales,19623.0,Australia,22.0,Male,High,Regular,10/31/2023,2023.0,,21:19:44,10.0,249.6727995,2496.727995,Clothing,Nike,Shoes,Bad,Express,Debit Card,Delivered,1.0,Sneakers,2023-10-31,2025-11-15 21:19:44,Missing values; 
3015337.0,12554.0,Eric Frank,Jeffrey72@gmail.com,4719137256.0,63443 Marissa Burg,Barrie,Ontario,65132.0,Canada,22.0,,High,Regular,01-08-24,2024.0,January,17:07:40,3.0,441.4031058,1324.209317,Home Decor,Home Depot,Furniture,Good,Same-Day,Cash,Delivered,4.0,Bed,2024-01-08,2025-11-15 17:07:40,Missing values; 
3252682.0,75450.0,Ricky Cunningham,Michelle28@gmail.com,7308570225.0,4268 Summers Key Suite 407,Colorado Springs,Nebraska,68071.0,USA,22.0,,High,Regular,4/22/2023,2023.0,April,18:14:48,8.0,153.0673016,1224.538413,Home Decor,Bed Bath & Beyond,Bedding,Excellent,Standard,Cash,Delivered,5.0,Throw pillow,2023-04-22,2025-11-15 18:14:48,Missing values; 
4884366.0,58312.0,Stacy Burnett,Laura74@gmail.com,1249333083.0,61510 Jeremy Islands,Chicago,Iowa,,USA,22.0,Female,High,Regular,12/20/2023,2023.0,December,3:28:16,1.0,166.9598587,166.9598587,Electronics,Sony,Smartphone,Bad,Same-Day,PayPal,Delivered,1.0,iPhone,2023-12-20,2025-11-15 03:28:16,Missing values; 
2065320.0,75155.0,Chelsea Randall,Brian50@gmail.com,6201900586.0,900 Guerrero Manors,Portland,Missouri,65080.0,USA,22.0,Male,High,Regular,12/17/2023,2023.0,December,10:11:13,10.0,122.3881076,1223.881076,Home Decor,Home Depot,Decorations,Bad,,Debit Card,Delivered,1.0,Wall art,2023-12-17,2025-11-15 10:11:13,Missing values; 
4125818.0,13462.0,Connie Suarez,Amy94@gmail.com,7773806385.0,58176 Jamie Divide,Detroit,Minnesota,56015.0,USA,22.0,,High,Regular,12/16/2023,2023.0,December,15:14:22,4.0,156.5992965,626.3971858,Books,HarperCollins,Thriller,Bad,Standard,PayPal,Delivered,1.0,Detective,2023-12-16,2025-11-15 15:14:22,Missing values; 
9400445.0,89605.0,Kathy West,James81@gmail.com,4802298597.0,245 Sandra Springs Apt. 562,Manchester,,12307.0,UK,22.0,Female,High,Regular,11-01-23,2023.0,November,23:13:05,8.0,266.2096896,2129.677517,Electronics,Apple,Tablet,Bad,Express,Cash,Delivered,1.0,Asus ZenPad,2023-11-01,2025-11-15 23:13:05,Missing values; 
9033477.0,17828.0,Christopher Lyons,Christopher75@gmail.com,9108234047.0,,Berlin,Berlin,91103.0,Germany,22.0,Male,High,Regular,4/25/2023,2023.0,April,14:38:04,2.0,442.5866167,885.1732334,Grocery,Nestle,Snacks,Good,Same-Day,Credit Card,Delivered,3.0,Beef jerky,2023-04-25,2025-11-15 14:38:04,Missing values; 
9210234.0,28720.0,Elizabeth Green,Mark90@gmail.com,6723361494.0,875 Stephenson Expressway Apt. 969,Oakland,Colorado,80709.0,USA,22.0,Male,High,Regular,,2023.0,April,11:57:21,7.0,45.82871496,320.8010047,Books,HarperCollins,Thriller,Average,Same-Day,,Delivered,2.0,Psychological thriller,,2025-11-15 11:57:21,Missing values; 
,87023.0,Jonathan Norris,Edward69@gmail.com,2179454385.0,91077 Obrien Garden Apt. 051,Birmingham,England,58469.0,UK,22.0,Male,High,Regular,02-04-24,2024.0,February,2:14:53,6.0,417.5914287,2505.548572,Home Decor,Bed Bath & Beyond,Bathroom,Excellent,Standard,Credit Card,Delivered,4.0,Toilet paper holder,2024-02-04,2025-11-15 02:14:53,Missing values; 
9232155.0,65886.0,Edward Villarreal,Emily43@gmail.com,6478091111.0,594 Aaron Port,Toronto,Ontario,23281.0,Canada,22.0,Male,High,Regular,5/19/2023,2023.0,May,3:54:07,1.0,11.27483587,11.27483587,Electronics,Sony,Headphones,Bad,,PayPal,Delivered,1.0,Studio headphones,2023-05-19,2025-11-15 03:54:07,Missing values; 
6073059.0,63767.0,Danielle Arnold,Ryan81@gmail.com,8177196358.0,50452 Tiffany Heights,Victoria,Ontario,5812.0,Canada,22.0,Male,High,Regular,,2023.0,August,19:40:28,2.0,131.550344,263.100688,Electronics,Apple,Smartphone,Average,Express,Debit Card,Delivered,2.0,OnePlus,,2025-11-15 19:40:28,Missing values; 
8712863.0,,Omar Gallegos,Todd75@gmail.com,6892294759.0,283 Gary Expressway Suite 515,St. John's,Ontario,82635.0,Canada,22.0,Female,High,Regular,02-01-24,2024.0,February,16:58:42,8.0,485.713601,3885.708808,Electronics,Samsung,Tablet,Excellent,Express,PayPal,Delivered,5.0,Microsoft Surface,2024-02-01,2025-11-15 16:58:42,Missing values; 
2259989.0,28453.0,Miranda Fisher,Robert29@gmail.com,5307080480.0,8779 Clark Ridges Apt. 451,Hanover,Berlin,75496.0,Germany,22.0,Female,High,Regular,03-03-23,2023.0,March,20:51:42,2.0,299.0330017,,Electronics,Samsung,Smartphone,Bad,Same-Day,Debit Card,Delivered,1.0,Sony Xperia,2023-03-03,2025-11-15 20:51:42,Missing values; 
7718178.0,73960.0,Mark Pearson,Kelly73@gmail.com,,750 Brown Lake,Houston,Indiana,46410.0,USA,22.0,Male,High,Regular,4/20/2023,2023.0,April,7:24:55,6.0,344.7723827,2068.634296,Electronics,Sony,Smartphone,Bad,Express,Debit Card,Delivered,1.0,OnePlus,2023-04-20,2025-11-15 07:24:55,Missing values; 
6628903.0,65368.0,Samantha Sullivan,Jessica29@gmail.com,5790749567.0,397 Carlson Drive,Stuttgart,,58526.0,Germany,22.0,Male,High,Regular,1/14/2024,2024.0,January,8:39:32,10.0,415.4741428,4154.741428,Electronics,Sony,Television,Excellent,Same-Day,Credit Card,Delivered,4.0,Smart TV,2024-01-14,2025-11-15 08:39:32,Missing values; 
7043684.0,33395.0,Joyce Shepherd,Robert94@gmail.com,6444364809.0,71387 Obrien Estate,Kansas City,Pennsylvania,18480.0,USA,22.0,Male,High,Regular,01-10-24,2024.0,January,1:38:38,10.0,384.4331274,,Grocery,Coca-Cola,Water,Good,Standard,Debit Card,Delivered,3.0,Mineral water,2024-01-10,2025-11-15 01:38:38,Missing values; 
8924255.0,21917.0,Sharon Warren,Paige12@gmail.com,9416146719.0,80917 Elizabeth Land,Birmingham,England,78326.0,UK,22.0,Male,High,Regular,06-02-23,,June,11:45:20,2.0,264.7531357,529.5062714,Books,Penguin Books,Fiction,Bad,Same-Day,Debit Card,Delivered,1.0,Adventure,2023-06-02,2025-11-15 11:45:20,Missing values; 
6331310.0,73584.0,Felicia Campbell,Angelica44@gmail.com,1097543566.0,3410 Wendy Street Suite 607,Calgary,,80420.0,Canada,22.0,Female,High,Regular,11/17/2023,2023.0,November,8:45:24,7.0,456.7594852,3197.316396,Home Decor,Bed Bath & Beyond,Bedding,Bad,Same-Day,PayPal,Delivered,1.0,Quilt,2023-11-17,2025-11-15 08:45:24,Missing values; 
2955435.0,38589.0,John Pearson,Natalie67@gmail.com,9334123402.0,5922 Mark Union,Southampton,England,27970.0,UK,22.0,Male,High,Regular,09-01-23,2023.0,September,17:40:53,1.0,,168.2340104,Electronics,Sony,Smartphone,Bad,Standard,Credit Card,Delivered,1.0,Xiaomi Mi,2023-09-01,2025-11-15 17:40:53,Missing values; 
2969649.0,15805.0,Samuel Steele,,4021472089.0,187 Parks Port Apt. 564,Dortmund,Berlin,15481.0,Germany,22.0,Female,High,Regular,02-12-24,2024.0,February,20:50:41,4.0,202.2850725,809.1402898,Books,HarperCollins,Thriller,Good,Standard,Credit Card,Delivered,3.0,Adventure,2024-02-12,2025-11-15 20:50:41,Missing values; 
9619790.0,16311.0,Betty Shannon,Mallory9@gmail.com,1994292205.0,5985 Webster Terrace,Bonn,Berlin,16436.0,Germany,22.0,Male,High,Regular,07-08-23,2023.0,,5:33:09,4.0,196.9660594,787.8642377,Grocery,Nestle,Coffee,Average,Express,Cash,Delivered,2.0,Instant coffee,2023-07-08,2025-11-15 05:33:09,Missing values; 
2160330.0,88034.0,Holly Sanford,Justin36@gmail.com,2098798027.0,7607 Green Lodge Suite 782,Colorado Springs,Maryland,21880.0,USA,22.0,Male,High,Regular,5/16/2023,2023.0,May,0:17:15,10.0,486.9721754,4869.721754,Grocery,Pepsi,Soft Drink,Average,Standard,,Delivered,2.0,Grape soda,2023-05-16,2025-11-15 00:17:15,Missing values; 
7861080.0,,Danielle Brady,Dawn86@gmail.com,7825667780.0,5866 Karen Way,Vancouver,Ontario,64089.0,Canada,22.0,Female,High,Regular,12-09-23,2023.0,December,4:51:42,10.0,247.1324139,2471.324139,Home Decor,Bed Bath & Beyond,Bedding,Good,Standard,Cash,Delivered,3.0,Mattress topper,2023-12-09,2025-11-15 04:51:42,Missing values; 
2021425.0,30936.0,Mr. Jerry Guzman,David39@gmail.com,4677695373.0,62098 Arthur Creek,Windsor,,89361.0,Canada,22.0,Female,High,Regular,9/23/2023,2023.0,September,8:55:02,6.0,404.7580817,2428.54849,Home Decor,Bed Bath & Beyond,Kitchen,Good,Express,Cash,Delivered,3.0,Coffee maker,2023-09-23,2025-11-15 08:55:02,Missing values; 
4615118.0,95662.0,Paul Anderson,Cynthia14@gmail.com,2404994511.0,,Canberra,New South Wales,2304.0,Australia,22.0,Male,High,Regular,07-07-23,2023.0,July,17:36:25,5.0,273.1673701,1365.83685,Home Decor,IKEA,Lighting,Good,Express,Debit Card,Delivered,3.0,Desk lamps,2023-07-07,2025-11-15 17:36:25,Missing values; 
4135552.0,74198.0,Philip Taylor,Emily10@gmail.com,3816350184.0,97802 Guerrero Island,Cairns,New South Wales,14157.0,Australia,22.0,Female,High,Regular,3/24/2023,2023.0,March,,6.0,384.4400485,2306.640291,Grocery,Pepsi,Water,Bad,Same-Day,PayPal,Delivered,1.0,Spring water,2023-03-24,,Missing values; 
2808245.0,21350.0,Richard Wilson,Stephen13@gmail.com,9724469212.0,29237 Baker Station Apt. 151,Sydney,New South Wales,38621.0,Australia,22.0,Female,High,Regular,3/13/2023,2023.0,March,,1.0,164.9474835,164.9474835,Clothing,Adidas,T-shirt,Good,Standard,Cash,Delivered,3.0,Henley tee,2023-03-13,,Missing values; 
7763595.0,49380.0,Isaac Logan,Alexis34@gmail.com,3512459073.0,4840 Jared Valleys,Hanover,Berlin,10016.0,Germany,22.0,Male,High,Regular,1/27/2024,,January,12:03:42,5.0,329.6055491,1648.027745,Grocery,Coca-Cola,Soft Drink,Average,Express,PayPal,Delivered,2.0,Ginger ale,2024-01-27,2025-11-15 12:03:42,Missing values; 
9862441.0,93995.0,Kenneth Ray,Robin81@gmail.com,6416961111.0,3448 Greer Fords,Dresden,Berlin,53022.0,Germany,22.0,Female,High,Regular,4/24/2023,2023.0,April,14:59:11,2.0,31.11001032,62.22002064,Books,Penguin Books,Fiction,Bad,Standard,,Delivered,1.0,Literary fiction,2023-04-24,2025-11-15 14:59:11,Missing values; 
1983904.0,88736.0,Emily Kelly,Jeffery39@gmail.com,6471581462.0,1757 Elizabeth Fort Suite 880,Edmonton,Ontario,6759.0,Canada,22.0,Female,High,Regular,1/25/2024,2024.0,January,15:56:43,5.0,265.0191661,1325.095831,Home Decor,Home Depot,Tools,,Same-Day,Cash,Delivered,,Saw,2024-01-25,2025-11-15 15:56:43,Missing values; 
4764471.0,46089.0,Mark Bryant,Charles35@gmail.com,3233136448.0,842 Frazier Mountains Suite 788,Nuremberg,Berlin,24724.0,Germany,22.0,Male,High,Regular,08-03-23,2023.0,August,,10.0,311.810326,3118.10326,Books,Penguin Books,Non-Fiction,Excellent,Same-Day,Credit Card,Delivered,5.0,Travel,2023-08-03,,Missing values; 
2675025.0,13582.0,Colin Nelson,Andrea40@gmail.com,5918931389.0,61723 Curtis Port Apt. 037,Halifax,Ontario,,Canada,22.0,Female,High,Regular,02-02-24,2024.0,February,7:55:02,4.0,235.5809481,942.3237923,Books,HarperCollins,Non-Fiction,Excellent,Standard,Cash,Delivered,4.0,Self-help,2024-02-02,2025-11-15 07:55:02,Missing values; 
3103455.0,15407.0,Abigail Reed,Erik70@gmail.com,3341540417.0,5477 Barry Way Suite 942,Leeds,,52352.0,UK,22.0,Male,High,Regular,9/26/2023,2023.0,September,6:01:02,7.0,105.481696,738.3718723,Grocery,Nestle,Snacks,Average,Standard,Cash,Delivered,2.0,Chips,2023-09-26,2025-11-15 06:01:02,Missing values; 
7364594.0,57768.0,Elaine Walsh,Stephanie47@gmail.com,6698857648.0,69254 Clark Springs,Quebec City,Ontario,11873.0,Canada,22.0,,High,Regular,5/16/2023,2023.0,May,10:40:54,7.0,245.3427956,1717.399569,Clothing,Adidas,Shoes,Bad,Standard,Debit Card,Delivered,1.0,Flip flops,2023-05-16,2025-11-15 10:40:54,Missing values; 
9145416.0,42895.0,William Gregory,Juan43@gmail.com,3512979267.0,3285 Karen Garden,Melbourne,New South Wales,99096.0,Australia,22.0,Female,High,Regular,07-10-23,2023.0,July,4:04:07,10.0,437.7013115,4377.013115,Books,Penguin Books,Fiction,,Express,Credit Card,Delivered,,Science fiction,2023-07-10,2025-11-15 04:04:07,Missing values; 
2878508.0,93554.0,Patricia Hall,Seth34@gmail.com,4061894737.0,20229 Gregory Estates,Leipzig,Berlin,97655.0,Germany,22.0,Male,High,Regular,10-01-23,2023.0,October,21:52:48,2.0,355.7411927,711.4823853,Grocery,,Snacks,Average,Standard,Debit Card,Delivered,2.0,Nuts,2023-10-01,2025-11-15 21:52:48,Missing values; 
9732390.0,71899.0,Maria Owens,Ashley64@gmail.com,7754089776.0,965 Knight Locks Suite 435,Newcastle,New South Wales,30476.0,Australia,22.0,Female,High,Regular,1/31/2024,2024.0,,15:21:20,6.0,193.6911424,1162.146854,Grocery,Pepsi,Soft Drink,Good,Standard,Cash,Delivered,4.0,Lemon-lime soda,2024-01-31,2025-11-15 15:21:20,Missing values; 
5729193.0,91048.0,,Crystal7@gmail.com,3071068735.0,1716 Wolf Mountains,Kitchener,Ontario,54627.0,Canada,22.0,Female,High,Regular,9/24/2023,2023.0,September,0:58:24,7.0,91.79125915,642.538814,Clothing,Adidas,T-shirt,Bad,Same-Day,Credit Card,Delivered,1.0,Plain tee,2023-09-24,2025-11-15 00:58:24,Missing values; 
4114096.0,85705.0,Matthew Cole,Mary26@gmail.com,9787761282.0,136 Harris Mills Suite 489,Victoria,,4758.0,Canada,22.0,Female,High,Regular,01-05-24,2024.0,January,4:31:53,5.0,177.5616172,887.8080861,Books,Random House,Non-Fiction,Average,Standard,Debit Card,Delivered,2.0,Travel,2024-01-05,2025-11-15 04:31:53,Missing values; 
3463222.0,64840.0,Rebecca Little,Jason57@gmail.com,,886 Anna Field Suite 455,Birmingham,England,49591.0,UK,22.0,Female,High,Regular,02-06-24,2024.0,February,15:45:25,7.0,231.3249788,1619.274851,Books,HarperCollins,Non-Fiction,Average,Express,Credit Card,Delivered,2.0,Biography,2024-02-06,2025-11-15 15:45:25,Missing values; 
1027018.0,48501.0,Ashley Barnes,Elizabeth67@gmail.com,1874256818.0,406 Debra Valleys,Liverpool,England,24567.0,UK,22.0,Male,High,Regular,6/18/2023,2023.0,June,5:04:26,8.0,,1255.17455,Grocery,Nestle,Snacks,Good,Standard,PayPal,Delivered,3.0,Crackers,2023-06-18,2025-11-15 05:04:26,Missing values; 
,75993.0,Michelle Ware,John21@gmail.com,6341363895.0,47203 Paul Drive,Oxford,England,68701.0,UK,22.0,Male,High,Regular,8/14/2023,2023.0,August,21:48:52,2.0,370.666896,741.333792,Home Decor,IKEA,Furniture,Average,Standard,Debit Card,Delivered,2.0,Wardrobe,2023-08-14,2025-11-15 21:48:52,Missing values; 
2450840.0,21245.0,,Jessica28@gmail.com,9751006323.0,5250 Dennis Mill Apt. 716,Hull,England,80525.0,UK,22.0,Female,High,Regular,10/22/2023,2023.0,October,6:36:36,1.0,148.5072402,148.5072402,Electronics,Sony,Television,Average,Express,Debit Card,Delivered,2.0,OLED TV,2023-10-22,2025-11-15 06:36:36,Missing values; 
5043542.0,79910.0,Emily Dunn,Jacob82@gmail.com,5487723152.0,362 Edward Corners Apt. 011,Edinburgh,England,75238.0,UK,22.0,,High,Regular,10/24/2023,2023.0,October,6:26:19,3.0,229.6698476,689.0095427,Electronics,Samsung,Television,Good,Same-Day,Credit Card,Delivered,3.0,LED TV,2023-10-24,2025-11-15 06:26:19,Missing values; 
5868402.0,39059.0,Brian Austin,Lindsay100@gmail.com,6535758703.0,096 Smith Parkways,London,England,9174.0,UK,22.0,Male,High,Regular,4/13/2023,2023.0,April,21:43:48,8.0,427.7061566,3421.649252,Electronics,Sony,Television,Bad,Express,,Delivered,1.0,Smart TV,2023-04-13,2025-11-15 21:43:48,Missing values; 
2864164.0,81823.0,Jose Myers,Kelly35@gmail.com,7355678359.0,2918 Mitchell Underpass,Liverpool,England,99735.0,UK,22.0,Male,Low,Regular,,2023.0,June,15:43:56,2.0,439.1950317,878.3900634,Grocery,Coca-Cola,Juice,Excellent,Same-Day,Debit Card,Delivered,5.0,Mango juice,,2025-11-15 15:43:56,Missing values; 
3238950.0,75540.0,Alexis Martin,,6018519670.0,106 Campbell Harbors Suite 696,Hobart,New South Wales,63998.0,Australia,22.0,Male,Medium,Regular,12-10-23,2023.0,December,20:59:00,4.0,190.4327227,761.7308909,Home Decor,IKEA,Furniture,Average,Express,Cash,Delivered,2.0,TV stand,2023-12-10,2025-11-15 20:59:00,Missing values; 
6612306.0,63198.0,Kevin Duran,Vanessa58@gmail.com,2141275910.0,2529 Bryant Mission Apt. 870,Hull,,16229.0,UK,22.0,Male,High,Regular,1/31/2024,2024.0,January,4:04:22,2.0,470.8326441,941.6652881,Books,HarperCollins,Thriller,Excellent,Standard,Cash,Delivered,5.0,Detective,2024-01-31,2025-11-15 04:04:22,Missing values; 
,18571.0,Janice Williams,Adam9@gmail.com,3085067814.0,56959 Michael Trafficway,Hull,England,38069.0,UK,22.0,Male,High,Regular,10-02-23,2023.0,October,13:46:22,2.0,314.0447972,628.0895943,Home Decor,IKEA,Decorations,Average,Same-Day,Debit Card,Delivered,2.0,Mirrors,2023-10-02,2025-11-15 13:46:22,Missing values; 
3115974.0,68288.0,Joel Brown,Christine46@gmail.com,5953061211.0,51878 Carlos Walks,Berlin,Berlin,55693.0,,22.0,Female,Low,Regular,03-01-23,2023.0,March,12:27:46,7.0,397.1441385,2780.008969,Grocery,Pepsi,Soft Drink,Bad,Same-Day,Cash,Delivered,1.0,Energy drink,2023-03-01,2025-11-15 12:27:46,Missing values; 
7355979.0,70199.0,Christina Terrell,Benjamin96@gmail.com,1315978576.0,92551 Jones Neck Suite 419,Portsmouth,England,20434.0,UK,22.0,Female,Low,Regular,09-03-23,2023.0,September,20:08:20,3.0,67.25939655,201.7781896,Electronics,Samsung,Television,Good,,PayPal,Delivered,3.0,Android TV,2023-09-03,2025-11-15 20:08:20,Missing values; 
6980706.0,63268.0,Christopher Walton,Kelly18@gmail.com,6768762008.0,3042 Murphy Forges,Albuquerque,Montana,59615.0,USA,22.0,Male,Low,Regular,7/28/2023,2023.0,July,6:02:20,9.0,29.45019991,265.0517991,Electronics,Samsung,Smartphone,,Express,Cash,Delivered,,Sony Xperia,2023-07-28,2025-11-15 06:02:20,Missing values; 
9726705.0,79631.0,Mark Estrada,Brandi59@gmail.com,6095634582.0,1473 Linda Way,Halifax,Ontario,98028.0,Canada,22.0,Male,Medium,Regular,6/24/2023,2023.0,June,15:34:11,6.0,375.5253001,,Grocery,Coca-Cola,Soft Drink,Excellent,Standard,Cash,Delivered,5.0,Iced tea,2023-06-24,2025-11-15 15:34:11,Missing values; 
3894419.0,93390.0,William Bennett,Mary33@gmail.com,7447925497.0,7424 Mcgrath Vista,Oshawa,Ontario,73391.0,,22.0,Male,Low,Regular,10/13/2023,2023.0,October,17:12:42,8.0,213.7405711,1709.924569,Clothing,Zara,Dress,Average,Standard,Cash,Delivered,2.0,Maxi dress,2023-10-13,2025-11-15 17:12:42,Missing values; 
9583563.0,52671.0,Matthew Jenkins,Alexander17@gmail.com,5726812940.0,8993 Ashley Wall Apt. 941,Sydney,New South Wales,42505.0,Australia,22.0,,Medium,Regular,05-02-23,2023.0,May,19:34:56,5.0,12.22450561,61.12252806,Electronics,Samsung,Smartphone,Average,Express,PayPal,Delivered,2.0,Motorola Moto,2023-05-02,2025-11-15 19:34:56,Missing values; 
3495481.0,89068.0,Ms. Briana Horne,Elijah68@gmail.com,6621728766.0,1592 Elizabeth Falls,Victoria,Ontario,7101.0,Canada,22.0,Male,High,Regular,2/22/2024,2024.0,February,20:23:34,5.0,473.9024994,2369.512497,Home Decor,Bed Bath & Beyond,Bedding,Good,,Debit Card,Delivered,4.0,Comforter,2024-02-22,2025-11-15 20:23:34,Missing values; 
2462605.0,37042.0,Jessica Hunter,Jacob82@gmail.com,6452381703.0,099 Smith Fields,Sacramento,New Mexico,88030.0,USA,22.0,Female,Low,Regular,02-01-24,2024.0,February,7:03:03,10.0,164.5783285,1645.783285,Clothing,,T-shirt,Excellent,Standard,Credit Card,Delivered,4.0,Crew neck tee,2024-02-01,2025-11-15 07:03:03,Missing values; 
2033959.0,75341.0,Taylor Austin,Mary11@gmail.com,6628679459.0,30126 Turner Loaf,Toowoomba,New South Wales,72762.0,Australia,22.0,Male,Medium,Regular,04-06-23,2023.0,April,12:19:33,1.0,,283.1439373,Books,Random House,Fiction,Good,Express,PayPal,Delivered,4.0,Science fiction,2023-04-06,2025-11-15 12:19:33,Missing values; 
3430155.0,23638.0,Nancy Savage,Christine95@gmail.com,7333233436.0,71622 Stacey Rapids,Essen,Berlin,,Germany,22.0,Male,High,Regular,10/24/2023,2023.0,October,4:08:51,8.0,294.6468049,2357.174439,Books,Random House,Literature,Bad,Same-Day,PayPal,Delivered,1.0,Essays,2023-10-24,2025-11-15 04:08:51,Missing values; 
8133929.0,45752.0,Kristy Hebert,Molly2@gmail.com,5689611144.0,97676 Kenneth Plaza Apt. 626,Wollongong,New South Wales,75350.0,Australia,22.0,Male,Medium,Regular,11/17/2023,2023.0,November,0:53:22,9.0,402.6067531,3623.460778,Electronics,Sony,Headphones,Average,Standard,,Delivered,2.0,In-ear headphones,2023-11-17,2025-11-15 00:53:22,Missing values; 
4395460.0,22587.0,Larry Anthony,Eric97@gmail.com,8525141440.0,086 Nguyen Station,Wuppertal,Berlin,75470.0,Germany,22.0,Male,High,Regular,,2023.0,March,3:12:15,2.0,400.3668647,800.7337294,Electronics,Sony,Headphones,Average,Standard,Cash,Delivered,2.0,Noise-cancelling headphones,,2025-11-15 03:12:15,Missing values; 
5390767.0,47456.0,Ryan Rose,Ryan25@gmail.com,5356582276.0,56435 Mckinney Unions,Albury-Wodonga,New South Wales,99493.0,Australia,22.0,Female,Low,Regular,6/13/2023,2023.0,June,10:17:41,3.0,419.6357328,1258.907198,Books,Random House,Non-Fiction,Good,,Credit Card,Delivered,4.0,Memoir,2023-06-13,2025-11-15 10:17:41,Missing values; 
5771447.0,35873.0,John Farrell,Jacob12@gmail.com,1840403187.0,,Wichita,Pennsylvania,17177.0,USA,22.0,Female,Medium,Regular,10/13/2023,2023.0,October,7:13:02,2.0,342.8988462,685.7976924,Electronics,Sony,Television,Excellent,Express,Credit Card,Delivered,4.0,4K TV,2023-10-13,2025-11-15 07:13:02,Missing values; 
7458390.0,52541.0,John Smith,Christopher8@gmail.com,6573916198.0,2154 Martinez Mountain Apt. 825,Mackay,New South Wales,5521.0,Australia,22.0,Male,Low,Regular,12/18/2023,2023.0,December,12:20:35,9.0,,1124.570145,Home Decor,Bed Bath & Beyond,Bathroom,Average,Same-Day,PayPal,Delivered,2.0,Shower curtain,2023-12-18,2025-11-15 12:20:35,Missing values; 
4739699.0,35699.0,April Smith,Austin92@gmail.com,3883653425.0,,Newcastle,New South Wales,12555.0,Australia,22.0,Male,Medium,Regular,02-03-24,2024.0,February,22:18:51,3.0,380.4776996,1141.433099,Grocery,Coca-Cola,Juice,Good,Express,Credit Card,Delivered,4.0,Apple juice,2024-02-03,2025-11-15 22:18:51,Missing values; 
4287699.0,71847.0,Jennifer Martin,Robert99@gmail.com,,4544 Johnson Bridge,Portsmouth,England,22865.0,UK,22.0,Male,Medium,Regular,09-09-23,2023.0,September,6:26:47,7.0,120.2216039,841.551227,Home Decor,Home Depot,Furniture,Bad,Standard,Cash,Delivered,1.0,Wardrobe,2023-09-09,2025-11-15 06:26:47,Missing values; 
1969598.0,26214.0,Rebecca Manning,Johnathan23@gmail.com,8394689117.0,0889 Darlene Flat Suite 725,Southampton,England,31477.0,UK,22.0,Male,Medium,Regular,7/13/2023,2023.0,July,13:15:41,5.0,310.4748214,1552.374107,Electronics,Sony,Television,,Standard,PayPal,Delivered,,OLED TV,2023-07-13,2025-11-15 13:15:41,Missing values; 
4511387.0,20478.0,Carol Johnson,Zachary47@gmail.com,7158225264.0,5086 Obrien Park Apt. 289,London,Ontario,,Canada,22.0,Female,Medium,Regular,02-10-24,2024.0,February,11:42:06,7.0,193.092645,1351.648515,Clothing,Adidas,Shoes,Excellent,Express,Debit Card,Delivered,5.0,Loafers,2024-02-10,2025-11-15 11:42:06,Missing values; 
5164961.0,49487.0,April White MD,Jacob41@gmail.com,5990048000.0,204 Williams Loaf Apt. 769,Melbourne,New South Wales,588.0,,22.0,Female,Low,Regular,07-11-23,2023.0,July,20:52:26,9.0,78.99279874,710.9351886,Clothing,Zara,Jeans,Bad,Standard,Debit Card,Delivered,1.0,Skinny jeans,2023-07-11,2025-11-15 20:52:26,Missing values; 
3857968.0,78612.0,Kelly Huber,,8900449033.0,3130 Angela Avenue,Essen,Berlin,89175.0,Germany,22.0,Male,High,Regular,04-07-23,2023.0,April,7:40:22,1.0,439.6635814,439.6635814,Books,HarperCollins,Thriller,Excellent,Express,Debit Card,Delivered,5.0,Psychological thriller,2023-04-07,2025-11-15 07:40:22,Missing values; 
5766444.0,27575.0,David Evans,Rachel67@gmail.com,3226800866.0,018 Beck Knolls,Colorado Springs,Vermont,5348.0,USA,22.0,Female,Low,Regular,4/28/2023,2023.0,April,8:13:09,,94.31763211,471.5881606,Electronics,Samsung,Television,Excellent,Express,Debit Card,Delivered,5.0,Curved TV,2023-04-28,2025-11-15 08:13:09,Missing values; 
6121557.0,42466.0,Jeremy Morgan,Katie85@gmail.com,9602772927.0,,Sydney,New South Wales,51884.0,Australia,22.0,Female,Medium,Regular,7/20/2023,2023.0,July,13:23:06,1.0,499.6705459,499.6705459,Books,Random House,Fiction,Good,Same-Day,Credit Card,Delivered,3.0,Literary fiction,2023-07-20,2025-11-15 13:23:06,Missing values; 
6301957.0,12933.0,Nicholas Harris,Debra48@gmail.com,9176552033.0,9117 Rice Port,Plymouth,England,36871.0,UK,22.0,Female,Low,Regular,,2023.0,October,18:40:54,5.0,16.94844554,84.74222771,Electronics,Apple,Smartphone,Average,Standard,Credit Card,Delivered,2.0,Sony Xperia,,2025-11-15 18:40:54,Missing values; 
7842183.0,59159.0,Jonathan Kennedy,Matthew53@gmail.com,3747373814.0,661 Alvarado Plaza,Portsmouth,,17775.0,UK,22.0,Male,Medium,Regular,1/26/2024,2024.0,January,15:47:22,9.0,356.6322841,3209.690557,Books,Random House,Literature,Good,Express,Credit Card,Delivered,3.0,Poetry,2024-01-26,2025-11-15 15:47:22,Missing values; 
8442217.0,18517.0,Sean Cooper,William12@gmail.com,7003276551.0,79460 Daniel Stream Suite 087,Sacramento,North Carolina,27701.0,USA,22.0,Male,High,Regular,8/26/2023,2023.0,August,11:37:11,1.0,,54.839142,Grocery,Coca-Cola,Juice,Average,Same-Day,Cash,Delivered,2.0,Apple juice,2023-08-26,2025-11-15 11:37:11,Missing values; 
4052137.0,17124.0,Robert Brown,Richard92@gmail.com,8976745814.0,1492 Green Square Suite 665,Hobart,New South Wales,38488.0,Australia,22.0,,Medium,Regular,8/17/2023,2023.0,August,8:53:04,1.0,49.50871955,49.50871955,Home Decor,Bed Bath & Beyond,Bathroom,Average,Standard,PayPal,Delivered,2.0,Toothbrush holder,2023-08-17,2025-11-15 08:53:04,Missing values; 
6034943.0,16532.0,Jennifer Reyes,Stephanie13@gmail.com,3500446300.0,928 Jesse Highway Apt. 708,Jacksonville,Ohio,45088.0,USA,22.0,Male,Low,Regular,02-03-24,2024.0,February,5:23:35,1.0,277.2252209,277.2252209,Home Decor,,Decorations,Excellent,Same-Day,Credit Card,Delivered,5.0,Vases,2024-02-03,2025-11-15 05:23:35,Missing values; 
9922174.0,52858.0,Thomas Mccann,Matthew55@gmail.com,1344171901.0,7792 Foster Park Suite 146,Hull,England,26631.0,UK,22.0,Male,Low,Regular,10-01-23,2023.0,October,5:11:07,1.0,478.0974819,478.0974819,Grocery,Nestle,Snacks,,Standard,Cash,Delivered,,Nuts,2023-10-01,2025-11-15 05:11:07,Missing values; 
2344287.0,35757.0,Ashley Joseph,Abigail53@gmail.com,3066902193.0,653 Meyer Inlet Suite 154,,North Carolina,27436.0,USA,22.0,Female,Low,Regular,09-07-23,2023.0,September,6:16:25,4.0,167.8157232,671.2628927,Home Decor,Home Depot,Tools,Excellent,Same-Day,PayPal,Delivered,4.0,Utility knife,2023-09-07,2025-11-15 06:16:25,Missing values; 
6426329.0,78044.0,Nicholas Lowe,Laura36@gmail.com,9436321827.0,,Toronto,Ontario,87409.0,Canada,22.0,Male,Low,Regular,2/15/2024,2024.0,February,16:57:37,6.0,491.7856717,2950.71403,Books,HarperCollins,Non-Fiction,Good,Same-Day,PayPal,Delivered,4.0,Travel,2024-02-15,2025-11-15 16:57:37,Missing values; 
1039093.0,72061.0,Gary Schaefer,Roger12@gmail.com,3478480960.0,482 Shane Common Suite 849,Liverpool,England,21621.0,UK,22.0,Male,Low,Regular,11-04-23,2023.0,November,5:32:54,4.0,209.5540774,838.2163094,,Apple,Smartphone,Good,Same-Day,Credit Card,Delivered,4.0,Samsung Galaxy,2023-11-04,2025-11-15 05:32:54,Missing values; 
3018463.0,22572.0,Victor Allen,Curtis91@gmail.com,5078196790.0,9161 Marie Fords Suite 244,Leicester,England,92916.0,UK,22.0,Female,Low,Regular,10/25/2023,2023.0,October,9:35:22,2.0,237.7913366,475.5826733,,Nestle,Snacks,Bad,Standard,Credit Card,Delivered,1.0,Beef jerky,2023-10-25,2025-11-15 09:35:22,Missing values; 
7227904.0,66278.0,Dylan Perez,James74@gmail.com,9684867797.0,61853 Duran Extensions,Toowoomba,New South Wales,53963.0,Australia,22.0,Male,Medium,Regular,05-02-23,2023.0,May,,5.0,48.8907434,244.453717,Books,HarperCollins,Fiction,Average,Same-Day,Credit Card,Delivered,2.0,Fantasy,2023-05-02,,Missing values; 
1420177.0,95372.0,Mary Phelps,Robin11@gmail.com,8751641233.0,65183 Le Lakes Suite 782,Liverpool,England,93887.0,UK,22.0,Female,High,Regular,6/16/2023,2023.0,June,19:54:43,6.0,376.6635809,2259.981485,Electronics,,Headphones,Bad,Standard,Credit Card,Delivered,1.0,Gaming headphones,2023-06-16,2025-11-15 19:54:43,Missing values; 
,38539.0,Richard Moreno,Marie8@gmail.com,1858754023.0,195 Amanda Mill,Halifax,Ontario,22146.0,Canada,22.0,Male,Low,Regular,9/28/2023,2023.0,September,19:52:45,6.0,390.6909769,2344.145861,Clothing,Adidas,Jacket,Bad,Express,Credit Card,Delivered,1.0,Denim jacket,2023-09-28,2025-11-15 19:52:45,Missing values; 
2125902.0,96613.0,Mary Kelly,Taylor29@gmail.com,3193572173.0,,Los Angeles,Illinois,62018.0,USA,22.0,Male,Medium,Regular,12/31/2023,2023.0,December,6:47:57,3.0,161.0926146,483.2778439,Grocery,Coca-Cola,Juice,Excellent,Standard,Debit Card,Delivered,5.0,Pineapple juice,2023-12-31,2025-11-15 06:47:57,Missing values; 
1159992.0,,Julian Mack,Stephen21@gmail.com,7946659196.0,1802 Michelle Lock,Munich,Berlin,50951.0,Germany,22.0,Male,High,Regular,9/25/2023,2023.0,September,21:43:45,8.0,356.6511529,2853.209223,Home Decor,Bed Bath & Beyond,Kitchen,Good,Express,PayPal,Delivered,4.0,Stove,2023-09-25,2025-11-15 21:43:45,Missing values; 
6220779.0,58316.0,Walter Fry,John26@gmail.com,1793749738.0,1934 Darrell View Apt. 386,Albury-Wodonga,New South Wales,92782.0,Australia,22.0,Female,Medium,Regular,07-10-23,2023.0,July,22:21:24,,445.9172864,1783.669146,Books,HarperCollins,Non-Fiction,Bad,Same-Day,PayPal,Delivered,1.0,Cooking,2023-07-10,2025-11-15 22:21:24,Missing values; 
8893325.0,94488.0,Kristen Morales,Kelly36@gmail.com,1343653999.0,98202 Bush Light,Arlington,Alabama,35257.0,USA,22.0,Female,Low,Regular,09-05-23,2023.0,September,5:05:09,,48.69125251,340.8387676,Home Decor,Home Depot,Tools,Excellent,Standard,Cash,Delivered,5.0,Hammer,2023-09-05,2025-11-15 05:05:09,Missing values; 
7362181.0,10232.0,Rebecca Mitchell,Isaiah24@gmail.com,,1508 Lawrence Extensions,Cologne,Berlin,92116.0,Germany,22.0,Female,Low,Regular,4/30/2023,2023.0,April,17:17:07,10.0,341.8094316,3418.094316,Grocery,Nestle,Coffee,Average,Standard,PayPal,Delivered,2.0,Mocha,2023-04-30,2025-11-15 17:17:07,Missing values; 
2478909.0,24051.0,Sara Hickman,Mallory37@gmail.com,2513383760.0,9202 Adams Forges,Dortmund,Berlin,35331.0,Germany,22.0,Male,,Regular,12/23/2023,2023.0,December,18:01:47,8.0,291.1390738,2329.11259,Books,Penguin Books,Children's,Bad,Same-Day,Cash,Delivered,1.0,Puzzles,2023-12-23,2025-11-15 18:01:47,Missing values; 
1424268.0,50379.0,Jonathan Mcmillan,Andrew18@gmail.com,4583492860.0,,Atlanta,South Dakota,57206.0,USA,22.0,Male,High,Regular,6/13/2023,2023.0,June,13:57:33,5.0,11.97022117,59.85110585,Clothing,Adidas,Jacket,Excellent,Standard,Debit Card,Delivered,4.0,Trench coat,2023-06-13,2025-11-15 13:57:33,Missing values; 
3329784.0,13865.0,Dennis Alexander,David17@gmail.com,3388446519.0,1781 Darryl Glens Suite 918,New York,North Dakota,58473.0,USA,22.0,Male,Medium,Regular,12/14/2023,2023.0,December,11:40:08,1.0,453.2495225,,Clothing,Adidas,Jacket,Excellent,Express,Credit Card,Delivered,5.0,Parka,2023-12-14,2025-11-15 11:40:08,Missing values; 
8020135.0,27233.0,Erica Thompson,Krystal69@gmail.com,8861666945.0,5803 Payne Plains,Townsville,New South Wales,93385.0,Australia,22.0,Female,Low,Regular,02-08-24,2024.0,February,0:27:49,,270.4876451,1893.413516,Grocery,Coca-Cola,Water,Average,Standard,Credit Card,Delivered,2.0,Coconut water,2024-02-08,2025-11-15 00:27:49,Missing values; 
8357408.0,86985.0,Michael Juarez,Barbara45@gmail.com,5433504081.0,00694 Bryant Parks,Nuremberg,Berlin,43863.0,Germany,22.0,Female,Low,Regular,9/25/2023,2023.0,September,20:01:07,3.0,273.1419049,819.4257146,Grocery,,Soft Drink,Excellent,Express,Credit Card,Delivered,4.0,Energy drink,2023-09-25,2025-11-15 20:01:07,Missing values; 
2859350.0,79645.0,Sarah Anderson,Ian59@gmail.com,8515209224.0,80087 Roy Locks Suite 088,Townsville,New South Wales,97042.0,Australia,22.0,Female,Low,Regular,5/26/2023,2023.0,May,2:20:20,8.0,347.1580626,2777.264501,Clothing,Nike,Shorts,Good,,Credit Card,Delivered,4.0,Athletic shorts,2023-05-26,2025-11-15 02:20:20,Missing values; 
8541695.0,24319.0,Crystal Lee,Angela20@gmail.com,7179093555.0,227 John Neck Apt. 306,Louisville,Alaska,99783.0,USA,22.0,Female,Medium,Regular,07-06-23,2023.0,July,,10.0,180.3552034,1803.552034,Clothing,Adidas,T-shirt,Excellent,Express,PayPal,Delivered,5.0,Long-sleeve tee,2023-07-06,,Missing values; 
9529790.0,97204.0,Kimberly Smith,Jill80@gmail.com,1463578649.0,2281 Crystal Spurs,Mackay,New South Wales,60306.0,Australia,22.0,Male,Low,Regular,08-10-23,2023.0,August,0:46:24,,15.86227585,79.31137927,Clothing,Adidas,T-shirt,Good,Standard,PayPal,Delivered,3.0,Scoop neck tee,2023-08-10,2025-11-15 00:46:24,Missing values; 
2431895.0,79333.0,Thomas Smith,Sean45@gmail.com,1107480318.0,3945 Jennifer Land Suite 927,Los Angeles,Missouri,,USA,22.0,Male,Low,Regular,9/15/2023,2023.0,September,4:19:48,8.0,483.4181713,3867.34537,Electronics,Sony,Headphones,Good,Same-Day,Debit Card,Delivered,3.0,Studio headphones,2023-09-15,2025-11-15 04:19:48,Missing values; 
9369515.0,55663.0,Michele Morris,Carol76@gmail.com,2209668732.0,1857 Megan Tunnel,Ballarat,New South Wales,,Australia,22.0,Female,Medium,Regular,6/22/2023,2023.0,June,17:59:31,10.0,296.2002171,2962.002171,Home Decor,Bed Bath & Beyond,Bedding,Average,Standard,Cash,Delivered,2.0,Throw pillow,2023-06-22,2025-11-15 17:59:31,Missing values; 
1720301.0,25656.0,Mark Hernandez,Christina2@gmail.com,7530116231.0,5949 Stevens Manor Suite 944,Leicester,,1956.0,UK,22.0,Male,Low,Regular,2/28/2024,2024.0,February,19:08:21,9.0,84.87219931,763.8497938,Grocery,Nestle,Chocolate,Bad,Standard,Debit Card,Delivered,1.0,Chocolate-covered fruits,2024-02-28,2025-11-15 19:08:21,Missing values; 
1921104.0,87704.0,Dawn Kramer,Kathleen15@gmail.com,1558079444.0,0421 Thomas Crossing Suite 503,Bonn,Berlin,93425.0,Germany,22.0,Male,Low,Regular,,2023.0,September,6:29:00,4.0,45.61532726,182.4613091,Books,Random House,Fiction,Excellent,Standard,PayPal,Delivered,5.0,Fantasy,,2025-11-15 06:29:00,Missing values; 
1326090.0,81785.0,Catherine Walls,Douglas24@gmail.com,8970563427.0,6381 Harris Village Suite 620,Raleigh,New Jersey,7505.0,USA,22.0,Male,Low,Regular,6/27/2023,,June,8:36:15,10.0,27.45720384,274.5720384,Grocery,Pepsi,Water,Excellent,Standard,PayPal,Delivered,4.0,Purified water,2023-06-27,2025-11-15 08:36:15,Missing values; 
5108610.0,70642.0,Shannon Nguyen,Brandon31@gmail.com,1744663912.0,95687 David Trace Apt. 288,Gold Coast,New South Wales,75585.0,Australia,22.0,Male,Low,Regular,9/20/2023,2023.0,September,11:04:01,1.0,471.0862252,,Books,Penguin Books,Fiction,Excellent,Standard,PayPal,Delivered,4.0,Romance,2023-09-20,2025-11-15 11:04:01,Missing values; 
6575307.0,71844.0,Nicholas Harrington,John72@gmail.com,3871251677.0,583 Sarah Inlet Suite 328,Philadelphia,Ohio,44298.0,USA,22.0,,Medium,Regular,11/26/2023,2023.0,November,12:32:22,3.0,424.4509832,1273.35295,Clothing,Nike,Shoes,Good,Express,Cash,Delivered,4.0,Loafers,2023-11-26,2025-11-15 12:32:22,Missing values; 
7611459.0,39731.0,William Young,Rebecca99@gmail.com,9730581827.0,0134 Brendan Glen,Mnster,Berlin,84460.0,Germany,22.0,Male,Low,Regular,3/23/2023,2023.0,March,17:39:27,6.0,32.05290661,192.3174397,Books,HarperCollins,Thriller,Good,Same-Day,,Delivered,4.0,Adventure,2023-03-23,2025-11-15 17:39:27,Missing values; 
6997795.0,24829.0,Tiffany Park DDS,Zachary69@gmail.com,3290326753.0,628 Rogers Square Apt. 085,Austin,Georgia,31747.0,USA,22.0,,Low,Regular,04-02-23,2023.0,April,2:11:21,4.0,363.8655397,1455.462159,Clothing,Zara,Dress,Average,Same-Day,Debit Card,Delivered,2.0,Casual dress,2023-04-02,2025-11-15 02:11:21,Missing values; 
2010272.0,33950.0,Shawna Gonzalez,Mario89@gmail.com,6442900388.0,7434 Stevens Brook Apt. 359,Dresden,Berlin,95670.0,Germany,22.0,,High,Regular,9/24/2023,2023.0,September,13:14:29,10.0,35.71200654,357.1200654,Grocery,Coca-Cola,Soft Drink,Excellent,Express,Credit Card,Delivered,4.0,Ginger ale,2023-09-24,2025-11-15 13:14:29,Missing values; 
2778022.0,20453.0,Victoria Miller,Amanda94@gmail.com,6682321136.0,72612 Acosta Lake,Dallas,North Carolina,28502.0,USA,22.0,Female,High,Regular,5/20/2023,2023.0,May,22:57:02,2.0,221.9519936,443.9039871,Clothing,Zara,Shirt,Excellent,Standard,,Delivered,4.0,Sweatshirt,2023-05-20,2025-11-15 22:57:02,Missing values; 
2548454.0,71058.0,Jeremy Macdonald,Shelly62@gmail.com,1944186407.0,923 Powell Square Apt. 832,Kitchener,Ontario,20408.0,Canada,22.0,Male,Medium,Regular,,2023.0,July,17:45:11,4.0,420.5099935,1682.039974,Grocery,Nestle,Chocolate,Excellent,Same-Day,PayPal,Delivered,4.0,Chocolate-covered fruits,,2025-11-15 17:45:11,Missing values; 
4113744.0,57433.0,Jessica Moses,Sandra51@gmail.com,4829613103.0,178 Monica Island,Kelowna,Ontario,57279.0,,22.0,Male,Low,Regular,1/21/2024,2024.0,January,17:31:29,5.0,359.1567271,1795.783635,Books,Penguin Books,Children's,Average,Same-Day,Credit Card,Delivered,2.0,Sports equipment,2024-01-21,2025-11-15 17:31:29,Missing values; 
9052064.0,23325.0,Sherry Garcia,Douglas21@gmail.com,1888078230.0,907 Edward Courts Suite 128,Liverpool,England,6166.0,,22.0,Female,Medium,Regular,4/29/2023,2023.0,April,18:30:26,7.0,360.8208374,2525.745862,Grocery,Pepsi,Water,Excellent,Same-Day,Cash,Delivered,4.0,Flavored water,2023-04-29,2025-11-15 18:30:26,Missing values; 
3277159.0,,James Johnson,Ashley38@gmail.com,3565235154.0,219 Deleon Unions Suite 413,Canberra,New South Wales,27364.0,Australia,22.0,Male,Medium,Regular,11-12-23,2023.0,November,22:11:04,4.0,92.4983257,369.9933028,Grocery,Pepsi,Juice,Good,Express,Cash,Delivered,3.0,Cranberry juice,2023-11-12,2025-11-15 22:11:04,Missing values; 
2885327.0,,Daniel Garcia,Crystal21@gmail.com,6605980901.0,2444 David Squares Apt. 885,Hamburg,Berlin,18181.0,Germany,22.0,Female,Medium,Regular,11/22/2023,2023.0,November,9:50:09,1.0,39.26108017,39.26108017,Electronics,Samsung,Smartphone,Excellent,Express,PayPal,Delivered,4.0,Samsung Galaxy,2023-11-22,2025-11-15 09:50:09,Missing values; 
8076303.0,36060.0,Amanda Ferguson,Ronald57@gmail.com,5027212009.0,21456 Kaitlin Club Suite 897,Indianapolis,Alaska,,USA,22.0,Male,Low,Regular,04-01-23,2023.0,April,15:00:47,6.0,466.7983424,2800.790055,Books,Random House,Literature,Good,Same-Day,PayPal,Delivered,3.0,Classic literature,2023-04-01,2025-11-15 15:00:47,Missing values; 
6646639.0,88962.0,Rebecca Smith,Andrea85@gmail.com,8807687362.0,380 Christensen Shores Suite 249,Cardiff,England,72316.0,UK,22.0,Female,High,Regular,04-09-23,2023.0,April,18:57:06,4.0,417.0643191,,Electronics,Apple,Laptop,Good,Express,Cash,Delivered,4.0,Dell XPS,2023-04-09,2025-11-15 18:57:06,Missing values; 
2962862.0,80858.0,Bruce Ortiz,Kayla10@gmail.com,2716965886.0,87457 Leblanc Shoal,London,England,47600.0,UK,22.0,Female,Medium,Regular,9/25/2023,,September,4:36:01,3.0,215.7607704,647.2823111,Books,Random House,Literature,Average,Express,Debit Card,Delivered,2.0,Contemporary literature,2023-09-25,2025-11-15 04:36:01,Missing values; 
4814871.0,62267.0,David Schaefer,Patrick95@gmail.com,5462048858.0,9288 Joseph Forest,Melbourne,New South Wales,67058.0,Australia,22.0,Female,High,Regular,12/19/2023,2023.0,December,19:29:32,7.0,85.80524887,,Home Decor,IKEA,Decorations,Excellent,Standard,Debit Card,Delivered,5.0,Picture frames,2023-12-19,2025-11-15 19:29:32,Missing values; 
5988964.0,60421.0,Daniel Johnson,Ricky31@gmail.com,2682324804.0,5596 Theresa Corner Suite 074,Oxford,England,72686.0,UK,22.0,Female,Medium,Regular,06-12-23,2023.0,June,,1.0,379.0592796,379.0592796,Grocery,Coca-Cola,Juice,Average,Express,PayPal,Delivered,2.0,Grape juice,2023-06-12,,Missing values; 
8620402.0,38993.0,Danielle Hoover,Larry31@gmail.com,8256122862.0,0091 Harmon Lane,Nuremberg,Berlin,60551.0,Germany,22.0,Female,Low,Regular,10/13/2023,2023.0,October,7:42:10,10.0,31.63413186,,Electronics,Apple,Smartphone,Bad,Express,PayPal,Delivered,1.0,Google Pixel,2023-10-13,2025-11-15 07:42:10,Missing values; 
6759219.0,,Richard Adams,Robert35@gmail.com,1332915233.0,61503 Michael Harbors,Edmonton,Ontario,84628.0,Canada,22.0,Male,Low,Regular,6/26/2023,2023.0,June,17:04:27,10.0,402.0307605,4020.307605,Books,HarperCollins,Non-Fiction,Good,Standard,Credit Card,Delivered,3.0,Science,2023-06-26,2025-11-15 17:04:27,Missing values; 
2557406.0,,Elizabeth Sharp,Anthony58@gmail.com,8641956996.0,730 Adrian Street,Seattle,Alabama,35714.0,USA,22.0,Male,Low,Regular,08-11-23,2023.0,August,4:12:06,3.0,39.30794407,117.9238322,Books,Penguin Books,Children's,Average,Same-Day,Credit Card,Delivered,2.0,Clothing,2023-08-11,2025-11-15 04:12:06,Missing values; 
4048284.0,42043.0,Kristin Zavala,Lynn15@gmail.com,8935477797.0,0431 Gardner Ports,Edinburgh,England,63254.0,UK,22.0,Male,Medium,Regular,08-04-23,2023.0,August,14:20:32,,466.2666978,1865.066791,Home Decor,Home Depot,Furniture,Average,Standard,Debit Card,Delivered,2.0,Bed,2023-08-04,2025-11-15 14:20:32,Missing values; 
6374938.0,10261.0,Tracey Brooks,Debra33@gmail.com,7486887576.0,870 Everett Bridge,Milwaukee,Indiana,47608.0,USA,22.0,Female,Medium,Regular,02-07-24,,February,13:10:35,3.0,276.8060261,830.4180782,Books,HarperCollins,Non-Fiction,Bad,Same-Day,Cash,Delivered,1.0,Travel,2024-02-07,2025-11-15 13:10:35,Missing values; 
3583228.0,93368.0,Jason Wilson,Amber55@gmail.com,2273650650.0,42942 White Manors,Louisville,West Virginia,26453.0,USA,22.0,Female,High,Regular,6/25/2023,2023.0,June,,1.0,323.3282262,323.3282262,Books,HarperCollins,Fiction,Good,Standard,Cash,Delivered,3.0,Romance,2023-06-25,,Missing values; 
8891850.0,35888.0,,Jennifer50@gmail.com,1632009632.0,070 Wilkinson Mountain,Calgary,Ontario,10255.0,Canada,22.0,Male,Low,Regular,12-09-23,2023.0,December,17:30:23,1.0,18.57786765,18.57786765,Home Decor,IKEA,Lighting,Good,Same-Day,Cash,Delivered,4.0,Wall sconces,2023-12-09,2025-11-15 17:30:23,Missing values; 
1669280.0,21905.0,Susan Robinson,Heather6@gmail.com,9176636699.0,7312 Hernandez Port,Victoria,Ontario,17136.0,Canada,22.0,Male,Low,Regular,09-03-23,2023.0,September,10:35:24,7.0,,733.7667885,Clothing,Adidas,T-shirt,Bad,Same-Day,PayPal,Delivered,1.0,Plain tee,2023-09-03,2025-11-15 10:35:24,Missing values; 
6678773.0,87233.0,Erica Garcia,Christopher3@gmail.com,8619023341.0,7640 Peters Tunnel Apt. 462,Toowoomba,New South Wales,40471.0,Australia,22.0,Male,Medium,Regular,04-04-23,2023.0,April,11:03:29,,103.2935587,723.0549111,Clothing,Nike,T-shirt,Good,Standard,Debit Card,Delivered,3.0,Plain tee,2023-04-04,2025-11-15 11:03:29,Missing values; 
8366462.0,98416.0,Erica Harrington,Tiffany68@gmail.com,2799922838.0,642 Mark Parkway,Sydney,New South Wales,52089.0,Australia,22.0,Male,Medium,Regular,,2023.0,March,2:51:46,2.0,83.38337321,166.7667464,Clothing,Zara,Dress,Excellent,Express,Debit Card,Delivered,5.0,Fit and flare dress,,2025-11-15 02:51:46,Missing values; 
8367842.0,15298.0,David Taylor,Taylor98@gmail.com,2200059825.0,7118 Banks Trail,London,Ontario,,Canada,22.0,Female,Medium,Regular,2/25/2024,2024.0,February,13:33:48,10.0,163.6859865,1636.859865,Clothing,Nike,Shoes,Average,Same-Day,PayPal,Delivered,2.0,Flip flops,2024-02-25,2025-11-15 13:33:48,Missing values; 
8226146.0,24763.0,Danielle Todd,Shannon31@gmail.com,6279245141.0,010 Mike Meadows Suite 836,Milwaukee,Idaho,83220.0,USA,22.0,Male,Low,Regular,12/22/2023,2023.0,,8:45:51,4.0,208.4208456,833.6833822,Home Decor,Home Depot,Tools,Excellent,Express,PayPal,Delivered,5.0,Drill,2023-12-22,2025-11-15 08:45:51,Missing values; 
6411369.0,48276.0,Ashley Brown,Angelica78@gmail.com,6187506372.0,0361 Jamie Curve,Southampton,,97583.0,UK,22.0,Male,Low,Regular,02-05-24,2024.0,February,13:58:33,4.0,479.1494297,1916.597719,Electronics,Apple,Tablet,Average,Express,PayPal,Delivered,2.0,Microsoft Surface,2024-02-05,2025-11-15 13:58:33,Missing values; 
4409533.0,77917.0,Anna Bautista,Holly17@gmail.com,8049384934.0,3361 Holloway Greens,Birmingham,England,58350.0,UK,22.0,Female,Low,Regular,12-04-23,2023.0,December,5:25:40,8.0,,3107.274827,Books,Penguin Books,Non-Fiction,Average,Standard,Debit Card,Delivered,2.0,Cooking,2023-12-04,2025-11-15 05:25:40,Missing values; 
1179068.0,76072.0,Lynn Greer,Jimmy79@gmail.com,1858365152.0,050 Stephanie Freeway Apt. 068,Leeds,England,,UK,22.0,Female,Low,Regular,3/17/2023,2023.0,March,11:30:56,9.0,103.2261076,929.0349685,Clothing,Nike,Shorts,Average,Express,PayPal,Delivered,2.0,Cargo shorts,2023-03-17,2025-11-15 11:30:56,Missing values; 
9043935.0,30010.0,Roger Miller,Melanie12@gmail.com,5248192547.0,7890 Wilson Loop Apt. 989,Cairns,New South Wales,2373.0,Australia,22.0,Male,Low,Regular,08-01-23,2023.0,August,6:31:18,8.0,201.7745704,1614.196563,Home Decor,IKEA,Decorations,Bad,Express,,Delivered,1.0,Wall art,2023-08-01,2025-11-15 06:31:18,Missing values; 
6061464.0,30821.0,Larry Thornton,Bryan89@gmail.com,1355882400.0,78184 Davis Squares Apt. 475,Wuppertal,Berlin,4842.0,Germany,22.0,Male,Medium,Regular,,2023.0,March,7:01:34,8.0,27.06276892,216.5021514,Home Decor,IKEA,Furniture,Good,Standard,Cash,Delivered,3.0,Bookshelf,,2025-11-15 07:01:34,Missing values; 
2893463.0,29397.0,Matthew Adams,April74@gmail.com,8460171024.0,4095 Stephanie Trafficway Suite 895,Manchester,England,41845.0,UK,22.0,,Medium,Regular,6/25/2023,2023.0,June,0:56:35,6.0,233.2070329,1399.242197,Clothing,Zara,Shirt,Bad,Express,Cash,Delivered,1.0,Tank top,2023-06-25,2025-11-15 00:56:35,Missing values; 
4669623.0,13562.0,,Joseph48@gmail.com,2198320775.0,36224 Harold Lodge Suite 152,Liverpool,England,39144.0,UK,22.0,Female,High,Regular,9/13/2023,2023.0,September,9:27:46,9.0,224.7798871,2023.018984,Electronics,Apple,Smartphone,Good,Standard,Debit Card,Delivered,3.0,Google Pixel,2023-09-13,2025-11-15 09:27:46,Missing values; 
8495824.0,48146.0,Ralph Rose,Andrew45@gmail.com,9832895809.0,256 Jason Hollow,Bonn,Berlin,6816.0,Germany,22.0,Male,Medium,Regular,11/28/2023,2023.0,November,6:29:18,1.0,260.7603775,260.7603775,Electronics,,Smartphone,Excellent,Same-Day,Credit Card,Delivered,4.0,Samsung Galaxy,2023-11-28,2025-11-15 06:29:18,Missing values; 
5959270.0,70459.0,Richard Day,Nathan25@gmail.com,5855595467.0,751 Jessica Fields,Fort Worth,Texas,79014.0,USA,22.0,Female,Low,Regular,12/18/2023,2023.0,December,4:19:01,,286.2974619,1717.784772,Grocery,Nestle,Snacks,Average,Express,PayPal,Delivered,2.0,Fruit snacks,2023-12-18,2025-11-15 04:19:01,Missing values; 
8258068.0,17345.0,Jennifer Martinez,Lauren73@gmail.com,8285757818.0,5839 Marshall Valley,Los Angeles,Florida,34878.0,USA,22.0,Male,High,Regular,02-05-24,2024.0,,11:32:45,9.0,410.4927151,3694.434436,Home Decor,Bed Bath & Beyond,Bedding,Good,Standard,Debit Card,Delivered,4.0,Bed sheet set,2024-02-05,2025-11-15 11:32:45,Missing values; 
4234852.0,68832.0,Kristin Brown,Andrea50@gmail.com,8059754980.0,2632 Carol Key Apt. 163,London,England,37708.0,UK,22.0,Male,High,Regular,09-10-23,2023.0,September,12:06:15,9.0,450.1791238,4051.612114,Electronics,Samsung,Tablet,Bad,,PayPal,Delivered,1.0,Acer Iconia Tab,2023-09-10,2025-11-15 12:06:15,Missing values; 
3060226.0,,Jason Yang,Brandon64@gmail.com,6392164047.0,9467 Cathy Manor Apt. 909,St. John's,Ontario,38189.0,Canada,22.0,Male,Medium,Regular,4/16/2023,2023.0,April,5:43:42,1.0,331.9749981,331.9749981,Electronics,Apple,Laptop,Good,Standard,Debit Card,Delivered,4.0,Lenovo ThinkPad,2023-04-16,2025-11-15 05:43:42,Missing values; 
4204473.0,54590.0,Jennifer Morris,Nancy54@gmail.com,6498894278.0,55203 Roberts Crest Suite 727,Detroit,Alabama,35431.0,USA,22.0,,Low,Regular,4/15/2023,2023.0,April,2:08:17,5.0,287.1992291,1435.996146,Electronics,Apple,Laptop,Good,Same-Day,Debit Card,Delivered,4.0,Razer Blade,2023-04-15,2025-11-15 02:08:17,Missing values; 
3387773.0,24570.0,Miss Tammy Parker,Candice32@gmail.com,7096502434.0,26024 Pearson Tunnel,Frankfurt,Berlin,54746.0,Germany,22.0,Male,Low,Regular,05-10-23,2023.0,,6:36:31,7.0,56.01502809,392.1051966,Grocery,Pepsi,Soft Drink,Average,Same-Day,PayPal,Delivered,2.0,Iced tea,2023-05-10,2025-11-15 06:36:31,Missing values; 
7031324.0,33812.0,Dana Sanders PhD,Ernest35@gmail.com,7442739591.0,04767 Gregory Rest,Baltimore,Oklahoma,73092.0,USA,22.0,Male,Low,Regular,10-05-23,2023.0,October,9:43:08,4.0,344.963209,1379.852836,Books,,Fiction,Average,Same-Day,PayPal,Delivered,2.0,Mystery,2023-10-05,2025-11-15 09:43:08,Missing values; 
7411788.0,96882.0,Jorge Torres,Olivia51@gmail.com,6581833900.0,03621 Alexandria Via Apt. 594,Oakland,Nebraska,,USA,22.0,Male,High,Regular,02-02-24,2024.0,February,5:25:03,10.0,343.4488236,3434.488236,Grocery,Nestle,Coffee,Good,Express,PayPal,Delivered,3.0,Americano,2024-02-02,2025-11-15 05:25:03,Missing values; 
4193550.0,32512.0,Alyssa Moon,Anthony6@gmail.com,7095940589.0,49247 Russell Village,Oakland,Montana,59724.0,USA,22.0,Male,Medium,Regular,7/26/2023,2023.0,July,13:28:08,6.0,254.322767,1525.936602,,Coca-Cola,Water,Good,Standard,PayPal,Delivered,4.0,Artesian water,2023-07-26,2025-11-15 13:28:08,Missing values; 
6052302.0,77502.0,Elizabeth House,Samantha90@gmail.com,1260487821.0,782 Joshua Flat Suite 572,Phoenix,Tennessee,37498.0,USA,22.0,Male,Low,Regular,02-02-24,2024.0,February,,6.0,415.8513236,2495.107941,Grocery,Nestle,Coffee,Excellent,Express,Credit Card,Delivered,4.0,Instant coffee,2024-02-02,,Missing values; 
8977339.0,77351.0,Kenneth Johnson,Michael54@gmail.com,9509600052.0,9310 White Brooks,Cardiff,England,99371.0,UK,22.0,Female,High,Regular,2/13/2024,2024.0,,17:30:12,2.0,30.85173488,61.70346977,Grocery,Pepsi,Water,Excellent,Express,Credit Card,Delivered,5.0,Spring water,2024-02-13,2025-11-15 17:30:12,Missing values; 
6311279.0,69037.0,Roger Richards,Michelle13@gmail.com,7133232064.0,11837 Hunter Gateway Apt. 230,,Arkansas,71902.0,USA,22.0,Male,High,Regular,03-06-23,2023.0,March,3:25:55,8.0,259.0639493,2072.511594,Grocery,Coca-Cola,Soft Drink,Average,Standard,PayPal,Delivered,2.0,Orange soda,2023-03-06,2025-11-15 03:25:55,Missing values; 
6766274.0,36578.0,Elizabeth Francis,Jason13@gmail.com,4342573951.0,6790 James Dam Apt. 167,Leicester,England,73717.0,UK,22.0,Female,Medium,Regular,4/16/2023,2023.0,April,14:21:10,2.0,150.8898255,301.7796509,,Random House,Non-Fiction,Excellent,Express,Cash,Delivered,5.0,Cooking,2023-04-16,2025-11-15 14:21:10,Missing values; 
3922821.0,79039.0,Isaac Berger,Lee63@gmail.com,6599245961.0,263 Mary Spring Suite 189,Regina,Ontario,75660.0,Canada,22.0,Male,Low,Regular,,2023.0,September,9:18:03,2.0,73.50474244,147.0094849,Clothing,Nike,Shoes,Good,Same-Day,PayPal,Delivered,3.0,Flip flops,,2025-11-15 09:18:03,Missing values; 
9620455.0,95615.0,Kristen Boyle,Julie87@gmail.com,5417434094.0,37687 Ashley River Suite 163,Kitchener,Ontario,3426.0,Canada,22.0,Male,Low,Regular,9/28/2023,,September,8:50:12,1.0,127.9006864,127.9006864,Clothing,Adidas,T-shirt,Excellent,Standard,Debit Card,Delivered,4.0,Graphic tee,2023-09-28,2025-11-15 08:50:12,Missing values; 
9199652.0,82797.0,,John66@gmail.com,3635596451.0,5328 Miller Bridge,Bielefeld,Berlin,83172.0,Germany,22.0,Male,Low,Regular,08-05-23,2023.0,August,13:17:31,5.0,356.2455455,1781.227727,Clothing,Nike,Shoes,Average,Express,Debit Card,Delivered,2.0,Sandals,2023-08-05,2025-11-15 13:17:31,Missing values; 
3658632.0,23756.0,Shannon Leonard,Patrick75@gmail.com,7808191841.0,7885 Heather Views Suite 457,Leeds,England,44543.0,UK,22.0,Female,Medium,Regular,12-09-23,2023.0,,16:54:05,1.0,321.1531315,321.1531315,Books,Penguin Books,Non-Fiction,Average,Same-Day,PayPal,Delivered,2.0,Science,2023-12-09,2025-11-15 16:54:05,Missing values; 
7028108.0,73352.0,Randall Garcia,,7330503243.0,118 Peterson Street Apt. 436,Glasgow,England,5932.0,UK,22.0,Male,High,Regular,09-06-23,2023.0,September,12:27:48,5.0,477.2945197,2386.472598,Clothing,Nike,T-shirt,Excellent,Standard,PayPal,Delivered,4.0,Graphic tee,2023-09-06,2025-11-15 12:27:48,Missing values; 
9592286.0,24317.0,Charles Smith,,7358844024.0,97697 Connor Glens Apt. 074,Raleigh,Oklahoma,73148.0,USA,22.0,Male,Low,Regular,08-05-23,2023.0,August,6:24:13,6.0,152.9383827,917.6302964,Electronics,Sony,Smartphone,Bad,Standard,Credit Card,Delivered,1.0,Xiaomi Mi,2023-08-05,2025-11-15 06:24:13,Missing values; 
6364411.0,97562.0,Joel Anderson,Sheri70@gmail.com,5962095186.0,13506 Garrett Mews,,New South Wales,85943.0,Australia,22.0,Female,Low,Regular,1/29/2024,2024.0,January,23:41:03,6.0,397.5150593,2385.090356,Books,HarperCollins,Non-Fiction,Excellent,Same-Day,Debit Card,Delivered,4.0,Psychology,2024-01-29,2025-11-15 23:41:03,Missing values; 
6179556.0,31784.0,Wanda Hall,John55@gmail.com,4513420063.0,4627 Mark Cliff Apt. 286,Dallas,,37996.0,USA,22.0,Male,Medium,Regular,6/27/2023,2023.0,June,5:23:11,2.0,340.3762475,680.7524951,Grocery,Coca-Cola,Juice,,Standard,Credit Card,Delivered,,Apple juice,2023-06-27,2025-11-15 05:23:11,Missing values; 
,20911.0,Ronald Campbell,Christina30@gmail.com,6593059871.0,90943 Adams Club,Melbourne,New South Wales,80527.0,Australia,22.0,,Low,Regular,06-04-23,2023.0,June,5:48:52,1.0,366.348356,366.348356,Home Decor,Home Depot,Decorations,Excellent,Standard,Debit Card,Delivered,5.0,Clocks,2023-06-04,2025-11-15 05:48:52,Missing values; 
3509293.0,15738.0,Kristin Richardson,,7845350544.0,0717 Donovan Dam Suite 213,Kelowna,Ontario,36178.0,Canada,22.0,Female,Low,Regular,06-09-23,2023.0,June,5:43:52,4.0,318.5273595,1274.109438,Clothing,Zara,Shirt,Average,Standard,Credit Card,Delivered,2.0,Polo shirt,2023-06-09,2025-11-15 05:43:52,Missing values; 
2391088.0,66255.0,Stephen Anderson,Brian61@gmail.com,,40398 Lisa Neck Apt. 580,Plymouth,England,17075.0,UK,22.0,Male,Medium,Regular,2/20/2024,2024.0,February,7:25:07,7.0,178.4844715,1249.3913,Grocery,Nestle,Coffee,Bad,Standard,Debit Card,Delivered,1.0,Ground coffee,2024-02-20,2025-11-15 07:25:07,Missing values; 
6543871.0,17307.0,Susan White,Phillip2@gmail.com,5877584758.0,6758 Martin Pike Apt. 929,Vancouver,Ontario,87948.0,Canada,22.0,Female,Low,Regular,7/21/2023,,July,12:26:54,7.0,287.2480357,2010.73625,Clothing,Nike,T-shirt,Bad,Standard,PayPal,Delivered,1.0,Long-sleeve tee,2023-07-21,2025-11-15 12:26:54,Missing values; 
9748385.0,,Roy Green,Amanda26@gmail.com,1570735834.0,4488 William Locks Suite 994,Hamburg,Berlin,38832.0,Germany,22.0,Male,Low,Regular,8/30/2023,2023.0,August,23:00:45,3.0,211.3539119,634.0617356,Grocery,Pepsi,Water,Good,Express,Cash,Delivered,3.0,Coconut water,2023-08-30,2025-11-15 23:00:45,Missing values; 
6329333.0,80015.0,Timothy Stone,Victor7@gmail.com,8024729169.0,,Calgary,Ontario,22919.0,Canada,22.0,Male,Medium,Regular,07-12-23,2023.0,July,18:21:34,1.0,352.6308266,352.6308266,Home Decor,Home Depot,Furniture,Bad,Standard,Debit Card,Delivered,1.0,Wardrobe,2023-07-12,2025-11-15 18:21:34,Missing values; 
7080595.0,65247.0,Karina Long,Jennifer68@gmail.com,3176116042.0,0586 Miles Tunnel,Phoenix,Nevada,89855.0,USA,22.0,Female,Low,Regular,2/22/2024,2024.0,February,22:11:49,5.0,258.9657335,1294.828668,Grocery,Nestle,Chocolate,Good,,Credit Card,Delivered,4.0,Chocolate mousse,2024-02-22,2025-11-15 22:11:49,Missing values; 
5798075.0,35928.0,Misty Long,Jennifer95@gmail.com,2131971727.0,9542 Delgado Common Apt. 784,Hamilton,Ontario,69755.0,Canada,22.0,Female,Medium,Regular,10-01-23,,October,15:45:49,6.0,165.5255338,993.1532029,Books,Penguin Books,Non-Fiction,Bad,Express,Credit Card,Delivered,1.0,Health,2023-10-01,2025-11-15 15:45:49,Missing values; 
1242121.0,14068.0,Kristina Holmes,William17@gmail.com,2835297577.0,6181 Kim Freeway,Brighton,England,82140.0,UK,22.0,Female,Medium,Regular,6/25/2023,2023.0,June,19:44:05,7.0,360.0880795,2520.616557,Books,HarperCollins,Fiction,Bad,,PayPal,Delivered,1.0,Romance,2023-06-25,2025-11-15 19:44:05,Missing values; 
9343535.0,83661.0,Michelle Stevenson,Thomas16@gmail.com,8324657251.0,603 Bryce Forge Suite 372,Berlin,,62506.0,Germany,22.0,Male,High,Regular,6/28/2023,2023.0,June,14:32:21,7.0,65.76639023,460.3647316,Clothing,Zara,Jeans,Good,Express,Cash,Delivered,4.0,Distressed jeans,2023-06-28,2025-11-15 14:32:21,Missing values; 
9898369.0,38882.0,Corey Guerra,Jonathan23@gmail.com,5993750106.0,23303 Garcia Circle,Toronto,Ontario,98442.0,Canada,22.0,Male,Medium,Regular,5/27/2023,2023.0,May,20:23:03,3.0,37.1978127,111.5934381,Home Decor,,Lighting,Good,Same-Day,Cash,Delivered,3.0,Pendant lights,2023-05-27,2025-11-15 20:23:03,Missing values; 
2877951.0,43039.0,Patricia Johnson,Krystal78@gmail.com,5171269131.0,1204 Scott Knolls Apt. 383,Windsor,Ontario,,Canada,22.0,Male,Medium,Regular,07-09-23,2023.0,July,18:31:00,1.0,394.2522732,394.2522732,Clothing,Adidas,Jacket,Bad,Same-Day,Credit Card,Delivered,1.0,Windbreaker,2023-07-09,2025-11-15 18:31:00,Missing values; 
7156859.0,16421.0,Nicholas Odonnell,Theresa97@gmail.com,2958569154.0,,Montreal,Ontario,70681.0,Canada,22.0,Female,Low,Regular,1/14/2024,2024.0,January,9:41:39,7.0,151.3831416,1059.681992,Home Decor,Home Depot,Furniture,Average,Same-Day,Credit Card,Delivered,2.0,Bookshelf,2024-01-14,2025-11-15 09:41:39,Missing values; 
3987139.0,60683.0,Nicole Mendoza,Andrea11@gmail.com,2762188798.0,7055 Hernandez Spur Apt. 788,Sydney,,54173.0,Australia,22.0,Female,High,Regular,04-09-23,2023.0,April,21:05:42,4.0,464.3059141,1857.223656,Clothing,Adidas,Jacket,Good,Express,Debit Card,Delivered,3.0,Varsity jacket,2023-04-09,2025-11-15 21:05:42,Missing values; 
8552376.0,61334.0,Roger Jackson,Alexander74@gmail.com,1306004902.0,030 Smith Parkways,Hanover,Berlin,8572.0,Germany,22.0,Male,Medium,Regular,3/18/2023,2023.0,,6:02:44,2.0,210.6642607,421.3285214,Home Decor,Bed Bath & Beyond,Kitchen,Bad,Same-Day,Debit Card,Delivered,1.0,Electric kettle,2023-03-18,2025-11-15 06:02:44,Missing values; 
4463009.0,43777.0,Haley Mccarty MD,,1385648682.0,957 Marquez Freeway Apt. 906,Raleigh,Oregon,97266.0,USA,22.0,Male,Low,Regular,12-10-23,2023.0,December,23:13:20,6.0,28.91416535,173.4849921,Clothing,Zara,Jeans,Good,Standard,PayPal,Delivered,4.0,Flare jeans,2023-12-10,2025-11-15 23:13:20,Missing values; 
4866683.0,68960.0,Blake Williams,Gabrielle27@gmail.com,9037731969.0,7715 Julia Via,Bendigo,New South Wales,68048.0,Australia,22.0,Male,Medium,Regular,05-09-23,2023.0,May,5:48:58,8.0,213.1668854,1705.335083,Clothing,Zara,Dress,Bad,Same-Day,,Delivered,1.0,Bodycon dress,2023-05-09,2025-11-15 05:48:58,Missing values; 
5165669.0,96348.0,Carrie Sullivan,Mark43@gmail.com,6894946444.0,3557 Andrea Creek,Plymouth,,59476.0,UK,22.0,Male,Low,Regular,08-09-23,2023.0,August,1:35:24,3.0,392.3386648,1177.015994,Grocery,Nestle,Snacks,Excellent,Same-Day,Cash,Delivered,4.0,Trail mix,2023-08-09,2025-11-15 01:35:24,Missing values; 
6652792.0,37638.0,Julia Sanchez,Francis94@gmail.com,3973865882.0,33801 Monica Freeway Suite 766,Frankfurt,Berlin,27117.0,Germany,22.0,Female,Low,Regular,,2023.0,September,12:49:19,6.0,213.3115824,1279.869494,Clothing,Zara,Shirt,Bad,Standard,Cash,Delivered,1.0,Blouse,,2025-11-15 12:49:19,Missing values; 
,29048.0,Matthew Bailey,Nicole26@gmail.com,6942066097.0,37896 Sarah Oval Apt. 148,Nashville,Washington,99122.0,USA,22.0,Female,High,Regular,2/27/2024,2024.0,February,10:53:54,10.0,215.8984183,2158.984183,Grocery,Nestle,Coffee,Bad,Standard,Cash,Delivered,1.0,Mocha,2024-02-27,2025-11-15 10:53:54,Missing values; 
3302583.0,32500.0,Jason Kelly,James24@gmail.com,1002760689.0,66910 Dwayne Course Suite 761,Leeds,England,15415.0,UK,22.0,Female,Medium,Regular,,2023.0,October,7:10:51,1.0,351.3002415,351.3002415,Clothing,Zara,Shirt,Excellent,Express,Cash,Delivered,5.0,Dress shirt,,2025-11-15 07:10:51,Missing values; 
4335172.0,39327.0,Jacqueline Bell,Kristine68@gmail.com,6184922546.0,59924 Casey Glens Suite 574,Kelowna,Ontario,20420.0,Canada,22.0,Male,Medium,Regular,9/29/2023,2023.0,,5:37:12,1.0,282.297888,282.297888,Grocery,Nestle,Chocolate,Average,Same-Day,Debit Card,Delivered,2.0,White chocolate,2023-09-29,2025-11-15 05:37:12,Missing values; 
5589024.0,12527.0,Daniel Obrien,Christopher17@gmail.com,8173729034.0,780 Russell Mission Suite 263,Birmingham,England,21245.0,UK,22.0,Male,High,Regular,05-02-23,,May,2:33:48,5.0,291.1899756,1455.949878,Books,Penguin Books,Fiction,Excellent,Express,Cash,Delivered,5.0,Historical fiction,2023-05-02,2025-11-15 02:33:48,Missing values; 
,90558.0,Troy Owens,Ruth3@gmail.com,7186156839.0,1862 Stacy Knoll,Toowoomba,New South Wales,20608.0,Australia,22.0,Male,Low,Regular,07-11-23,2023.0,July,7:49:50,8.0,284.9590731,2279.672584,Grocery,Coca-Cola,Juice,Bad,Same-Day,Debit Card,Delivered,1.0,Cranberry juice,2023-07-11,2025-11-15 07:49:50,Missing values; 
,11901.0,Kristen Blair,Jeffery54@gmail.com,8785563272.0,15970 Amy Crossroad,Toronto,Ontario,50749.0,Canada,22.0,Male,High,Regular,1/19/2024,2024.0,January,13:13:19,4.0,101.2282974,404.9131896,Clothing,Zara,Jeans,Good,Standard,Credit Card,Delivered,3.0,Flare jeans,2024-01-19,2025-11-15 13:13:19,Missing values; 
8014204.0,59532.0,Patrick Castaneda,Kendra53@gmail.com,4456576118.0,8998 Brian Loaf,Dallas,North Dakota,58417.0,USA,22.0,Male,High,Regular,08-12-23,2023.0,August,5:42:16,8.0,,1593.568516,Grocery,Pepsi,Water,Average,Standard,Cash,Delivered,2.0,Flavored water,2023-08-12,2025-11-15 05:42:16,Missing values; 
7641184.0,43944.0,Todd Mcneil,Andrea83@gmail.com,2053428453.0,5165 Samuel Mission Suite 199,Bremen,Berlin,3665.0,Germany,22.0,,Low,Regular,03-03-23,2023.0,March,3:15:13,9.0,29.98717306,269.8845576,Clothing,Zara,Dress,Excellent,Standard,PayPal,Delivered,5.0,Fit and flare dress,2023-03-03,2025-11-15 03:15:13,Missing values; 
9770338.0,77504.0,Mr. John Brooks,Crystal80@gmail.com,2582388763.0,889 Leonard Lodge,Cardiff,England,5586.0,UK,22.0,Male,Low,Regular,9/19/2023,2023.0,September,21:05:33,1.0,405.7673248,405.7673248,,Samsung,Television,Average,Same-Day,PayPal,Delivered,2.0,HDR TV,2023-09-19,2025-11-15 21:05:33,Missing values; 
6657791.0,76616.0,Lisa Wilson,Christopher82@gmail.com,4194314661.0,006 Kramer Rapid,Munich,Berlin,38456.0,Germany,22.0,Male,Low,Regular,2/13/2024,2024.0,February,11:59:00,7.0,325.1867072,,Clothing,Nike,Shoes,Average,Same-Day,Credit Card,Delivered,2.0,Flip flops,2024-02-13,2025-11-15 11:59:00,Missing values; 
6340762.0,14527.0,Melinda Kline,Alexander15@gmail.com,8549490848.0,36838 Young Shores Suite 956,Leeds,England,28157.0,UK,22.0,Female,Low,Regular,12-06-23,2023.0,December,16:29:00,5.0,376.3930154,1881.965077,Electronics,Sony,Smartphone,,Standard,Cash,Delivered,,Xiaomi Mi,2023-12-06,2025-11-15 16:29:00,Missing values; 
9864687.0,35100.0,,Nicole23@gmail.com,4898725881.0,9944 Gonzalez Road,Ballarat,New South Wales,59191.0,Australia,22.0,Female,Low,Regular,7/13/2023,2023.0,July,21:06:29,7.0,259.0132009,1813.092407,Books,HarperCollins,Non-Fiction,Good,Same-Day,PayPal,Delivered,4.0,Memoir,2023-07-13,2025-11-15 21:06:29,Missing values; 
6347203.0,76578.0,Amanda Kirby,Jeff100@gmail.com,9579065969.0,16041 Deborah Throughway Apt. 329,Hanover,Berlin,25780.0,Germany,22.0,Female,Low,Regular,2/13/2024,2024.0,February,5:03:18,3.0,292.3750182,,Grocery,Nestle,Coffee,Bad,Express,PayPal,Delivered,1.0,Americano,2024-02-13,2025-11-15 05:03:18,Missing values; 
4733656.0,63571.0,Karen Mann,Eric50@gmail.com,9000998940.0,34140 Margaret Flat,Munich,Berlin,61111.0,Germany,22.0,Male,Medium,Regular,6/27/2023,2023.0,June,23:46:07,4.0,102.9959939,411.9839756,,Adidas,Shoes,Bad,Same-Day,Credit Card,Delivered,1.0,Espadrilles,2023-06-27,2025-11-15 23:46:07,Missing values; 
9950443.0,11035.0,Matthew Garcia,Casey93@gmail.com,7511436256.0,29120 Yoder Spur,Bremen,Berlin,18672.0,Germany,22.0,Male,Low,Regular,04-12-23,2023.0,April,19:24:20,,263.0280366,1315.140183,Home Decor,Home Depot,Decorations,Good,Same-Day,Debit Card,Delivered,4.0,Mirrors,2023-04-12,2025-11-15 19:24:20,Missing values; 
2489616.0,20277.0,Sara Perry,Jessica43@gmail.com,7415753051.0,761 Connor Mission Suite 200,Toronto,Ontario,91383.0,Canada,22.0,Male,Medium,Regular,5/13/2023,2023.0,May,,5.0,244.9284682,1224.642341,Books,Penguin Books,Non-Fiction,Good,Same-Day,PayPal,Delivered,4.0,Business,2023-05-13,,Missing values; 
9732832.0,17801.0,Adam Mitchell,David79@gmail.com,9693406128.0,7951 April Pines Suite 422,Frankfurt,Berlin,23578.0,Germany,22.0,Male,Medium,Regular,03-01-23,2023.0,March,12:47:29,4.0,395.8753989,1583.501596,Grocery,,Water,Bad,Standard,Cash,Delivered,1.0,Mineral water,2023-03-01,2025-11-15 12:47:29,Missing values; 
2461399.0,27043.0,Jon Lewis,Scott83@gmail.com,8998101887.0,48101 Kelly Land,Essen,Berlin,40322.0,Germany,22.0,Female,,Regular,1/15/2024,2024.0,January,20:19:14,2.0,498.7830352,997.5660704,Electronics,Samsung,Television,Good,Standard,Cash,Delivered,4.0,LED TV,2024-01-15,2025-11-15 20:19:14,Missing values; 
3801835.0,74204.0,Jeffrey Wallace,Joseph84@gmail.com,8498871492.0,10204 Timothy Harbors,Barrie,Ontario,64975.0,Canada,22.0,Male,High,Regular,12/26/2023,2023.0,December,4:32:53,5.0,488.7551247,2443.775624,,Nestle,Coffee,Average,Same-Day,PayPal,Delivered,2.0,Ground coffee,2023-12-26,2025-11-15 04:32:53,Missing values; 
6064450.0,93983.0,Timothy Lewis,,2399808875.0,4835 Craig Extensions,Cairns,New South Wales,41676.0,Australia,22.0,Female,High,Regular,5/25/2023,2023.0,May,20:55:18,2.0,399.3936673,798.7873346,Home Decor,Bed Bath & Beyond,Kitchen,Excellent,Express,Debit Card,Delivered,5.0,Food processor,2023-05-25,2025-11-15 20:55:18,Missing values; 
4202470.0,39550.0,Shawn Shepherd,Matthew67@gmail.com,,1344 John Mountains Suite 056,Phoenix,Iowa,51008.0,USA,22.0,Female,Medium,Regular,10-07-23,2023.0,October,21:53:05,6.0,401.8860394,2411.316236,Grocery,Pepsi,Juice,Bad,Standard,Credit Card,Delivered,1.0,Mango juice,2023-10-07,2025-11-15 21:53:05,Missing values; 
6007511.0,41242.0,Martin Lopez,Robert23@gmail.com,2995046389.0,126 Freeman Mission,Portland,Louisiana,70317.0,USA,22.0,Male,Medium,Regular,6/19/2023,2023.0,June,20:45:10,6.0,382.8519143,2297.111486,Clothing,Adidas,T-shirt,,Standard,Credit Card,Delivered,,Raglan tee,2023-06-19,2025-11-15 20:45:10,Missing values; 
4422261.0,35420.0,Mr. Matthew Combs,Kurt45@gmail.com,2545596356.0,,Montreal,Ontario,22909.0,Canada,22.0,Female,Low,Regular,9/16/2023,2023.0,September,12:20:14,3.0,266.8125398,800.4376195,Clothing,Adidas,Shoes,Excellent,Standard,Credit Card,Delivered,5.0,Slippers,2023-09-16,2025-11-15 12:20:14,Missing values; 
3516677.0,77636.0,Jennifer Lopez,,4017707024.0,2717 Perkins Center,Detroit,Maine,4747.0,USA,22.0,Male,Low,Regular,07-09-23,2023.0,July,12:50:01,4.0,245.5541691,982.2166764,Clothing,Nike,Shoes,Average,Standard,PayPal,Delivered,2.0,Boots,2023-07-09,2025-11-15 12:50:01,Missing values; 
4992565.0,88433.0,Stacy Howell,Mary85@gmail.com,4036264329.0,9992 Donovan Path Suite 503,Albury-Wodonga,New South Wales,,Australia,22.0,Female,Medium,Regular,06-11-23,2023.0,June,18:45:01,4.0,299.1646377,1196.658551,Books,HarperCollins,Fiction,Good,Same-Day,Cash,Delivered,4.0,Mystery,2023-06-11,2025-11-15 18:45:01,Missing values; 
4210721.0,80167.0,Gloria Potter,Steven53@gmail.com,6068458308.0,1507 William Ville Suite 024,Hull,England,95377.0,,22.0,Male,Low,Regular,6/13/2023,2023.0,June,19:35:21,2.0,54.50284362,109.0056872,Grocery,Coca-Cola,Juice,Bad,Standard,PayPal,Delivered,1.0,Cranberry juice,2023-06-13,2025-11-15 19:35:21,Missing values; 
2538029.0,86917.0,Renee Cantu,Carl20@gmail.com,6765151746.0,07815 Charles Park Suite 681,Birmingham,England,48325.0,UK,22.0,Male,Low,Regular,,2023.0,May,1:44:12,6.0,148.980757,893.8845417,Books,Penguin Books,Non-Fiction,Excellent,Same-Day,Cash,Delivered,5.0,Travel,,2025-11-15 01:44:12,Missing values; 
1880316.0,25925.0,Sherri May,Joshua6@gmail.com,2474019444.0,56934 Angela Street,Frankfurt,Berlin,13358.0,Germany,22.0,Male,Medium,Regular,12-09-23,2023.0,December,14:14:32,5.0,416.4835925,,Electronics,Samsung,Smartphone,Bad,Same-Day,Cash,Delivered,1.0,Google Pixel,2023-12-09,2025-11-15 14:14:32,Missing values; 
9382092.0,83275.0,Cindy Ball,Monica38@gmail.com,4209913920.0,992 Steven Plaza,Frankfurt,Berlin,94055.0,Germany,22.0,Female,Medium,Regular,3/28/2023,2023.0,March,20:22:48,2.0,265.7447158,531.4894315,Clothing,Adidas,T-shirt,,Standard,PayPal,Delivered,,Scoop neck tee,2023-03-28,2025-11-15 20:22:48,Missing values; 
1551962.0,72244.0,Jaime Harris,Trevor22@gmail.com,1220547400.0,5532 Kelley Circles,Chicago,Wisconsin,,USA,22.0,Male,Medium,Regular,6/18/2023,2023.0,June,13:30:41,3.0,461.8634062,1385.590219,Electronics,Samsung,Television,Bad,Express,Debit Card,Delivered,1.0,QLED TV,2023-06-18,2025-11-15 13:30:41,Missing values; 
1809293.0,47340.0,Trevor Powers,Mallory70@gmail.com,9202771767.0,2926 Horne Spurs,Baltimore,Maryland,21412.0,USA,22.0,Female,Medium,Regular,11-04-23,2023.0,November,,2.0,342.726696,685.4533919,Home Decor,IKEA,Decorations,Bad,Express,Credit Card,Delivered,1.0,Sculptures,2023-11-04,,Missing values; 
1117260.0,96815.0,Ryan Rowe,Christine66@gmail.com,2871371236.0,23657 Bender Green,Mesa,Michigan,48400.0,,22.0,Male,High,Regular,01-04-24,2024.0,January,5:25:01,9.0,109.5196254,985.6766289,Home Decor,Home Depot,Decorations,Bad,Express,Debit Card,Delivered,1.0,Vases,2024-01-04,2025-11-15 05:25:01,Missing values; 
,64455.0,Donald Campbell,Tony9@gmail.com,2758315993.0,20824 Jarvis Rest Apt. 144,Memphis,Tennessee,37161.0,USA,22.0,Female,High,Regular,8/18/2023,2023.0,August,0:59:17,1.0,422.9187748,422.9187748,Clothing,Adidas,Jacket,Excellent,Standard,Credit Card,Delivered,4.0,Denim jacket,2023-08-18,2025-11-15 00:59:17,Missing values; 
5646917.0,28874.0,,Amanda86@gmail.com,7441538645.0,067 Robert Alley,Montreal,Ontario,70694.0,Canada,22.0,Male,Low,Regular,7/21/2023,2023.0,July,14:58:00,8.0,302.3504127,2418.803301,Grocery,Nestle,Coffee,Average,Express,PayPal,Delivered,2.0,Americano,2023-07-21,2025-11-15 14:58:00,Missing values; 
4701973.0,92263.0,Jessica Ortiz,Vincent28@gmail.com,2485082611.0,5521 Pitts Points,San Jose,Washington,98849.0,USA,22.0,Male,,Regular,4/29/2023,2023.0,April,16:22:27,2.0,455.8356292,911.6712584,Home Decor,IKEA,Furniture,Bad,Same-Day,Credit Card,Delivered,1.0,Coffee table,2023-04-29,2025-11-15 16:22:27,Missing values; 
7252106.0,80610.0,Kelli Alvarez,,1437845038.0,57371 Shawn Fields Suite 792,Munich,Berlin,78260.0,Germany,22.0,Male,Low,Regular,4/20/2023,2023.0,April,9:04:26,2.0,54.54363311,109.0872662,Clothing,Nike,T-shirt,Excellent,Standard,Debit Card,Delivered,4.0,Plain tee,2023-04-20,2025-11-15 09:04:26,Missing values; 
2001432.0,48237.0,Derek Mack,Amber98@gmail.com,6827421445.0,2323 Holder Green Apt. 393,,England,39923.0,UK,22.0,Male,High,Regular,05-01-23,2023.0,May,3:28:14,1.0,81.24353752,81.24353752,Grocery,Coca-Cola,Soft Drink,Average,Standard,Debit Card,Delivered,2.0,Ginger ale,2023-05-01,2025-11-15 03:28:14,Missing values; 
3833181.0,57664.0,Jeffrey Hall,Travis81@gmail.com,4476051038.0,499 Laura Mount Suite 562,Munich,Berlin,89432.0,Germany,22.0,Male,Low,Regular,11/14/2023,2023.0,November,3:59:40,5.0,441.9763485,,Electronics,Samsung,Smartphone,Excellent,Same-Day,Debit Card,Delivered,5.0,Huawei P,2023-11-14,2025-11-15 03:59:40,Missing values; 
7311692.0,10688.0,Kelly Hensley,Daniel3@gmail.com,,929 Tyler Road,Ballarat,New South Wales,54954.0,Australia,22.0,Male,Medium,Regular,09-08-23,2023.0,September,20:28:54,7.0,488.6002066,3420.201446,Clothing,Nike,Shoes,Bad,Same-Day,Credit Card,Delivered,1.0,Boots,2023-09-08,2025-11-15 20:28:54,Missing values; 
7817058.0,76240.0,Robert Pope,Kathleen79@gmail.com,9713409009.0,52532 Wesley Way,London,England,34600.0,UK,22.0,Female,High,Regular,8/28/2023,2023.0,August,8:05:08,4.0,154.1303047,616.5212189,Home Decor,IKEA,Decorations,Average,Same-Day,,Delivered,2.0,Clocks,2023-08-28,2025-11-15 08:05:08,Missing values; 
4239223.0,30562.0,Lisa Luna,Zachary27@gmail.com,8133526360.0,090 Timothy Ville Apt. 525,Dallas,North Dakota,58568.0,USA,22.0,Male,Medium,Regular,1/26/2024,2024.0,January,16:43:33,10.0,481.8140645,4818.140645,Clothing,Adidas,Shoes,Bad,Express,,Delivered,1.0,Running shoes,2024-01-26,2025-11-15 16:43:33,Missing values; 
8723232.0,17025.0,Lauren Marquez,Brian8@gmail.com,5553989142.0,4696 Eric Street,Kansas City,West Virginia,25354.0,,22.0,Male,High,Regular,04-07-23,2023.0,April,9:31:51,5.0,453.775939,2268.879695,Clothing,Nike,Shorts,Good,Same-Day,Debit Card,Delivered,3.0,Denim shorts,2023-04-07,2025-11-15 09:31:51,Missing values; 
6940329.0,76411.0,Haley Ortiz,Jason15@gmail.com,7050495839.0,494 Angela Village Apt. 233,Portland,,6174.0,USA,22.0,Male,Medium,Regular,12/19/2023,2023.0,December,17:41:00,1.0,415.2756642,415.2756642,Electronics,Samsung,Television,Good,Standard,PayPal,Delivered,4.0,Curved TV,2023-12-19,2025-11-15 17:41:00,Missing values; 
1362278.0,84201.0,Victor Wilson,Heather28@gmail.com,6651943104.0,7477 Nelson Harbor Suite 695,London,England,40016.0,UK,22.0,Male,Low,Regular,4/13/2023,2023.0,April,15:25:09,4.0,42.31588195,169.2635278,Books,HarperCollins,Thriller,Bad,,Cash,Delivered,1.0,Action,2023-04-13,2025-11-15 15:25:09,Missing values; 
3451018.0,82769.0,Ronald Williams,Susan71@gmail.com,7070377123.0,8584 Sandra Locks Apt. 474,Montreal,Ontario,66714.0,Canada,22.0,Male,,Regular,11-03-23,2023.0,November,3:47:38,8.0,121.2340806,969.872645,Books,HarperCollins,Non-Fiction,Good,Express,Debit Card,Delivered,3.0,History,2023-11-03,2025-11-15 03:47:38,Missing values; 
,20517.0,Alyssa Taylor,Dana32@gmail.com,8719023620.0,18319 Roberts Club,Launceston,New South Wales,11008.0,Australia,22.0,Female,High,Regular,8/20/2023,2023.0,August,21:41:43,9.0,372.5611268,3353.050141,Electronics,Apple,Tablet,Excellent,Express,Credit Card,Delivered,4.0,Lenovo Tab,2023-08-20,2025-11-15 21:41:43,Missing values; 
4082818.0,59949.0,David Parker,Thomas14@gmail.com,5562268119.0,23710 Alexander Hills Suite 831,Las Vegas,Washington,98781.0,USA,22.0,Female,Medium,Regular,12/13/2023,2023.0,December,13:17:36,4.0,171.278295,685.1131801,Clothing,Zara,Jeans,Good,,Cash,Delivered,3.0,Boyfriend jeans,2023-12-13,2025-11-15 13:17:36,Missing values; 
3164339.0,58450.0,Mark Long,,4593611904.0,2990 Warren Prairie,Oxford,England,52812.0,UK,22.0,Female,Medium,Regular,3/25/2023,2023.0,March,11:00:47,3.0,442.0313654,1326.094096,Clothing,Adidas,T-shirt,Good,Express,Debit Card,Delivered,3.0,Crew neck tee,2023-03-25,2025-11-15 11:00:47,Missing values; 
,39364.0,John Wilson,Michael18@gmail.com,5157656475.0,5685 Paul Way,Sacramento,Washington,98988.0,USA,22.0,Male,Low,Regular,06-03-23,2023.0,June,13:53:40,7.0,42.72016766,299.0411736,Electronics,Sony,Headphones,Bad,Express,Cash,Delivered,1.0,Noise-cancelling headphones,2023-06-03,2025-11-15 13:53:40,Missing values; 
2640406.0,99247.0,Jeffrey Middleton,Donald77@gmail.com,9375809584.0,,New York,West Virginia,26691.0,USA,22.0,Female,Medium,Regular,6/28/2023,2023.0,June,15:32:29,8.0,118.4691142,947.7529138,Books,Penguin Books,Fiction,Excellent,Express,Credit Card,Delivered,5.0,Thriller,2023-06-28,2025-11-15 15:32:29,Missing values; 
6937233.0,46649.0,Edward Mcclain,Arthur65@gmail.com,7395430327.0,4219 Jimenez Walks,Mackay,New South Wales,75921.0,Australia,22.0,Female,Medium,Regular,12-08-23,2023.0,December,16:01:42,1.0,34.55339384,,Electronics,Sony,Television,Good,Same-Day,Cash,Delivered,4.0,QLED TV,2023-12-08,2025-11-15 16:01:42,Missing values; 
4162254.0,,Noah Jimenez,Christina3@gmail.com,9366560153.0,9845 Tammy Loaf Suite 252,Cleveland,Indiana,47882.0,USA,22.0,Male,Medium,Regular,02-07-24,2024.0,February,13:54:57,5.0,45.2919407,226.4597035,Home Decor,Bed Bath & Beyond,Kitchen,Excellent,Same-Day,Credit Card,Delivered,4.0,Blender,2024-02-07,2025-11-15 13:54:57,Missing values; 
,57688.0,Rhonda Douglas,Norma84@gmail.com,2798404607.0,084 John Mission Suite 966,Quebec City,Ontario,59756.0,Canada,22.0,Male,Low,Regular,6/14/2023,2023.0,June,16:48:19,4.0,190.8578783,763.4315131,Grocery,Pepsi,Soft Drink,Excellent,Express,PayPal,Delivered,4.0,Root beer,2023-06-14,2025-11-15 16:48:19,Missing values; 
4809255.0,59300.0,Brenda Pittman,Eric6@gmail.com,1535582231.0,4004 Juan Court,Southampton,England,73078.0,UK,22.0,Female,Low,Regular,1/25/2024,2024.0,January,4:27:45,1.0,303.3809195,303.3809195,Books,HarperCollins,Non-Fiction,Excellent,,Debit Card,Delivered,4.0,Science,2024-01-25,2025-11-15 04:27:45,Missing values; 
3010403.0,38697.0,Matthew Robinson,Anna45@gmail.com,6495555244.0,50827 Kimberly Ways,Essen,Berlin,13556.0,Germany,22.0,Female,,Regular,10/30/2023,2023.0,October,8:29:38,8.0,258.484912,2067.879296,Home Decor,Bed Bath & Beyond,Kitchen,Good,Standard,Credit Card,Delivered,4.0,Food processor,2023-10-30,2025-11-15 08:29:38,Missing values; 
6477192.0,36056.0,Michael Sanchez,Jennifer21@gmail.com,9538026663.0,02944 Williams Knolls,,New South Wales,67888.0,Australia,22.0,Female,Medium,Regular,8/19/2023,2023.0,August,22:03:14,7.0,465.1423384,3255.996369,Clothing,Nike,Shoes,Excellent,Express,Credit Card,Delivered,4.0,Loafers,2023-08-19,2025-11-15 22:03:14,Missing values; 
6947499.0,96225.0,Samuel Ross,Michael71@gmail.com,6778968653.0,20663 Sara Via Apt. 945,El Paso,Minnesota,55538.0,USA,22.0,Male,High,Regular,,2023.0,September,17:35:55,3.0,207.6070673,622.821202,Home Decor,IKEA,Decorations,Bad,Express,Debit Card,Delivered,1.0,Picture frames,,2025-11-15 17:35:55,Missing values; 
5015345.0,42681.0,Christopher Owens,Justin3@gmail.com,8404436159.0,50484 Vega Shoals Apt. 646,Kelowna,Ontario,55423.0,Canada,22.0,Male,Medium,Regular,02-12-24,2024.0,February,18:20:16,2.0,255.1787891,510.3575782,Grocery,Pepsi,Water,,Same-Day,Debit Card,Delivered,,Distilled water,2024-02-12,2025-11-15 18:20:16,Missing values; 
5742454.0,79101.0,Alicia Davis,Kelly50@gmail.com,7740854869.0,57663 Barajas Mountain Suite 463,Portsmouth,England,,UK,22.0,Male,Low,Regular,08-08-23,2023.0,August,12:51:01,3.0,383.5895845,1150.768754,Electronics,Sony,Smartphone,Good,Express,Cash,Delivered,3.0,Motorola Moto,2023-08-08,2025-11-15 12:51:01,Missing values; 
4073849.0,20586.0,Brett Cochran,Ashley99@gmail.com,1628183581.0,353 Terry Flats,Newcastle upon Tyne,England,85209.0,UK,22.0,Male,High,Regular,2/24/2024,2024.0,February,5:02:27,6.0,385.0471675,,Grocery,Nestle,Snacks,Average,Express,Credit Card,Delivered,2.0,Nuts,2024-02-24,2025-11-15 05:02:27,Missing values; 
8449783.0,30374.0,Willie Navarro,Christopher46@gmail.com,8357811473.0,449 Dunn Extension Apt. 177,Dortmund,Berlin,52973.0,Germany,22.0,Female,High,Regular,11/28/2023,2023.0,November,10:05:06,,491.0137108,4419.123397,Clothing,Nike,T-shirt,Bad,Express,Debit Card,Delivered,1.0,Crop top,2023-11-28,2025-11-15 10:05:06,Missing values; 
7730445.0,22319.0,Willie Chang,Phillip42@gmail.com,7492585561.0,9057 Price Mission Apt. 728,Cologne,Berlin,20870.0,Germany,22.0,Male,High,Regular,11/22/2023,2023.0,,8:47:15,5.0,80.77794021,403.8897011,Clothing,Adidas,Shoes,Bad,Same-Day,Cash,Delivered,1.0,Boots,2023-11-22,2025-11-15 08:47:15,Missing values; 
9257640.0,65820.0,Danielle Smith,Kimberly66@gmail.com,5482801038.0,84072 Ward Fall Suite 575,Oxford,England,61209.0,,22.0,Female,Low,Regular,2/17/2024,2024.0,February,4:16:01,6.0,288.7699598,1732.619759,Home Decor,Bed Bath & Beyond,Kitchen,Excellent,Same-Day,PayPal,Delivered,5.0,Refrigerator,2024-02-17,2025-11-15 04:16:01,Missing values; 
9789907.0,58475.0,John Jackson,Dana92@gmail.com,5934962842.0,67544 Anthony Rest,San Jose,Delaware,19808.0,USA,22.0,,Medium,Regular,07-11-23,2023.0,July,5:40:17,2.0,381.2439602,762.4879204,Grocery,Coca-Cola,Water,Bad,Standard,Credit Card,Delivered,1.0,Bottled water,2023-07-11,2025-11-15 05:40:17,Missing values; 
7087597.0,85684.0,Nathaniel Castro,Anna10@gmail.com,7412867440.0,8136 Nancy Parkway,Bendigo,New South Wales,49989.0,Australia,22.0,Female,,Regular,1/27/2024,2024.0,January,18:04:08,6.0,213.6519393,1281.911636,Home Decor,Home Depot,Tools,Bad,Same-Day,Debit Card,Delivered,1.0,Utility knife,2024-01-27,2025-11-15 18:04:08,Missing values; 
6378097.0,88039.0,Charles Mccoy,Brittany52@gmail.com,4497719322.0,13083 Peter Road Apt. 536,Plymouth,England,83185.0,UK,22.0,Female,,Regular,05-04-23,2023.0,May,18:15:47,2.0,232.6038304,465.2076608,Home Decor,Bed Bath & Beyond,Bedding,Bad,Same-Day,Debit Card,Delivered,1.0,Bed sheet set,2023-05-04,2025-11-15 18:15:47,Missing values; 
8333532.0,21184.0,Mary Mcgee,Christy49@gmail.com,4903268020.0,0391 Simpson Light,Montreal,Ontario,4110.0,Canada,22.0,Female,Medium,Regular,,2023.0,September,12:56:13,3.0,119.9293746,359.7881237,Home Decor,Bed Bath & Beyond,Bedding,Excellent,Same-Day,Debit Card,Delivered,4.0,Pillowcase set,,2025-11-15 12:56:13,Missing values; 
1412278.0,,Nancy Mercado,Mark74@gmail.com,1363395609.0,320 Wesley Canyon Apt. 889,Newcastle upon Tyne,England,55768.0,UK,22.0,Female,Low,Regular,7/20/2023,2023.0,July,4:25:15,3.0,35.72257821,107.1677346,Home Decor,Home Depot,Furniture,Good,Express,PayPal,Delivered,4.0,Bookshelf,2023-07-20,2025-11-15 04:25:15,Missing values; 
7461662.0,35990.0,James Flores,Reginald94@gmail.com,8865523026.0,1156 Reese Shoals Suite 797,Glasgow,England,,UK,22.0,Female,Low,Regular,08-02-23,2023.0,August,14:46:56,6.0,187.3295538,1123.977323,Home Decor,Bed Bath & Beyond,Bedding,Excellent,Same-Day,Debit Card,Delivered,4.0,Quilt,2023-08-02,2025-11-15 14:46:56,Missing values; 
5380157.0,44929.0,Glenn Powell,Eddie27@gmail.com,8056042693.0,48760 Perry Port Suite 993,Townsville,New South Wales,32282.0,Australia,22.0,Male,Medium,Regular,02-04-24,2024.0,February,8:21:05,8.0,113.331078,906.6486244,Home Decor,Bed Bath & Beyond,Bathroom,,Standard,PayPal,Delivered,,Toothbrush holder,2024-02-04,2025-11-15 08:21:05,Missing values; 
3743736.0,58721.0,Brandon Garcia,Thomas50@gmail.com,1892930192.0,6234 Theodore Course,Austin,Wyoming,83079.0,USA,22.0,Male,High,Regular,11/30/2023,2023.0,,6:03:02,5.0,484.6123444,2423.061722,Home Decor,Bed Bath & Beyond,Bedding,Bad,Same-Day,PayPal,Delivered,1.0,Duvet cover,2023-11-30,2025-11-15 06:03:02,Missing values; 
1062120.0,40910.0,Terry Cole,Brad88@gmail.com,9120272097.0,497 Joyce Rapid,Victoria,Ontario,80428.0,Canada,22.0,Female,Low,Regular,2/29/2024,2024.0,February,14:21:57,,75.55701723,226.6710517,Grocery,Nestle,Snacks,Excellent,Express,PayPal,Delivered,5.0,Cheese snacks,2024-02-29,2025-11-15 14:21:57,Missing values; 
2545115.0,10357.0,Derek Payne,,8737455722.0,14255 Patel Run Suite 033,Hull,England,80910.0,UK,22.0,Male,Low,Regular,7/13/2023,2023.0,July,22:01:39,3.0,101.2355305,303.7065914,Clothing,Nike,Shoes,Excellent,Same-Day,Credit Card,Delivered,5.0,Espadrilles,2023-07-13,2025-11-15 22:01:39,Missing values; 
2231338.0,38788.0,Anita Gomez,Ronald18@gmail.com,9182550853.0,,Leipzig,Berlin,30136.0,Germany,22.0,Male,High,Regular,06-11-23,2023.0,June,1:21:40,9.0,164.0019349,1476.017414,Home Decor,Bed Bath & Beyond,Bathroom,Bad,Express,Credit Card,Delivered,1.0,Bathtub,2023-06-11,2025-11-15 01:21:40,Missing values; 
7608539.0,40468.0,Joseph Parker,Nicole31@gmail.com,8798322103.0,304 Nichols Row,Sydney,New South Wales,32018.0,Australia,22.0,,Low,Regular,4/25/2023,2023.0,April,2:59:57,1.0,103.2590027,103.2590027,Grocery,Nestle,Snacks,Average,Express,Debit Card,Delivered,2.0,Pretzels,2023-04-25,2025-11-15 02:59:57,Missing values; 
1659087.0,36463.0,Katherine Price,Vickie37@gmail.com,1216811030.0,6735 Peters Track,Edmonton,Ontario,9371.0,Canada,22.0,Male,,Regular,04-11-23,2023.0,April,6:33:26,5.0,130.5637575,652.8187873,Grocery,Coca-Cola,Juice,Excellent,Same-Day,Credit Card,Delivered,4.0,Apple juice,2023-04-11,2025-11-15 06:33:26,Missing values; 
3260598.0,67244.0,Amy Smith,Jennifer18@gmail.com,6577246990.0,674 Lee Streets,Gold Coast,New South Wales,25353.0,Australia,22.0,Male,Medium,Regular,09-11-23,2023.0,September,9:51:06,7.0,,2441.619339,Home Decor,Home Depot,Decorations,Excellent,,PayPal,Delivered,4.0,Vases,2023-09-11,2025-11-15 09:51:06,Missing values; 
5728064.0,98870.0,Joyce Kennedy,John39@gmail.com,5787050284.0,905 Colton Ports,New York,California,92763.0,USA,22.0,Male,High,Regular,,2023.0,May,16:45:33,4.0,255.1612434,1020.644974,Clothing,Nike,Shoes,Bad,Standard,Cash,Delivered,1.0,Slippers,,2025-11-15 16:45:33,Missing values; 
7385043.0,39232.0,Katie Patel,Anthony44@gmail.com,6542405213.0,1025 Armstrong Square Suite 123,Oxford,England,,UK,22.0,Female,Low,Regular,05-09-23,2023.0,May,13:25:39,9.0,275.8241818,2482.417637,Grocery,Coca-Cola,Soft Drink,Good,Standard,Cash,Delivered,3.0,Iced tea,2023-05-09,2025-11-15 13:25:39,Missing values; 
9479375.0,49908.0,Beverly Ryan,Helen96@gmail.com,9830668281.0,44714 Christopher Parkways,Cardiff,England,20674.0,UK,22.0,Male,Low,Regular,04-03-23,2023.0,April,9:07:57,,98.55684255,98.55684255,Home Decor,IKEA,Lighting,Average,Same-Day,Cash,Delivered,2.0,Recessed lighting,2023-04-03,2025-11-15 09:07:57,Missing values; 
4207210.0,23736.0,Brandon Stewart,Bethany44@gmail.com,1228054114.0,4310 Joseph Pike Apt. 977,Oxford,England,80194.0,,22.0,Male,Medium,Regular,11/20/2023,2023.0,November,6:08:09,7.0,380.5932071,2664.15245,Clothing,Adidas,T-shirt,Good,Express,Cash,Delivered,4.0,Raglan tee,2023-11-20,2025-11-15 06:08:09,Missing values; 
,42092.0,Alan Haynes,Nicole80@gmail.com,3101725153.0,7913 Heather Crossing Apt. 932,Boston,Massachusetts,1428.0,USA,22.0,Male,Medium,Regular,2/14/2024,2024.0,February,14:24:29,4.0,339.6161093,1358.464437,Clothing,Zara,Dress,Average,Same-Day,PayPal,Delivered,2.0,Casual dress,2024-02-14,2025-11-15 14:24:29,Missing values; 
9188885.0,54372.0,Christopher Stanley,Jennifer14@gmail.com,2704882896.0,,Sacramento,Ohio,45933.0,USA,22.0,Male,Low,Regular,8/31/2023,2023.0,August,13:34:05,5.0,244.0231403,1220.115701,,Samsung,Smartphone,Average,Same-Day,PayPal,Delivered,2.0,Nokia,2023-08-31,2025-11-15 13:34:05,Missing values; 
7211582.0,57045.0,Charles Clarke,,2926299326.0,434 Joanna Common,Victoria,Ontario,53458.0,Canada,22.0,Female,Low,Regular,7/27/2023,2023.0,July,20:16:50,9.0,147.7150525,1329.435472,Electronics,Sony,Television,Excellent,Express,Credit Card,Delivered,4.0,OLED TV,2023-07-27,2025-11-15 20:16:50,Missing values; 
3225785.0,63061.0,Jill Baker,Philip100@gmail.com,,771 Alexander Inlet Suite 899,Halifax,Ontario,47741.0,Canada,22.0,Male,Medium,Regular,3/31/2023,2023.0,March,13:07:42,1.0,53.769079,53.769079,Home Decor,Home Depot,Furniture,Bad,Express,Debit Card,Delivered,1.0,TV stand,2023-03-31,2025-11-15 13:07:42,Missing values; 
8241455.0,52267.0,Julia Davidson,Erica86@gmail.com,3724035020.0,8306 Andrea Parkway Suite 803,Gold Coast,New South Wales,8532.0,Australia,22.0,Male,Medium,Regular,4/22/2023,2023.0,,16:55:21,2.0,40.53810825,81.07621651,Clothing,Adidas,Jacket,Bad,Standard,Cash,Delivered,1.0,Denim jacket,2023-04-22,2025-11-15 16:55:21,Missing values; 
3467224.0,44022.0,Fernando Little,Candice85@gmail.com,3447397582.0,489 Tran Branch Suite 485,Mnster,,44933.0,Germany,22.0,Male,High,Regular,3/21/2023,2023.0,March,17:46:11,1.0,404.987448,404.987448,Electronics,Samsung,Tablet,Average,Same-Day,Cash,Delivered,2.0,Lenovo Tab,2023-03-21,2025-11-15 17:46:11,Missing values; 
3293294.0,81907.0,Laura Ferguson,Timothy16@gmail.com,,4455 Harvey Burg Suite 673,Nottingham,England,29948.0,UK,22.0,Female,Low,Regular,12-01-23,2023.0,December,16:25:00,2.0,298.3260503,596.6521007,Clothing,Nike,T-shirt,Good,Standard,Debit Card,Delivered,3.0,Henley tee,2023-12-01,2025-11-15 16:25:00,Missing values; 
7495072.0,56861.0,Aaron Porter,Lisa24@gmail.com,8505664223.0,3209 Stephanie Locks Apt. 858,Sheffield,England,33135.0,UK,22.0,Female,Low,Regular,01-07-24,2024.0,January,16:13:12,4.0,226.828483,907.3139321,Clothing,Zara,Jeans,,Express,Cash,Delivered,,Boyfriend jeans,2024-01-07,2025-11-15 16:13:12,Missing values; 
7291728.0,41200.0,Daniel Allen,Henry67@gmail.com,6918072998.0,379 Harvey Mews Apt. 376,Albuquerque,Kansas,66004.0,USA,22.0,,High,Regular,7/25/2023,2023.0,July,15:14:16,6.0,342.3965801,2054.379481,Books,Penguin Books,Fiction,Excellent,Same-Day,Cash,Delivered,5.0,Dystopian,2023-07-25,2025-11-15 15:14:16,Missing values; 
,89606.0,Richard Smith,James27@gmail.com,5483886077.0,782 Linda Island Suite 938,Kitchener,Ontario,68578.0,Canada,22.0,Male,Low,Regular,1/29/2024,2024.0,January,15:28:42,7.0,221.1637684,1548.146379,Clothing,Nike,T-shirt,Bad,Standard,Credit Card,Delivered,1.0,Crew neck tee,2024-01-29,2025-11-15 15:28:42,Missing values; 
6558547.0,93372.0,Kevin Cole,Kimberly73@gmail.com,1825255865.0,02308 Matthew View Apt. 217,Canberra,New South Wales,93207.0,Australia,22.0,,Low,Regular,7/20/2023,2023.0,July,16:34:31,10.0,235.7893343,2357.893343,Home Decor,IKEA,Lighting,Average,Standard,Debit Card,Delivered,2.0,Track lighting,2023-07-20,2025-11-15 16:34:31,Missing values; 
9738742.0,16762.0,Cheryl Rose,Alicia64@gmail.com,7026871220.0,121 Lee Extensions,Stuttgart,Berlin,37896.0,Germany,22.0,Male,High,Regular,7/31/2023,2023.0,,2:53:01,9.0,455.8784097,4102.905687,Grocery,Coca-Cola,Juice,Bad,Express,Debit Card,Delivered,1.0,Mixed fruit juice,2023-07-31,2025-11-15 02:53:01,Missing values; 
5789617.0,44602.0,Dr. Samuel Myers Jr.,Theodore18@gmail.com,,563 Kelley Stream Suite 030,Kelowna,Ontario,94514.0,Canada,22.0,Male,Medium,Regular,11/27/2023,2023.0,November,0:26:47,8.0,199.0159245,1592.127396,Clothing,Zara,Jeans,Good,Standard,PayPal,Delivered,4.0,High-waisted jeans,2023-11-27,2025-11-15 00:26:47,Missing values; 
9009281.0,47466.0,Erin Flores,Anna74@gmail.com,2058441853.0,7981 Burke Square Suite 970,Cardiff,England,97483.0,UK,22.0,Male,High,Regular,3/23/2023,2023.0,March,,3.0,222.2150854,666.6452563,Clothing,Zara,Dress,Average,Same-Day,Debit Card,Delivered,2.0,A-line dress,2023-03-23,,Missing values; 
1696879.0,36431.0,Kevin Martin,Elizabeth72@gmail.com,9119524587.0,21416 Hurst Greens Apt. 126,Portsmouth,England,94814.0,UK,22.0,Male,Medium,Regular,3/19/2023,2023.0,March,15:45:41,10.0,300.0792068,3000.792068,Electronics,Apple,Laptop,,Standard,Debit Card,Delivered,,Samsung Notebook,2023-03-19,2025-11-15 15:45:41,Missing values; 
5919402.0,54714.0,Kylie Weiss,,9004457120.0,3791 Neal Keys,Montreal,Ontario,87785.0,Canada,22.0,Male,Low,Regular,6/18/2023,2023.0,June,20:33:49,5.0,108.9853186,544.9265931,Clothing,Nike,T-shirt,Average,Express,Debit Card,Delivered,2.0,Crew neck tee,2023-06-18,2025-11-15 20:33:49,Missing values; 
2737926.0,74991.0,Casey Maddox,Russell5@gmail.com,2848887676.0,429 Dawn Ways,Portland,Nevada,89841.0,USA,22.0,Female,Low,Regular,7/21/2023,2023.0,July,19:13:25,8.0,252.5310911,2020.248729,,Nike,Shoes,Average,Standard,PayPal,Delivered,2.0,Boots,2023-07-21,2025-11-15 19:13:25,Missing values; 
7065492.0,14208.0,Rebecca Alexander,Julie11@gmail.com,5574089852.0,693 Mann Ports,Saskatoon,Ontario,64150.0,Canada,22.0,Male,Low,Regular,9/20/2023,2023.0,September,11:42:19,6.0,70.46407981,422.7844789,Clothing,,Shorts,Bad,Express,Debit Card,Delivered,1.0,Board shorts,2023-09-20,2025-11-15 11:42:19,Missing values; 
3001216.0,90698.0,Peter Reyes,Trevor38@gmail.com,2452018653.0,56304 Fowler Drive,Hanover,Berlin,99578.0,Germany,22.0,Female,Medium,Regular,,2023.0,April,17:14:39,1.0,44.20735835,44.20735835,Electronics,Apple,Smartphone,Good,Standard,PayPal,Delivered,3.0,Sony Xperia,,2025-11-15 17:14:39,Missing values; 
4395459.0,42645.0,Matthew Trujillo,Bonnie46@gmail.com,7564189860.0,7169 Lang Brooks Apt. 257,Glasgow,England,40884.0,UK,22.0,Female,Low,Regular,05-10-23,,May,7:50:09,7.0,384.0550166,2688.385116,Books,Random House,Fiction,Good,Express,PayPal,Delivered,3.0,Adventure,2023-05-10,2025-11-15 07:50:09,Missing values; 
5699552.0,89740.0,Shawn Fitzpatrick,Victoria99@gmail.com,,0630 Joshua Loop Suite 314,Nuremberg,Berlin,19917.0,Germany,22.0,Male,Medium,Regular,2/27/2024,2024.0,February,23:38:53,1.0,35.01339485,35.01339485,Home Decor,Bed Bath & Beyond,Kitchen,Bad,Same-Day,Credit Card,Delivered,1.0,Food processor,2024-02-27,2025-11-15 23:38:53,Missing values; 
4371297.0,27103.0,Angela Cole,Kathryn72@gmail.com,5056305968.0,006 Gabrielle Port,Miami,Arkansas,72073.0,USA,22.0,Female,Medium,Regular,8/14/2023,2023.0,August,23:48:28,5.0,282.5571827,,Home Decor,Home Depot,Furniture,Excellent,Express,Credit Card,Delivered,4.0,Bed,2023-08-14,2025-11-15 23:48:28,Missing values; 
8549078.0,46387.0,Katrina Walker,Teresa1@gmail.com,4143136779.0,37551 Joseph Drives Apt. 732,Oakland,Arizona,85559.0,USA,22.0,,Medium,Regular,04-06-23,2023.0,April,0:33:33,4.0,460.8382866,1843.353146,Electronics,Apple,Smartphone,Good,Same-Day,Cash,Delivered,3.0,Google Pixel,2023-04-06,2025-11-15 00:33:33,Missing values; 
5727289.0,70734.0,Aaron Daniels,Ashley30@gmail.com,8589978134.0,197 Larry Drive,Leicester,,47114.0,UK,22.0,Male,Medium,Regular,5/26/2023,2023.0,May,16:05:21,7.0,373.1859813,2612.301869,Home Decor,Home Depot,Tools,Bad,Standard,PayPal,Delivered,1.0,Screwdriver set,2023-05-26,2025-11-15 16:05:21,Missing values; 
6346011.0,67964.0,Paula Brown,Raymond18@gmail.com,2691090169.0,18379 Lopez Stream,Hamilton,Ontario,36476.0,Canada,22.0,Male,Low,Regular,,2024.0,February,9:56:28,10.0,195.6112749,1956.112749,Electronics,Samsung,Tablet,Good,Same-Day,Credit Card,Delivered,4.0,iPad,,2025-11-15 09:56:28,Missing values; 
3223617.0,95320.0,Megan Harris,Marilyn82@gmail.com,6886090469.0,4734 Omar Crescent Suite 719,Hanover,Berlin,71628.0,Germany,22.0,Male,,Regular,03-06-23,2023.0,March,1:03:39,2.0,428.2446688,856.4893376,Electronics,Apple,Laptop,Average,Standard,PayPal,Delivered,2.0,MacBook,2023-03-06,2025-11-15 01:03:39,Missing values; 
1056407.0,22909.0,Christine Wright,Eric3@gmail.com,3102452874.0,241 Ford Viaduct Apt. 308,Kansas City,Utah,84749.0,USA,22.0,Male,Low,Regular,02-03-24,2024.0,February,8:24:34,3.0,129.7566406,,Home Decor,Bed Bath & Beyond,Bathroom,Bad,Same-Day,Credit Card,Delivered,1.0,Bathtub,2024-02-03,2025-11-15 08:24:34,Missing values; 
1663088.0,20127.0,John Kane,Danielle54@gmail.com,9472662499.0,530 Webb Passage,Virginia Beach,Kansas,66016.0,USA,22.0,Male,Low,Regular,3/23/2023,2023.0,March,23:45:55,6.0,353.8114249,2122.868549,,Nestle,Snacks,Good,Same-Day,PayPal,Delivered,3.0,Fruit snacks,2023-03-23,2025-11-15 23:45:55,Missing values; 
2022385.0,33353.0,Gabriel Cooley MD,Jacob31@gmail.com,4788819557.0,936 Heather Brooks Suite 373,Hobart,New South Wales,11958.0,Australia,22.0,Male,Medium,Regular,2/13/2024,2024.0,February,,8.0,81.22742647,649.8194117,Clothing,Adidas,Jacket,Average,Standard,Debit Card,Delivered,2.0,Windbreaker,2024-02-13,,Missing values; 
7777021.0,65188.0,John Hill,Eric97@gmail.com,1946513733.0,131 Gomez Station,Quebec City,Ontario,36144.0,Canada,22.0,Male,Low,Regular,7/25/2023,2023.0,July,11:58:09,9.0,320.4766372,,Home Decor,Bed Bath & Beyond,Kitchen,Bad,Standard,PayPal,Delivered,1.0,Refrigerator,2023-07-25,2025-11-15 11:58:09,Missing values; 
5816557.0,22183.0,William Hanna,Rebecca99@gmail.com,4652084534.0,9682 Jacobs Corner,Halifax,Ontario,32100.0,Canada,22.0,Female,Low,Regular,5/23/2023,2023.0,May,8:46:08,,51.40479334,462.64314,Home Decor,Bed Bath & Beyond,Bathroom,Excellent,Standard,Debit Card,Delivered,4.0,Bathtub,2023-05-23,2025-11-15 08:46:08,Missing values; 
2739800.0,,Tara Miller,Seth51@gmail.com,2449724832.0,89114 Dennis Extension,Brighton,England,51717.0,UK,22.0,Female,Low,Regular,12-01-23,2023.0,December,15:25:56,6.0,430.9188548,2585.513129,Grocery,Pepsi,Soft Drink,Excellent,Express,Credit Card,Delivered,4.0,Cola,2023-12-01,2025-11-15 15:25:56,Missing values; 
8483654.0,19727.0,Lance Sims,Amber68@gmail.com,4315531892.0,8155 Russell Springs Apt. 140,Duisburg,Berlin,88377.0,Germany,22.0,Male,,Regular,07-06-23,2023.0,July,10:58:27,6.0,239.9679176,1439.807506,Clothing,Adidas,Shoes,Average,Standard,Cash,Delivered,2.0,Boots,2023-07-06,2025-11-15 10:58:27,Missing values; 
,15838.0,Lorraine Stevenson,Sara95@gmail.com,4256988386.0,758 Valentine Glen,Victoria,Ontario,72562.0,Canada,22.0,Male,Low,Regular,7/27/2023,2023.0,July,4:10:30,3.0,132.5646235,397.6938705,Electronics,Samsung,Tablet,Good,Express,Debit Card,Delivered,3.0,Huawei MediaPad,2023-07-27,2025-11-15 04:10:30,Missing values; 
2316694.0,89366.0,Destiny Massey,Karen83@gmail.com,2004271773.0,05339 Mitchell Springs Apt. 896,Portsmouth,England,91054.0,UK,22.0,Female,High,Regular,2/28/2024,2024.0,February,18:33:44,8.0,350.7959524,2806.36762,Home Decor,Home Depot,Furniture,Excellent,,PayPal,Delivered,5.0,Desk,2024-02-28,2025-11-15 18:33:44,Missing values; 
4242144.0,17160.0,Adam Mason,Michael28@gmail.com,2792151834.0,656 Michael Manor,Mnster,Berlin,15335.0,Germany,22.0,Male,High,Regular,1/14/2024,2024.0,,2:55:46,5.0,351.3458958,1756.729479,Grocery,Nestle,Coffee,Excellent,Express,PayPal,Delivered,4.0,Mocha,2024-01-14,2025-11-15 02:55:46,Missing values; 
8849381.0,78252.0,Timothy Mcdowell Jr.,Juan90@gmail.com,9794431206.0,6618 Sherri Fall Apt. 933,Southampton,England,34790.0,UK,22.0,Female,Low,Regular,12/30/2023,,December,9:11:35,3.0,252.5568834,757.6706502,Home Decor,Home Depot,Furniture,Good,Same-Day,Debit Card,Delivered,4.0,Coffee table,2023-12-30,2025-11-15 09:11:35,Missing values; 
8053789.0,15687.0,Randall Moore,Ronald67@gmail.com,4995243814.0,254 Hammond Springs Apt. 949,Belfast,England,64734.0,UK,22.0,Female,Low,Regular,2/21/2024,2024.0,February,14:35:37,4.0,362.4266319,1449.706527,Books,HarperCollins,Non-Fiction,Good,,Debit Card,Delivered,3.0,Health,2024-02-21,2025-11-15 14:35:37,Missing values; 
6447194.0,60902.0,Amy Thomas,Michelle82@gmail.com,1974337345.0,986 Holly Camp,Miami,Hawaii,96832.0,USA,22.0,,Medium,Regular,2/18/2024,2024.0,February,13:12:27,1.0,255.1453468,255.1453468,Books,HarperCollins,Thriller,Bad,Same-Day,Cash,Delivered,1.0,Legal thriller,2024-02-18,2025-11-15 13:12:27,Missing values; 
9209986.0,93712.0,Ashley Lopez,Thomas8@gmail.com,9953647718.0,7816 Ramirez Club Suite 729,Albury-Wodonga,New South Wales,40675.0,Australia,22.0,Male,Low,Regular,09-04-23,2023.0,September,14:46:18,10.0,,3194.237323,Grocery,Coca-Cola,Juice,Average,Same-Day,Debit Card,Delivered,2.0,Tomato juice,2023-09-04,2025-11-15 14:46:18,Missing values; 
5060064.0,84426.0,Jennifer Hernandez,Jeffrey54@gmail.com,6675916761.0,67952 Brenda Forest,Hull,England,40432.0,UK,22.0,Female,Medium,Regular,12-06-23,2023.0,December,18:27:58,7.0,410.5144973,,Books,HarperCollins,Non-Fiction,Bad,Express,Cash,Delivered,1.0,Science,2023-12-06,2025-11-15 18:27:58,Missing values; 
7021734.0,51818.0,Angela Fox,James10@gmail.com,9509871562.0,15569 Katie Parkway,Bremen,,67105.0,Germany,22.0,Male,Low,Regular,11/18/2023,2023.0,November,23:10:13,10.0,91.04880161,910.4880161,Grocery,Pepsi,Water,Bad,Express,Debit Card,Delivered,1.0,Mineral water,2023-11-18,2025-11-15 23:10:13,Missing values; 
3231729.0,91656.0,Mark Moore,Wendy20@gmail.com,6252452192.0,3418 Kara Ports,Edinburgh,England,61770.0,UK,22.0,Male,Low,Regular,03-11-23,2023.0,,15:31:19,1.0,294.0236309,294.0236309,Clothing,Nike,Shoes,Excellent,Same-Day,Credit Card,Delivered,5.0,Loafers,2023-03-11,2025-11-15 15:31:19,Missing values; 
5245701.0,48017.0,Austin Moon,Andre96@gmail.com,4863685359.0,615 Adam Key Suite 190,Oshawa,Ontario,5868.0,Canada,22.0,Male,,Regular,3/24/2023,2023.0,March,21:01:21,8.0,211.9700115,1695.760092,Home Decor,Home Depot,Decorations,Excellent,Express,Debit Card,Delivered,5.0,Mirrors,2023-03-24,2025-11-15 21:01:21,Missing values; 
2769607.0,93838.0,Felicia Camacho,Nicole65@gmail.com,8028086064.0,77177 Tara Loop,Dortmund,,67454.0,Germany,22.0,Female,High,Regular,9/19/2023,2023.0,September,23:23:05,5.0,487.9682133,2439.841066,Grocery,Pepsi,Soft Drink,Good,Express,PayPal,Delivered,3.0,Cola,2023-09-19,2025-11-15 23:23:05,Missing values; 
3226651.0,18007.0,Melissa Fields,Stephen21@gmail.com,,41438 Bowers Summit,Townsville,New South Wales,4288.0,Australia,22.0,Male,Low,Regular,8/21/2023,2023.0,August,13:34:26,7.0,312.4142586,2186.89981,Books,Random House,Non-Fiction,Excellent,Express,Debit Card,Delivered,4.0,Memoir,2023-08-21,2025-11-15 13:34:26,Missing values; 
,87633.0,Mitchell Powers,Willie55@gmail.com,8548972960.0,93034 Karen Lodge,Leeds,England,93518.0,UK,22.0,Male,Medium,Regular,11/26/2023,2023.0,November,15:44:56,4.0,359.0246783,1436.098713,Books,Penguin Books,Non-Fiction,Good,Express,Debit Card,Delivered,3.0,Psychology,2023-11-26,2025-11-15 15:44:56,Missing values; 
3825940.0,21292.0,Jack Nielsen,Monica31@gmail.com,9322256447.0,3361 Thomas Port Apt. 103,Edinburgh,,20883.0,UK,22.0,Male,High,Regular,01-01-24,2024.0,January,12:13:04,2.0,384.8152348,769.6304697,Books,Penguin Books,Non-Fiction,Bad,Express,Cash,Delivered,1.0,Science,2024-01-01,2025-11-15 12:13:04,Missing values; 
6489968.0,73277.0,Fernando Waters,Joshua35@gmail.com,8585704609.0,0892 Macdonald Greens Apt. 324,Liverpool,England,41195.0,UK,22.0,Male,Low,Regular,12/23/2023,2023.0,,23:47:59,10.0,424.6917038,4246.917038,Books,Penguin Books,Non-Fiction,Average,Standard,Cash,Delivered,2.0,Memoir,2023-12-23,2025-11-15 23:47:59,Missing values; 
5286116.0,85417.0,Steve Martinez,Kristine17@gmail.com,1100311545.0,42990 Craig Islands Suite 473,Edmonton,Ontario,91170.0,Canada,22.0,Male,Low,Regular,02-07-24,2024.0,February,18:43:44,2.0,45.45332722,90.90665443,Grocery,,Soft Drink,Good,Express,PayPal,Delivered,4.0,Grape soda,2024-02-07,2025-11-15 18:43:44,Missing values; 
8836321.0,95189.0,Eric Cobb,Steven64@gmail.com,2315592717.0,257 Jeremy Extension Suite 891,Charlotte,Mississippi,38645.0,USA,22.0,Female,Low,Regular,3/19/2023,2023.0,,8:37:35,7.0,261.3992809,1829.794967,Home Decor,Bed Bath & Beyond,Bathroom,Excellent,Express,Credit Card,Delivered,5.0,Mirror,2023-03-19,2025-11-15 08:37:35,Missing values; 
5462909.0,15648.0,Danielle Krueger,Steven88@gmail.com,1316209695.0,1062 Cameron Views,Dsseldorf,Berlin,4116.0,,22.0,Male,Low,Regular,12-10-23,2023.0,December,15:47:22,8.0,232.116301,1856.930408,Grocery,Nestle,Chocolate,Excellent,Express,PayPal,Delivered,4.0,Chocolate fondue,2023-12-10,2025-11-15 15:47:22,Missing values; 
4812035.0,66843.0,Katherine Olson,Sandra29@gmail.com,3219818259.0,28692 Harris Center,Ottawa,Ontario,26728.0,,22.0,Male,Medium,Regular,11-06-23,2023.0,November,13:35:41,4.0,53.41228577,213.6491431,Home Decor,Home Depot,Furniture,Bad,Express,PayPal,Delivered,1.0,Wardrobe,2023-11-06,2025-11-15 13:35:41,Missing values; 
4485445.0,97813.0,James Beck,Charles72@gmail.com,2687028184.0,,Essen,Berlin,99776.0,Germany,22.0,Female,Low,Regular,10/22/2023,2023.0,October,15:34:16,8.0,268.7880279,2150.304223,Books,Random House,Non-Fiction,Bad,Same-Day,Cash,Delivered,1.0,Cooking,2023-10-22,2025-11-15 15:34:16,Missing values; 
8830903.0,31323.0,Angela Spencer MD,Ronald7@gmail.com,6841579608.0,412 Chapman Lodge Apt. 561,,Connecticut,6169.0,USA,22.0,Male,Medium,Regular,10-08-23,2023.0,October,7:33:52,5.0,342.3887117,1711.943558,Grocery,Nestle,Coffee,Bad,Same-Day,PayPal,Delivered,1.0,Espresso,2023-10-08,2025-11-15 07:33:52,Missing values; 
5444537.0,95548.0,Stephanie Edwards,Jose27@gmail.com,1691691216.0,57896 Mark Harbor,Bonn,Berlin,55733.0,Germany,22.0,Male,Medium,Regular,12/21/2023,2023.0,December,8:16:05,9.0,398.668519,3588.016671,Books,HarperCollins,Fiction,Average,,Debit Card,Delivered,2.0,Historical fiction,2023-12-21,2025-11-15 08:16:05,Missing values; 
4648493.0,33564.0,Ashley Perez,Andrew31@gmail.com,6329058941.0,19004 Pena Glen,Albury-Wodonga,New South Wales,26678.0,Australia,22.0,Female,Medium,Regular,10-03-23,2023.0,October,10:10:21,3.0,317.5920336,952.7761008,Clothing,Nike,Shoes,Excellent,,PayPal,Delivered,4.0,Sandals,2023-10-03,2025-11-15 10:10:21,Missing values; 
3963361.0,87197.0,Stanley Drake,Lindsey11@gmail.com,3181072097.0,01511 John Knolls Suite 909,Adelaide,New South Wales,16934.0,,22.0,Female,Low,Regular,8/23/2023,2023.0,August,16:44:32,1.0,139.6166189,139.6166189,Home Decor,Bed Bath & Beyond,Kitchen,Average,Express,Credit Card,Delivered,2.0,Refrigerator,2023-08-23,2025-11-15 16:44:32,Missing values; 
6349220.0,55455.0,Elaine Newman,Madeline66@gmail.com,,027 Joseph Station,Vancouver,Ontario,71567.0,Canada,22.0,Male,Medium,Regular,09-10-23,2023.0,September,1:57:14,1.0,178.877304,178.877304,Grocery,Nestle,Snacks,Good,Standard,Credit Card,Delivered,4.0,Granola bars,2023-09-10,2025-11-15 01:57:14,Missing values; 
8360996.0,48324.0,Travis Russell,Cynthia4@gmail.com,2089589976.0,230 Ward Curve,Tulsa,Colorado,80630.0,USA,22.0,Female,Medium,Regular,07-11-23,2023.0,July,3:49:32,9.0,168.6488334,1517.839501,Home Decor,,Lighting,Good,Standard,Debit Card,Delivered,3.0,Desk lamps,2023-07-11,2025-11-15 03:49:32,Missing values; 
7722858.0,69136.0,,Jorge10@gmail.com,6869241640.0,8989 Stokes Light,Bremen,Berlin,80794.0,Germany,22.0,Female,Low,Regular,12/19/2023,2023.0,December,18:18:20,8.0,272.2181177,2177.744942,Books,HarperCollins,Non-Fiction,Bad,Express,Debit Card,Delivered,1.0,Business,2023-12-19,2025-11-15 18:18:20,Missing values; 
7893445.0,10532.0,Ruth Holt,Elizabeth29@gmail.com,,757 Brown Groves Apt. 804,Cairns,New South Wales,25246.0,Australia,22.0,Male,Low,Regular,10-07-23,2023.0,October,9:38:43,10.0,270.5233757,2705.233757,Home Decor,IKEA,Decorations,Bad,Standard,Cash,Delivered,1.0,Vases,2023-10-07,2025-11-15 09:38:43,Missing values; 
7694557.0,96553.0,Amanda Sullivan,Richard50@gmail.com,8104674546.0,852 Anthony Stream Suite 420,Montreal,Ontario,36592.0,Canada,22.0,Female,Medium,Regular,3/14/2023,2023.0,,8:01:58,10.0,467.4236193,4674.236193,Books,HarperCollins,Non-Fiction,Excellent,Standard,,Delivered,4.0,Business,2023-03-14,2025-11-15 08:01:58,Missing values; 
8373947.0,70389.0,Roy Adams,Hannah34@gmail.com,4830754859.0,6744 Espinoza Centers Apt. 407,Toowoomba,New South Wales,17049.0,Australia,22.0,Female,High,Regular,10/16/2023,2023.0,October,12:14:34,9.0,254.7142293,,Clothing,Zara,Shirt,Excellent,Express,PayPal,Delivered,5.0,Flannel shirt,2023-10-16,2025-11-15 12:14:34,Missing values; 
8355608.0,72542.0,Elizabeth Paul,David11@gmail.com,9697158315.0,8219 Schultz Village,Brighton,England,71253.0,UK,22.0,Male,Low,Regular,08-12-23,2023.0,,20:57:41,2.0,166.1730766,332.3461533,Books,HarperCollins,Non-Fiction,Bad,Same-Day,Credit Card,Delivered,1.0,Biography,2023-08-12,2025-11-15 20:57:41,Missing values; 
7364088.0,10574.0,Dr. Joshua Cortez Jr.,,2365119597.0,51956 Tim Mews Suite 564,Kelowna,Ontario,36372.0,Canada,22.0,Female,Low,Regular,2/16/2024,2024.0,February,3:50:33,8.0,379.1014231,3032.811385,Electronics,Sony,Smartphone,Good,Express,Debit Card,Delivered,4.0,iPhone,2024-02-16,2025-11-15 03:50:33,Missing values; 
8254071.0,23801.0,Blake Hester,,7866325075.0,6862 Thomas Viaduct,Leipzig,Berlin,57716.0,Germany,22.0,Female,Low,Regular,10/22/2023,2023.0,October,5:55:48,6.0,138.064277,828.3856622,Books,Random House,Non-Fiction,Bad,Standard,PayPal,Delivered,1.0,Memoir,2023-10-22,2025-11-15 05:55:48,Missing values; 
9129663.0,67677.0,Ashley Johnson DDS,Ashley47@gmail.com,9588795065.0,277 Gabriel Plaza Apt. 702,Dortmund,Berlin,20454.0,,22.0,Male,Low,Regular,2/24/2024,2024.0,February,19:21:48,3.0,195.5094973,586.5284919,Books,Random House,Non-Fiction,Average,Express,PayPal,Delivered,2.0,Health,2024-02-24,2025-11-15 19:21:48,Missing values; 
4833259.0,14262.0,Monica Huerta,John26@gmail.com,7220256233.0,300 Vega Lodge,Virginia Beach,Vermont,5178.0,USA,22.0,Female,Low,Regular,01-09-24,2024.0,January,0:26:36,9.0,,3824.189383,Books,Penguin Books,Children's,Average,Same-Day,PayPal,Delivered,2.0,Books,2024-01-09,2025-11-15 00:26:36,Missing values; 
1405889.0,97184.0,Kimberly Harris,,8078571812.0,44826 Reynolds Vista,Darwin,New South Wales,65982.0,Australia,22.0,Male,Low,Regular,09-03-23,2023.0,September,14:32:22,7.0,99.65607836,697.5925485,Home Decor,IKEA,Decorations,Excellent,Same-Day,Credit Card,Delivered,5.0,Curtains,2023-09-03,2025-11-15 14:32:22,Missing values; 
8389671.0,16863.0,Tara Woods,Isabella42@gmail.com,9495899275.0,0934 Gregory Cliffs Suite 890,Barrie,Ontario,,Canada,22.0,Male,Medium,Regular,12/19/2023,2023.0,December,20:25:13,5.0,126.9437524,634.718762,Clothing,Adidas,Jacket,Bad,Standard,Debit Card,Delivered,1.0,Parka,2023-12-19,2025-11-15 20:25:13,Missing values; 
9090538.0,99304.0,Colleen Bryant,Alice25@gmail.com,9234621406.0,906 Dixon Corners Apt. 012,Victoria,Ontario,10682.0,Canada,53.0,Female,,Regular,8/19/2023,2023.0,August,7:22:48,5.0,362.9840097,1814.920048,Home Decor,Home Depot,Decorations,Bad,Same-Day,Cash,Delivered,1.0,Picture frames,2023-08-19,2025-11-15 07:22:48,Missing values; 
8028185.0,32498.0,Paul Jimenez,Anthony46@gmail.com,9677739102.0,380 Jean Fall Apt. 647,Canberra,New South Wales,52038.0,Australia,20.0,,Medium,Regular,8/30/2023,2023.0,August,19:12:30,5.0,130.9450089,654.7250445,Home Decor,Home Depot,Furniture,Average,Same-Day,Debit Card,Delivered,2.0,Wardrobe,2023-08-30,2025-11-15 19:12:30,Missing values; 
1644848.0,62609.0,,James31@gmail.com,1519629887.0,28939 Meyer Garden Suite 865,Dsseldorf,Berlin,93183.0,Germany,20.0,Male,Low,Regular,1/31/2024,2024.0,January,16:05:52,3.0,34.66294098,103.9888229,Clothing,Adidas,Shoes,Bad,Express,Cash,Delivered,1.0,Slippers,2024-01-31,2025-11-15 16:05:52,Missing values; 
4276385.0,63559.0,Melissa Meyers MD,Alexander85@gmail.com,2712867809.0,61282 Zimmerman Hollow Suite 796,Belfast,England,11094.0,UK,20.0,Female,Medium,Regular,5/25/2023,2023.0,,23:12:42,10.0,400.0232364,4000.232364,Home Decor,IKEA,Furniture,Average,Same-Day,Debit Card,Delivered,2.0,Dining table,2023-05-25,2025-11-15 23:12:42,Missing values; 
4100964.0,19801.0,William Reed,David32@gmail.com,,434 Williams Mountains Suite 525,Birmingham,England,85751.0,UK,20.0,Male,Medium,Regular,3/27/2023,2023.0,March,16:09:17,8.0,490.9986559,3927.989247,Books,HarperCollins,Non-Fiction,Average,Express,PayPal,Delivered,2.0,Biography,2023-03-27,2025-11-15 16:09:17,Missing values; 
7483049.0,93149.0,Cynthia Stevenson,Kevin61@gmail.com,4053305249.0,0895 Richardson Crossing Suite 210,Toronto,Ontario,44613.0,Canada,20.0,Male,Low,Regular,6/26/2023,2023.0,June,20:11:09,5.0,175.3248939,876.6244696,Electronics,,Tablet,Good,Same-Day,Debit Card,Delivered,4.0,Asus ZenPad,2023-06-26,2025-11-15 20:11:09,Missing values; 
5478889.0,15599.0,Sarah Bailey,Angela82@gmail.com,4699362638.0,840 Carolyn Drive,Dsseldorf,Berlin,90795.0,Germany,20.0,,Low,Regular,10-09-23,2023.0,October,13:10:20,4.0,183.6043669,734.4174676,Electronics,Apple,Smartphone,Bad,Standard,Debit Card,Delivered,1.0,iPhone,2023-10-09,2025-11-15 13:10:20,Missing values; 
5340869.0,63814.0,Carl Jackson,Laura63@gmail.com,9533329151.0,381 David Vista Apt. 367,Edinburgh,England,16076.0,UK,20.0,Male,Medium,Regular,1/29/2024,2024.0,,0:11:36,7.0,110.1894982,771.3264876,Electronics,Samsung,Tablet,Bad,Same-Day,PayPal,Delivered,1.0,Lenovo Tab,2024-01-29,2025-11-15 00:11:36,Missing values; 
3534050.0,,Austin Williams,Mary68@gmail.com,1778967126.0,28269 Chelsea River,Hamburg,Berlin,15442.0,Germany,20.0,Male,Low,Regular,2/21/2024,2024.0,February,7:07:22,2.0,307.7718572,615.5437145,Clothing,Adidas,Jacket,Bad,Express,Debit Card,Delivered,1.0,Peacoat,2024-02-21,2025-11-15 07:07:22,Missing values; 
1923944.0,41550.0,Stephanie Grant,Meghan66@gmail.com,8020110819.0,92227 John Rapids Apt. 089,Wollongong,New South Wales,82137.0,Australia,20.0,Male,Medium,Regular,05-02-23,2023.0,May,1:48:05,,453.4645592,2267.322796,Electronics,Samsung,Television,Bad,Same-Day,Debit Card,Delivered,1.0,QLED TV,2023-05-02,2025-11-15 01:48:05,Missing values; 
4951079.0,64273.0,Anthony Smith,Natalie60@gmail.com,1582534646.0,111 Sara Square,Ballarat,New South Wales,62210.0,Australia,20.0,Male,,Regular,08-04-23,2023.0,August,11:59:42,5.0,450.3384935,2251.692467,Books,Penguin Books,Fiction,Excellent,Standard,Cash,Delivered,4.0,Fantasy,2023-08-04,2025-11-15 11:59:42,Missing values; 
2357186.0,26328.0,Michelle Ortega,Joseph84@gmail.com,6313905261.0,43258 Rodriguez Field Apt. 941,Geelong,New South Wales,63971.0,Australia,20.0,Male,Low,Regular,12-09-23,2023.0,,13:51:56,7.0,208.4462426,1459.123698,Grocery,Pepsi,Water,Bad,Same-Day,Debit Card,Delivered,1.0,Mineral water,2023-12-09,2025-11-15 13:51:56,Missing values; 
2677287.0,59867.0,,Gregory78@gmail.com,8799203201.0,20544 Thomas Heights,Wollongong,New South Wales,89060.0,Australia,20.0,Male,Low,Regular,08-02-23,2023.0,August,2:49:12,6.0,452.014165,2712.08499,Electronics,Samsung,Television,Bad,Express,PayPal,Delivered,1.0,LED TV,2023-08-02,2025-11-15 02:49:12,Missing values; 
3218056.0,98156.0,Karen Barrett,Charles100@gmail.com,,9911 William Isle,Bendigo,New South Wales,41872.0,Australia,20.0,Female,Medium,Regular,10/22/2023,2023.0,October,15:02:25,2.0,203.3743937,406.7487874,Clothing,Zara,Jeans,Excellent,Express,Debit Card,Delivered,5.0,Low-rise jeans,2023-10-22,2025-11-15 15:02:25,Missing values; 
7488008.0,25123.0,Allison Garza,Victor40@gmail.com,,8328 West Crossroad,Leicester,England,2007.0,UK,20.0,Male,Low,Regular,3/28/2023,2023.0,March,12:26:46,4.0,190.500082,762.0003281,Electronics,Apple,Smartphone,Excellent,Standard,Credit Card,Delivered,4.0,Huawei P,2023-03-28,2025-11-15 12:26:46,Missing values; 
8480241.0,56622.0,Sarah Santiago,Jonathan100@gmail.com,5659483564.0,9420 Patel Land Apt. 888,Cairns,New South Wales,66032.0,Australia,20.0,Female,Medium,Regular,12-06-23,2023.0,,11:00:17,3.0,226.7536179,680.2608536,Electronics,Samsung,Tablet,Bad,Express,PayPal,Delivered,1.0,Acer Iconia Tab,2023-12-06,2025-11-15 11:00:17,Missing values; 
2308998.0,85184.0,Jessica Summers,Kristen59@gmail.com,3402372765.0,217 Lynch Motorway Suite 591,Cardiff,England,,UK,20.0,Female,Medium,Regular,06-10-23,2023.0,June,9:44:08,1.0,69.43005924,69.43005924,Electronics,Samsung,Tablet,Good,Standard,Debit Card,Delivered,4.0,Amazon Fire Tablet,2023-06-10,2025-11-15 09:44:08,Missing values; 
,79046.0,Jeffery Morris,Carlos66@gmail.com,5131971997.0,4608 Omar Forges,Edinburgh,England,70186.0,UK,20.0,Female,High,Regular,12/16/2023,2023.0,December,8:24:14,5.0,497.412639,2487.063195,Grocery,Pepsi,Water,Bad,Express,Cash,Delivered,1.0,Alkaline water,2023-12-16,2025-11-15 08:24:14,Missing values; 
3892356.0,90215.0,Marcia Brock,Anthony67@gmail.com,8852556409.0,496 Baker Path,Glasgow,England,39347.0,UK,20.0,Female,Low,Regular,3/21/2023,2023.0,March,6:32:31,9.0,329.9716671,2969.745004,Grocery,,Juice,Good,Same-Day,Credit Card,Delivered,4.0,Mango juice,2023-03-21,2025-11-15 06:32:31,Missing values; 
6396949.0,18501.0,Luis Larson,Christina8@gmail.com,1605858322.0,8856 Ferrell Drives Suite 661,Denver,New Jersey,8485.0,USA,20.0,Female,Medium,Regular,04-02-23,2023.0,April,12:16:56,3.0,152.9848493,458.954548,Clothing,Adidas,Shoes,,Express,Cash,Delivered,,Running shoes,2023-04-02,2025-11-15 12:16:56,Missing values; 
9202733.0,60257.0,Joseph Reese,Nicholas94@gmail.com,9011764300.0,3903 Jonathan Ridge Apt. 171,Geelong,New South Wales,79982.0,Australia,20.0,Female,Low,Regular,3/15/2023,2023.0,March,,8.0,368.3425687,2946.74055,Grocery,Pepsi,Soft Drink,Good,Standard,Debit Card,Delivered,3.0,Orange soda,2023-03-15,,Missing values; 
8575040.0,15654.0,Desiree Schneider,Tina13@gmail.com,2984890077.0,406 Figueroa Mills Apt. 522,Gold Coast,New South Wales,,Australia,20.0,Male,Low,Regular,8/14/2023,2023.0,August,3:10:46,7.0,142.3841993,996.6893953,Electronics,Samsung,Smartphone,Good,Same-Day,Debit Card,Delivered,3.0,Google Pixel,2023-08-14,2025-11-15 03:10:46,Missing values; 
2053696.0,46080.0,Clayton Martinez,Rick50@gmail.com,4986913465.0,5009 Nancy Shores Suite 459,Brisbane,New South Wales,4942.0,Australia,20.0,Male,High,Regular,11-01-23,2023.0,November,10:27:18,,218.8579538,2188.579538,Books,Penguin Books,Fiction,Good,Same-Day,Cash,Delivered,3.0,Romance,2023-11-01,2025-11-15 10:27:18,Missing values; 
1628751.0,60847.0,Steven King,Karen41@gmail.com,9159404755.0,54441 Michael Via,Birmingham,England,25713.0,UK,20.0,Female,Low,Regular,,2023.0,December,16:27:07,5.0,254.2445945,1271.222973,Books,Random House,Literature,Bad,Same-Day,PayPal,Delivered,1.0,Essays,,2025-11-15 16:27:07,Missing values; 
9297537.0,53937.0,Danielle Pace,Craig51@gmail.com,,277 Rojas Drive,Leicester,England,7674.0,UK,20.0,Male,High,Regular,2/13/2024,2024.0,February,10:15:41,1.0,420.1960208,420.1960208,Electronics,Apple,Smartphone,Average,Standard,PayPal,Delivered,2.0,Sony Xperia,2024-02-13,2025-11-15 10:15:41,Missing values; 
3659573.0,43378.0,Kaitlyn Bowers DDS,Wendy100@gmail.com,5485214053.0,2376 Sarah Vista Apt. 028,Seattle,Maryland,21282.0,USA,20.0,Male,Medium,Regular,03-04-23,2023.0,March,21:35:21,8.0,56.52567885,452.2054308,Books,,Thriller,Excellent,Express,PayPal,Delivered,4.0,Psychological thriller,2023-03-04,2025-11-15 21:35:21,Missing values; 
4169727.0,97831.0,Gregory Thomas,Miranda75@gmail.com,1588519759.0,315 Oliver Meadow Apt. 473,Vancouver,Ontario,23238.0,Canada,20.0,Male,Low,Regular,08-05-23,2023.0,August,2:22:25,4.0,100.3050383,,Books,Penguin Books,Fiction,Excellent,Standard,Credit Card,Delivered,5.0,Adventure,2023-08-05,2025-11-15 02:22:25,Missing values; 
9851892.0,85314.0,John Collins,Rebecca75@gmail.com,7768708320.0,025 Christian Isle,,Ontario,41704.0,Canada,20.0,Female,Low,Regular,01-03-24,2024.0,January,18:59:59,8.0,442.2122939,3537.698351,Home Decor,Home Depot,Furniture,Average,Standard,PayPal,Delivered,2.0,Nightstand,2024-01-03,2025-11-15 18:59:59,Missing values; 
3780869.0,74226.0,,John67@gmail.com,3471368912.0,123 Quinn Trafficway Apt. 842,Leeds,England,4624.0,UK,20.0,Male,Medium,Regular,01-07-24,2024.0,January,10:47:04,9.0,198.4716217,1786.244595,Electronics,Samsung,Tablet,Good,Same-Day,PayPal,Delivered,4.0,Sony Xperia Tablet,2024-01-07,2025-11-15 10:47:04,Missing values; 
9495108.0,50264.0,Donald Cain,Courtney82@gmail.com,9436400252.0,2357 George Light Suite 366,Wichita,Kentucky,41592.0,USA,20.0,Male,High,Regular,11-06-23,,November,5:33:38,3.0,364.6933477,1094.080043,Grocery,Pepsi,Water,Bad,Standard,Debit Card,Delivered,1.0,Bottled water,2023-11-06,2025-11-15 05:33:38,Missing values; 
2447424.0,65643.0,Alexis Randolph,Brittany78@gmail.com,7247170193.0,32926 Kathryn Point,Hamilton,,96975.0,Canada,20.0,Male,Medium,Regular,10/20/2023,2023.0,October,11:10:24,1.0,66.45006418,66.45006418,Home Decor,IKEA,Furniture,Bad,Express,Credit Card,Delivered,1.0,Dining table,2023-10-20,2025-11-15 11:10:24,Missing values; 
1868350.0,19427.0,John Haley,Jason45@gmail.com,3899694941.0,711 Williams Flats Suite 919,Melbourne,New South Wales,28370.0,Australia,20.0,Male,Low,Regular,01-06-24,2024.0,January,21:18:41,5.0,381.8329959,1909.16498,Electronics,Sony,Smartphone,Excellent,Standard,,Delivered,5.0,Google Pixel,2024-01-06,2025-11-15 21:18:41,Missing values; 
8840868.0,79116.0,Amanda Miller,Christina72@gmail.com,1419729566.0,9867 Mitchell Route Suite 157,Frankfurt,,36751.0,Germany,20.0,Male,High,Regular,08-09-23,2023.0,August,0:33:45,8.0,246.5800685,1972.640548,Grocery,Coca-Cola,Water,Average,Standard,Debit Card,Delivered,2.0,Mineral water,2023-08-09,2025-11-15 00:33:45,Missing values; 
1794326.0,17709.0,Cristina Miranda,Alexandra65@gmail.com,7581636082.0,84780 Wilson Summit Apt. 465,Ottawa,Ontario,69987.0,Canada,20.0,Male,High,Regular,2/23/2024,2024.0,February,,2.0,308.9760868,617.9521735,Books,Random House,Fiction,Average,Same-Day,PayPal,Delivered,2.0,Science fiction,2024-02-23,,Missing values; 
9437780.0,52755.0,Robert Byrd,Charles87@gmail.com,7619713808.0,931 Mcmillan Streets,London,Ontario,2244.0,Canada,20.0,,Low,Regular,1/13/2024,2024.0,January,21:41:03,6.0,454.3494206,2726.096524,Clothing,Nike,T-shirt,Bad,Same-Day,PayPal,Delivered,1.0,Scoop neck tee,2024-01-13,2025-11-15 21:41:03,Missing values; 
7862293.0,88836.0,Stacey Johnson,Susan84@gmail.com,3233484184.0,4019 Anthony Falls,Winnipeg,Ontario,27413.0,Canada,20.0,Male,Medium,Regular,7/23/2023,2023.0,July,16:29:38,4.0,410.6737248,1642.694899,Grocery,Nestle,Coffee,Bad,,Cash,Delivered,1.0,Ground coffee,2023-07-23,2025-11-15 16:29:38,Missing values; 
6406633.0,46332.0,John Woods,Tracy34@gmail.com,9762731230.0,711 Stephanie Rapid,Brighton,England,27398.0,UK,20.0,Male,Medium,Regular,5/22/2023,2023.0,May,1:12:13,9.0,370.9737827,3338.764044,,Random House,Non-Fiction,Excellent,Standard,PayPal,Delivered,4.0,Psychology,2023-05-22,2025-11-15 01:12:13,Missing values; 
2278902.0,52033.0,Kathy Pacheco,Deanna86@gmail.com,9799225615.0,113 House Key Suite 321,Leicester,,19633.0,UK,20.0,Female,Low,Regular,9/28/2023,2023.0,September,9:19:26,2.0,221.2837864,442.5675727,Books,HarperCollins,Non-Fiction,Good,Express,PayPal,Delivered,4.0,Self-help,2023-09-28,2025-11-15 09:19:26,Missing values; 
7681236.0,59385.0,James Christensen,Nicole44@gmail.com,9194671726.0,04449 Michael Valleys Suite 609,Newcastle,New South Wales,31116.0,Australia,20.0,Male,Low,Regular,03-04-23,2023.0,March,2:04:20,5.0,,1029.711885,Books,HarperCollins,Fiction,Good,Same-Day,Cash,Delivered,4.0,Adventure,2023-03-04,2025-11-15 02:04:20,Missing values; 
5002140.0,50320.0,Michael Stafford,Olivia13@gmail.com,2077586338.0,6397 Eric Shoals Apt. 615,Vancouver,Ontario,6598.0,Canada,20.0,Male,Medium,Regular,,2023.0,October,8:41:53,1.0,372.3902819,372.3902819,Grocery,Pepsi,Water,Excellent,Express,PayPal,Delivered,5.0,Purified water,,2025-11-15 08:41:53,Missing values; 
7122511.0,97970.0,Jaime Jones,Alex29@gmail.com,2438657808.0,135 Norton Key,Mackay,New South Wales,2147.0,Australia,20.0,Female,Low,Regular,12/13/2023,2023.0,December,22:09:33,9.0,216.7338449,1950.604604,Home Decor,Bed Bath & Beyond,Bathroom,Average,Express,,Delivered,2.0,Sink,2023-12-13,2025-11-15 22:09:33,Missing values; 
7967656.0,33250.0,Susan Simpson,Connie85@gmail.com,5831444687.0,36768 William Road,Newcastle upon Tyne,England,,UK,20.0,Female,Low,Regular,7/21/2023,2023.0,July,11:27:50,8.0,111.3311784,890.6494276,Electronics,Apple,Laptop,Excellent,Standard,Debit Card,Delivered,5.0,HP Spectre,2023-07-21,2025-11-15 11:27:50,Missing values; 
5512133.0,66403.0,Amanda Hunter,Daniel67@gmail.com,,387 Rodriguez Bridge Suite 558,Oshawa,Ontario,10408.0,Canada,20.0,Male,Medium,Regular,1/18/2024,2024.0,January,15:50:43,9.0,211.9809475,1907.828527,Grocery,Coca-Cola,Water,Bad,Standard,PayPal,Delivered,1.0,Coconut water,2024-01-18,2025-11-15 15:50:43,Missing values; 
1812606.0,30556.0,Madison Nelson,Eric39@gmail.com,7078953471.0,74874 Ramos Springs,Austin,Kentucky,40263.0,USA,20.0,Female,,Regular,05-02-23,2023.0,May,5:30:09,6.0,276.8241154,1660.944693,Clothing,Zara,Shirt,Good,Standard,Cash,Delivered,4.0,Hoodie,2023-05-02,2025-11-15 05:30:09,Missing values; 
8462458.0,73998.0,,Joseph38@gmail.com,7451985252.0,629 Valencia Groves,Halifax,Ontario,49462.0,Canada,20.0,Male,Low,Regular,05-08-23,2023.0,May,18:37:24,2.0,64.13366738,128.2673348,Electronics,Apple,Tablet,Bad,Standard,Credit Card,Delivered,1.0,Google Pixel Slate,2023-05-08,2025-11-15 18:37:24,Missing values; 
6845568.0,65128.0,Holly Grant,Douglas56@gmail.com,9240712764.0,38360 King Meadows,Charlotte,Oregon,97424.0,USA,20.0,Male,Medium,Regular,4/15/2023,2023.0,April,6:28:21,3.0,194.5385784,583.6157351,Books,Random House,Fiction,,Same-Day,Debit Card,Delivered,,Dystopian,2023-04-15,2025-11-15 06:28:21,Missing values; 
7026978.0,63468.0,Dana Smith,Allison64@gmail.com,,969 Natasha Meadows,San Francisco,Wisconsin,53419.0,USA,20.0,Male,Low,Regular,4/30/2023,2023.0,April,10:59:33,6.0,250.7441134,1504.464681,Clothing,Adidas,Jacket,Bad,Same-Day,Cash,Delivered,1.0,Peacoat,2023-04-30,2025-11-15 10:59:33,Missing values; 
8355882.0,33564.0,Anna Perkins,Grace89@gmail.com,9382286979.0,2325 Amber Highway Apt. 650,New York,,86350.0,USA,20.0,Female,Low,Regular,01-09-24,2024.0,January,23:47:50,3.0,140.3006292,420.9018875,Books,Penguin Books,Fiction,Excellent,Standard,Credit Card,Delivered,4.0,Dystopian,2024-01-09,2025-11-15 23:47:50,Missing values; 
3025718.0,41855.0,Kelly Campbell,Kendra19@gmail.com,2416139567.0,62210 Fuentes Flat,Toronto,Ontario,26689.0,,20.0,Male,Low,Regular,7/25/2023,2023.0,July,6:35:40,6.0,83.85697394,503.1418437,Clothing,Adidas,Shoes,Bad,Express,Cash,Delivered,1.0,High heels,2023-07-25,2025-11-15 06:35:40,Missing values; 
6889084.0,39886.0,Shelia Salinas,Roy55@gmail.com,,18341 Woods Islands Apt. 792,Leeds,England,94608.0,UK,20.0,Male,Medium,Regular,6/13/2023,2023.0,June,18:26:07,5.0,404.8204307,2024.102153,Home Decor,Home Depot,Furniture,Bad,Same-Day,Debit Card,Delivered,1.0,Desk,2023-06-13,2025-11-15 18:26:07,Missing values; 
8172815.0,75095.0,Melissa Garner,Denise90@gmail.com,7589320758.0,51255 Jason Brooks Suite 306,Virginia Beach,Florida,33255.0,USA,20.0,Female,Medium,Regular,2/17/2024,2024.0,February,19:21:14,10.0,17.4754303,174.754303,Clothing,Adidas,Jacket,Average,Express,,Delivered,2.0,Bomber jacket,2024-02-17,2025-11-15 19:21:14,Missing values; 
4970966.0,59864.0,Rachel Lee,Brian11@gmail.com,7650895714.0,30422 Kelly Locks Apt. 075,Tulsa,New Hampshire,3602.0,USA,20.0,Female,High,Regular,5/21/2023,2023.0,May,10:50:10,8.0,284.5934967,2276.747974,Home Decor,Bed Bath & Beyond,Bedding,Good,Same-Day,,Delivered,3.0,Duvet cover,2023-05-21,2025-11-15 10:50:10,Missing values; 
6641090.0,94435.0,Deborah Allen,Katrina73@gmail.com,3808899354.0,517 Lee Crest Suite 001,Bristol,England,33591.0,UK,20.0,,Low,Regular,02-08-24,2024.0,February,19:34:40,4.0,287.7077288,1150.830915,Books,Random House,Non-Fiction,Good,Express,Debit Card,Delivered,3.0,Science,2024-02-08,2025-11-15 19:34:40,Missing values; 
8986882.0,,Caitlin Gordon,Mike42@gmail.com,8817202562.0,60970 Peterson Junction Apt. 168,Montreal,Ontario,90139.0,Canada,20.0,Male,High,Regular,12-08-23,2023.0,December,16:17:14,1.0,192.3114725,192.3114725,Electronics,Sony,Smartphone,Excellent,Express,PayPal,Delivered,5.0,Sony Xperia,2023-12-08,2025-11-15 16:17:14,Missing values; 
9352429.0,21891.0,Amber Richardson,Amber99@gmail.com,4935448066.0,4402 Amber Throughway,Saskatoon,,19080.0,Canada,20.0,Female,Medium,Regular,9/24/2023,2023.0,September,19:09:42,9.0,312.314875,2810.833875,Clothing,Nike,T-shirt,Bad,Same-Day,Credit Card,Delivered,1.0,Crop top,2023-09-24,2025-11-15 19:09:42,Missing values; 
8510492.0,95405.0,Tracy Murphy,Walter60@gmail.com,9271018757.0,907 Steven Keys,Atlanta,Washington,,USA,20.0,Male,High,Regular,11/16/2023,2023.0,November,20:36:42,4.0,49.50275905,198.0110362,Clothing,Zara,Shirt,Excellent,Same-Day,PayPal,Delivered,5.0,Sweatshirt,2023-11-16,2025-11-15 20:36:42,Missing values; 
2462608.0,22470.0,Joshua Christian,Mark99@gmail.com,3552462520.0,,Portsmouth,England,95879.0,UK,20.0,Female,Low,Regular,10-03-23,2023.0,October,8:38:29,1.0,363.3117636,363.3117636,Home Decor,Home Depot,Decorations,Excellent,Same-Day,PayPal,Delivered,4.0,Picture frames,2023-10-03,2025-11-15 08:38:29,Missing values; 
4308549.0,43946.0,Jessica Robinson,Brian98@gmail.com,8120407807.0,,Launceston,New South Wales,83764.0,Australia,20.0,Female,Medium,Regular,6/19/2023,2023.0,June,21:03:49,2.0,497.4867851,994.9735702,Grocery,Nestle,Snacks,Average,Standard,Cash,Delivered,2.0,Popcorn,2023-06-19,2025-11-15 21:03:49,Missing values; 
3981128.0,58601.0,,Troy16@gmail.com,1423937179.0,0511 Matthew Spurs Apt. 175,London,Ontario,55129.0,Canada,20.0,Male,High,Regular,6/14/2023,2023.0,June,21:31:17,2.0,50.94619693,101.8923939,Grocery,Coca-Cola,Soft Drink,Bad,Express,Debit Card,Delivered,1.0,Cola,2023-06-14,2025-11-15 21:31:17,Missing values; 
8505862.0,55209.0,Ashley Mooney,Michelle52@gmail.com,6552617409.0,1200 Shannon Avenue,Miami,Montana,59657.0,USA,20.0,Female,Medium,Regular,1/19/2024,2024.0,January,17:12:46,6.0,404.1776673,2425.066004,Books,Random House,Fiction,,Express,Debit Card,Delivered,,Literary fiction,2024-01-19,2025-11-15 17:12:46,Missing values; 
5306194.0,17809.0,Cynthia Williams,,9053524329.0,73448 Renee Manor,Bochum,Berlin,37847.0,Germany,20.0,Male,Low,Regular,1/26/2024,2024.0,January,0:10:01,4.0,123.7648179,495.0592717,Grocery,Pepsi,Water,Bad,Standard,Debit Card,Delivered,1.0,Flavored water,2024-01-26,2025-11-15 00:10:01,Missing values; 
3492235.0,37098.0,Charles Delgado,Deborah58@gmail.com,8470749043.0,7418 Ryan Drive Apt. 452,London,Ontario,46848.0,,20.0,Male,Medium,Regular,5/25/2023,2023.0,May,14:28:17,4.0,283.0903584,1132.361434,Grocery,Pepsi,Water,Excellent,Express,Debit Card,Delivered,4.0,Artesian water,2023-05-25,2025-11-15 14:28:17,Missing values; 
4548999.0,82301.0,Jessica Reed,Larry33@gmail.com,8700531303.0,96417 Becker Route,Munich,Berlin,90151.0,Germany,20.0,Male,High,Regular,01-04-24,2024.0,January,6:06:20,2.0,179.0608967,358.1217934,Grocery,Coca-Cola,Soft Drink,Average,Standard,,Delivered,2.0,Ginger ale,2024-01-04,2025-11-15 06:06:20,Missing values; 
9488537.0,40523.0,Paul Ross,,5194694469.0,982 Anderson Curve Apt. 795,Plymouth,England,60706.0,UK,20.0,Male,Low,Regular,2/25/2024,2024.0,February,13:03:47,8.0,306.0780097,2448.624078,Grocery,Pepsi,Juice,Bad,Express,Debit Card,Delivered,1.0,Grape juice,2024-02-25,2025-11-15 13:03:47,Missing values; 
5862125.0,26192.0,Jill Evans,Adam37@gmail.com,2432174922.0,2962 Peters Ville,Nottingham,England,84356.0,UK,20.0,Male,Medium,Regular,01-08-24,2024.0,January,8:56:46,5.0,116.0803949,580.4019744,Grocery,Nestle,Chocolate,Average,,Cash,Delivered,2.0,Chocolate cookies,2024-01-08,2025-11-15 08:56:46,Missing values; 
3809728.0,80499.0,Morgan Sharp,Raymond29@gmail.com,5991362330.0,429 Carroll Station Suite 339,Regina,Ontario,15449.0,Canada,20.0,Male,Medium,Regular,1/22/2024,2024.0,January,16:41:56,7.0,164.374237,1150.619659,,Sony,Smartphone,Average,Express,Cash,Delivered,2.0,Huawei P,2024-01-22,2025-11-15 16:41:56,Missing values; 
4096570.0,58427.0,Suzanne Ferguson,Cynthia51@gmail.com,5658023899.0,6122 Zoe Creek,Stuttgart,Berlin,87237.0,Germany,20.0,Male,Low,Regular,11-08-23,2023.0,November,6:57:37,,263.017348,263.017348,Clothing,Nike,Shorts,Good,Standard,Debit Card,Delivered,3.0,Cycling shorts,2023-11-08,2025-11-15 06:57:37,Missing values; 
4904654.0,54975.0,Andrea Harrison,Thomas56@gmail.com,7271567699.0,6302 Rogers Ports,,Pennsylvania,15289.0,USA,20.0,Male,Low,Regular,03-08-23,2023.0,March,6:02:46,8.0,343.3368699,2746.69496,Electronics,Apple,Tablet,Excellent,Standard,Credit Card,Delivered,5.0,Acer Iconia Tab,2023-03-08,2025-11-15 06:02:46,Missing values; 
3332992.0,24888.0,Lynn Baker,Michael75@gmail.com,1744392776.0,826 Cohen Squares Suite 951,,South Carolina,29948.0,USA,20.0,Male,Low,Regular,01-07-24,2024.0,January,15:27:47,10.0,190.9047398,1909.047398,Home Decor,IKEA,Lighting,Good,Same-Day,Cash,Delivered,3.0,Recessed lighting,2024-01-07,2025-11-15 15:27:47,Missing values; 
7872975.0,,James Harris,Diana15@gmail.com,5039148910.0,60600 Reed Mission Apt. 579,Nuremberg,Berlin,90428.0,Germany,20.0,Female,Medium,Regular,10/20/2023,2023.0,October,0:57:09,2.0,90.72325594,181.4465119,Clothing,Adidas,Shoes,Bad,Same-Day,Credit Card,Delivered,1.0,Slippers,2023-10-20,2025-11-15 00:57:09,Missing values; 
2793948.0,50290.0,Michelle Cole,Jared2@gmail.com,6917769620.0,7070 Richard Extensions Suite 080,Wuppertal,Berlin,89033.0,Germany,20.0,,Medium,Regular,7/20/2023,2023.0,July,23:32:28,9.0,15.07921351,135.7129216,Books,Random House,Literature,Bad,Standard,Credit Card,Delivered,1.0,Modern literature,2023-07-20,2025-11-15 23:32:28,Missing values; 
8873953.0,97005.0,Bryan Lopez,Christine91@gmail.com,5526687139.0,243 Mitchell Ridge Apt. 559,London,Ontario,60069.0,Canada,20.0,Male,Low,Regular,1/13/2024,2024.0,January,6:02:50,4.0,459.4444599,1837.77784,Grocery,Pepsi,Juice,Bad,,PayPal,Delivered,1.0,Mango juice,2024-01-13,2025-11-15 06:02:50,Missing values; 
7028180.0,61429.0,Jenny Peterson,,9166885494.0,30398 Smith Mall Suite 456,Sheffield,England,5848.0,UK,20.0,Female,Low,Regular,3/16/2023,2023.0,March,2:31:48,10.0,160.2533862,1602.533862,Clothing,Nike,Shoes,Good,Same-Day,Cash,Delivered,3.0,Espadrilles,2023-03-16,2025-11-15 02:31:48,Missing values; 
8213104.0,93339.0,Christopher Berry,,1656252242.0,32709 Hector Crossing,Sheffield,England,94689.0,UK,20.0,Male,Low,Regular,11/14/2023,2023.0,November,4:57:43,5.0,406.2831221,2031.415611,Books,HarperCollins,Non-Fiction,Good,Standard,Cash,Delivered,4.0,Self-help,2023-11-14,2025-11-15 04:57:43,Missing values; 
3382253.0,86801.0,Douglas Mitchell,Derek59@gmail.com,2985295913.0,087 Williams Plaza,Melbourne,New South Wales,56690.0,Australia,20.0,,High,Regular,5/24/2023,2023.0,May,1:36:32,3.0,384.8396453,1154.518936,Electronics,Samsung,Tablet,Good,Express,Cash,Delivered,4.0,Asus ZenPad,2023-05-24,2025-11-15 01:36:32,Missing values; 
4663958.0,59090.0,Michael Roberts PhD,Jonathon50@gmail.com,9174201088.0,6473 Leslie Haven Apt. 475,San Antonio,Oregon,97897.0,USA,20.0,Male,Low,Regular,,2023.0,September,0:01:29,7.0,90.41634112,632.9143878,Books,Random House,Fiction,Excellent,Standard,PayPal,Delivered,5.0,Adventure,,2025-11-15 00:01:29,Missing values; 
6413538.0,71427.0,Charlotte Noble,,3471818920.0,16460 Kim Ramp,Geelong,New South Wales,83568.0,Australia,20.0,Female,Medium,Regular,12-04-23,2023.0,December,16:54:39,7.0,326.9597287,2288.718101,,Nike,Shorts,Good,Same-Day,PayPal,Pending,3.0,Bermuda shorts,2023-12-04,2025-11-15 16:54:39,Missing values; 
5374142.0,61150.0,Hailey Moran,Christina27@gmail.com,,77180 Mark Landing Suite 483,St. John's,Ontario,46511.0,Canada,20.0,Male,Medium,Regular,07-12-23,2023.0,July,1:26:44,2.0,35.02236299,70.04472599,Electronics,Samsung,Tablet,Bad,Standard,Cash,Delivered,1.0,Acer Iconia Tab,2023-07-12,2025-11-15 01:26:44,Missing values; 
2031001.0,46329.0,Natasha Ellis,Lorraine35@gmail.com,1947239205.0,6501 Anthony Falls,Adelaide,New South Wales,46707.0,Australia,20.0,,High,Regular,03-02-23,2023.0,March,19:01:02,4.0,349.91407,1399.65628,Home Decor,Bed Bath & Beyond,Kitchen,Bad,Express,Debit Card,Shipped,1.0,Food processor,2023-03-02,2025-11-15 19:01:02,Missing values; 
5907556.0,86706.0,George Krueger,Trevor81@gmail.com,2201361112.0,0784 Harmon Lodge,Kelowna,Ontario,66276.0,Canada,20.0,Male,High,Regular,6/22/2023,2023.0,June,18:37:41,3.0,445.7795478,1337.338643,,Apple,Smartphone,Average,Same-Day,Cash,Shipped,2.0,Sony Xperia,2023-06-22,2025-11-15 18:37:41,Missing values; 
3064250.0,16122.0,Rachel Shannon DVM,Danielle65@gmail.com,,0865 Jimmy Island,Frankfurt,Berlin,37098.0,Germany,20.0,Female,Medium,Regular,10-09-23,2023.0,October,16:20:38,2.0,43.3677542,86.7355084,Grocery,Nestle,Snacks,Good,Same-Day,Credit Card,Delivered,4.0,Fruit snacks,2023-10-09,2025-11-15 16:20:38,Missing values; 
3551351.0,77852.0,Paula Wood,Sabrina6@gmail.com,9866541646.0,05599 Moore Locks Suite 368,Houston,Iowa,51119.0,USA,20.0,Female,Low,Regular,09-12-23,2023.0,September,11:18:10,6.0,28.68020944,,Clothing,Adidas,Shoes,Bad,Standard,Cash,Delivered,1.0,Boots,2023-09-12,2025-11-15 11:18:10,Missing values; 
3109176.0,23268.0,Linda Chavez,Austin67@gmail.com,2560293392.0,1467 Owens Forge,Belfast,England,68245.0,UK,20.0,Female,Low,Regular,3/28/2023,2023.0,March,,9.0,421.2139927,3790.925935,Electronics,Sony,Smartphone,Excellent,Express,Cash,Pending,4.0,iPhone,2023-03-28,,Missing values; 
1632292.0,50770.0,Teresa King,Courtney98@gmail.com,,9586 Tyler Divide Apt. 159,Bielefeld,Berlin,47999.0,Germany,20.0,Male,Low,Regular,8/25/2023,2023.0,August,12:29:04,2.0,457.5528418,915.1056836,Home Decor,Home Depot,Decorations,Good,Same-Day,Debit Card,Shipped,3.0,Rugs,2023-08-25,2025-11-15 12:29:04,Missing values; 
5682018.0,15828.0,Diamond Lewis,Gregory70@gmail.com,2764176240.0,892 Kimberly Spurs,Dortmund,Berlin,24204.0,Germany,20.0,Female,Medium,Regular,4/25/2023,,April,0:08:41,3.0,290.840414,872.5212419,Home Decor,IKEA,Lighting,Bad,Same-Day,Cash,Delivered,1.0,Under cabinet lighting,2023-04-25,2025-11-15 00:08:41,Missing values; 
6437480.0,17359.0,Elizabeth Patrick,William2@gmail.com,,88004 Bush Walk Apt. 361,Victoria,Ontario,78017.0,Canada,20.0,Female,High,Regular,11/20/2023,2023.0,November,4:29:31,5.0,242.6462487,1213.231243,Clothing,Adidas,Shoes,Average,Standard,Debit Card,Pending,2.0,Flip flops,2023-11-20,2025-11-15 04:29:31,Missing values; 
9258786.0,11338.0,Brandon Cortez,Michael16@gmail.com,,26970 Dominique Ports Apt. 377,Bielefeld,Berlin,84307.0,Germany,20.0,Female,Low,Regular,5/19/2023,2023.0,May,21:25:23,6.0,367.2713081,2203.627848,Clothing,Adidas,Shoes,Good,Express,Credit Card,Shipped,4.0,High heels,2023-05-19,2025-11-15 21:25:23,Missing values; 
8565544.0,80611.0,Erica Reed,John33@gmail.com,9149156147.0,2999 Tanya Views Suite 367,Darwin,New South Wales,52999.0,Australia,20.0,Male,Medium,Regular,01-03-24,2024.0,January,23:35:51,9.0,430.1020499,3870.918449,Home Decor,IKEA,Lighting,,Standard,Debit Card,Delivered,,Track lighting,2024-01-03,2025-11-15 23:35:51,Missing values; 
5962289.0,85527.0,Cassandra Graves,,5917924041.0,9469 Haley Extension Apt. 269,Mackay,New South Wales,59310.0,Australia,20.0,Female,High,Regular,12-12-23,2023.0,December,23:44:33,9.0,399.9065431,3599.158888,Books,HarperCollins,Thriller,Bad,Standard,PayPal,Processing,1.0,Crime,2023-12-12,2025-11-15 23:44:33,Missing values; 
8793747.0,93878.0,Haley Kelly,Thomas53@gmail.com,7410627648.0,2794 Justin Course,Adelaide,New South Wales,87387.0,Australia,20.0,Male,Low,Regular,04-02-23,2023.0,April,15:46:29,10.0,181.1501555,,Home Decor,Home Depot,Furniture,Excellent,Standard,Cash,Delivered,4.0,Nightstand,2023-04-02,2025-11-15 15:46:29,Missing values; 
5515690.0,97941.0,Melissa Hernandez,Brittany54@gmail.com,5056353966.0,49824 West Valley,Edmonton,Ontario,,Canada,20.0,Female,High,Regular,2/28/2024,2024.0,February,11:43:07,6.0,208.7258339,1252.355003,Clothing,Zara,Shirt,Good,Standard,Debit Card,Shipped,3.0,Tank top,2024-02-28,2025-11-15 11:43:07,Missing values; 
6664765.0,97024.0,Christopher Walters,Nicole12@gmail.com,7780297558.0,79717 Williamson Corners Suite 642,London,Ontario,22124.0,Canada,20.0,Female,Low,Regular,,2023.0,July,6:24:48,6.0,452.5017686,2715.010612,Clothing,Nike,Shoes,Excellent,Standard,PayPal,Shipped,5.0,Sandals,,2025-11-15 06:24:48,Missing values; 
3629023.0,55148.0,Luis Jordan,Gary90@gmail.com,9834905890.0,7866 Charles Lodge Apt. 291,Geelong,New South Wales,27609.0,Australia,20.0,Female,Medium,Regular,9/13/2023,2023.0,September,21:02:40,6.0,283.8084397,,Clothing,Zara,Shirt,Average,Same-Day,Credit Card,Shipped,2.0,Dress shirt,2023-09-13,2025-11-15 21:02:40,Missing values; 
4959190.0,96718.0,James West,Donald71@gmail.com,7791893594.0,750 Kim Glens Suite 297,Hull,England,54476.0,UK,20.0,Female,Medium,Regular,12/20/2023,,December,12:47:05,2.0,189.7210631,379.4421262,Grocery,Nestle,Chocolate,Excellent,Standard,Credit Card,Shipped,5.0,Milk chocolate,2023-12-20,2025-11-15 12:47:05,Missing values; 
7704925.0,,Michael Nelson,Jonathan48@gmail.com,2447527770.0,1916 Jerry Light Apt. 362,Nottingham,England,18636.0,UK,20.0,Male,Medium,Regular,8/17/2023,2023.0,August,8:03:32,4.0,214.2818795,857.1275182,Home Decor,Bed Bath & Beyond,Bedding,Bad,Express,Credit Card,Delivered,1.0,Throw pillow,2023-08-17,2025-11-15 08:03:32,Missing values; 
6392927.0,11975.0,Michelle Lambert,Amanda57@gmail.com,1205356276.0,508 Payne Pass,Newcastle upon Tyne,England,,UK,20.0,Female,Medium,Regular,11/21/2023,2023.0,November,17:11:04,9.0,12.38812567,111.493131,Books,HarperCollins,Fiction,Good,Same-Day,Cash,Delivered,3.0,Mystery,2023-11-21,2025-11-15 17:11:04,Missing values; 
4353273.0,11418.0,Paul Torres,Kristi61@gmail.com,1373090342.0,150 Dawn Circle,Stuttgart,Berlin,37398.0,,20.0,Female,Medium,Regular,10/18/2023,2023.0,October,5:52:49,4.0,309.4627102,1237.850841,Clothing,Nike,T-shirt,Average,Express,PayPal,Processing,2.0,V-neck tee,2023-10-18,2025-11-15 05:52:49,Missing values; 
2981189.0,73122.0,Joshua Hayes,Blake5@gmail.com,6275476988.0,9014 Reese Groves,Manchester,England,50752.0,UK,20.0,Male,Low,Regular,11-09-23,2023.0,November,3:26:16,7.0,90.46183251,633.2328276,Home Decor,IKEA,Lighting,,Same-Day,Credit Card,Delivered,,Under cabinet lighting,2023-11-09,2025-11-15 03:26:16,Missing values; 
5089593.0,93827.0,Kimberly Vargas,Jill15@gmail.com,4762623584.0,4030 Mcintosh Walks Suite 921,,Ontario,29983.0,Canada,20.0,Female,Medium,Regular,01-11-24,2024.0,January,4:03:31,1.0,29.01006361,29.01006361,Home Decor,Home Depot,Furniture,Excellent,Same-Day,PayPal,Processing,4.0,Bed,2024-01-11,2025-11-15 04:03:31,Missing values; 
3459336.0,64874.0,Brandon Mendez,Brenda91@gmail.com,1326023248.0,01286 Robert Crescent,Leeds,England,65317.0,UK,20.0,Male,,Regular,11/23/2023,2023.0,November,5:25:00,4.0,497.7090818,1990.836327,Clothing,Nike,Shorts,Average,Same-Day,Debit Card,Shipped,2.0,Bermuda shorts,2023-11-23,2025-11-15 05:25:00,Missing values; 
1822169.0,13151.0,Sara Walker,Melissa56@gmail.com,7443212361.0,097 Gonzales Divide Suite 706,Philadelphia,Mississippi,39597.0,USA,20.0,Male,Medium,Regular,6/17/2023,2023.0,June,21:49:37,2.0,288.3252915,576.650583,Books,Random House,Fiction,,Express,Cash,Shipped,,Fantasy,2023-06-17,2025-11-15 21:49:37,Missing values; 
2106131.0,95211.0,Brian Fritz,Nicholas91@gmail.com,3686963855.0,3377 Crystal Mission Suite 162,Nottingham,England,63908.0,UK,20.0,Female,Medium,Regular,09-09-23,2023.0,September,,4.0,158.3174773,633.2699091,Clothing,Zara,Jeans,Bad,Express,Cash,Pending,1.0,Boyfriend jeans,2023-09-09,,Missing values; 
2948400.0,47678.0,,Eric13@gmail.com,7569822213.0,496 William Mills Apt. 317,Toowoomba,New South Wales,72269.0,Australia,20.0,Female,Medium,Regular,6/15/2023,2023.0,June,0:50:38,4.0,476.8978006,1907.591202,Clothing,Zara,Dress,Good,Express,PayPal,Shipped,3.0,Wrap dress,2023-06-15,2025-11-15 00:50:38,Missing values; 
7899266.0,74727.0,Jeffrey Foster,Jonathan91@gmail.com,9028200578.0,025 Shaun Stravenue Apt. 955,Leipzig,Berlin,76435.0,Germany,20.0,Male,Medium,Regular,4/15/2023,2023.0,April,13:11:41,5.0,,2074.607277,Electronics,Sony,Smartphone,Good,Same-Day,Cash,Delivered,3.0,Google Pixel,2023-04-15,2025-11-15 13:11:41,Missing values; 
2943489.0,73987.0,Cynthia Allen,Candice4@gmail.com,4289913148.0,226 Robinson Landing,Belfast,England,74865.0,UK,20.0,Male,High,Regular,9/20/2023,2023.0,,14:52:27,1.0,69.05336814,69.05336814,Clothing,Nike,T-shirt,Good,Express,PayPal,Shipped,4.0,Crop top,2023-09-20,2025-11-15 14:52:27,Missing values; 
9234104.0,24029.0,Julie Soto,Jessica15@gmail.com,5265715892.0,97122 Mckinney Turnpike,Dallas,Vermont,5323.0,USA,20.0,Male,Low,Regular,9/27/2023,2023.0,September,16:52:43,5.0,471.5806608,2357.903304,Home Decor,Home Depot,Furniture,Excellent,Same-Day,Credit Card,,4.0,Nightstand,2023-09-27,2025-11-15 16:52:43,Missing values; 
6848111.0,45513.0,Terry Brown,Justin7@gmail.com,6655103236.0,854 Flores Village Suite 242,Stuttgart,Berlin,98936.0,Germany,20.0,Male,Medium,Regular,5/22/2023,2023.0,May,12:50:16,1.0,478.9081989,478.9081989,Electronics,Sony,Headphones,Average,Standard,Credit Card,,2.0,Wireless headphones,2023-05-22,2025-11-15 12:50:16,Missing values; 
5150576.0,26328.0,Stephanie Patel,Melissa38@gmail.com,4876736270.0,21815 Austin Plaza,Canberra,New South Wales,77843.0,,20.0,Female,Medium,Regular,03-07-23,2023.0,March,11:53:24,8.0,277.7729075,2222.18326,Electronics,Apple,Tablet,Average,Standard,Cash,Pending,2.0,Asus ZenPad,2023-03-07,2025-11-15 11:53:24,Missing values; 
7798020.0,,Jennifer Adams,Travis15@gmail.com,7437065669.0,154 Jenna Mission,Hull,England,88201.0,UK,20.0,Male,Medium,Regular,02-08-24,2024.0,February,2:43:41,1.0,446.4171116,446.4171116,Clothing,Nike,Shoes,Good,Standard,PayPal,Shipped,3.0,Espadrilles,2024-02-08,2025-11-15 02:43:41,Missing values; 
1659749.0,87686.0,Dale Brown,Lori3@gmail.com,7236397487.0,41295 Cooper River Suite 620,Edinburgh,England,89561.0,UK,20.0,Female,High,Regular,,2023.0,April,19:09:57,9.0,363.6689087,3273.020178,Home Decor,Home Depot,Tools,Average,Same-Day,Credit Card,Shipped,2.0,Hammer,,2025-11-15 19:09:57,Missing values; 
4112844.0,12547.0,David Ford,Patricia35@gmail.com,3805474974.0,336 Samuel Camp,Houston,Minnesota,55273.0,USA,20.0,Male,High,Regular,8/26/2023,2023.0,August,12:23:46,10.0,134.8771984,1348.771984,Books,,Children's,Good,Express,Cash,Pending,3.0,Games,2023-08-26,2025-11-15 12:23:46,Missing values; 
7087598.0,41164.0,Sarah Williams,Isaac30@gmail.com,4264202295.0,8599 Brad Garden,Detroit,New Jersey,8076.0,USA,20.0,Male,Medium,Regular,,2023.0,August,2:54:04,8.0,349.4541476,2795.633181,Clothing,Zara,Dress,Average,Same-Day,PayPal,Shipped,2.0,Casual dress,,2025-11-15 02:54:04,Missing values; 
3642639.0,33615.0,Adrienne Norton,Paige25@gmail.com,7354724325.0,243 Rogers Port,Raleigh,Georgia,31592.0,USA,20.0,Female,High,Regular,08-10-23,2023.0,August,14:04:07,4.0,62.31314904,249.2525962,Electronics,Apple,Smartphone,Average,,Debit Card,Delivered,2.0,OnePlus,2023-08-10,2025-11-15 14:04:07,Missing values; 
9420524.0,48599.0,John Chapman,Shawna32@gmail.com,7257638035.0,21385 Cooper Ranch,Raleigh,New Jersey,7156.0,USA,20.0,Male,Medium,Regular,11/20/2023,2023.0,November,6:20:05,1.0,323.1326336,323.1326336,Books,HarperCollins,Thriller,,Same-Day,Debit Card,Delivered,,Political thriller,2023-11-20,2025-11-15 06:20:05,Missing values; 
3953912.0,25107.0,Nathan Cooper,Madison68@gmail.com,8491687168.0,,Victoria,Ontario,24168.0,Canada,20.0,Female,Medium,Regular,11/17/2023,2023.0,November,1:48:59,4.0,113.3610639,453.4442557,Books,HarperCollins,Fiction,Bad,Express,PayPal,Shipped,1.0,Science fiction,2023-11-17,2025-11-15 01:48:59,Missing values; 
8882032.0,,Robyn Johnson,Heather64@gmail.com,8807700441.0,6841 Butler Rapid Apt. 459,Nuremberg,Berlin,72824.0,Germany,20.0,Female,Low,Regular,11/15/2023,2023.0,November,12:50:23,2.0,301.3753468,602.7506936,Books,Penguin Books,Fiction,Bad,Express,Credit Card,Processing,1.0,Science fiction,2023-11-15,2025-11-15 12:50:23,Missing values; 
4319395.0,68104.0,Oscar Edwards,Dalton86@gmail.com,4954248288.0,287 Mitchell Glen Apt. 544,Leipzig,Berlin,74996.0,Germany,20.0,Male,Medium,Regular,01-09-24,2024.0,January,7:18:24,5.0,364.4599337,1822.299668,Home Decor,Home Depot,Furniture,,Standard,Debit Card,Delivered,,Dining table,2024-01-09,2025-11-15 07:18:24,Missing values; 
,78654.0,Tracy Rogers,Kathy66@gmail.com,3905135329.0,8647 Roberts Branch,Phoenix,Arizona,85378.0,USA,20.0,Female,Medium,Regular,6/14/2023,2023.0,June,1:59:22,1.0,170.1456028,170.1456028,Books,Penguin Books,Non-Fiction,Bad,Standard,Credit Card,Shipped,1.0,Travel,2023-06-14,2025-11-15 01:59:22,Missing values; 
1503819.0,86540.0,,Dennis74@gmail.com,2679684438.0,557 James Wall Apt. 338,Ballarat,New South Wales,72652.0,Australia,20.0,Male,Medium,Regular,10-09-23,2023.0,October,15:20:59,4.0,307.6754424,1230.701769,Grocery,Nestle,Snacks,Average,Standard,Debit Card,Pending,2.0,Crackers,2023-10-09,2025-11-15 15:20:59,Missing values; 
5152924.0,79770.0,Mrs. Ann Howard,Matthew75@gmail.com,9344754100.0,83619 Mccall Landing,,New South Wales,66894.0,Australia,20.0,Male,Low,Regular,9/29/2023,2023.0,September,11:25:39,1.0,488.2618949,488.2618949,Books,HarperCollins,Fiction,Average,Standard,Debit Card,Pending,2.0,Fantasy,2023-09-29,2025-11-15 11:25:39,Missing values; 
2915153.0,38313.0,William Bailey,Robert54@gmail.com,2744113551.0,6467 Rebecca Coves,Perth,New South Wales,29426.0,Australia,20.0,,Medium,Regular,11-04-23,2023.0,November,13:38:48,2.0,498.3553491,996.7106982,Grocery,Pepsi,Water,Good,Express,Credit Card,Processing,4.0,Alkaline water,2023-11-04,2025-11-15 13:38:48,Missing values; 
9751543.0,24912.0,Karen Horn,Kelli76@gmail.com,9842110078.0,79439 Tammy Plains Suite 821,Edinburgh,England,,UK,20.0,Male,Medium,Regular,7/31/2023,2023.0,July,14:22:35,8.0,60.90032092,487.2025673,Clothing,Zara,Shirt,Average,Standard,Debit Card,Delivered,2.0,Flannel shirt,2023-07-31,2025-11-15 14:22:35,Missing values; 
3755980.0,32068.0,Stephen Turner,Anthony70@gmail.com,7179190194.0,49514 Ellis Flat Suite 538,Windsor,Ontario,16674.0,Canada,20.0,Male,,Regular,09-10-23,2023.0,September,0:03:51,5.0,372.3760095,1861.880048,Books,Random House,Non-Fiction,Bad,Standard,Debit Card,Processing,1.0,Self-help,2023-09-10,2025-11-15 00:03:51,Missing values; 
,59658.0,Alejandro Davis,Angela79@gmail.com,1346801129.0,5541 Allison Manors Apt. 576,Jacksonville,Virginia,23144.0,USA,20.0,Female,Low,Regular,11-09-23,2023.0,November,16:02:50,1.0,232.6858257,232.6858257,Grocery,Nestle,Coffee,Excellent,Express,Cash,Shipped,5.0,Ground coffee,2023-11-09,2025-11-15 16:02:50,Missing values; 
8069816.0,98662.0,Michael Chandler,Lisa84@gmail.com,3847214598.0,962 Cynthia Forges,Essen,Berlin,67526.0,Germany,20.0,Male,Medium,Regular,7/21/2023,2023.0,July,19:03:01,7.0,112.3239979,786.2679853,Grocery,Pepsi,Juice,Excellent,,Debit Card,Shipped,5.0,Orange juice,2023-07-21,2025-11-15 19:03:01,Missing values; 
7282994.0,57982.0,Bethany Davis,Roger90@gmail.com,8848796685.0,813 Bradley Spur,Bonn,Berlin,24442.0,Germany,20.0,Female,Medium,Regular,12/31/2023,2023.0,December,13:52:17,,320.1988902,320.1988902,Home Decor,Bed Bath & Beyond,Bathroom,Excellent,Same-Day,Debit Card,Shipped,5.0,Sink,2023-12-31,2025-11-15 13:52:17,Missing values; 
5023676.0,71436.0,Anne Weaver,Kristina65@gmail.com,2968916392.0,678 Timothy Manors,Bonn,Berlin,57107.0,Germany,20.0,Female,Low,Regular,5/30/2023,2023.0,May,5:10:12,6.0,262.9465952,,Home Decor,Home Depot,Decorations,Excellent,Express,Cash,Pending,5.0,Picture frames,2023-05-30,2025-11-15 05:10:12,Missing values; 
3805826.0,94905.0,Miranda Hunt,Stephen78@gmail.com,6767442686.0,02223 Salazar Causeway Suite 056,Oklahoma City,Kentucky,41969.0,USA,20.0,,Low,Regular,5/25/2023,2023.0,May,6:26:11,4.0,18.60872755,74.43491018,Electronics,Sony,Headphones,Bad,Same-Day,PayPal,Delivered,1.0,Noise-cancelling headphones,2023-05-25,2025-11-15 06:26:11,Missing values; 
7477376.0,18221.0,Karen Porter,Ryan76@gmail.com,5675782806.0,8923 Jones Heights,Launceston,New South Wales,47510.0,Australia,20.0,Male,Low,Regular,01-10-24,2024.0,January,19:59:23,6.0,,711.9753699,Clothing,Zara,Jeans,Excellent,Same-Day,Cash,Shipped,5.0,Boyfriend jeans,2024-01-10,2025-11-15 19:59:23,Missing values; 
,54880.0,Richard Salinas,Nicole20@gmail.com,5543179050.0,568 Carter Summit,Birmingham,England,25387.0,UK,20.0,Female,Medium,Regular,04-04-23,2023.0,April,16:29:04,10.0,172.4837791,1724.837791,Books,Random House,Non-Fiction,Good,Express,PayPal,Processing,4.0,History,2023-04-04,2025-11-15 16:29:04,Missing values; 
2313291.0,41890.0,Jenna Lambert,Ashley71@gmail.com,4919944946.0,955 Carter Fords Suite 212,Toowoomba,New South Wales,74723.0,Australia,20.0,Female,Low,Regular,2/26/2024,2024.0,February,4:18:50,4.0,376.146243,1504.584972,Clothing,Adidas,Jacket,Good,Same-Day,,Pending,4.0,Denim jacket,2024-02-26,2025-11-15 04:18:50,Missing values; 
3749045.0,91065.0,,Joseph49@gmail.com,3764195200.0,473 Sandoval Keys,Edinburgh,England,67447.0,UK,20.0,Female,Low,Regular,7/16/2023,2023.0,July,8:00:16,9.0,487.4041907,4386.637716,Grocery,Coca-Cola,Juice,Bad,Express,Debit Card,Delivered,1.0,Pineapple juice,2023-07-16,2025-11-15 08:00:16,Missing values; 
3202591.0,49629.0,Rachel Rose,Michael39@gmail.com,4675885021.0,545 Duncan Courts,Cairns,New South Wales,43100.0,Australia,20.0,Female,Low,Regular,2/14/2024,2024.0,February,14:11:14,9.0,156.7350553,1410.615497,Clothing,Adidas,Shoes,Excellent,Same-Day,PayPal,,4.0,Oxfords,2024-02-14,2025-11-15 14:11:14,Missing values; 
4973885.0,97600.0,Melissa Rhodes,Taylor58@gmail.com,8390083931.0,,Mackay,New South Wales,7921.0,Australia,20.0,Male,Low,Regular,10/28/2023,2023.0,October,6:11:27,1.0,107.8059622,107.8059622,Electronics,Sony,Television,Average,Express,Debit Card,Delivered,2.0,OLED TV,2023-10-28,2025-11-15 06:11:27,Missing values; 
4597701.0,57155.0,Jessica Chavez,Alfred85@gmail.com,5186740098.0,02009 Pamela Flats,Halifax,Ontario,58035.0,Canada,20.0,Female,Low,Regular,10/15/2023,2023.0,October,10:45:48,2.0,34.16191766,68.32383531,,Coca-Cola,Soft Drink,Bad,Standard,Credit Card,Shipped,1.0,Grape soda,2023-10-15,2025-11-15 10:45:48,Missing values; 
1498472.0,85820.0,Roger Brown,,8536885378.0,32181 Erika Expressway,Canberra,New South Wales,34867.0,Australia,20.0,Female,High,Regular,3/29/2023,2023.0,March,6:21:23,5.0,297.7535802,1488.767901,Books,Penguin Books,Children's,Bad,Standard,PayPal,Pending,1.0,Toys,2023-03-29,2025-11-15 06:21:23,Missing values; 
1278741.0,83077.0,Jesus Valenzuela,Paul57@gmail.com,6657844978.0,557 Harper Street,Berlin,Berlin,20749.0,,20.0,Female,Low,Regular,3/21/2023,2023.0,March,18:03:04,4.0,474.2954926,1897.18197,Home Decor,IKEA,Decorations,Average,Standard,PayPal,Pending,2.0,Curtains,2023-03-21,2025-11-15 18:03:04,Missing values; 
9917988.0,52232.0,Frances King,Ashley88@gmail.com,3828383004.0,711 Christensen Lodge,Sydney,New South Wales,85526.0,Australia,20.0,Male,Medium,Regular,09-08-23,2023.0,September,22:55:50,5.0,180.7202569,903.6012845,,Coca-Cola,Soft Drink,Good,Express,PayPal,Delivered,4.0,Ginger ale,2023-09-08,2025-11-15 22:55:50,Missing values; 
6624793.0,15175.0,Billy Bates,Patrick71@gmail.com,7676863530.0,3108 Ramos Center Suite 445,Kelowna,Ontario,53105.0,Canada,20.0,Female,Low,Regular,11/17/2023,2023.0,November,8:57:17,8.0,,2640.306475,Books,Random House,Non-Fiction,Good,Express,Cash,Processing,3.0,Memoir,2023-11-17,2025-11-15 08:57:17,Missing values; 
4591167.0,45267.0,Jessica Rodriguez,Cody13@gmail.com,7755486966.0,838 Anna Drives Suite 169,Bendigo,New South Wales,23803.0,Australia,20.0,Female,Medium,Regular,02-12-24,2024.0,February,4:56:14,3.0,112.5849852,337.7549557,,Apple,Laptop,Excellent,Express,Credit Card,Shipped,4.0,MacBook,2024-02-12,2025-11-15 04:56:14,Missing values; 
2002940.0,87983.0,Leslie Dennis,Mark39@gmail.com,9041823560.0,0308 Lisa Mountain,Winnipeg,Ontario,51625.0,Canada,20.0,Male,Medium,Regular,7/28/2023,2023.0,July,23:52:39,10.0,301.862116,3018.62116,Home Decor,,Bathroom,Average,Same-Day,Credit Card,Shipped,2.0,Toilet,2023-07-28,2025-11-15 23:52:39,Missing values; 
9522243.0,99036.0,Donna Perkins,Brandon37@gmail.com,6991008889.0,038 Russell Green,Perth,New South Wales,16541.0,Australia,20.0,,Low,Regular,8/28/2023,2023.0,August,6:57:24,4.0,290.5248198,1162.099279,Grocery,Coca-Cola,Juice,Good,Same-Day,PayPal,Processing,3.0,Apple juice,2023-08-28,2025-11-15 06:57:24,Missing values; 
3304206.0,65408.0,Victoria Haas,Stephen58@gmail.com,3112573136.0,32142 Barbara Roads,Quebec City,Ontario,68030.0,Canada,20.0,Female,Medium,Regular,7/19/2023,2023.0,,20:49:57,5.0,452.0309964,2260.154982,Clothing,Zara,Shirt,Excellent,Same-Day,PayPal,Delivered,4.0,Blouse,2023-07-19,2025-11-15 20:49:57,Missing values; 
9180534.0,31121.0,Elizabeth Smith,Rebecca19@gmail.com,2815727390.0,302 Stuart Lane Apt. 510,Brighton,England,84931.0,UK,20.0,Male,Medium,Regular,1/20/2024,2024.0,January,3:38:32,6.0,300.3644225,1802.186535,Grocery,Coca-Cola,Water,Average,Express,Cash,,2.0,Coconut water,2024-01-20,2025-11-15 03:38:32,Missing values; 
5025714.0,79192.0,Tina Bishop,Aaron96@gmail.com,3116987194.0,9419 Gloria Trail Apt. 507,Berlin,Berlin,,Germany,20.0,Female,Low,Regular,11-01-23,2023.0,November,8:19:28,6.0,159.6037662,957.6225969,Electronics,Apple,Smartphone,Good,Standard,Credit Card,Shipped,4.0,iPhone,2023-11-01,2025-11-15 08:19:28,Missing values; 
9826195.0,26398.0,Darryl Gonzalez,Connie30@gmail.com,5084058107.0,6101 Ruiz Brooks Suite 459,Launceston,New South Wales,59144.0,,20.0,Male,Low,Regular,10/28/2023,2023.0,October,7:48:25,10.0,197.2864307,1972.864307,Grocery,Coca-Cola,Water,Bad,Standard,PayPal,Pending,1.0,Spring water,2023-10-28,2025-11-15 07:48:25,Missing values; 
7629039.0,,Karen Jenkins,Kenneth73@gmail.com,2123892088.0,63632 Petersen Shoals Apt. 944,Regina,Ontario,68059.0,Canada,20.0,Female,Low,Regular,12/16/2023,2023.0,December,16:18:17,2.0,227.9554442,455.9108884,Books,Penguin Books,Children's,Bad,Same-Day,Credit Card,Pending,1.0,Games,2023-12-16,2025-11-15 16:18:17,Missing values; 
7349333.0,51603.0,Jordan Mcdonald,Stacey44@gmail.com,4241026469.0,230 Reed Route Apt. 544,Atlanta,Wyoming,,USA,20.0,Female,High,Regular,3/21/2023,2023.0,March,11:11:15,1.0,321.5503765,321.5503765,Clothing,Nike,Shorts,Bad,Express,Credit Card,Pending,1.0,Swim trunks,2023-03-21,2025-11-15 11:11:15,Missing values; 
5926293.0,14744.0,Tiffany Jackson,Donna51@gmail.com,5741652676.0,11425 Hughes Shore Suite 301,San Antonio,Vermont,5101.0,USA,20.0,Male,Low,Regular,,2024.0,January,4:49:03,10.0,346.0225108,3460.225108,Books,Random House,Fiction,Good,Same-Day,Credit Card,Processing,3.0,Science fiction,,2025-11-15 04:49:03,Missing values; 
9637734.0,,Christina Jones,Shirley11@gmail.com,8033892058.0,0498 Harris Island,Montreal,Ontario,48150.0,Canada,20.0,Male,Medium,Regular,6/27/2023,2023.0,June,10:44:38,8.0,95.91300206,767.3040165,Clothing,Nike,T-shirt,Average,Same-Day,Debit Card,Pending,2.0,Plain tee,2023-06-27,2025-11-15 10:44:38,Missing values; 
5971023.0,19059.0,Monique Copeland,Michael29@gmail.com,3138576132.0,3733 Jill Motorway,Plymouth,England,35620.0,UK,20.0,Female,Low,Regular,8/23/2023,2023.0,August,13:43:52,6.0,40.38606292,242.3163775,Electronics,Samsung,Tablet,Bad,Same-Day,Credit Card,,1.0,Acer Iconia Tab,2023-08-23,2025-11-15 13:43:52,Missing values; 
9412936.0,67327.0,,Stephanie29@gmail.com,4008285742.0,8438 Megan Viaduct Suite 560,Oxford,England,71230.0,UK,20.0,Male,High,Regular,6/24/2023,2023.0,June,23:14:21,4.0,297.4095652,1189.638261,Clothing,Nike,Shoes,Average,Standard,Debit Card,Pending,2.0,Loafers,2023-06-24,2025-11-15 23:14:21,Missing values; 
4052972.0,29067.0,Michael Harris,Andrew40@gmail.com,6171202470.0,2936 Neal Forks,Sydney,New South Wales,18212.0,Australia,20.0,Female,Low,Regular,7/24/2023,2023.0,July,20:20:38,10.0,455.5587781,4555.587781,Home Decor,IKEA,Furniture,Average,,Cash,Pending,2.0,Dresser,2023-07-24,2025-11-15 20:20:38,Missing values; 
2938620.0,78228.0,Rachel Horn,Jennifer83@gmail.com,4600970184.0,8156 Sharp Ranch,Sydney,New South Wales,31127.0,Australia,20.0,Female,Medium,Regular,12/24/2023,2023.0,December,10:19:28,6.0,159.5817626,,Grocery,Nestle,Coffee,Good,Standard,PayPal,Processing,4.0,Mocha,2023-12-24,2025-11-15 10:19:28,Missing values; 
4289128.0,87839.0,,Thomas52@gmail.com,4794220729.0,08928 Alejandro Meadows,Newcastle upon Tyne,England,45505.0,UK,20.0,Male,Low,Regular,12-08-23,2023.0,December,13:48:53,5.0,443.020218,2215.10109,Electronics,Apple,Smartphone,Bad,Express,Debit Card,Processing,1.0,iPhone,2023-12-08,2025-11-15 13:48:53,Missing values; 
6216450.0,48693.0,Kevin Pena,Ryan78@gmail.com,5162880827.0,5606 Charles Shoals Apt. 417,Ottawa,Ontario,54515.0,Canada,20.0,Female,High,Regular,10/22/2023,2023.0,October,7:18:54,5.0,276.5613469,1382.806734,Electronics,Sony,Television,Average,Express,,Delivered,2.0,Curved TV,2023-10-22,2025-11-15 07:18:54,Missing values; 
4360565.0,72152.0,John Avery,Todd7@gmail.com,9553605434.0,852 Pearson Via Suite 633,Dortmund,Berlin,12875.0,,20.0,Female,Medium,Regular,02-09-24,2024.0,February,8:09:05,4.0,176.8650657,707.4602627,Clothing,Nike,Shorts,Excellent,Express,PayPal,Delivered,5.0,Cargo shorts,2024-02-09,2025-11-15 08:09:05,Missing values; 
4244137.0,40977.0,Mary Thompson,Bradley36@gmail.com,3781147332.0,0714 David Turnpike Apt. 698,Manchester,England,12055.0,UK,20.0,Male,Medium,Regular,1/23/2024,2024.0,January,0:30:14,7.0,347.1054983,2429.738488,Books,HarperCollins,Fiction,Good,Standard,Cash,,4.0,Adventure,2024-01-23,2025-11-15 00:30:14,Missing values; 
5559210.0,92241.0,John Johnson,Drew100@gmail.com,3409938461.0,89225 James Estates,Mnster,Berlin,50738.0,Germany,20.0,Male,High,Regular,07-03-23,2023.0,July,,9.0,248.8714805,2239.843324,Home Decor,IKEA,Decorations,Excellent,Same-Day,Credit Card,Delivered,4.0,Decorative pillows,2023-07-03,,Missing values; 
5511477.0,11915.0,Tamara Hudson,Angela21@gmail.com,5849015623.0,467 Gibson Loaf Apt. 567,Winnipeg,Ontario,76603.0,Canada,20.0,Female,Medium,Regular,9/21/2023,2023.0,September,11:08:02,5.0,448.2772943,2241.386472,Books,,Literature,Bad,Same-Day,Debit Card,Shipped,1.0,Short stories,2023-09-21,2025-11-15 11:08:02,Missing values; 
2335605.0,62706.0,Danielle Obrien,Amy13@gmail.com,6124661397.0,7989 Joshua Land Suite 185,Edmonton,Ontario,8704.0,Canada,20.0,Male,Medium,Regular,04-06-23,2023.0,April,18:06:29,4.0,426.1496457,1704.598583,Electronics,,Smartphone,Good,Standard,Cash,Delivered,4.0,Sony Xperia,2023-04-06,2025-11-15 18:06:29,Missing values; 
7038242.0,97896.0,Matthew Goodwin,Steven14@gmail.com,9148480039.0,2544 Stacy Roads,Birmingham,England,,UK,20.0,Male,High,Regular,01-11-24,2024.0,January,20:22:10,2.0,459.7619351,919.5238702,Clothing,Zara,Jeans,Bad,Same-Day,Credit Card,Shipped,1.0,Wide-leg jeans,2024-01-11,2025-11-15 20:22:10,Missing values; 
3309836.0,20258.0,John Henry,Amy72@gmail.com,5204582731.0,,Gold Coast,New South Wales,34962.0,Australia,20.0,Female,Medium,Regular,10/22/2023,2023.0,October,2:06:43,10.0,113.2472066,1132.472066,Grocery,Coca-Cola,Soft Drink,Bad,Express,PayPal,Processing,1.0,Grape soda,2023-10-22,2025-11-15 02:06:43,Missing values; 
3235141.0,37579.0,Robert Taylor,John72@gmail.com,4529647011.0,0449 Hailey Glens Apt. 616,Dsseldorf,Berlin,66465.0,Germany,20.0,Male,Medium,Regular,5/31/2023,,May,15:28:49,5.0,406.5664495,2032.832247,Home Decor,Bed Bath & Beyond,Kitchen,Bad,Same-Day,Cash,Processing,1.0,Refrigerator,2023-05-31,2025-11-15 15:28:49,Missing values; 
6669327.0,63308.0,Michael Smith,Adrienne51@gmail.com,9188820986.0,648 Paula Isle Suite 303,,South Dakota,57286.0,USA,20.0,Male,High,Regular,10/23/2023,2023.0,October,3:01:05,5.0,15.46638302,77.33191508,Electronics,Sony,Television,Good,Standard,Debit Card,Processing,4.0,QLED TV,2023-10-23,2025-11-15 03:01:05,Missing values; 
4800115.0,68886.0,Steven Hancock Jr.,Robert59@gmail.com,7147065788.0,82001 Jesus Spring Suite 499,Calgary,Ontario,25320.0,Canada,20.0,Male,High,Regular,10/21/2023,2023.0,October,6:28:51,3.0,52.99402255,158.9820677,,Adidas,Jacket,Excellent,Same-Day,Cash,Processing,5.0,Peacoat,2023-10-21,2025-11-15 06:28:51,Missing values; 
8782404.0,43337.0,Taylor Banks,Michael92@gmail.com,6077503688.0,,Ballarat,New South Wales,62261.0,Australia,20.0,Male,Medium,Regular,04-05-23,2023.0,April,0:29:50,5.0,141.4658019,707.3290095,Books,Random House,Fiction,Good,Same-Day,Credit Card,Processing,4.0,Adventure,2023-04-05,2025-11-15 00:29:50,Missing values; 
8188540.0,28807.0,Bianca Long,Jeffrey42@gmail.com,6405278901.0,228 Hanson Hollow,Kitchener,Ontario,29599.0,Canada,20.0,Female,Medium,Regular,05-06-23,2023.0,May,10:44:37,,441.5822796,1324.746839,Grocery,Pepsi,Soft Drink,Excellent,Same-Day,Debit Card,Shipped,4.0,Ginger ale,2023-05-06,2025-11-15 10:44:37,Missing values; 
8857740.0,75134.0,Kimberly Bryant,David39@gmail.com,5597132537.0,57591 Wagner Viaduct Apt. 592,Windsor,Ontario,98520.0,Canada,20.0,Female,High,Regular,02-09-24,2024.0,February,5:00:19,6.0,190.5936968,1143.562181,Books,Penguin Books,Non-Fiction,Good,Same-Day,,Shipped,4.0,Business,2024-02-09,2025-11-15 05:00:19,Missing values; 
7860619.0,88042.0,Bobby Doyle,Tom23@gmail.com,5698212062.0,814 Jerry Gardens Suite 183,Berlin,Berlin,63274.0,,20.0,Female,Medium,Premium,11/30/2023,2023.0,November,23:35:23,8.0,270.1298127,2161.038501,Grocery,Pepsi,Water,Bad,Same-Day,Debit Card,Delivered,1.0,Mineral water,2023-11-30,2025-11-15 23:35:23,Missing values; 
1144978.0,24646.0,Brent Garcia,Charles47@gmail.com,3706227761.0,891 Pennington Knoll,Duisburg,Berlin,37383.0,Germany,20.0,Male,Medium,New,11/18/2023,2023.0,November,20:43:58,8.0,84.35060004,674.8048003,Books,Penguin Books,Fiction,Excellent,,Credit Card,Shipped,5.0,Dystopian,2023-11-18,2025-11-15 20:43:58,Missing values; 
6353164.0,96399.0,Jeremy Kramer,Stacey16@gmail.com,8510256955.0,287 Alexis Divide Suite 192,,England,77530.0,UK,20.0,Male,Medium,New,01-08-24,2024.0,January,8:27:08,7.0,176.2633932,1233.843752,Clothing,Adidas,Shoes,Bad,Standard,Debit Card,Processing,1.0,Flip flops,2024-01-08,2025-11-15 08:27:08,Missing values; 
4266378.0,60807.0,Karen Frazier,Courtney8@gmail.com,1599332669.0,606 Gibbs Causeway Suite 409,Hamilton,,35714.0,Canada,20.0,Female,Low,New,9/26/2023,2023.0,September,23:32:13,2.0,137.1508115,274.301623,Home Decor,Home Depot,Decorations,Good,Standard,Credit Card,Shipped,4.0,Wall art,2023-09-26,2025-11-15 23:32:13,Missing values; 
2943792.0,20954.0,David Sims,Erika57@gmail.com,9700392160.0,14715 Tyler Greens,Leicester,England,40788.0,UK,20.0,Male,Low,New,07-11-23,2023.0,July,18:32:26,4.0,113.9136896,,Grocery,Pepsi,Water,Good,Same-Day,Credit Card,Delivered,4.0,Flavored water,2023-07-11,2025-11-15 18:32:26,Missing values; 
2827637.0,32622.0,Deanna Velez,Tanya53@gmail.com,8388112094.0,995 Caldwell Keys Suite 393,Hamilton,Ontario,1133.0,Canada,20.0,Male,Medium,New,02-08-24,2024.0,February,13:59:07,2.0,416.0056192,832.0112384,Clothing,Adidas,T-shirt,,Standard,PayPal,Processing,,Crew neck tee,2024-02-08,2025-11-15 13:59:07,Missing values; 
2286220.0,39815.0,Kevin Page,Allen62@gmail.com,3730147667.0,7823 Jessica Highway,Regina,Ontario,88237.0,Canada,20.0,Male,Low,New,6/30/2023,2023.0,June,,1.0,325.4308868,325.4308868,Grocery,Coca-Cola,Juice,Good,Express,Credit Card,Processing,4.0,Tomato juice,2023-06-30,,Missing values; 
2026526.0,83897.0,Adrian Gentry,John40@gmail.com,7442819121.0,,Townsville,New South Wales,52806.0,Australia,20.0,Female,Low,New,1/13/2024,2024.0,January,10:44:10,3.0,247.2888019,741.8664057,Books,Penguin Books,Fiction,Excellent,Standard,Credit Card,Processing,4.0,Adventure,2024-01-13,2025-11-15 10:44:10,Missing values; 
1540022.0,74288.0,Ashley Walsh,Kimberly76@gmail.com,3238472243.0,035 Morris Station Suite 864,Cardiff,England,59877.0,UK,20.0,Male,Low,New,02-04-24,2024.0,February,,8.0,336.4982744,2691.986195,Electronics,Apple,Laptop,Bad,Express,Debit Card,Delivered,1.0,Lenovo ThinkPad,2024-02-04,,Missing values; 
4831622.0,48028.0,Eric Johnson,Todd7@gmail.com,9735774423.0,92675 Miles Glens,Duisburg,Berlin,17053.0,Germany,20.0,Female,Low,New,6/24/2023,2023.0,June,16:37:45,1.0,317.2145466,,Grocery,Pepsi,Soft Drink,Good,Same-Day,PayPal,Delivered,4.0,Fruit punch,2023-06-24,2025-11-15 16:37:45,Missing values; 
7254292.0,85605.0,Tony Scott,Theresa71@gmail.com,3172861561.0,22619 Sandra Row Suite 548,Quebec City,Ontario,48410.0,Canada,20.0,Male,High,New,11/16/2023,2023.0,November,8:26:19,2.0,62.52624945,125.0524989,,IKEA,Decorations,Bad,Express,Debit Card,Delivered,1.0,Sculptures,2023-11-16,2025-11-15 08:26:19,Missing values; 
4496707.0,73166.0,Edward Snyder,Travis100@gmail.com,9707492914.0,113 Kayla Forest Suite 405,Kansas City,West Virginia,26602.0,USA,20.0,Female,Low,New,06-07-23,2023.0,June,,3.0,128.5344171,385.6032514,Home Decor,IKEA,Lighting,Good,Standard,Credit Card,Processing,3.0,Table lamps,2023-06-07,,Missing values; 
6145008.0,54143.0,Kevin Green,Sherri57@gmail.com,2398422350.0,266 Martha Gardens Apt. 969,El Paso,Rhode Island,2820.0,USA,20.0,Female,Medium,New,,2023.0,September,11:05:05,3.0,327.7328675,983.1986025,Home Decor,Home Depot,Tools,Average,Standard,Credit Card,Processing,2.0,Utility knife,,2025-11-15 11:05:05,Missing values; 
,91480.0,Megan Sanders,Sharon83@gmail.com,8444894015.0,65229 Joshua Parkways Suite 642,Leipzig,Berlin,45784.0,Germany,20.0,Female,Low,New,3/28/2023,2023.0,March,15:42:47,3.0,18.6486751,55.94602531,Electronics,Sony,Headphones,Bad,Standard,Credit Card,Delivered,1.0,Over-ear headphones,2023-03-28,2025-11-15 15:42:47,Missing values; 
2036056.0,88209.0,Joan Hancock,David40@gmail.com,1805384942.0,555 Elizabeth Estates Apt. 437,Oklahoma City,Maine,4048.0,USA,20.0,Female,Medium,New,,2023.0,September,14:32:55,7.0,209.5011235,1466.507865,Electronics,Samsung,Tablet,Bad,Same-Day,Debit Card,Pending,1.0,Lenovo Tab,,2025-11-15 14:32:55,Missing values; 
5560214.0,83765.0,Steven Doyle,Stephen90@gmail.com,2462234384.0,660 Kayla Underpass,Barrie,Ontario,2079.0,Canada,20.0,Female,High,New,05-05-23,2023.0,May,17:32:09,3.0,275.3913734,826.1741201,Electronics,Samsung,Television,,Same-Day,Cash,Shipped,,Smart TV,2023-05-05,2025-11-15 17:32:09,Missing values; 
8861519.0,55191.0,Heather Anderson,,9910735286.0,729 Meghan Orchard,Edinburgh,England,91128.0,UK,20.0,Male,Medium,New,01-12-24,2024.0,January,7:00:08,6.0,10.40406165,62.4243699,Grocery,Nestle,Chocolate,Average,Standard,Credit Card,Pending,2.0,Chocolate-covered fruits,2024-01-12,2025-11-15 07:00:08,Missing values; 
3266074.0,,Samuel Hawkins,Matthew99@gmail.com,6701343635.0,708 Benjamin Manor Apt. 168,Memphis,Georgia,30591.0,USA,20.0,Female,Low,New,11-12-23,2023.0,November,19:54:57,1.0,472.2137561,472.2137561,Home Decor,Bed Bath & Beyond,Kitchen,Excellent,Standard,Debit Card,Shipped,5.0,Stove,2023-11-12,2025-11-15 19:54:57,Missing values; 
2148001.0,60537.0,Michael Stone,Haley73@gmail.com,,56966 Flores Dale Suite 359,Bristol,England,55745.0,UK,20.0,Male,High,New,1/22/2024,2024.0,January,6:52:25,6.0,253.9752169,1523.851301,Clothing,Nike,Shoes,Excellent,Standard,Debit Card,Processing,4.0,Running shoes,2024-01-22,2025-11-15 06:52:25,Missing values; 
7554209.0,31346.0,Carly Long,Tara73@gmail.com,8434841647.0,91054 Ellis Plains,Bristol,England,10511.0,UK,20.0,Female,,New,2/14/2024,2024.0,February,17:19:49,5.0,430.5395381,2152.69769,Grocery,Nestle,Coffee,Good,Express,Credit Card,Delivered,3.0,Latte,2024-02-14,2025-11-15 17:19:49,Missing values; 
9617849.0,18514.0,Anna Barnes,Tyler65@gmail.com,9172055680.0,080 Martin Manor Suite 128,Perth,New South Wales,13761.0,Australia,20.0,Male,Low,New,3/14/2023,2023.0,,20:50:30,8.0,490.9732455,3927.785964,Home Decor,Bed Bath & Beyond,Bathroom,Bad,Standard,Debit Card,Processing,1.0,Toilet paper holder,2023-03-14,2025-11-15 20:50:30,Missing values; 
5667248.0,96908.0,Joseph Vargas,,6520055578.0,3186 Savannah Pass Suite 784,Houston,Kentucky,41715.0,USA,20.0,Male,Low,New,08-12-23,2023.0,August,3:42:57,4.0,108.7579369,435.0317477,Electronics,Sony,Smartphone,Good,Express,Cash,Delivered,4.0,Samsung Galaxy,2023-08-12,2025-11-15 03:42:57,Missing values; 
8933969.0,10709.0,Samantha Harris,Timothy23@gmail.com,1753251328.0,358 Kyle Motorway Apt. 213,Hobart,New South Wales,,Australia,20.0,Male,Medium,New,,2023.0,December,8:09:59,1.0,435.4576897,435.4576897,Home Decor,IKEA,Furniture,Good,Standard,Debit Card,Delivered,3.0,Bed,,2025-11-15 08:09:59,Missing values; 
3526547.0,22362.0,Rachel Baldwin,Theresa97@gmail.com,7975974037.0,65194 Garcia Forge Apt. 263,Victoria,Ontario,33596.0,Canada,20.0,Male,,New,09-08-23,2023.0,September,14:02:25,2.0,365.7355323,731.4710646,Electronics,Apple,Smartphone,Bad,Express,Cash,Shipped,1.0,Xiaomi Mi,2023-09-08,2025-11-15 14:02:25,Missing values; 
5528560.0,68424.0,Douglas Moore,Veronica47@gmail.com,7752051356.0,827 Kristine Drive,Cairns,New South Wales,90190.0,Australia,20.0,Male,Low,New,3/16/2023,2023.0,March,11:59:59,4.0,211.7132365,846.8529459,Home Decor,IKEA,Decorations,Excellent,Same-Day,Debit Card,,4.0,Picture frames,2023-03-16,2025-11-15 11:59:59,Missing values; 
3622757.0,91379.0,Deborah Ashley,Karen8@gmail.com,2712100670.0,64096 Mary Mountain Apt. 401,Sheffield,,98129.0,UK,20.0,Male,Low,New,12/26/2023,2023.0,December,7:23:59,10.0,247.8396195,2478.396195,Electronics,Apple,Laptop,Good,Standard,PayPal,Shipped,3.0,LG Gram,2023-12-26,2025-11-15 07:23:59,Missing values; 
1060895.0,10987.0,Natasha Smith,Daniel86@gmail.com,6070589639.0,,Halifax,Ontario,57733.0,Canada,20.0,Male,High,New,10/29/2023,2023.0,October,21:26:22,2.0,244.4206029,488.8412058,Electronics,Apple,Tablet,Bad,Express,Debit Card,Pending,1.0,Samsung Galaxy Tab,2023-10-29,2025-11-15 21:26:22,Missing values; 
8481544.0,25251.0,Haley York PhD,Samuel3@gmail.com,1840520550.0,938 Christopher Trail,Baltimore,Alaska,,USA,20.0,Male,Medium,New,6/19/2023,2023.0,June,11:53:02,9.0,139.7415796,1257.674217,Grocery,Pepsi,Water,Bad,Standard,Credit Card,Shipped,1.0,Sparkling water,2023-06-19,2025-11-15 11:53:02,Missing values; 
5577438.0,84860.0,Shannon Griffith,Jared45@gmail.com,8006732915.0,024 Marshall Ranch,Belfast,England,48856.0,UK,20.0,Male,High,New,10/24/2023,2023.0,October,13:23:07,9.0,,4290.310098,Electronics,Apple,Laptop,Excellent,Same-Day,Cash,Pending,4.0,MacBook,2023-10-24,2025-11-15 13:23:07,Missing values; 
1094662.0,18383.0,Anthony Davis,Lisa16@gmail.com,,649 David Valley Suite 003,Oakland,Rhode Island,2860.0,USA,20.0,Male,High,New,08-11-23,2023.0,August,23:50:28,5.0,51.97492737,259.8746369,Home Decor,Bed Bath & Beyond,Bedding,Excellent,Same-Day,Credit Card,Processing,4.0,Duvet cover,2023-08-11,2025-11-15 23:50:28,Missing values; 
5362264.0,73916.0,Cynthia Deleon,Tracy10@gmail.com,8528938508.0,4423 Davis Port,,Berlin,11143.0,Germany,20.0,Male,Medium,New,06-06-23,2023.0,June,5:52:04,1.0,299.872722,299.872722,Grocery,Coca-Cola,Juice,Bad,Express,Debit Card,Processing,1.0,Mango juice,2023-06-06,2025-11-15 05:52:04,Missing values; 
7517708.0,61426.0,Sheila Smith,Terri70@gmail.com,2390594181.0,98906 Turner Locks,Montreal,Ontario,54351.0,Canada,20.0,,Medium,New,12/25/2023,2023.0,December,23:40:36,7.0,93.00684025,651.0478818,Home Decor,Bed Bath & Beyond,Bedding,Average,Express,Debit Card,Pending,2.0,Dust ruffle,2023-12-25,2025-11-15 23:40:36,Missing values; 
8887553.0,49328.0,Terri Ortiz,Vincent16@gmail.com,2764805173.0,092 Garcia Mall Apt. 366,Birmingham,England,59895.0,,20.0,Male,Low,New,11/26/2023,2023.0,November,12:57:14,8.0,315.6928005,2525.542404,Books,HarperCollins,Thriller,Excellent,Standard,Debit Card,Delivered,4.0,Detective,2023-11-26,2025-11-15 12:57:14,Missing values; 
4561028.0,73580.0,Jordan Martin DVM,Sean13@gmail.com,8816615791.0,503 Edward Vista Suite 962,Duisburg,Berlin,86877.0,Germany,20.0,Male,Low,New,,2023.0,March,17:36:59,10.0,14.99471801,149.9471801,Electronics,Samsung,Smartphone,Average,Same-Day,Debit Card,Processing,2.0,Nokia,,2025-11-15 17:36:59,Missing values; 
8935238.0,78864.0,Stephen Mclaughlin,William38@gmail.com,5861830332.0,126 Mcgrath Mission Suite 074,Fort Worth,South Carolina,29935.0,USA,20.0,Male,Medium,New,10/21/2023,2023.0,October,11:22:01,3.0,322.4496468,967.3489403,,HarperCollins,Thriller,Bad,Same-Day,PayPal,Pending,1.0,Political thriller,2023-10-21,2025-11-15 11:22:01,Missing values; 
4942063.0,62029.0,Jordan Frazier,Dawn18@gmail.com,8271871282.0,78987 Brenda Drives Apt. 011,Liverpool,England,4745.0,UK,20.0,Male,Low,New,01-05-24,2024.0,January,4:12:11,6.0,424.8208207,,Grocery,Pepsi,Water,Excellent,Same-Day,Cash,Shipped,5.0,Distilled water,2024-01-05,2025-11-15 04:12:11,Missing values; 
8069973.0,50145.0,James Shepard,Nicole91@gmail.com,,5836 Michelle Bypass,Barrie,Ontario,14652.0,Canada,20.0,Male,Medium,New,01-08-24,2024.0,January,5:16:17,6.0,263.1432251,1578.85935,Electronics,Samsung,Television,Average,Same-Day,Credit Card,Pending,2.0,Smart TV,2024-01-08,2025-11-15 05:16:17,Missing values; 
1191199.0,12318.0,Meredith Jackson,Thomas62@gmail.com,4712836550.0,947 Young Mountain Apt. 795,Chicago,South Dakota,,USA,20.0,Male,Low,New,09-01-23,2023.0,September,4:31:42,6.0,404.7529323,2428.517594,Grocery,Pepsi,Soft Drink,Excellent,Standard,PayPal,Delivered,5.0,Grape soda,2023-09-01,2025-11-15 04:31:42,Missing values; 
1223530.0,40244.0,Joshua Johnson,Robin45@gmail.com,4380464581.0,65340 Hill Harbor,Albury-Wodonga,,80430.0,Australia,20.0,Female,High,New,05-12-23,2023.0,May,9:42:24,8.0,359.8465105,2878.772084,Grocery,Nestle,Snacks,Bad,Express,Credit Card,Delivered,1.0,Trail mix,2023-05-12,2025-11-15 09:42:24,Missing values; 
7905078.0,67233.0,Nicole Day,Richard53@gmail.com,9667122498.0,4830 Heather Road Apt. 394,St. John's,Ontario,71234.0,Canada,20.0,Female,Medium,New,12-04-23,2023.0,December,18:14:10,10.0,421.2066672,4212.066672,Grocery,Nestle,Snacks,Good,,Cash,Pending,4.0,Nuts,2023-12-04,2025-11-15 18:14:10,Missing values; 
7235747.0,50276.0,Brandon Baker,Billy52@gmail.com,1299997453.0,228 Julia Shoal Suite 055,Duisburg,Berlin,22117.0,Germany,20.0,Male,High,New,01-12-24,2024.0,,16:32:02,1.0,381.5514568,381.5514568,Electronics,Apple,Laptop,Bad,Express,Cash,Pending,1.0,Acer Swift,2024-01-12,2025-11-15 16:32:02,Missing values; 
4418138.0,64705.0,Ashley King,Jason19@gmail.com,1577700276.0,61610 Danny Via Suite 127,Edmonton,Ontario,87333.0,Canada,20.0,Female,Low,New,7/22/2023,2023.0,July,12:15:46,1.0,274.7820608,274.7820608,Home Decor,IKEA,Decorations,Excellent,,Credit Card,Pending,5.0,Vases,2023-07-22,2025-11-15 12:15:46,Missing values; 
9646844.0,18767.0,Mr. Joseph Rodriguez,Carla63@gmail.com,7226328129.0,57338 Crystal Lane,Birmingham,England,36368.0,UK,20.0,Male,High,New,1/24/2024,2024.0,January,5:11:31,1.0,300.9274342,300.9274342,Books,HarperCollins,Fiction,Bad,,PayPal,Pending,1.0,Historical fiction,2024-01-24,2025-11-15 05:11:31,Missing values; 
1740538.0,78485.0,Heather Harris,Michelle47@gmail.com,1572217437.0,1672 Weaver Cliffs,Mackay,New South Wales,35864.0,Australia,20.0,Male,,New,10/26/2023,2023.0,October,18:40:47,7.0,466.2470579,3263.729405,Grocery,Coca-Cola,Juice,Excellent,Same-Day,Credit Card,Shipped,4.0,Tomato juice,2023-10-26,2025-11-15 18:40:47,Missing values; 
9778130.0,34237.0,Michael Chavez,Karen70@gmail.com,7056446382.0,1619 Aaron Station,Wollongong,New South Wales,4490.0,Australia,20.0,Male,Medium,New,09-02-23,2023.0,September,2:22:56,4.0,89.97300733,359.8920293,Clothing,,Shoes,Bad,Express,Debit Card,Pending,1.0,Oxfords,2023-09-02,2025-11-15 02:22:56,Missing values; 
2438755.0,45634.0,Rebecca Williams,,4674556058.0,9371 Wilson Plaza Apt. 722,Mnster,Berlin,35159.0,Germany,20.0,Male,Medium,New,5/16/2023,2023.0,May,11:15:35,1.0,499.1605706,499.1605706,Home Decor,IKEA,Furniture,Excellent,Same-Day,Debit Card,Processing,5.0,Nightstand,2023-05-16,2025-11-15 11:15:35,Missing values; 
9202635.0,58510.0,Donna Barnes,Ashley99@gmail.com,6088733462.0,3335 Shannon Fork Suite 361,Portsmouth,England,42147.0,UK,20.0,Male,Low,New,9/28/2023,2023.0,September,16:10:01,5.0,402.1597872,2010.798936,Grocery,Coca-Cola,Juice,Good,,Debit Card,Processing,4.0,Cranberry juice,2023-09-28,2025-11-15 16:10:01,Missing values; 
5825006.0,16632.0,Melissa Wilkinson,,8086971054.0,8823 Joshua Fort Apt. 250,Virginia Beach,California,92747.0,USA,20.0,Male,High,New,8/13/2023,2023.0,August,8:33:26,3.0,222.5977858,667.7933574,Grocery,Nestle,Snacks,Bad,Standard,Debit Card,Processing,1.0,Pretzels,2023-08-13,2025-11-15 08:33:26,Missing values; 
7494419.0,36696.0,Martha Moses,Jennifer39@gmail.com,4506138797.0,43287 Allen Center,Bonn,Berlin,9358.0,Germany,20.0,Female,Medium,New,11/27/2023,2023.0,November,21:03:18,8.0,155.0006868,1240.005495,Grocery,Pepsi,Soft Drink,Average,Express,,Delivered,2.0,Orange soda,2023-11-27,2025-11-15 21:03:18,Missing values; 
8980184.0,57655.0,Gerald Armstrong,Andrea12@gmail.com,7165362588.0,130 Aguilar Shoals Apt. 331,Sheffield,,35030.0,UK,20.0,Male,Medium,New,05-12-23,2023.0,May,21:37:55,2.0,273.2972839,546.5945677,Clothing,Adidas,T-shirt,Average,Standard,PayPal,Shipped,2.0,Crew neck tee,2023-05-12,2025-11-15 21:37:55,Missing values; 
7059268.0,71156.0,Audrey Crawford,Amanda82@gmail.com,2836091995.0,399 Danielle Street Apt. 298,Bendigo,New South Wales,21743.0,Australia,20.0,Male,Medium,New,08-03-23,2023.0,August,6:13:53,1.0,199.429926,199.429926,,Home Depot,Decorations,Excellent,Standard,PayPal,Shipped,4.0,Vases,2023-08-03,2025-11-15 06:13:53,Missing values; 
4072003.0,38753.0,Daniel Reynolds,Brent88@gmail.com,6981233161.0,394 Manuel Lock,,England,90101.0,UK,20.0,Female,High,New,3/26/2023,2023.0,March,0:04:28,10.0,406.6608447,4066.608447,Grocery,Nestle,Coffee,Excellent,Same-Day,Credit Card,Shipped,4.0,Espresso,2023-03-26,2025-11-15 00:04:28,Missing values; 
4766061.0,18360.0,Cindy Mendez,Cynthia83@gmail.com,4194829125.0,80850 Ronald Estates Suite 514,Melbourne,New South Wales,95805.0,Australia,20.0,Male,Medium,New,12-12-23,2023.0,December,19:49:05,3.0,,871.3852082,Clothing,Adidas,Shoes,Average,Same-Day,PayPal,Pending,2.0,Boots,2023-12-12,2025-11-15 19:49:05,Missing values; 
1617699.0,80861.0,Debra Aguilar,Mary74@gmail.com,8450108311.0,414 Simon Garden Suite 960,Stuttgart,Berlin,5582.0,Germany,20.0,Male,Low,New,1/31/2024,,January,11:55:19,5.0,402.5587838,2012.793919,Grocery,Pepsi,Juice,Bad,Standard,Credit Card,Processing,1.0,Cranberry juice,2024-01-31,2025-11-15 11:55:19,Missing values; 
9395220.0,62313.0,Rhonda Blankenship,Mark92@gmail.com,6595378719.0,25169 Jonathan Inlet Suite 513,London,Ontario,81350.0,Canada,20.0,Female,Low,New,11/19/2023,2023.0,November,13:27:06,5.0,154.9588775,774.7943874,Electronics,Samsung,Television,,Same-Day,Cash,Pending,,QLED TV,2023-11-19,2025-11-15 13:27:06,Missing values; 
5343899.0,66745.0,Julia Anderson,Tyler37@gmail.com,4417604198.0,219 Paul Skyway,Hull,England,33445.0,UK,20.0,Male,High,New,10/28/2023,2023.0,October,19:21:00,4.0,480.4334721,1921.733888,Electronics,Apple,Laptop,,Same-Day,Cash,Delivered,,Lenovo ThinkPad,2023-10-28,2025-11-15 19:21:00,Missing values; 
9914202.0,30088.0,Brianna Brown,Jonathan20@gmail.com,2020000579.0,0358 Howe Keys Suite 386,Wichita,Florida,32858.0,USA,20.0,,Low,New,06-05-23,2023.0,June,8:01:21,4.0,488.6093612,1954.437445,Home Decor,Home Depot,Decorations,Average,Same-Day,Credit Card,Processing,2.0,Curtains,2023-06-05,2025-11-15 08:01:21,Missing values; 
6514074.0,37859.0,Joseph King,Jonathan6@gmail.com,7043863433.0,32304 Vega Orchard Apt. 572,Quebec City,Ontario,11943.0,,20.0,Male,Medium,New,5/23/2023,2023.0,May,5:50:35,2.0,424.5720611,849.1441222,Grocery,Nestle,Snacks,Good,Standard,PayPal,Pending,4.0,Beef jerky,2023-05-23,2025-11-15 05:50:35,Missing values; 
7222623.0,65482.0,Louis Hernandez,Brittany60@gmail.com,,66295 Mccarthy Mountain,Gold Coast,New South Wales,70773.0,Australia,20.0,Male,Medium,New,03-06-23,2023.0,March,5:30:04,3.0,35.72425394,107.1727618,Clothing,Adidas,Shoes,Average,Same-Day,PayPal,Pending,2.0,Boots,2023-03-06,2025-11-15 05:30:04,Missing values; 
8174368.0,40399.0,Dawn Rodriguez,Alicia16@gmail.com,9974238012.0,834 Sandoval Passage,Saskatoon,Ontario,39732.0,Canada,20.0,Male,High,New,5/23/2023,,May,9:30:23,8.0,265.8497973,2126.798379,Grocery,Nestle,Chocolate,Bad,Same-Day,Cash,Processing,1.0,Chocolate-covered nuts,2023-05-23,2025-11-15 09:30:23,Missing values; 
5894589.0,90058.0,Felicia King MD,Jeffrey56@gmail.com,7557289413.0,40276 Krystal Station Suite 278,Memphis,Wisconsin,53445.0,USA,20.0,Female,Low,New,4/22/2023,2023.0,April,14:50:39,9.0,491.5594875,4424.035387,,Apple,Laptop,Good,Same-Day,Debit Card,Delivered,4.0,Samsung Notebook,2023-04-22,2025-11-15 14:50:39,Missing values; 
,72535.0,Oscar Ryan,Dorothy58@gmail.com,8685112703.0,056 Jeremiah Rapids Suite 612,Ottawa,Ontario,4957.0,Canada,20.0,Female,High,New,8/16/2023,2023.0,August,16:46:49,1.0,295.9554385,295.9554385,Books,Penguin Books,Children's,Excellent,Express,Credit Card,Pending,5.0,Clothing,2023-08-16,2025-11-15 16:46:49,Missing values; 
4028828.0,83989.0,Michael Ballard,Cesar96@gmail.com,4335462376.0,1949 Ryan Lakes Apt. 154,Duisburg,Berlin,18124.0,Germany,20.0,Male,Low,New,6/16/2023,2023.0,June,18:05:02,2.0,,286.0764599,Books,Random House,Literature,Average,Express,Credit Card,Processing,2.0,Literary fiction,2023-06-16,2025-11-15 18:05:02,Missing values; 
9965934.0,10830.0,Allen Howard,Valerie47@gmail.com,3099476706.0,76431 David Green Suite 803,Bochum,Berlin,6237.0,Germany,20.0,Male,Low,New,6/13/2023,2023.0,June,9:17:19,2.0,476.1818935,952.3637869,Electronics,Samsung,Tablet,,Same-Day,Credit Card,Delivered,,iPad,2023-06-13,2025-11-15 09:17:19,Missing values; 
4398264.0,37065.0,Shirley Craig,Michael47@gmail.com,8332857369.0,939 Deborah Gardens Suite 620,Darwin,New South Wales,45071.0,Australia,20.0,Female,High,New,,2023.0,July,4:05:31,1.0,115.0119785,115.0119785,Electronics,Apple,Smartphone,Good,Standard,Cash,Delivered,4.0,Motorola Moto,,2025-11-15 04:05:31,Missing values; 
8947020.0,40997.0,Joyce Sullivan,,8070488165.0,138 Andrews Bridge Apt. 186,Bochum,Berlin,91905.0,Germany,20.0,Male,Medium,New,12-02-23,2023.0,December,10:50:46,3.0,168.5521778,505.6565334,Home Decor,IKEA,Lighting,Bad,Express,Credit Card,Processing,1.0,Desk lamps,2023-12-02,2025-11-15 10:50:46,Missing values; 
3759227.0,47928.0,Roberto Boyd,,6061604122.0,26141 Barnes Rapids Apt. 602,Toronto,Ontario,30791.0,Canada,20.0,Female,High,New,10-08-23,2023.0,October,22:01:20,7.0,23.3105893,163.1741251,Books,HarperCollins,Non-Fiction,Excellent,Same-Day,Cash,Processing,4.0,Biography,2023-10-08,2025-11-15 22:01:20,Missing values; 
8149498.0,32009.0,Angela Lucas,Sheryl57@gmail.com,9292042142.0,947 Joshua Plains,Darwin,New South Wales,41345.0,Australia,20.0,Male,Low,New,4/27/2023,2023.0,April,15:08:15,8.0,134.4380086,,Grocery,Coca-Cola,Soft Drink,Bad,Standard,Credit Card,Shipped,1.0,Cola,2023-04-27,2025-11-15 15:08:15,Missing values; 
3980224.0,63449.0,Deanna Chung MD,Laura50@gmail.com,8070981056.0,65080 Bennett Estate Suite 909,Stuttgart,Berlin,36563.0,Germany,20.0,Female,Medium,New,8/15/2023,2023.0,August,19:06:36,,78.66390038,786.6390038,Electronics,Apple,Laptop,Average,Standard,Credit Card,Shipped,2.0,Asus ZenBook,2023-08-15,2025-11-15 19:06:36,Missing values; 
4066708.0,38611.0,Annette Davis,Teresa100@gmail.com,4779112426.0,0901 Thompson Square,Dortmund,Berlin,19327.0,Germany,20.0,Female,Medium,New,11-09-23,2023.0,November,7:10:19,7.0,88.49097202,619.4368041,Electronics,Sony,Television,Good,Same-Day,Cash,,4.0,4K TV,2023-11-09,2025-11-15 07:10:19,Missing values; 
4701564.0,64805.0,,Gregory16@gmail.com,4990186059.0,84288 Reed Tunnel,Ottawa,Ontario,62939.0,Canada,20.0,Female,Medium,New,2/19/2024,2024.0,February,14:02:58,2.0,87.1553987,174.3107974,Home Decor,IKEA,Decorations,Good,Standard,Debit Card,Delivered,4.0,Picture frames,2024-02-19,2025-11-15 14:02:58,Missing values; 
7119472.0,37904.0,Dan Davis,Jonathan84@gmail.com,9558871256.0,5868 Mary Run,,England,34288.0,UK,20.0,Male,Medium,New,01-10-24,2024.0,January,11:18:12,4.0,61.47644588,245.9057835,Books,Random House,Fiction,Average,Express,Credit Card,Delivered,2.0,Historical fiction,2024-01-10,2025-11-15 11:18:12,Missing values; 
8976229.0,28143.0,Veronica Woods,Ruth20@gmail.com,1361837031.0,35373 Miller Neck,Portland,Kansas,66193.0,USA,20.0,Male,Medium,New,3/16/2023,2023.0,,7:21:46,5.0,220.8256274,1104.128137,Home Decor,Bed Bath & Beyond,Bathroom,Good,Express,Cash,Delivered,3.0,Shower curtain,2023-03-16,2025-11-15 07:21:46,Missing values; 
1908637.0,78243.0,Kathy Chambers,David73@gmail.com,1773560793.0,7417 Gomez Tunnel Suite 944,Ballarat,New South Wales,13921.0,Australia,20.0,Male,Low,New,11-06-23,2023.0,November,1:33:44,6.0,169.1581032,,Electronics,Samsung,Smartphone,Excellent,Standard,PayPal,Pending,4.0,OnePlus,2023-11-06,2025-11-15 01:33:44,Missing values; 
7017905.0,99081.0,Phillip Cobb,Rodney10@gmail.com,5677501402.0,283 James Streets,Dsseldorf,Berlin,83688.0,Germany,20.0,Female,Medium,New,06-02-23,2023.0,June,22:03:20,,433.8454116,1301.536235,Clothing,Nike,Shoes,Excellent,Same-Day,Credit Card,Processing,5.0,Loafers,2023-06-02,2025-11-15 22:03:20,Missing values; 
2146698.0,22819.0,Erin Bennett,Rachael55@gmail.com,4948133433.0,,Mnster,Berlin,52354.0,Germany,20.0,Female,Medium,New,10/25/2023,2023.0,October,17:48:39,5.0,359.4157919,1797.07896,Books,Penguin Books,Non-Fiction,Excellent,Express,PayPal,Delivered,5.0,Biography,2023-10-25,2025-11-15 17:48:39,Missing values; 
1347146.0,70101.0,Timothy Taylor,Michael87@gmail.com,3789749603.0,91360 Jacqueline Forge Apt. 597,Boston,Arizona,85884.0,USA,20.0,Male,Medium,New,3/26/2023,2023.0,March,9:46:35,7.0,25.39274355,177.7492049,Books,HarperCollins,Non-Fiction,Bad,,Cash,Shipped,1.0,Science,2023-03-26,2025-11-15 09:46:35,Missing values; 
9785850.0,88168.0,Jamie Wagner,Ryan25@gmail.com,9700293634.0,21842 John Green Apt. 226,Sydney,New South Wales,29661.0,Australia,20.0,Male,Medium,New,12/26/2023,2023.0,December,,1.0,388.8629482,388.8629482,Books,Random House,Non-Fiction,Average,Standard,Credit Card,Pending,2.0,History,2023-12-26,,Missing values; 
2270212.0,15241.0,Curtis Fischer,Dawn34@gmail.com,3964968093.0,3387 Jennifer Curve,Columbus,South Carolina,29203.0,USA,20.0,Female,High,New,2/21/2024,2024.0,February,7:31:09,3.0,83.49751652,250.4925495,Books,,Non-Fiction,Average,Same-Day,Cash,Pending,2.0,Self-help,2024-02-21,2025-11-15 07:31:09,Missing values; 
6776761.0,47862.0,Justin Bennett,Michelle3@gmail.com,2696633944.0,23058 Michael Extensions Apt. 653,Newcastle upon Tyne,England,74087.0,UK,20.0,Male,Low,New,4/14/2023,2023.0,April,2:01:23,1.0,188.9707773,188.9707773,Grocery,Pepsi,Water,Excellent,Same-Day,,Processing,5.0,Spring water,2023-04-14,2025-11-15 02:01:23,Missing values; 
7798562.0,28185.0,Daniel Keller,Norma31@gmail.com,4120602170.0,8493 Mark Tunnel Apt. 991,Bonn,,64260.0,,20.0,Male,High,New,03-03-23,2023.0,March,13:52:55,2.0,214.4428983,428.8857966,Books,HarperCollins,Thriller,Average,Same-Day,Credit Card,Delivered,2.0,Crime,2023-03-03,2025-11-15 13:52:55,Missing values; 
9579993.0,10039.0,Christy Crawford,Sarah34@gmail.com,5438046449.0,185 Shelly Corners,Belfast,England,1598.0,,20.0,Male,Medium,New,2/14/2024,2024.0,February,22:08:24,9.0,444.6900867,4002.21078,Electronics,Apple,Tablet,Bad,Same-Day,Debit Card,Delivered,1.0,Huawei MediaPad,2024-02-14,2025-11-15 22:08:24,Missing values; 
8265493.0,64542.0,,David51@gmail.com,2679550634.0,732 Eric Corner Suite 042,Austin,Maryland,21336.0,USA,20.0,Female,Medium,New,8/18/2023,2023.0,August,21:11:54,2.0,163.8819901,327.7639802,Electronics,Samsung,Smartphone,Excellent,Express,Cash,Delivered,5.0,Huawei P,2023-08-18,2025-11-15 21:11:54,Missing values; 
1150836.0,87617.0,Nicole Simpson,Aaron8@gmail.com,6308887193.0,,Munich,Berlin,79173.0,Germany,20.0,Female,Medium,New,10/27/2023,2023.0,October,21:56:22,1.0,274.8110232,274.8110232,Electronics,Samsung,Smartphone,Excellent,Express,Debit Card,Shipped,5.0,OnePlus,2023-10-27,2025-11-15 21:56:22,Missing values; 
2340557.0,55634.0,Jacqueline Simpson,Melissa88@gmail.com,6460147415.0,,Kitchener,Ontario,6397.0,Canada,20.0,Male,High,New,5/16/2023,2023.0,May,10:24:02,9.0,171.6922339,1545.230105,Books,Random House,Literature,Average,Same-Day,PayPal,Shipped,2.0,Literary fiction,2023-05-16,2025-11-15 10:24:02,Missing values; 
8187773.0,22868.0,Sarah Nelson,Donald98@gmail.com,8499349131.0,2378 Ponce Forges,Oxford,England,75265.0,UK,20.0,Male,High,New,2/26/2024,2024.0,February,23:23:48,2.0,164.705307,329.410614,Books,HarperCollins,Fiction,Good,Standard,Debit Card,,4.0,Romance,2024-02-26,2025-11-15 23:23:48,Missing values; 
5043198.0,49928.0,Thomas Stephens,Angela69@gmail.com,3793966028.0,48853 Frey Creek,Halifax,Ontario,32458.0,Canada,20.0,Male,Medium,New,,2023.0,November,7:40:47,5.0,32.28309954,161.4154977,Home Decor,Bed Bath & Beyond,Kitchen,Excellent,Same-Day,Credit Card,Processing,4.0,Electric kettle,,2025-11-15 07:40:47,Missing values; 
5617858.0,40397.0,Angel Christian,Joseph60@gmail.com,6226272319.0,044 Bonnie Ferry Suite 939,Oxford,England,34880.0,UK,20.0,Female,Low,New,3/14/2023,2023.0,March,4:44:00,1.0,276.5140913,276.5140913,Books,Penguin Books,Children's,Excellent,Same-Day,,Processing,4.0,Building blocks,2023-03-14,2025-11-15 04:44:00,Missing values; 
5755945.0,25753.0,Sydney Wright,Samantha12@gmail.com,5149742581.0,955 Matthew Fields,Manchester,England,24110.0,UK,20.0,,Medium,New,12-07-23,2023.0,December,6:58:21,5.0,378.8258447,1894.129224,Clothing,Zara,Jeans,Excellent,Same-Day,PayPal,Delivered,4.0,Boyfriend jeans,2023-12-07,2025-11-15 06:58:21,Missing values; 
4682172.0,16337.0,Katherine Levy,John93@gmail.com,4425589435.0,8907 Bauer Valley,Berlin,,36625.0,Germany,20.0,Male,Low,New,11-09-23,2023.0,November,15:29:11,9.0,264.1019191,2376.917272,Books,Random House,Fiction,Good,Standard,Debit Card,Delivered,4.0,Fantasy,2023-11-09,2025-11-15 15:29:11,Missing values; 
7133823.0,25287.0,Carol Moore,Marcia70@gmail.com,1762208016.0,586 Hunt Mountain,London,England,18685.0,UK,20.0,Male,Low,New,06-08-23,2023.0,June,9:30:53,5.0,445.4227372,2227.113686,Electronics,,Tablet,Bad,Same-Day,Debit Card,Shipped,1.0,Asus ZenPad,2023-06-08,2025-11-15 09:30:53,Missing values; 
6646496.0,22490.0,Daniel Henry,Jorge77@gmail.com,3331601334.0,38326 Taylor Key Suite 907,Calgary,,31594.0,Canada,20.0,Male,Low,New,4/30/2023,2023.0,April,2:34:09,1.0,373.6656825,373.6656825,Grocery,Pepsi,Soft Drink,Bad,Standard,Cash,Delivered,1.0,Cola,2023-04-30,2025-11-15 02:34:09,Missing values; 
7908971.0,71356.0,Kimberly Rodgers,Jacob33@gmail.com,1776283679.0,71497 Gates Port,Belfast,England,29636.0,UK,20.0,Male,Low,New,12-04-23,2023.0,December,14:46:01,,49.81601255,498.1601255,Clothing,Adidas,T-shirt,Average,Same-Day,Debit Card,Shipped,2.0,Graphic tee,2023-12-04,2025-11-15 14:46:01,Missing values; 
8543713.0,54082.0,Donald Garcia,Stephen42@gmail.com,7962254694.0,9923 Brian Light,Adelaide,New South Wales,85702.0,Australia,20.0,Male,,New,2/18/2024,2024.0,February,19:38:22,2.0,156.087971,312.175942,Electronics,Samsung,Smartphone,Bad,Standard,Credit Card,Shipped,1.0,Samsung Galaxy,2024-02-18,2025-11-15 19:38:22,Missing values; 
1094400.0,15158.0,Sally Burnett,Kristina80@gmail.com,1001710985.0,7475 Palmer Mission,,New South Wales,39869.0,Australia,20.0,Female,High,New,01-08-24,2024.0,,15:16:14,4.0,103.4080364,413.6321454,Grocery,Coca-Cola,Soft Drink,Good,Same-Day,Debit Card,Pending,4.0,Grape soda,2024-01-08,2025-11-15 15:16:14,Missing values; 
1859801.0,37204.0,Rebecca Robertson,Regina56@gmail.com,8352810150.0,853 Brown Spring,Ottawa,Ontario,99509.0,,20.0,Female,Medium,New,11/17/2023,2023.0,November,7:49:10,2.0,284.8960364,569.7920728,Home Decor,IKEA,Decorations,Good,Express,PayPal,Delivered,4.0,Decorative pillows,2023-11-17,2025-11-15 07:49:10,Missing values; 
5612637.0,72533.0,,Brian15@gmail.com,8812260823.0,7027 Wilson Locks Apt. 975,Kitchener,Ontario,86804.0,Canada,20.0,Female,Low,New,03-08-23,2023.0,March,0:03:50,7.0,284.0890367,1988.623257,Electronics,Sony,Smartphone,Bad,Same-Day,Cash,Processing,1.0,Xiaomi Mi,2023-03-08,2025-11-15 00:03:50,Missing values; 
8939643.0,74956.0,Matthew Harmon,Christopher36@gmail.com,6183535883.0,987 Anthony Light Suite 659,Dresden,Berlin,27909.0,Germany,20.0,Male,Low,New,4/15/2023,2023.0,April,16:40:50,1.0,,159.6308163,Home Decor,Bed Bath & Beyond,Kitchen,Excellent,Standard,Cash,Pending,5.0,Oven,2023-04-15,2025-11-15 16:40:50,Missing values; 
2442451.0,33746.0,Michael Reynolds,Kenneth73@gmail.com,9144422782.0,9507 Sullivan Island,Windsor,Ontario,24535.0,,20.0,Female,Low,New,11/20/2023,2023.0,November,12:22:48,4.0,409.0023021,1636.009209,Home Decor,Bed Bath & Beyond,Bedding,Average,Express,Debit Card,Shipped,2.0,Throw pillow,2023-11-20,2025-11-15 12:22:48,Missing values; 
8421690.0,76920.0,Howard Cooke,Jennifer66@gmail.com,5571419518.0,,Plymouth,England,14006.0,UK,20.0,Male,High,New,11/14/2023,2023.0,November,6:19:00,5.0,192.3169157,961.5845784,Books,Random House,Non-Fiction,Bad,Express,Debit Card,Pending,1.0,Travel,2023-11-14,2025-11-15 06:19:00,Missing values; 
5475191.0,87605.0,James Valenzuela,Eddie52@gmail.com,7538074265.0,1148 Sullivan Ports,Montreal,Ontario,90185.0,Canada,20.0,Female,Medium,New,11-09-23,2023.0,November,9:56:37,5.0,174.703072,873.5153601,Clothing,Zara,Shirt,Bad,,Credit Card,Pending,1.0,Hoodie,2023-11-09,2025-11-15 09:56:37,Missing values; 
7950021.0,10750.0,Justin Mckinney,Lauren30@gmail.com,8660440187.0,,Hanover,Berlin,96057.0,Germany,20.0,Male,Low,New,5/28/2023,2023.0,May,21:35:03,3.0,383.8972504,1151.691751,Clothing,Adidas,T-shirt,Good,Express,Cash,Delivered,3.0,Henley tee,2023-05-28,2025-11-15 21:35:03,Missing values; 
7252788.0,13509.0,David Werner,Daniel74@gmail.com,3755073394.0,4756 Gray Coves,,Ontario,45886.0,Canada,20.0,Male,Medium,New,9/14/2023,2023.0,September,18:53:45,4.0,249.857284,999.4291359,Books,HarperCollins,Non-Fiction,Bad,Standard,Credit Card,Delivered,1.0,Psychology,2023-09-14,2025-11-15 18:53:45,Missing values; 
6127501.0,32419.0,Annette Perez,James86@gmail.com,5929095592.0,799 Heather Garden,Saskatoon,Ontario,,Canada,20.0,Female,Low,New,09-12-23,2023.0,September,0:29:00,10.0,340.4280134,3404.280134,Home Decor,Home Depot,Tools,Good,Standard,Cash,Delivered,4.0,Level,2023-09-12,2025-11-15 00:29:00,Missing values; 
3396625.0,93939.0,John Lynch,,7086396625.0,2876 Robert Knolls Apt. 472,Leeds,England,61649.0,UK,20.0,Male,Low,New,05-10-23,2023.0,May,13:03:10,2.0,262.9687922,525.9375845,Grocery,Coca-Cola,Soft Drink,Bad,Standard,PayPal,Shipped,1.0,Cola,2023-05-10,2025-11-15 13:03:10,Missing values; 
5582529.0,57886.0,Jessica Valdez,Michelle21@gmail.com,6926015123.0,646 Elizabeth Fall,Melbourne,New South Wales,2854.0,Australia,20.0,Female,Low,New,4/23/2023,,April,8:45:54,6.0,98.20905136,589.2543082,Clothing,Zara,Jeans,Good,Express,Credit Card,Processing,3.0,Wide-leg jeans,2023-04-23,2025-11-15 08:45:54,Missing values; 
6241887.0,16010.0,Kelsey Love,,4380523227.0,038 Harry Spurs Apt. 254,Perth,New South Wales,5469.0,Australia,20.0,Female,Low,New,10-03-23,2023.0,October,18:48:42,2.0,24.54792478,49.09584956,Books,Random House,Fiction,Excellent,Same-Day,Cash,Delivered,4.0,Thriller,2023-10-03,2025-11-15 18:48:42,Missing values; 
4596847.0,53260.0,Donna Cohen,Rodney80@gmail.com,3955772220.0,8486 Morgan Coves,Newcastle,New South Wales,76160.0,Australia,20.0,Female,High,New,11/19/2023,2023.0,November,3:56:46,9.0,105.3720292,948.3482627,Electronics,Apple,Smartphone,Excellent,Same-Day,,Delivered,4.0,Xiaomi Mi,2023-11-19,2025-11-15 03:56:46,Missing values; 
2205041.0,33806.0,Scott Mills,Kevin80@gmail.com,7001478354.0,49593 Garcia Ranch Suite 770,Darwin,New South Wales,68853.0,Australia,20.0,Male,Medium,New,12/14/2023,2023.0,December,0:40:22,,117.3350795,586.6753973,Books,HarperCollins,Non-Fiction,Bad,Standard,Cash,Shipped,1.0,History,2023-12-14,2025-11-15 00:40:22,Missing values; 
9091659.0,,Christopher Wiggins,Troy79@gmail.com,9229492659.0,8594 Susan Ridge,Melbourne,New South Wales,42832.0,Australia,20.0,Female,High,New,3/17/2023,2023.0,March,18:19:58,5.0,372.7648926,1863.824463,Books,HarperCollins,Thriller,Bad,Express,Credit Card,Pending,1.0,Suspense,2023-03-17,2025-11-15 18:19:58,Missing values; 
7800014.0,70391.0,Cynthia Warren,Thomas21@gmail.com,3140876810.0,112 Timothy Fort,Mackay,New South Wales,76567.0,Australia,20.0,Female,Medium,New,4/19/2023,2023.0,April,11:17:19,2.0,224.8588133,449.7176266,,Nestle,Chocolate,Excellent,Same-Day,Debit Card,Pending,4.0,Chocolate-covered nuts,2023-04-19,2025-11-15 11:17:19,Missing values; 
9986020.0,,Tonya Durham,Jamie28@gmail.com,4860153190.0,45901 Karen Fords,Glasgow,England,43000.0,UK,20.0,Female,Low,New,5/17/2023,2023.0,May,3:27:33,7.0,30.14415583,211.0090908,Grocery,Pepsi,Juice,Average,Express,Credit Card,Pending,2.0,Orange juice,2023-05-17,2025-11-15 03:27:33,Missing values; 
7326272.0,81918.0,Ryan Mcbride,Richard36@gmail.com,2618853656.0,,Raleigh,South Dakota,57716.0,USA,20.0,Male,High,New,07-02-23,2023.0,July,8:36:27,5.0,464.9219823,2324.609912,Clothing,Zara,Shirt,Excellent,Same-Day,Credit Card,Pending,5.0,Polo shirt,2023-07-02,2025-11-15 08:36:27,Missing values; 
5042353.0,54939.0,Gregory Clark,Cody1@gmail.com,8812152240.0,67431 Scott Extensions,Townsville,New South Wales,86672.0,Australia,20.0,Female,Medium,New,,2023.0,July,22:25:35,5.0,209.6598669,1048.299335,Electronics,Apple,Tablet,Good,Standard,Credit Card,Processing,3.0,Huawei MediaPad,,2025-11-15 22:25:35,Missing values; 
8696118.0,33586.0,Sarah Escobar,Cole80@gmail.com,4213367177.0,3705 Smith Oval,Plymouth,England,60051.0,UK,20.0,Male,Medium,New,12-05-23,2023.0,December,13:10:35,,370.9183116,741.8366232,Books,HarperCollins,Fiction,Average,Same-Day,Cash,Delivered,2.0,Horror,2023-12-05,2025-11-15 13:10:35,Missing values; 
1700223.0,69630.0,Summer Rodriguez,Paul22@gmail.com,7065955356.0,56126 Marshall Mills Suite 509,Stuttgart,Berlin,60095.0,Germany,20.0,Female,Medium,New,10/18/2023,2023.0,,20:06:00,1.0,343.7207974,343.7207974,Grocery,Coca-Cola,Juice,Average,Express,PayPal,Delivered,2.0,Tomato juice,2023-10-18,2025-11-15 20:06:00,Missing values; 
3532622.0,53543.0,Olivia Pennington,Diane39@gmail.com,8836137636.0,442 Stone Branch,,New South Wales,79416.0,Australia,20.0,Female,Low,New,06-02-23,2023.0,June,16:15:24,1.0,351.9915522,351.9915522,Home Decor,IKEA,Furniture,Bad,Express,PayPal,Delivered,1.0,Wardrobe,2023-06-02,2025-11-15 16:15:24,Missing values; 
6671017.0,16023.0,,Anthony63@gmail.com,3461731342.0,531 Pena Forks,Windsor,Ontario,74875.0,Canada,20.0,Female,High,New,03-07-23,2023.0,March,1:42:58,7.0,114.4156033,800.9092232,Home Decor,Home Depot,Furniture,Bad,Same-Day,Cash,Delivered,1.0,Nightstand,2023-03-07,2025-11-15 01:42:58,Missing values; 
1034468.0,20687.0,Joseph Patrick,Patrick9@gmail.com,1746749901.0,70110 Patrick Meadow,Cologne,Berlin,92839.0,Germany,20.0,Male,Low,New,2/22/2024,2024.0,February,20:46:11,6.0,84.14394553,504.8636732,Clothing,Adidas,T-shirt,Average,,Debit Card,Pending,2.0,Plain tee,2024-02-22,2025-11-15 20:46:11,Missing values; 
9096052.0,43871.0,Zachary Griffin,Tamara86@gmail.com,1207209149.0,37273 King Cliffs Suite 375,Philadelphia,Louisiana,,USA,20.0,Male,High,New,10/23/2023,2023.0,October,16:08:46,9.0,117.07622,1053.68598,Home Decor,Home Depot,Decorations,Excellent,Same-Day,PayPal,Pending,5.0,Mirrors,2023-10-23,2025-11-15 16:08:46,Missing values; 
,64564.0,Destiny Taylor,Diane6@gmail.com,1209879768.0,814 Davis Trace Apt. 529,Quebec City,Ontario,36100.0,Canada,20.0,Male,Low,New,6/17/2023,2023.0,June,4:37:23,6.0,41.78538689,250.7123213,Home Decor,Home Depot,Decorations,Bad,Express,Credit Card,Delivered,1.0,Picture frames,2023-06-17,2025-11-15 04:37:23,Missing values; 
8834135.0,28646.0,Christopher Adams,Natalie8@gmail.com,5324640713.0,4294 Harris Village,Newcastle upon Tyne,England,87524.0,UK,20.0,Female,Medium,New,11-05-23,2023.0,November,10:53:55,7.0,448.783747,3141.486229,Home Decor,,Kitchen,Average,Same-Day,Debit Card,Delivered,2.0,Coffee maker,2023-11-05,2025-11-15 10:53:55,Missing values; 
4796343.0,54514.0,,Steven68@gmail.com,9004400122.0,3167 Roach Ville,Duisburg,Berlin,3417.0,Germany,20.0,Female,Medium,New,12-08-23,2023.0,December,7:27:00,7.0,280.6723778,1964.706644,Home Decor,Home Depot,Decorations,Bad,Standard,Cash,Shipped,1.0,Candles,2023-12-08,2025-11-15 07:27:00,Missing values; 
,46170.0,Lindsay Tate,Lisa92@gmail.com,4338094688.0,3700 Jimenez Bridge,Windsor,Ontario,32563.0,Canada,20.0,Male,High,New,10/24/2023,2023.0,October,18:22:52,4.0,316.2015826,1264.80633,Clothing,Adidas,Shoes,Bad,Same-Day,Debit Card,Processing,1.0,Sneakers,2023-10-24,2025-11-15 18:22:52,Missing values; 
8834249.0,50240.0,Kimberly Cooke,Michael11@gmail.com,8829146040.0,7349 Lisa Corners,Adelaide,New South Wales,13404.0,Australia,20.0,,Medium,New,3/15/2023,2023.0,March,4:42:39,7.0,288.5445159,2019.811612,Electronics,Samsung,Smartphone,Bad,Express,Cash,Pending,1.0,Nokia,2023-03-15,2025-11-15 04:42:39,Missing values; 
5324608.0,38686.0,Sandra Wang,Abigail2@gmail.com,8825666287.0,,Leeds,England,79401.0,UK,20.0,Female,Medium,New,04-06-23,2023.0,April,2:14:21,9.0,399.2147927,3592.933135,Grocery,Nestle,Coffee,Excellent,Express,Cash,Processing,4.0,Mocha,2023-04-06,2025-11-15 02:14:21,Missing values; 
9850709.0,69482.0,Alicia Davis MD,Brittany83@gmail.com,1514086261.0,65549 Mcmahon Ways,Dortmund,Berlin,81128.0,Germany,20.0,Female,Low,New,06-09-23,2023.0,June,16:25:21,8.0,450.3263579,3602.610863,Clothing,Nike,Shoes,Bad,,Debit Card,Processing,1.0,Espadrilles,2023-06-09,2025-11-15 16:25:21,Missing values; 
3773149.0,57966.0,Christina Marquez,Sean30@gmail.com,8798970485.0,55137 Joanne Junction Suite 071,Edmonton,Ontario,35836.0,Canada,20.0,Male,,New,06-06-23,2023.0,June,1:41:41,1.0,145.7774968,145.7774968,Clothing,Zara,Jeans,Bad,Express,Debit Card,Shipped,1.0,Flare jeans,2023-06-06,2025-11-15 01:41:41,Missing values; 
9598605.0,35015.0,Eric Johnson,Danielle18@gmail.com,1805558377.0,850 Paige Mews Suite 890,Nuremberg,Berlin,47247.0,Germany,20.0,Female,Low,New,11/23/2023,2023.0,November,17:54:31,,167.3336933,502.0010798,Books,HarperCollins,Fiction,Average,Express,Cash,Processing,2.0,Horror,2023-11-23,2025-11-15 17:54:31,Missing values; 
5128861.0,85447.0,Kelly Soto,Paula24@gmail.com,5331437311.0,96133 Steven Ranch,Albury-Wodonga,New South Wales,37615.0,Australia,20.0,Male,Low,New,5/28/2023,2023.0,May,16:05:44,1.0,257.9007013,257.9007013,Books,Penguin Books,Fiction,,Express,Cash,Shipped,,Thriller,2023-05-28,2025-11-15 16:05:44,Missing values; 
3952855.0,88983.0,Michael Dunlap,Chad12@gmail.com,3706788515.0,17539 Graham Road,Nottingham,England,25664.0,UK,20.0,Male,Medium,New,,2023.0,August,8:14:57,4.0,433.6609997,1734.643999,Grocery,Coca-Cola,Juice,Good,Same-Day,Debit Card,Processing,4.0,Orange juice,,2025-11-15 08:14:57,Missing values; 
2191709.0,58686.0,Mary Campos,Debra74@gmail.com,4944351350.0,5503 Schultz Loop Suite 282,Glasgow,,48872.0,UK,20.0,Male,High,New,12-12-23,2023.0,December,3:52:43,9.0,14.28911541,128.6020387,Books,Random House,Non-Fiction,Excellent,Express,PayPal,Delivered,4.0,Travel,2023-12-12,2025-11-15 03:52:43,Missing values; 
3699953.0,71596.0,Nicole Marshall,Joshua85@gmail.com,5771044376.0,86196 Andrea Expressway,Edinburgh,England,59503.0,UK,20.0,Female,,New,09-12-23,2023.0,September,4:05:13,9.0,243.9800691,2195.820622,Home Decor,Home Depot,Tools,Bad,Express,Debit Card,Processing,1.0,Drill,2023-09-12,2025-11-15 04:05:13,Missing values; 
4298007.0,71906.0,,Susan31@gmail.com,4742718839.0,55613 Santos Oval,Kitchener,Ontario,62840.0,Canada,20.0,Male,Low,New,08-06-23,2023.0,August,6:29:55,10.0,400.0023319,4000.023319,Electronics,Sony,Smartphone,Good,Express,PayPal,Pending,3.0,Motorola Moto,2023-08-06,2025-11-15 06:29:55,Missing values; 
8457151.0,80487.0,Whitney Wade,Anthony55@gmail.com,3778047335.0,5894 Jenna Plains Suite 574,Houston,Mississippi,38982.0,USA,20.0,Male,Medium,New,03-01-23,2023.0,March,13:58:18,2.0,190.4990466,380.9980933,Books,Random House,Non-Fiction,Excellent,,Credit Card,Delivered,5.0,History,2023-03-01,2025-11-15 13:58:18,Missing values; 
3740469.0,24288.0,Jennifer Greene,Aimee10@gmail.com,3518764464.0,73948 Mackenzie Station Suite 433,Berlin,Berlin,81265.0,,20.0,Female,Medium,New,1/29/2024,2024.0,January,10:26:00,8.0,340.6024101,2724.819281,Clothing,Nike,T-shirt,Average,Express,Debit Card,Processing,2.0,Scoop neck tee,2024-01-29,2025-11-15 10:26:00,Missing values; 
3558009.0,90403.0,Mr. Timothy Jones,Thomas81@gmail.com,8570502303.0,,Stuttgart,Berlin,57872.0,Germany,20.0,Male,Medium,New,7/14/2023,2023.0,July,23:46:56,6.0,141.3392243,848.0353456,Clothing,Zara,Shirt,Bad,Same-Day,Debit Card,Delivered,1.0,Flannel shirt,2023-07-14,2025-11-15 23:46:56,Missing values; 
1092359.0,16945.0,Jennifer Wolf,Robert45@gmail.com,,21572 Mccall Green,Long Beach,North Dakota,58351.0,USA,20.0,Female,High,New,11/24/2023,2023.0,November,4:30:45,1.0,115.2476645,115.2476645,Home Decor,Home Depot,Decorations,Excellent,Same-Day,Credit Card,Pending,5.0,Candles,2023-11-24,2025-11-15 04:30:45,Missing values; 
5128427.0,85441.0,Nathan Garcia DDS,Patty48@gmail.com,5719080465.0,98337 Travis Rapids Apt. 825,Montreal,Ontario,42934.0,Canada,20.0,Male,Low,New,1/25/2024,2024.0,January,21:35:17,2.0,38.22157376,76.44314752,Clothing,Nike,T-shirt,Good,,PayPal,Pending,4.0,Raglan tee,2024-01-25,2025-11-15 21:35:17,Missing values; 
7006837.0,40144.0,Christopher Harrington,Walter47@gmail.com,6056720798.0,9941 Boyer Brooks,Ballarat,New South Wales,75622.0,Australia,20.0,Female,High,New,08-03-23,2023.0,August,11:49:43,4.0,469.549572,,Books,Penguin Books,Non-Fiction,Average,Same-Day,Credit Card,Pending,2.0,Health,2023-08-03,2025-11-15 11:49:43,Missing values; 
9496800.0,59440.0,Ryan Herrera,,9739810362.0,273 Eddie Passage,Memphis,Texas,77347.0,USA,20.0,Male,Low,New,09-07-23,2023.0,September,19:45:03,9.0,247.827819,2230.450371,Home Decor,Bed Bath & Beyond,Bathroom,Good,Same-Day,Cash,Pending,3.0,Shower,2023-09-07,2025-11-15 19:45:03,Missing values; 
5887505.0,83619.0,Mark Ball,,1305371669.0,0095 Smith Corners Suite 117,Quebec City,Ontario,87057.0,Canada,20.0,Female,Medium,New,10/24/2023,2023.0,October,22:57:26,5.0,330.072858,1650.36429,Electronics,Apple,Laptop,Bad,Same-Day,PayPal,Pending,1.0,LG Gram,2023-10-24,2025-11-15 22:57:26,Missing values; 
4255708.0,54127.0,Darrell Chambers,Christopher4@gmail.com,3807783792.0,,Los Angeles,Kansas,66919.0,USA,20.0,Female,Medium,New,10-04-23,2023.0,October,21:22:44,9.0,139.3080118,1253.772106,Books,HarperCollins,Thriller,Good,Standard,Credit Card,Delivered,3.0,Crime,2023-10-04,2025-11-15 21:22:44,Missing values; 
3182764.0,86626.0,,Jamie76@gmail.com,8876345563.0,88731 White Fields Apt. 487,Glasgow,England,20759.0,UK,20.0,Female,High,New,06-09-23,2023.0,June,19:22:09,1.0,385.5311363,385.5311363,Electronics,Apple,Tablet,Excellent,Standard,Credit Card,Processing,4.0,Google Pixel Slate,2023-06-09,2025-11-15 19:22:09,Missing values; 
7830542.0,84432.0,Eric Benjamin Jr.,Chelsea3@gmail.com,2228708209.0,,Tucson,Minnesota,55776.0,USA,20.0,Male,Low,New,10/13/2023,2023.0,October,9:13:50,4.0,190.923123,763.6924919,Electronics,Sony,Smartphone,Good,Same-Day,Cash,Pending,3.0,OnePlus,2023-10-13,2025-11-15 09:13:50,Missing values; 
2936944.0,85238.0,Michael Welch,Mitchell12@gmail.com,6764781544.0,44753 Kaitlyn Manors Suite 433,Canberra,New South Wales,84098.0,Australia,20.0,Male,High,New,3/30/2023,2023.0,March,5:06:04,,209.7220567,1677.776454,Books,Penguin Books,Children's,Good,Express,PayPal,Shipped,4.0,Games,2023-03-30,2025-11-15 05:06:04,Missing values; 
7729393.0,,Erin Dominguez,Jeffery65@gmail.com,6301517710.0,928 Kayla Rest,Louisville,Nevada,89194.0,USA,20.0,Female,Low,New,03-04-23,2023.0,March,6:24:15,7.0,423.433524,2964.034668,Electronics,Apple,Tablet,Good,Same-Day,Cash,Delivered,4.0,Lenovo Tab,2023-03-04,2025-11-15 06:24:15,Missing values; 
5373656.0,18160.0,Jared Allen,Erica90@gmail.com,3274933296.0,0266 Kimberly Lodge Apt. 141,Cairns,,81833.0,Australia,20.0,Male,Medium,New,2/27/2024,2024.0,February,16:47:53,7.0,101.0399332,707.2795323,Grocery,Coca-Cola,Soft Drink,Average,Express,PayPal,Shipped,2.0,Root beer,2024-02-27,2025-11-15 16:47:53,Missing values; 
8606604.0,54324.0,Jacob Taylor,Shelby96@gmail.com,3415139585.0,01676 Turner Ports,Dresden,Berlin,39392.0,Germany,20.0,,Low,New,01-03-24,2024.0,January,8:01:30,8.0,62.42338339,499.3870671,Home Decor,IKEA,Decorations,Good,Standard,PayPal,Delivered,3.0,Decorative pillows,2024-01-03,2025-11-15 08:01:30,Missing values; 
8785702.0,54491.0,Rebecca Mcmahon,Madeline77@gmail.com,3955444583.0,63511 Tony Port,,Berlin,88492.0,Germany,20.0,Male,Low,New,08-02-23,2023.0,August,6:39:44,2.0,394.9186175,789.837235,Home Decor,Home Depot,Furniture,Good,Same-Day,Credit Card,Processing,3.0,Dining table,2023-08-02,2025-11-15 06:39:44,Missing values; 
6761655.0,64793.0,Joshua Gonzalez,Angelica61@gmail.com,6756549997.0,200 House Avenue,Las Vegas,Oregon,97105.0,USA,20.0,Male,High,New,,2023.0,April,23:16:50,1.0,388.5508336,388.5508336,Electronics,Sony,Television,Average,Standard,Cash,Delivered,2.0,4K TV,,2025-11-15 23:16:50,Missing values; 
7538828.0,96650.0,Shelley Rodriguez,Miguel69@gmail.com,3837539651.0,88989 Morgan Hills,Las Vegas,Nebraska,68046.0,USA,20.0,Male,Low,New,9/15/2023,2023.0,September,13:18:12,10.0,261.1033057,2611.033057,Books,,Fiction,Good,Express,PayPal,Pending,3.0,Horror,2023-09-15,2025-11-15 13:18:12,Missing values; 
1545146.0,81574.0,Jacqueline Harris,Gail89@gmail.com,1375286425.0,1885 Moran Station Apt. 853,Victoria,Ontario,91764.0,Canada,20.0,Female,Low,New,6/28/2023,2023.0,June,20:22:45,,466.2150799,3263.505559,Grocery,Nestle,Chocolate,Excellent,Express,PayPal,Delivered,4.0,Chocolate-covered fruits,2023-06-28,2025-11-15 20:22:45,Missing values; 
4802146.0,25856.0,Rebecca Maxwell,Denise70@gmail.com,4443060385.0,38909 Jesse Mount Suite 844,Berlin,,62890.0,Germany,20.0,Female,Medium,New,4/24/2023,2023.0,April,3:53:12,4.0,139.1688321,556.6753283,Grocery,Pepsi,Juice,Good,Express,Cash,Pending,3.0,Pineapple juice,2023-04-24,2025-11-15 03:53:12,Missing values; 
6051430.0,22772.0,Samantha Welch,Tony1@gmail.com,1099497677.0,,Windsor,Ontario,46441.0,Canada,20.0,Male,Medium,New,5/28/2023,2023.0,May,8:57:02,3.0,137.0896137,411.268841,Grocery,Coca-Cola,Water,Average,Express,Credit Card,Delivered,2.0,Flavored water,2023-05-28,2025-11-15 08:57:02,Missing values; 
7979224.0,15664.0,Lauren Goodwin,Jessica59@gmail.com,2052731965.0,87930 Brown Trafficway,Edinburgh,England,17623.0,UK,20.0,Female,High,New,,2023.0,April,20:56:21,4.0,496.1386273,1984.554509,Home Decor,Home Depot,Tools,Excellent,Express,PayPal,Pending,4.0,Screwdriver set,,2025-11-15 20:56:21,Missing values; 
3108682.0,46152.0,Joseph Hansen,Katherine46@gmail.com,6318265617.0,3618 Fitzpatrick Field Apt. 544,Saskatoon,Ontario,47158.0,Canada,20.0,Male,Medium,New,10/24/2023,2023.0,,7:20:03,8.0,417.9200443,3343.360355,Electronics,Samsung,Television,Bad,Standard,Credit Card,Delivered,1.0,4K TV,2023-10-24,2025-11-15 07:20:03,Missing values; 
8813374.0,95436.0,Natalie Sanchez,,7675966558.0,8898 Lisa Highway,Brighton,England,17664.0,UK,20.0,Female,Low,New,02-05-24,2024.0,February,1:47:18,9.0,94.86927209,853.8234488,Books,Penguin Books,Fiction,Excellent,Standard,PayPal,Delivered,5.0,Dystopian,2024-02-05,2025-11-15 01:47:18,Missing values; 
9936543.0,21632.0,,Nancy6@gmail.com,9943854061.0,16759 Martin Run,Kitchener,Ontario,39396.0,Canada,20.0,Male,High,New,09-06-23,2023.0,September,22:28:13,10.0,440.0751367,4400.751367,Grocery,Pepsi,Water,Bad,Express,Debit Card,Processing,1.0,Bottled water,2023-09-06,2025-11-15 22:28:13,Missing values; 
2546137.0,67858.0,Casey Jordan,Shane85@gmail.com,1747292848.0,027 David Camp,Cologne,Berlin,77341.0,Germany,20.0,Female,Medium,New,1/16/2024,,January,16:45:37,4.0,352.0643359,1408.257344,Electronics,Samsung,Tablet,Excellent,Standard,Credit Card,Processing,4.0,Acer Iconia Tab,2024-01-16,2025-11-15 16:45:37,Missing values; 
2996322.0,96930.0,Mark Stevens,John89@gmail.com,5534657122.0,241 Joseph Field Suite 747,Saskatoon,Ontario,30484.0,Canada,20.0,Male,Low,New,8/23/2023,2023.0,August,23:12:41,4.0,48.96999776,195.879991,Home Decor,Bed Bath & Beyond,Bedding,Excellent,,Debit Card,Processing,5.0,Duvet cover,2023-08-23,2025-11-15 23:12:41,Missing values; 
7273144.0,22241.0,Crystal Harris,Monique37@gmail.com,7778965117.0,80122 Randy Well Apt. 280,Manchester,England,39330.0,UK,20.0,Male,Low,New,8/23/2023,2023.0,August,17:43:38,3.0,52.18998162,156.5699449,Electronics,Sony,Headphones,Excellent,Express,,Delivered,4.0,Gaming headphones,2023-08-23,2025-11-15 17:43:38,Missing values; 
1902143.0,27336.0,Karen Moses,Heather27@gmail.com,1024372106.0,074 Steven Common,,New South Wales,92160.0,Australia,20.0,Female,High,New,8/18/2023,2023.0,August,5:06:12,2.0,51.9351889,103.8703778,Electronics,Apple,Smartphone,Excellent,Standard,PayPal,Shipped,4.0,Nokia,2023-08-18,2025-11-15 05:06:12,Missing values; 
7284130.0,80456.0,Loretta Sanchez,Misty92@gmail.com,9821970017.0,415 Alicia Plains Suite 178,Bochum,Berlin,70402.0,Germany,20.0,,Medium,New,07-09-23,2023.0,July,14:44:38,7.0,355.7380284,2490.166199,Books,HarperCollins,Non-Fiction,Excellent,Same-Day,PayPal,Processing,4.0,Science,2023-07-09,2025-11-15 14:44:38,Missing values; 
8199448.0,81950.0,Michael Chase,Evelyn24@gmail.com,,5489 Johnson Cliff Apt. 033,Kelowna,Ontario,33928.0,Canada,20.0,Female,Medium,New,2/17/2024,2024.0,February,19:57:05,1.0,346.8721859,346.8721859,Home Decor,Bed Bath & Beyond,Bathroom,Good,Same-Day,Cash,Processing,4.0,Soap dispenser,2024-02-17,2025-11-15 19:57:05,Missing values; 
7851524.0,60891.0,Ashley Wright,Elizabeth15@gmail.com,2149628872.0,20962 Brady Falls,Essen,Berlin,48313.0,Germany,20.0,Male,Medium,New,8/24/2023,2023.0,August,5:03:34,2.0,211.5887323,423.1774647,Grocery,Coca-Cola,Water,,Same-Day,PayPal,Delivered,,Mineral water,2023-08-24,2025-11-15 05:03:34,Missing values; 
3431766.0,71242.0,Ashley Madden,David58@gmail.com,5389742434.0,413 Martinez Wall,Hobart,New South Wales,14501.0,Australia,20.0,Male,Medium,New,5/19/2023,2023.0,May,14:53:54,6.0,283.618307,1701.709842,Grocery,Nestle,Coffee,Excellent,Standard,Debit Card,,5.0,Americano,2023-05-19,2025-11-15 14:53:54,Missing values; 
8955620.0,24515.0,Joseph Freeman,Sarah31@gmail.com,1868363674.0,7302 Alejandro Glens,San Jose,Rhode Island,2839.0,USA,20.0,,Medium,New,10-11-23,2023.0,October,6:53:04,1.0,379.9010701,379.9010701,Home Decor,Bed Bath & Beyond,Bathroom,Bad,Same-Day,Cash,Shipped,1.0,Shower curtain,2023-10-11,2025-11-15 06:53:04,Missing values; 
3718928.0,84870.0,Craig Perez,Lauren39@gmail.com,5158062079.0,21382 Tamara Glens Apt. 188,Virginia Beach,South Carolina,29068.0,USA,20.0,Female,High,New,10-11-23,2023.0,October,,6.0,448.1944071,2689.166443,Grocery,Coca-Cola,Juice,Average,Same-Day,Credit Card,Processing,2.0,Cranberry juice,2023-10-11,,Missing values; 
9812536.0,15062.0,Susan Vazquez,Daniel14@gmail.com,2579922798.0,88053 Sarah Mountain Suite 365,Hamilton,Ontario,61126.0,Canada,20.0,Female,Low,New,,2023.0,August,15:32:35,5.0,199.3888692,996.944346,Home Decor,Bed Bath & Beyond,Kitchen,Excellent,Standard,Debit Card,Pending,4.0,Microwave,,2025-11-15 15:32:35,Missing values; 
8541937.0,10876.0,Jamie Miller,Beth61@gmail.com,,31984 Casey Square Suite 109,Fort Worth,Texas,75593.0,USA,20.0,Male,High,New,1/13/2024,2024.0,January,13:44:47,6.0,40.80699231,244.8419538,Grocery,Coca-Cola,Juice,Average,Same-Day,Debit Card,Processing,2.0,Pineapple juice,2024-01-13,2025-11-15 13:44:47,Missing values; 
6601062.0,65024.0,Amanda Adkins,Dorothy21@gmail.com,5101013932.0,184 Wilson Isle Apt. 506,Austin,North Carolina,27570.0,USA,20.0,Male,,New,6/30/2023,2023.0,June,4:25:37,10.0,470.121417,4701.21417,Books,Penguin Books,Non-Fiction,Bad,Express,Credit Card,Pending,1.0,Travel,2023-06-30,2025-11-15 04:25:37,Missing values; 
6581520.0,39199.0,Melissa Owens MD,Joseph20@gmail.com,3573227609.0,15402 Stephens Mountains Suite 081,Barrie,Ontario,74328.0,Canada,20.0,Female,Low,New,12-06-23,2023.0,December,6:11:39,5.0,,1960.456421,Clothing,Nike,T-shirt,Bad,Express,Debit Card,Shipped,1.0,Crew neck tee,2023-12-06,2025-11-15 06:11:39,Missing values; 
2304606.0,17546.0,Justin Hernandez,Scott73@gmail.com,6645188780.0,3880 Riley Trail Apt. 038,Dallas,Nevada,89644.0,USA,20.0,Male,Low,New,6/18/2023,2023.0,June,2:41:34,5.0,440.1293814,2200.646907,Home Decor,Bed Bath & Beyond,Bathroom,Bad,Same-Day,Cash,,1.0,Shower,2023-06-18,2025-11-15 02:41:34,Missing values; 
1284556.0,53922.0,Shelly Alexander,Adriana70@gmail.com,6027239257.0,00520 David Forks,Manchester,England,8772.0,UK,20.0,Female,Medium,New,01-09-24,2024.0,January,7:08:12,2.0,158.1786907,316.3573813,Home Decor,Home Depot,Tools,Bad,Same-Day,,Delivered,1.0,Wrench,2024-01-09,2025-11-15 07:08:12,Missing values; 
6243215.0,68215.0,Norma Cox,Jacob70@gmail.com,7241258976.0,363 Burton Extension,Philadelphia,Florida,34029.0,USA,20.0,Male,Low,New,10/18/2023,2023.0,October,7:50:28,3.0,310.5777858,931.7333575,Books,Random House,Fiction,Bad,Standard,PayPal,,1.0,Thriller,2023-10-18,2025-11-15 07:50:28,Missing values; 
2659431.0,53300.0,,Javier55@gmail.com,7049570250.0,94934 Amy Crossing Suite 912,Nuremberg,Berlin,56251.0,Germany,20.0,Male,Low,New,2/13/2024,2024.0,February,3:42:54,2.0,90.39526781,180.7905356,Home Decor,Bed Bath & Beyond,Bathroom,Average,Express,PayPal,Processing,2.0,Bathtub,2024-02-13,2025-11-15 03:42:54,Missing values; 
5975753.0,82015.0,Jennifer Evans,Susan60@gmail.com,2990314995.0,717 Stephanie Village,,New South Wales,5673.0,Australia,20.0,Male,Medium,New,4/25/2023,2023.0,April,18:06:05,9.0,483.6555716,4352.900145,Clothing,Adidas,Shoes,Good,Same-Day,PayPal,Delivered,4.0,Sandals,2023-04-25,2025-11-15 18:06:05,Missing values; 
5858336.0,37464.0,Jordan Nunez,Laura15@gmail.com,4608987303.0,69052 Leslie Corner,Kansas City,Kentucky,40689.0,USA,20.0,Female,Medium,New,08-12-23,2023.0,August,14:58:44,3.0,15.97159303,47.91477908,,Zara,Jeans,Average,Same-Day,PayPal,Delivered,2.0,Distressed jeans,2023-08-12,2025-11-15 14:58:44,Missing values; 
3145316.0,99676.0,Alexander Schroeder,Lindsey31@gmail.com,7513191021.0,09882 Michael Expressway,Munich,Berlin,25122.0,Germany,20.0,Female,High,New,,2023.0,October,6:11:25,10.0,288.0142265,2880.142265,Electronics,Samsung,Smartphone,Bad,Express,Credit Card,Processing,1.0,iPhone,,2025-11-15 06:11:25,Missing values; 
5118986.0,53575.0,James Leon,Amber74@gmail.com,5278141515.0,9659 Case Inlet,Sacramento,Illinois,62617.0,USA,20.0,Male,Medium,New,09-11-23,2023.0,September,,7.0,234.8194699,1643.736289,Books,Random House,Literature,Bad,Same-Day,PayPal,Processing,1.0,Contemporary literature,2023-09-11,,Missing values; 
1192180.0,49518.0,Jennifer Taylor,Crystal53@gmail.com,8316973666.0,607 Linda Gateway Suite 640,Plymouth,England,81702.0,UK,20.0,Male,High,New,11/28/2023,2023.0,,4:26:15,1.0,68.08041443,68.08041443,Home Decor,IKEA,Decorations,Excellent,Express,Cash,Shipped,4.0,Curtains,2023-11-28,2025-11-15 04:26:15,Missing values; 
1633746.0,54254.0,Wendy Marsh,Alexandra6@gmail.com,5269045143.0,3275 Jeffrey Gardens,Dortmund,Berlin,7024.0,Germany,20.0,Female,,New,02-12-24,2024.0,February,22:50:55,3.0,356.5991634,1069.79749,Electronics,Samsung,Television,Average,Standard,Credit Card,Processing,2.0,LCD TV,2024-02-12,2025-11-15 22:50:55,Missing values; 
6000148.0,19663.0,Ralph Rodgers,Mackenzie60@gmail.com,7413053834.0,9107 Keller Court,Nuremberg,Berlin,67409.0,Germany,20.0,Male,Medium,New,05-11-23,,May,4:51:17,10.0,380.2159936,3802.159936,Electronics,Sony,Smartphone,Average,Express,Debit Card,Processing,2.0,LG G,2023-05-11,2025-11-15 04:51:17,Missing values; 
5703972.0,15599.0,Rachel Matthews,Bruce66@gmail.com,4716506127.0,53844 Clements Dale Apt. 407,Brighton,England,597.0,,20.0,Male,Medium,New,4/16/2023,2023.0,April,12:30:41,4.0,119.3233651,477.2934604,Home Decor,IKEA,Decorations,Bad,Standard,Debit Card,Delivered,1.0,Mirrors,2023-04-16,2025-11-15 12:30:41,Missing values; 
4420796.0,11401.0,David Hill,Jacob43@gmail.com,,954 Edward Divide Apt. 225,Barrie,Ontario,6879.0,Canada,20.0,Male,High,New,12-07-23,2023.0,December,7:06:34,10.0,189.1594241,1891.594241,Clothing,Zara,Shirt,Bad,Same-Day,Debit Card,Processing,1.0,Button-down shirt,2023-12-07,2025-11-15 07:06:34,Missing values; 
8836510.0,93716.0,Kevin Kemp,George41@gmail.com,1743391540.0,98285 Allison Hills,Boston,,57061.0,USA,20.0,Male,High,New,7/21/2023,2023.0,July,22:31:01,5.0,280.8708934,1404.354467,Grocery,Coca-Cola,Soft Drink,Bad,Express,Debit Card,Delivered,1.0,Root beer,2023-07-21,2025-11-15 22:31:01,Missing values; 
3393315.0,57349.0,Brittany Collins,Angela68@gmail.com,5278511484.0,29748 Bean Lodge Suite 260,Sheffield,England,53387.0,UK,20.0,Female,Low,New,7/22/2023,2023.0,July,11:51:27,6.0,357.0664255,2142.398553,Books,,Fiction,Good,Standard,Cash,Delivered,4.0,Mystery,2023-07-22,2025-11-15 11:51:27,Missing values; 
4962422.0,24641.0,Michael Mays,Shannon38@gmail.com,5378660411.0,647 Charles Square,Essen,Berlin,94019.0,Germany,20.0,Female,Low,New,,2023.0,December,18:09:22,10.0,131.4412114,1314.412114,Books,Penguin Books,Fiction,Good,Express,Credit Card,Processing,4.0,Thriller,,2025-11-15 18:09:22,Missing values; 
9741541.0,78333.0,Jimmy Williams,Kevin42@gmail.com,9105322541.0,385 Carolyn Plaza Apt. 407,Cologne,Berlin,14690.0,Germany,20.0,Male,Low,New,12/27/2023,2023.0,December,9:23:16,5.0,34.45694361,,Clothing,Adidas,Shoes,Excellent,Express,Debit Card,Shipped,5.0,Boots,2023-12-27,2025-11-15 09:23:16,Missing values; 
1640470.0,14248.0,Cynthia Hernandez,Valerie89@gmail.com,3745740275.0,639 Robinson Club Apt. 128,Munich,Berlin,8615.0,Germany,20.0,Female,,New,6/29/2023,2023.0,June,19:48:26,4.0,62.68072637,250.7229055,Grocery,Nestle,Chocolate,Average,Standard,Cash,Delivered,2.0,Chocolate mousse,2023-06-29,2025-11-15 19:48:26,Missing values; 
6597039.0,96593.0,Christopher Hamilton,Jon32@gmail.com,1265807590.0,56421 John Manors,Minneapolis,Missouri,65685.0,USA,20.0,Male,Low,New,02-03-24,2024.0,February,21:39:47,,399.7317259,399.7317259,Home Decor,Bed Bath & Beyond,Kitchen,Good,Express,Cash,Pending,4.0,Coffee maker,2024-02-03,2025-11-15 21:39:47,Missing values; 
7503480.0,97083.0,Jennifer Knapp,Michelle66@gmail.com,4923832043.0,175 Michelle Crescent,,New Jersey,7605.0,USA,20.0,Female,Medium,New,11-07-23,2023.0,November,9:06:51,2.0,479.6293552,959.2587104,Clothing,Nike,T-shirt,Average,Same-Day,PayPal,Processing,2.0,Off-the-shoulder tee,2023-11-07,2025-11-15 09:06:51,Missing values; 
1317725.0,93462.0,Monica Strong,Candice35@gmail.com,4561026811.0,21081 Melinda Wall Suite 053,London,England,79764.0,UK,20.0,Male,Low,New,10/22/2023,2023.0,October,9:24:46,8.0,453.9019207,3631.215366,Electronics,Sony,Headphones,Excellent,Same-Day,,Delivered,5.0,Bluetooth headphones,2023-10-22,2025-11-15 09:24:46,Missing values; 
2397852.0,,Lauren Townsend,Ryan39@gmail.com,6647787625.0,2313 Mcclure Spurs,Leicester,England,25771.0,UK,20.0,Male,Medium,New,3/28/2023,2023.0,March,23:09:41,6.0,453.4507326,2720.704395,Home Decor,Bed Bath & Beyond,Kitchen,Excellent,Standard,Cash,Pending,5.0,Electric kettle,2023-03-28,2025-11-15 23:09:41,Missing values; 
2336965.0,50427.0,Jeffrey Freeman,Brenda84@gmail.com,1112022642.0,774 Clay Plain,Newcastle upon Tyne,England,46328.0,UK,20.0,Male,Medium,New,2/21/2024,2024.0,February,1:03:10,4.0,367.2260713,1468.904285,Books,Random House,Literature,Excellent,Express,,Processing,4.0,Literary fiction,2024-02-21,2025-11-15 01:03:10,Missing values; 
8324959.0,80411.0,Janet Gonzalez,Brenda28@gmail.com,5910988743.0,,Winnipeg,Ontario,90818.0,Canada,20.0,Female,High,New,2/21/2024,2024.0,February,20:51:55,1.0,26.41620233,26.41620233,Clothing,Zara,Shirt,Good,Standard,Cash,Processing,3.0,Hoodie,2024-02-21,2025-11-15 20:51:55,Missing values; 
,71640.0,Ian Lyons,Patrick14@gmail.com,5143702865.0,023 Castillo Landing Suite 760,Liverpool,England,11355.0,UK,20.0,Female,High,New,04-08-23,2023.0,April,0:46:20,1.0,93.68066024,93.68066024,Books,Random House,Literature,Excellent,Same-Day,PayPal,Processing,5.0,Poetry,2023-04-08,2025-11-15 00:46:20,Missing values; 
1540219.0,15089.0,Katherine Rowland,Veronica76@gmail.com,4057417626.0,834 Wayne Street Suite 347,London,Ontario,29497.0,Canada,20.0,Female,High,New,12/26/2023,2023.0,December,6:53:53,8.0,237.7263626,1901.810901,Books,,Thriller,Excellent,Same-Day,PayPal,Processing,4.0,Suspense,2023-12-26,2025-11-15 06:53:53,Missing values; 
6316261.0,19497.0,Katie Hamilton,Michael98@gmail.com,5912639711.0,64062 Russell Burgs Suite 353,Berlin,Berlin,45496.0,Germany,20.0,Male,High,New,06-12-23,2023.0,June,23:10:40,7.0,179.7269294,1258.088506,Books,Random House,Literature,,Same-Day,Cash,Processing,,Contemporary literature,2023-06-12,2025-11-15 23:10:40,Missing values; 
2359946.0,,Greg Smith,Samuel18@gmail.com,2494532400.0,9390 Robinson Radial,Saskatoon,Ontario,59529.0,Canada,20.0,Male,Low,New,12-05-23,2023.0,December,21:02:02,10.0,284.4914062,2844.914062,Home Decor,IKEA,Lighting,Bad,Standard,Cash,Processing,1.0,Wall sconces,2023-12-05,2025-11-15 21:02:02,Missing values; 
2935901.0,34561.0,Margaret Fleming,Ashlee25@gmail.com,7217982046.0,18530 Morris Lodge,Sacramento,Indiana,46727.0,USA,20.0,Male,Low,New,12-01-23,2023.0,,11:18:27,,272.3459374,1634.075625,Electronics,Samsung,Television,Bad,Standard,Cash,Pending,1.0,Plasma TV,2023-12-01,2025-11-15 11:18:27,Missing values; 
7616029.0,54977.0,James Owens,Kevin24@gmail.com,4511129933.0,0289 Johnson Run Suite 209,Portsmouth,England,82462.0,UK,20.0,Male,High,New,4/28/2023,2023.0,April,23:30:28,9.0,26.75123962,240.7611566,,Nestle,Coffee,Bad,Standard,Debit Card,Pending,1.0,Affogato,2023-04-28,2025-11-15 23:30:28,Missing values; 
8045032.0,98599.0,Ross Cohen,Bridget54@gmail.com,6601536567.0,168 Riley Creek,Saskatoon,Ontario,58105.0,Canada,20.0,Female,Medium,New,8/21/2023,2023.0,August,2:59:03,4.0,307.3234101,1229.29364,Clothing,Adidas,Shoes,Average,Same-Day,,Processing,2.0,Boots,2023-08-21,2025-11-15 02:59:03,Missing values; 
4169417.0,37649.0,Nicole Brandt,Brittany89@gmail.com,9936231813.0,0973 Eric Throughway,Leeds,England,90504.0,UK,20.0,Male,High,New,10/30/2023,2023.0,,6:24:08,8.0,379.1244344,3032.995475,Books,HarperCollins,Fiction,Good,Express,Cash,Pending,4.0,Horror,2023-10-30,2025-11-15 06:24:08,Missing values; 
8929409.0,28953.0,Cheryl Gomez,Christopher59@gmail.com,3608272273.0,444 Butler Fords,Sacramento,South Carolina,29231.0,USA,20.0,Female,Medium,New,6/25/2023,2023.0,June,7:00:04,1.0,,146.850913,Electronics,Apple,Tablet,Excellent,Express,Credit Card,Processing,5.0,Acer Iconia Tab,2023-06-25,2025-11-15 07:00:04,Missing values; 
8557802.0,42759.0,Seth Doyle,Theresa87@gmail.com,5974128900.0,21152 Laura Valley Suite 801,Hamburg,Berlin,80020.0,Germany,20.0,Female,Low,New,11/18/2023,2023.0,November,9:58:54,5.0,403.986285,2019.931425,Books,,Thriller,Good,Same-Day,Debit Card,Processing,3.0,Political thriller,2023-11-18,2025-11-15 09:58:54,Missing values; 
9026131.0,82281.0,Shannon Diaz,Sandra44@gmail.com,8182481279.0,6130 Joseph Stravenue Suite 643,Nuremberg,Berlin,58499.0,Germany,20.0,Male,Medium,New,3/18/2023,2023.0,March,17:44:57,4.0,104.8389156,419.3556622,Grocery,Coca-Cola,Water,,Standard,Cash,Pending,,Artesian water,2023-03-18,2025-11-15 17:44:57,Missing values; 
9693665.0,90045.0,Mark Parker,Amanda67@gmail.com,5927049781.0,6691 Scott Burg Suite 386,Montreal,Ontario,65549.0,Canada,20.0,Female,Medium,New,11-03-23,2023.0,November,8:07:51,6.0,,2719.782704,Electronics,Sony,Television,Excellent,Standard,Cash,Processing,5.0,QLED TV,2023-11-03,2025-11-15 08:07:51,Missing values; 
3274927.0,76413.0,Robert Hull,Justin59@gmail.com,4553014571.0,8799 Smith Shore Suite 126,Memphis,Kentucky,40467.0,USA,20.0,,Low,New,08-10-23,2023.0,August,18:41:08,9.0,345.5980045,3110.382041,Clothing,Nike,Shoes,Good,Express,Cash,Pending,3.0,Espadrilles,2023-08-10,2025-11-15 18:41:08,Missing values; 
9250087.0,58424.0,Brandon Barton,Karen85@gmail.com,7807484032.0,089 Hunter Drives,Long Beach,Arizona,85925.0,USA,20.0,Male,Low,New,3/22/2023,,March,4:38:16,2.0,51.30550109,102.6110022,Grocery,Coca-Cola,Juice,Average,Express,Credit Card,Processing,2.0,Grapefruit juice,2023-03-22,2025-11-15 04:38:16,Missing values; 
9374911.0,29572.0,Ashley Klein,Peggy78@gmail.com,8395013332.0,6287 Phillips Hollow Apt. 740,,New South Wales,63803.0,Australia,20.0,Male,Low,New,07-12-23,2023.0,July,0:50:50,3.0,337.6181895,1012.854569,Electronics,Samsung,Smartphone,Good,Same-Day,Debit Card,Shipped,4.0,Google Pixel,2023-07-12,2025-11-15 00:50:50,Missing values; 
1504178.0,77793.0,Michele Barnes,Garrett83@gmail.com,5750342145.0,5555 Morgan Cliffs Apt. 258,Fresno,Wyoming,82571.0,USA,20.0,Male,Low,New,4/17/2023,2023.0,April,18:14:24,1.0,49.98301182,49.98301182,,Nike,Shoes,Bad,Express,Debit Card,Shipped,1.0,Running shoes,2023-04-17,2025-11-15 18:14:24,Missing values; 
4530327.0,31700.0,Carol Hill,Andrea40@gmail.com,3744332664.0,73653 Angela Loaf Apt. 233,Oakland,,67250.0,USA,20.0,Male,Low,New,10/31/2023,2023.0,October,16:36:56,2.0,131.5547154,263.1094308,Electronics,Samsung,Television,Excellent,Standard,PayPal,Pending,4.0,Plasma TV,2023-10-31,2025-11-15 16:36:56,Missing values; 
9099910.0,86688.0,Matthew Smith,Brenda19@gmail.com,8042429947.0,1691 Robinson Roads Suite 176,Dresden,Berlin,,Germany,20.0,Male,Low,New,12-08-23,2023.0,December,13:13:20,9.0,432.7691173,3894.922056,Electronics,Samsung,Tablet,Good,Same-Day,PayPal,Pending,3.0,Lenovo Tab,2023-12-08,2025-11-15 13:13:20,Missing values; 
1698301.0,57215.0,Stephanie Holloway,Alexander68@gmail.com,3620091764.0,022 Mcguire Plaza,Oklahoma City,Massachusetts,1209.0,USA,20.0,Male,,New,7/20/2023,2023.0,July,21:27:58,8.0,411.3299399,3290.639519,Grocery,Pepsi,Soft Drink,Average,Express,Cash,Shipped,2.0,Grape soda,2023-07-20,2025-11-15 21:27:58,Missing values; 
7022819.0,52073.0,Max Washington,Andrea64@gmail.com,,4761 Cheyenne Bridge Apt. 579,Hamburg,Berlin,13270.0,Germany,20.0,Male,Low,New,04-05-23,2023.0,April,12:33:38,9.0,24.38521534,219.4669381,Electronics,Apple,Tablet,Excellent,Same-Day,PayPal,Pending,5.0,Microsoft Surface,2023-04-05,2025-11-15 12:33:38,Missing values; 
7966330.0,71008.0,Whitney Salazar,Stephen6@gmail.com,4753498962.0,2049 Maddox Avenue,Saskatoon,Ontario,53570.0,Canada,20.0,Male,Low,New,04-07-23,2023.0,April,7:34:43,2.0,360.1517572,720.3035145,,Penguin Books,Fiction,Bad,Standard,Cash,Delivered,1.0,Fantasy,2023-04-07,2025-11-15 07:34:43,Missing values; 
2003093.0,17327.0,Angela Martin,David23@gmail.com,5871240315.0,43359 Kayla Plains,Brisbane,New South Wales,76297.0,Australia,20.0,Female,,New,6/29/2023,2023.0,June,13:47:42,10.0,404.3188433,4043.188433,Electronics,Samsung,Television,Excellent,Same-Day,PayPal,Delivered,4.0,LCD TV,2023-06-29,2025-11-15 13:47:42,Missing values; 
5206639.0,56319.0,Taylor King,,9380969148.0,45411 Smith Cove,Frankfurt,Berlin,80017.0,Germany,20.0,Male,Low,New,5/29/2023,2023.0,May,6:47:32,3.0,249.8864176,749.6592528,Books,HarperCollins,Non-Fiction,Good,Same-Day,PayPal,Processing,4.0,Self-help,2023-05-29,2025-11-15 06:47:32,Missing values; 
6159437.0,87284.0,Tammy Osborne,Aaron64@gmail.com,3052749664.0,9300 Sandra Crossing Apt. 565,Oklahoma City,Nebraska,68022.0,USA,20.0,Female,High,New,07-10-23,2023.0,July,23:19:32,2.0,415.966711,,Electronics,Apple,Tablet,Bad,Same-Day,PayPal,Pending,1.0,Asus ZenPad,2023-07-10,2025-11-15 23:19:32,Missing values; 
7070698.0,14381.0,Thomas Chandler,,1136197497.0,21777 Evan Rapid,Canberra,New South Wales,82234.0,Australia,20.0,Male,Medium,New,7/22/2023,2023.0,July,15:01:39,8.0,272.2661333,2178.129066,Home Decor,IKEA,Lighting,Good,Express,Debit Card,Pending,4.0,Ceiling lights,2023-07-22,2025-11-15 15:01:39,Missing values; 
7418319.0,92249.0,Laura Harvey,Nicole37@gmail.com,6627408759.0,414 Lindsey Dam Apt. 462,,England,72814.0,UK,20.0,Female,Medium,New,01-08-24,2024.0,January,15:06:16,6.0,401.0547696,2406.328618,Home Decor,Bed Bath & Beyond,Kitchen,Good,Standard,Cash,Delivered,3.0,Refrigerator,2024-01-08,2025-11-15 15:06:16,Missing values; 
6806938.0,73753.0,Ann Cervantes,Steve44@gmail.com,5017675159.0,,Nuremberg,Berlin,88740.0,Germany,20.0,Female,Medium,New,04-06-23,2023.0,April,19:00:59,6.0,263.7030868,1582.218521,Grocery,Pepsi,Water,Good,Express,Cash,Shipped,3.0,Coconut water,2023-04-06,2025-11-15 19:00:59,Missing values; 
6029314.0,94885.0,William Daniel,Peggy3@gmail.com,8849801131.0,,Regina,Ontario,59475.0,Canada,20.0,Male,Medium,New,3/16/2023,2023.0,March,2:09:46,7.0,468.8548317,3281.983822,Books,Random House,Fiction,Good,Standard,PayPal,Delivered,3.0,Horror,2023-03-16,2025-11-15 02:09:46,Missing values; 
2648553.0,,Jason Tate,Gene22@gmail.com,1911584152.0,1558 Martinez Row Suite 840,Fresno,Illinois,62996.0,USA,20.0,Male,Low,New,04-08-23,2023.0,April,5:49:44,3.0,394.051381,1182.154143,Clothing,Nike,Shoes,Average,Express,Debit Card,Delivered,2.0,Loafers,2023-04-08,2025-11-15 05:49:44,Missing values; 
7633716.0,74891.0,Kerri Gray,David56@gmail.com,3527330678.0,208 Angela Square,Dsseldorf,Berlin,28886.0,Germany,20.0,Male,High,New,06-10-23,2023.0,June,3:47:08,9.0,415.3591691,,Electronics,Samsung,Television,Excellent,Same-Day,PayPal,Pending,4.0,LCD TV,2023-06-10,2025-11-15 03:47:08,Missing values; 
7035639.0,57719.0,,Hector41@gmail.com,8015479934.0,057 Henry Bridge Apt. 378,Nuremberg,Berlin,81940.0,Germany,20.0,Male,High,New,02-10-24,2024.0,February,17:56:47,10.0,181.1842125,1811.842125,Home Decor,Bed Bath & Beyond,Kitchen,Excellent,Express,PayPal,Processing,5.0,Stove,2024-02-10,2025-11-15 17:56:47,Missing values; 
1470479.0,88694.0,John Gomez,Todd21@gmail.com,3847074720.0,0862 Smith Mill Apt. 867,Hanover,Berlin,7153.0,Germany,20.0,Female,Low,New,07-02-23,2023.0,July,,2.0,354.706936,709.413872,Clothing,Adidas,Shoes,Good,Same-Day,Credit Card,Delivered,3.0,Running shoes,2023-07-02,,Missing values; 
6907382.0,70683.0,,Ashley88@gmail.com,5819152119.0,4615 Johnson Park Suite 053,Darwin,New South Wales,36009.0,Australia,20.0,Male,Low,New,01-11-24,2024.0,January,13:53:35,1.0,291.8491514,291.8491514,Books,Penguin Books,Fiction,Good,Standard,PayPal,Shipped,3.0,Thriller,2024-01-11,2025-11-15 13:53:35,Missing values; 
5454481.0,54359.0,Arthur Blake,Christopher85@gmail.com,7710238597.0,52691 Eric Mills,Darwin,New South Wales,95107.0,Australia,20.0,Female,Low,New,09-04-23,2023.0,September,16:45:12,4.0,152.086366,608.3454641,Electronics,Samsung,Tablet,Excellent,Standard,Cash,,5.0,Asus ZenPad,2023-09-04,2025-11-15 16:45:12,Missing values; 
7947776.0,65645.0,Jesus Johnson,Jacob3@gmail.com,4883839044.0,117 Robert Expressway,Winnipeg,Ontario,48208.0,Canada,20.0,Male,Low,New,7/28/2023,2023.0,July,14:36:46,2.0,452.0215344,904.0430687,Grocery,Pepsi,Water,Bad,,Cash,Processing,1.0,Coconut water,2023-07-28,2025-11-15 14:36:46,Missing values; 
4055972.0,54194.0,Debbie Allen,James68@gmail.com,3168948353.0,829 Woods Fork Apt. 556,Darwin,New South Wales,44274.0,Australia,20.0,Male,Low,New,08-01-23,2023.0,August,19:13:05,10.0,51.8017564,,Grocery,Coca-Cola,Soft Drink,Excellent,Standard,Debit Card,Pending,5.0,Cola,2023-08-01,2025-11-15 19:13:05,Missing values; 
4271757.0,71943.0,Scott Walsh,Edward76@gmail.com,4259304835.0,242 Cathy Hollow Suite 104,Mnster,Berlin,88828.0,Germany,20.0,Male,,New,04-11-23,2023.0,April,6:44:56,5.0,64.40028367,322.0014184,Electronics,Sony,Headphones,Excellent,Express,Cash,Delivered,4.0,DJ headphones,2023-04-11,2025-11-15 06:44:56,Missing values; 
9680661.0,94158.0,Christina Gray,Kayla10@gmail.com,,1417 Raymond Locks,Sheffield,England,18794.0,UK,20.0,Male,High,New,08-03-23,2023.0,August,1:36:53,2.0,244.5814424,489.1628849,Books,Random House,Literature,Bad,Express,Debit Card,Shipped,1.0,Short stories,2023-08-03,2025-11-15 01:36:53,Missing values; 
4243457.0,73654.0,Michelle Walker,Patrick33@gmail.com,8056950375.0,655 Sarah Burg Suite 304,,New Hampshire,3811.0,USA,20.0,Female,Medium,New,01-04-24,2024.0,January,6:22:04,6.0,419.0498312,2514.298987,Grocery,Coca-Cola,Juice,Good,Express,Cash,Processing,3.0,Grapefruit juice,2024-01-04,2025-11-15 06:22:04,Missing values; 
7944454.0,10388.0,Elizabeth Villegas,Thomas52@gmail.com,7837849683.0,27656 Ellis Wells,Albuquerque,Oklahoma,73066.0,USA,20.0,,High,New,5/16/2023,2023.0,May,5:50:30,7.0,233.6822152,1635.775507,Grocery,Pepsi,Water,Good,Same-Day,Cash,Pending,3.0,Distilled water,2023-05-16,2025-11-15 05:50:30,Missing values; 
8039234.0,56319.0,Matthew Calderon,Barbara93@gmail.com,3191241993.0,49389 Stephanie Lights Apt. 689,Manchester,England,77424.0,UK,20.0,Male,Low,New,05-01-23,2023.0,May,,3.0,372.0329712,1116.098914,Electronics,Samsung,Smartphone,Average,Same-Day,Credit Card,Processing,2.0,Motorola Moto,2023-05-01,,Missing values; 
8595173.0,21276.0,Stephen Holloway,Jonathan20@gmail.com,3836280109.0,09576 Stephanie Parks Apt. 891,Townsville,New South Wales,81363.0,Australia,20.0,Female,Medium,New,10-09-23,2023.0,October,7:29:39,,436.6667037,3493.33363,Home Decor,Bed Bath & Beyond,Kitchen,Average,Express,Debit Card,Shipped,2.0,Stove,2023-10-09,2025-11-15 07:29:39,Missing values; 
9498155.0,83769.0,Terri King,Danielle5@gmail.com,2019769150.0,42841 Day Shoal Suite 322,Cairns,New South Wales,3700.0,,20.0,Male,Medium,New,10/18/2023,2023.0,October,16:45:00,4.0,146.7735093,587.0940372,Grocery,Pepsi,Soft Drink,Good,Express,,Shipped,4.0,Root beer,2023-10-18,2025-11-15 16:45:00,Missing values; 
8710665.0,59991.0,Christopher Jones,Phillip8@gmail.com,6967296382.0,340 Brian Islands Suite 303,Wuppertal,Berlin,74466.0,Germany,20.0,Female,Medium,New,,2023.0,May,15:09:21,1.0,252.4973424,252.4973424,Electronics,Sony,Smartphone,Excellent,Express,Credit Card,Shipped,5.0,Sony Xperia,,2025-11-15 15:09:21,Missing values; 
9067375.0,37439.0,Timothy Bates,Kurt24@gmail.com,2409943040.0,36491 Nguyen Corner,Dortmund,Berlin,79418.0,Germany,20.0,Male,High,New,7/25/2023,2023.0,July,12:14:34,9.0,18.84479603,,Electronics,Samsung,Tablet,Bad,Standard,Cash,Shipped,1.0,Huawei MediaPad,2023-07-25,2025-11-15 12:14:34,Missing values; 
2744630.0,81501.0,Sharon Rivera DDS,William24@gmail.com,9115566502.0,50826 Warren Port Suite 626,Bremen,Berlin,39993.0,Germany,20.0,Male,Medium,New,1/15/2024,2024.0,January,2:55:18,4.0,95.91610066,383.6644026,Books,Penguin Books,Children's,Bad,Standard,,Delivered,1.0,Puzzles,2024-01-15,2025-11-15 02:55:18,Missing values; 
7326491.0,75883.0,Timothy Simon,Alicia22@gmail.com,9713454874.0,281 Alvarez Rest,Bonn,Berlin,87974.0,Germany,20.0,Male,,New,10-01-23,2023.0,October,13:26:58,3.0,156.4764215,469.4292646,Home Decor,Home Depot,Furniture,Excellent,Express,PayPal,Pending,4.0,Bookshelf,2023-10-01,2025-11-15 13:26:58,Missing values; 
7015591.0,61779.0,Mark West,Sarah54@gmail.com,4448390195.0,21792 Sanchez Shoal Suite 953,Portland,New Hampshire,3830.0,USA,20.0,Female,Low,New,9/21/2023,2023.0,September,7:16:17,,285.3488639,1141.395456,Clothing,Adidas,Jacket,Good,Express,Cash,Delivered,4.0,Bomber jacket,2023-09-21,2025-11-15 07:16:17,Missing values; 
5139853.0,68206.0,Crystal Brown,Kimberly62@gmail.com,5292724488.0,5262 Hood Isle,Hanover,Berlin,93756.0,Germany,20.0,Male,High,New,12-11-23,,December,16:50:17,1.0,413.8202721,413.8202721,Clothing,Adidas,Jacket,Bad,Express,Cash,Processing,1.0,Windbreaker,2023-12-11,2025-11-15 16:50:17,Missing values; 
8079022.0,45636.0,Megan Kim,Larry82@gmail.com,5079627978.0,20699 Carr Brook Suite 922,New York,Arkansas,72260.0,USA,20.0,Female,Medium,New,1/22/2024,2024.0,January,14:24:55,9.0,200.3614292,1803.252863,Clothing,Adidas,Jacket,Bad,Express,PayPal,,1.0,Parka,2024-01-22,2025-11-15 14:24:55,Missing values; 
5695971.0,86133.0,Mark Briggs,Stephanie81@gmail.com,8138378754.0,4838 Joseph Vista Apt. 225,Duisburg,Berlin,,Germany,20.0,Male,Low,New,8/26/2023,2023.0,August,8:24:27,10.0,477.1093603,4771.093603,Books,Penguin Books,Non-Fiction,Excellent,Express,Debit Card,Delivered,4.0,Psychology,2023-08-26,2025-11-15 08:24:27,Missing values; 
5981100.0,78694.0,Anna Campbell,Michelle46@gmail.com,6213143048.0,671 Garrett Dam Apt. 626,Sydney,New South Wales,68558.0,Australia,20.0,Male,Medium,New,09-05-23,2023.0,September,19:36:59,4.0,47.52005233,190.0802093,Clothing,Nike,Shorts,Good,Same-Day,,Delivered,4.0,Bermuda shorts,2023-09-05,2025-11-15 19:36:59,Missing values; 
6265016.0,61628.0,Allison Williams,Stephanie39@gmail.com,3861091990.0,3321 Lee Rest,Brisbane,New South Wales,64279.0,Australia,20.0,Male,Low,New,02-08-24,2024.0,,15:55:38,4.0,427.2243069,1708.897227,Clothing,Zara,Shirt,Bad,Express,Credit Card,Pending,1.0,Dress shirt,2024-02-08,2025-11-15 15:55:38,Missing values; 
3512225.0,36047.0,Jonathon Yang,Nicole94@gmail.com,6430573560.0,59065 Stanton Island Apt. 587,Geelong,New South Wales,45167.0,Australia,20.0,Female,Medium,New,12/25/2023,2023.0,December,12:33:12,,202.988482,1826.896338,Books,Random House,Fiction,Excellent,Express,Cash,Pending,5.0,Science fiction,2023-12-25,2025-11-15 12:33:12,Missing values; 
5002416.0,79540.0,Joseph Chavez,Kenneth58@gmail.com,1056146600.0,,Geelong,New South Wales,74518.0,Australia,20.0,Male,Low,New,1/29/2024,2024.0,January,20:07:14,2.0,241.5553348,483.1106696,Grocery,Pepsi,Soft Drink,Good,Express,Debit Card,Delivered,3.0,Root beer,2024-01-29,2025-11-15 20:07:14,Missing values; 
6592461.0,40996.0,Jason Floyd,Kathryn86@gmail.com,6603068609.0,757 Stephanie Well Apt. 667,Birmingham,England,72815.0,UK,20.0,Male,High,New,3/23/2023,2023.0,March,8:10:22,7.0,285.1153914,1995.80774,Home Decor,,Furniture,Good,Express,Cash,Shipped,3.0,Dresser,2023-03-23,2025-11-15 08:10:22,Missing values; 
6091616.0,73086.0,Susan Clark,,3243409709.0,516 Austin Flats,Edmonton,Ontario,91030.0,Canada,20.0,Female,Medium,New,04-04-23,2023.0,April,14:39:01,8.0,271.3015183,2170.412146,Home Decor,Bed Bath & Beyond,Kitchen,Bad,Standard,PayPal,Pending,1.0,Stove,2023-04-04,2025-11-15 14:39:01,Missing values; 
6641486.0,79367.0,Steve Mullen,Monica71@gmail.com,1237459206.0,43100 Jasmin Way Apt. 733,Gold Coast,New South Wales,96869.0,Australia,20.0,Male,High,New,11/15/2023,2023.0,November,,1.0,387.3946266,387.3946266,Home Decor,Bed Bath & Beyond,Bedding,Good,Same-Day,PayPal,Shipped,4.0,Comforter,2023-11-15,,Missing values; 
2408236.0,82164.0,Joseph Garcia,,9032848902.0,407 Rachel Plain Suite 487,Cairns,New South Wales,91845.0,Australia,20.0,Female,Medium,New,12-03-23,2023.0,December,18:30:50,,121.9440557,853.6083899,Electronics,Samsung,Smartphone,Average,Express,Credit Card,Shipped,2.0,Samsung Galaxy,2023-12-03,2025-11-15 18:30:50,Missing values; 
1848169.0,63608.0,Dustin Butler,Alexander69@gmail.com,4501249438.0,90567 Cox Ramp Apt. 959,Los Angeles,Alaska,99601.0,USA,20.0,Male,Low,New,06-12-23,2023.0,,13:52:54,4.0,179.7439216,718.9756865,Electronics,Sony,Smartphone,Excellent,Express,Debit Card,Processing,5.0,OnePlus,2023-06-12,2025-11-15 13:52:54,Missing values; 
5512610.0,32277.0,Jillian White,Todd27@gmail.com,1150415260.0,1899 Vargas Mission Suite 306,Hobart,New South Wales,58008.0,Australia,20.0,Female,Medium,New,1/19/2024,2024.0,January,7:58:58,10.0,363.0583609,3630.583609,Home Decor,,Decorations,Average,Express,Debit Card,Processing,2.0,Wall art,2024-01-19,2025-11-15 07:58:58,Missing values; 
6256469.0,30002.0,William Phillips,Leslie21@gmail.com,5497694382.0,236 Elaine Flats Apt. 275,Nuremberg,Berlin,,Germany,20.0,Female,Low,New,10/15/2023,2023.0,October,11:34:41,6.0,168.4898504,1010.939102,Electronics,Samsung,Television,Good,Express,Debit Card,Delivered,4.0,Curved TV,2023-10-15,2025-11-15 11:34:41,Missing values; 
6205804.0,89302.0,Joe Wilson,Tiffany21@gmail.com,1424946035.0,25835 Henry Park Apt. 036,Ballarat,New South Wales,33096.0,Australia,20.0,Male,Low,New,05-04-23,2023.0,May,4:19:44,7.0,411.3668559,2879.567992,,Adidas,Jacket,Excellent,Express,Credit Card,Delivered,5.0,Parka,2023-05-04,2025-11-15 04:19:44,Missing values; 
3981971.0,44683.0,Samantha Watson,Diana48@gmail.com,3874227547.0,34512 Hernandez Stream,Munich,Berlin,63492.0,Germany,20.0,Female,High,New,2/28/2024,2024.0,February,,5.0,479.9283354,2399.641677,Electronics,Apple,Tablet,Bad,Express,Cash,Processing,1.0,Amazon Fire Tablet,2024-02-28,,Missing values; 
2910126.0,84457.0,Joshua Barnett,Benjamin38@gmail.com,2508645098.0,6506 Mendez Terrace Apt. 421,Leeds,England,84521.0,UK,20.0,Female,Medium,New,3/16/2023,2023.0,March,,3.0,143.5258674,430.5776023,Home Decor,Bed Bath & Beyond,Bathroom,Average,Standard,Credit Card,Shipped,2.0,Toothbrush holder,2023-03-16,,Missing values; 
8618973.0,12996.0,James Waters,Kimberly40@gmail.com,2477064257.0,503 King Parkways,Vancouver,Ontario,39143.0,Canada,20.0,Female,High,New,01-08-24,,January,11:48:20,10.0,269.3852117,2693.852117,Electronics,Samsung,Television,Good,Express,Credit Card,Processing,4.0,QLED TV,2024-01-08,2025-11-15 11:48:20,Missing values; 
2676043.0,73528.0,Susan Gregory,,4347315589.0,3266 Christina Shoal,Adelaide,New South Wales,30031.0,Australia,20.0,Male,High,New,8/22/2023,2023.0,August,13:00:44,2.0,58.35414023,116.7082805,Books,HarperCollins,Non-Fiction,Excellent,Standard,Debit Card,Shipped,4.0,Self-help,2023-08-22,2025-11-15 13:00:44,Missing values; 
9861624.0,58344.0,David Warren,Kim13@gmail.com,5191557647.0,585 Mark Village,Frankfurt,Berlin,73028.0,Germany,20.0,Male,High,New,01-10-24,2024.0,January,23:35:33,8.0,29.74360836,237.9488669,,Nike,T-shirt,Good,Same-Day,Cash,Processing,3.0,Plain tee,2024-01-10,2025-11-15 23:35:33,Missing values; 
4249740.0,41657.0,Shelby Farmer,,8097737854.0,32093 William Tunnel Suite 329,Hamburg,Berlin,29105.0,Germany,20.0,Female,Medium,New,07-06-23,2023.0,July,7:56:43,1.0,176.7367761,176.7367761,Books,Penguin Books,Children's,Good,Standard,PayPal,Processing,4.0,Art supplies,2023-07-06,2025-11-15 07:56:43,Missing values; 
6501496.0,24664.0,,Gary62@gmail.com,2102671730.0,3638 Katherine Plains Suite 584,Bristol,England,53716.0,UK,20.0,Male,High,New,04-10-23,2023.0,April,21:18:16,6.0,367.1885653,2203.131392,Home Decor,IKEA,Decorations,Good,Standard,Debit Card,Shipped,3.0,Wall art,2023-04-10,2025-11-15 21:18:16,Missing values; 
5793907.0,51972.0,Gary Myers,,4751587459.0,80821 Mack Road Suite 726,Memphis,Vermont,5188.0,USA,20.0,Male,High,New,6/15/2023,2023.0,June,21:46:08,5.0,294.9994766,1474.997383,Home Decor,Bed Bath & Beyond,Bedding,Average,Express,Cash,Delivered,2.0,Duvet cover,2023-06-15,2025-11-15 21:46:08,Missing values; 
5825559.0,10911.0,John Andrews,Brandon8@gmail.com,9894886194.0,874 Leslie Pike Suite 433,Canberra,New South Wales,88486.0,Australia,20.0,Female,Low,New,9/28/2023,2023.0,September,10:54:07,4.0,93.74517883,374.9807153,Books,HarperCollins,Non-Fiction,Average,,PayPal,Processing,2.0,Business,2023-09-28,2025-11-15 10:54:07,Missing values; 
9162715.0,21729.0,Evelyn Chavez,Deborah93@gmail.com,6452206009.0,18407 Jennifer Haven Suite 334,Wuppertal,Berlin,17979.0,,20.0,Male,Low,New,1/15/2024,2024.0,January,1:26:20,10.0,227.5006134,2275.006134,Clothing,Adidas,Shoes,Bad,Express,PayPal,Shipped,1.0,Loafers,2024-01-15,2025-11-15 01:26:20,Missing values; 
5471488.0,86628.0,Joshua Richmond,Todd31@gmail.com,2540452754.0,85046 Kimberly Stravenue Suite 292,Hamburg,Berlin,9335.0,Germany,20.0,Male,Medium,New,4/26/2023,2023.0,April,19:47:39,2.0,82.22278127,164.4455625,Grocery,Nestle,Snacks,Bad,,Debit Card,Shipped,1.0,Popcorn,2023-04-26,2025-11-15 19:47:39,Missing values; 
3433292.0,84929.0,Christopher Cardenas,Amanda42@gmail.com,6852708438.0,090 Robert Island,Sacramento,Wyoming,82989.0,USA,20.0,,Low,New,04-08-23,2023.0,April,12:29:12,6.0,47.21648659,283.2989195,Electronics,Sony,Headphones,Average,Same-Day,PayPal,Shipped,2.0,Bluetooth headphones,2023-04-08,2025-11-15 12:29:12,Missing values; 
2441848.0,54750.0,Stephanie Craig,Renee86@gmail.com,8337740825.0,3572 Warren Underpass,Launceston,New South Wales,,Australia,20.0,Male,Medium,New,1/14/2024,2024.0,January,6:09:18,,454.9891349,1364.967405,Clothing,Adidas,T-shirt,Good,Same-Day,Cash,Pending,3.0,Scoop neck tee,2024-01-14,2025-11-15 06:09:18,Missing values; 
9851102.0,59729.0,Michelle Hayes,Jennifer67@gmail.com,8142560503.0,069 Novak Island Suite 063,Albury-Wodonga,New South Wales,77254.0,Australia,20.0,Male,Low,New,02-02-24,2024.0,February,,2.0,476.2592834,952.5185669,Grocery,Coca-Cola,Juice,Average,Express,Credit Card,Processing,2.0,Grape juice,2024-02-02,,Missing values; 
3610379.0,44811.0,Luis Morse,,7589113701.0,1412 Adams Ports,Kansas City,West Virginia,25684.0,USA,20.0,Male,Low,New,7/16/2023,2023.0,July,22:00:46,6.0,125.422438,752.5346278,Grocery,Coca-Cola,Soft Drink,Average,Standard,Debit Card,Delivered,2.0,Root beer,2023-07-16,2025-11-15 22:00:46,Missing values; 
9213776.0,56147.0,Kathryn Vazquez,Gregory28@gmail.com,8671388631.0,3211 Karen Valleys Suite 787,Bendigo,New South Wales,56156.0,,20.0,Male,High,New,1/26/2024,2024.0,January,13:23:47,9.0,236.3724049,2127.351644,Electronics,Sony,Television,Excellent,Standard,Debit Card,Delivered,5.0,Android TV,2024-01-26,2025-11-15 13:23:47,Missing values; 
1204403.0,59069.0,Joshua Roberts,Jessica61@gmail.com,4306016044.0,20902 Caitlin Brook,,Berlin,12313.0,Germany,20.0,Male,High,New,2/26/2024,2024.0,February,18:28:26,5.0,343.6925955,1718.462977,Electronics,Samsung,Smartphone,Bad,Express,PayPal,Delivered,1.0,LG G,2024-02-26,2025-11-15 18:28:26,Missing values; 
4473086.0,89694.0,Joy Warren,,9467450492.0,82305 Andrew Greens,Essen,Berlin,10308.0,Germany,20.0,Female,High,New,7/23/2023,2023.0,July,4:28:42,8.0,387.8819347,3103.055478,Clothing,Zara,Shirt,Excellent,Standard,Credit Card,Shipped,4.0,Blouse,2023-07-23,2025-11-15 04:28:42,Missing values; 
8669522.0,45827.0,Mary Wang,,1482375549.0,87792 Christopher Grove,Mackay,New South Wales,93562.0,Australia,20.0,Male,Low,New,09-11-23,2023.0,September,2:42:54,5.0,34.57984909,172.8992455,Home Decor,Bed Bath & Beyond,Bedding,Excellent,Same-Day,PayPal,Shipped,5.0,Duvet cover,2023-09-11,2025-11-15 02:42:54,Missing values; 
4534384.0,71412.0,Nicholas Wilson,Dale7@gmail.com,7902103263.0,968 Hill Shores,Bonn,Berlin,46480.0,Germany,20.0,Male,Medium,New,8/19/2023,2023.0,August,13:54:41,7.0,407.0802181,2849.561527,Home Decor,Bed Bath & Beyond,Bedding,Excellent,Standard,,Shipped,4.0,Quilt,2023-08-19,2025-11-15 13:54:41,Missing values; 
1225277.0,78437.0,Anthony Baird,Christine38@gmail.com,2281536225.0,73394 Diaz Station Suite 950,,New South Wales,53395.0,Australia,20.0,Male,High,New,12-12-23,2023.0,December,17:43:15,4.0,399.6690263,1598.676105,Books,Penguin Books,Fiction,Bad,Standard,Cash,Processing,1.0,Horror,2023-12-12,2025-11-15 17:43:15,Missing values; 
9177265.0,89212.0,Joseph Vega,Nichole47@gmail.com,7598371731.0,43198 Sierra Fort,Brighton,England,71618.0,UK,20.0,Male,Low,New,02-04-24,2024.0,February,15:28:49,2.0,346.9432473,693.8864946,,Sony,Television,Average,Same-Day,PayPal,Pending,2.0,LED TV,2024-02-04,2025-11-15 15:28:49,Missing values; 
,65986.0,Heather Garcia,Christian57@gmail.com,6164351155.0,0765 Alicia Forges,Denver,North Carolina,27683.0,USA,20.0,Male,Medium,New,7/27/2023,2023.0,July,15:59:02,6.0,433.7504298,2602.502579,Grocery,Pepsi,Juice,Average,Express,PayPal,Pending,2.0,Orange juice,2023-07-27,2025-11-15 15:59:02,Missing values; 
4660121.0,84969.0,Charles Hicks,Samuel46@gmail.com,4577612440.0,,Ottawa,Ontario,91659.0,Canada,20.0,Male,Low,New,11-06-23,2023.0,November,4:30:14,4.0,473.0480022,1892.192009,Clothing,Zara,Jeans,Average,Standard,Credit Card,Pending,2.0,Flare jeans,2023-11-06,2025-11-15 04:30:14,Missing values; 
2922417.0,97668.0,Connor Simon,Betty59@gmail.com,9202093610.0,178 Carrie Valleys Suite 888,Las Vegas,Indiana,47539.0,USA,20.0,Male,Low,New,1/16/2024,2024.0,January,9:14:04,4.0,,519.2889733,Electronics,Samsung,Television,Bad,Express,Credit Card,Pending,1.0,Plasma TV,2024-01-16,2025-11-15 09:14:04,Missing values; 
2639810.0,10805.0,,Stanley45@gmail.com,7258845851.0,914 Jason Fords Apt. 762,Geelong,New South Wales,83165.0,Australia,20.0,Male,Low,New,4/30/2023,2023.0,April,1:40:40,8.0,454.139988,3633.119904,Clothing,Nike,T-shirt,Average,Same-Day,Debit Card,Processing,2.0,Crew neck tee,2023-04-30,2025-11-15 01:40:40,Missing values; 
9752481.0,93256.0,Kathryn Wang,Seth40@gmail.com,3029342915.0,644 Lisa Causeway,Plymouth,England,69748.0,UK,20.0,Female,Medium,New,1/27/2024,2024.0,January,20:46:09,8.0,230.952206,,Electronics,Sony,Smartphone,Average,Standard,Cash,Processing,2.0,Samsung Galaxy,2024-01-27,2025-11-15 20:46:09,Missing values; 
2245797.0,52775.0,Joanna Hayden,Rachel58@gmail.com,2714778262.0,494 Jackson View,Plymouth,England,52603.0,UK,20.0,Male,Medium,New,10/17/2023,2023.0,October,8:52:05,7.0,10.27003335,71.89023343,,Adidas,Jacket,Good,Express,Credit Card,Processing,3.0,Trench coat,2023-10-17,2025-11-15 08:52:05,Missing values; 
9817823.0,46779.0,Crystal Rogers,Amber98@gmail.com,8300842261.0,9631 Perkins Fort,Edmonton,Ontario,66685.0,Canada,20.0,Female,Medium,New,10-07-23,2023.0,October,18:10:27,3.0,272.3708488,,Electronics,Apple,Smartphone,Bad,Standard,Debit Card,Pending,1.0,Huawei P,2023-10-07,2025-11-15 18:10:27,Missing values; 
6082472.0,51993.0,David Miller,Jonathan75@gmail.com,8749351159.0,58750 Ashley Row Apt. 075,Windsor,Ontario,52665.0,Canada,20.0,Male,Medium,New,11-11-23,2023.0,November,0:47:35,,350.333259,1401.333036,Grocery,Coca-Cola,Juice,Good,Express,PayPal,Shipped,3.0,Apple juice,2023-11-11,2025-11-15 00:47:35,Missing values; 
2680173.0,49606.0,Ian Romero,,8804747069.0,1341 Mackenzie Mount,Plymouth,England,60233.0,UK,20.0,Male,High,New,08-09-23,2023.0,August,19:29:25,8.0,261.798111,2094.384888,Electronics,Apple,Tablet,Average,Same-Day,Debit Card,Shipped,2.0,Lenovo Tab,2023-08-09,2025-11-15 19:29:25,Missing values; 
2287179.0,70758.0,,Victor42@gmail.com,5935166401.0,139 Brown Forest Apt. 380,Frankfurt,Berlin,71197.0,Germany,20.0,Male,Low,New,5/15/2023,2023.0,May,18:41:23,10.0,174.9266706,1749.266706,Books,HarperCollins,Non-Fiction,Excellent,Express,Credit Card,Delivered,5.0,Business,2023-05-15,2025-11-15 18:41:23,Missing values; 
8292592.0,72885.0,Mitchell Lawrence,Michael42@gmail.com,5025762768.0,999 Rebecca Walk,Kitchener,Ontario,44500.0,Canada,20.0,Male,Medium,New,08-08-23,2023.0,August,13:21:40,2.0,364.7080674,729.4161348,Books,Random House,Fiction,,Standard,PayPal,Processing,,Horror,2023-08-08,2025-11-15 13:21:40,Missing values; 
3768892.0,70528.0,Amanda Lee,Lance71@gmail.com,7795712203.0,213 Elliott Mount,Denver,Indiana,46910.0,USA,20.0,Male,High,New,4/20/2023,2023.0,April,18:50:54,8.0,235.8476908,1886.781527,,Nestle,Chocolate,Average,Express,Cash,Processing,2.0,Chocolate-covered nuts,2023-04-20,2025-11-15 18:50:54,Missing values; 
5578772.0,73692.0,Heather Kelly MD,Jessica70@gmail.com,7424930044.0,0505 Waters Street,Leicester,England,95595.0,UK,20.0,Female,High,New,2/18/2024,,February,20:58:54,10.0,206.990435,2069.90435,Books,HarperCollins,Thriller,Good,Standard,Cash,Processing,3.0,Techno-thriller,2024-02-18,2025-11-15 20:58:54,Missing values; 
1236615.0,13794.0,Joseph Stark,Breanna97@gmail.com,6996053673.0,36865 Roberto Mount Apt. 981,Barrie,Ontario,45616.0,Canada,20.0,Female,High,New,10/21/2023,2023.0,October,0:49:39,7.0,252.7860193,1769.502135,Home Decor,IKEA,Lighting,Average,Express,Credit Card,,2.0,Desk lamps,2023-10-21,2025-11-15 00:49:39,Missing values; 
5601373.0,67989.0,Jennifer Bolton,Heather99@gmail.com,1355625867.0,953 Young Mill,Austin,Iowa,52229.0,USA,20.0,Male,Medium,New,04-01-23,2023.0,April,9:32:57,1.0,195.958409,195.958409,Books,Penguin Books,Children's,Good,,Credit Card,Processing,3.0,Toys,2023-04-01,2025-11-15 09:32:57,Missing values; 
9203843.0,52817.0,Ryan Green,John44@gmail.com,3519350226.0,479 Rhodes Lodge,Windsor,Ontario,87999.0,Canada,20.0,Male,High,New,8/20/2023,2023.0,August,21:33:37,,440.2554132,3081.787892,Home Decor,Home Depot,Furniture,Excellent,Express,Debit Card,Shipped,4.0,Dining table,2023-08-20,2025-11-15 21:33:37,Missing values; 
2281097.0,29391.0,Melissa Rogers,Crystal43@gmail.com,,85572 Rodriguez Skyway Suite 099,Leipzig,Berlin,19285.0,Germany,20.0,Male,Medium,New,12/23/2023,2023.0,December,14:50:48,4.0,249.713434,998.8537358,Grocery,Pepsi,Soft Drink,Average,Express,Credit Card,Delivered,2.0,Energy drink,2023-12-23,2025-11-15 14:50:48,Missing values; 
8056569.0,24289.0,Latoya Rivera,Alejandro19@gmail.com,,41923 Barnett Springs,Leipzig,Berlin,23371.0,Germany,20.0,Female,Medium,New,4/27/2023,2023.0,April,20:10:14,8.0,375.9816229,3007.852983,Home Decor,IKEA,Lighting,Excellent,Express,Credit Card,Shipped,5.0,Floor lamps,2023-04-27,2025-11-15 20:10:14,Missing values; 
2872344.0,79902.0,Debra Bond,Danielle73@gmail.com,9170911811.0,85549 Gutierrez Light,Newcastle,New South Wales,8125.0,,20.0,Female,High,New,05-07-23,2023.0,May,7:04:01,5.0,149.1346819,745.6734093,Electronics,Sony,Headphones,Excellent,Express,Cash,Shipped,4.0,Bluetooth headphones,2023-05-07,2025-11-15 07:04:01,Missing values; 
6075879.0,41386.0,Robin Lee,James60@gmail.com,9072166286.0,412 Cline Garden Apt. 536,Calgary,Ontario,69098.0,Canada,20.0,Male,Medium,New,02-04-24,2024.0,February,16:10:29,5.0,277.7844549,1388.922274,Grocery,Coca-Cola,Water,Good,,PayPal,Shipped,3.0,Distilled water,2024-02-04,2025-11-15 16:10:29,Missing values; 
3481247.0,64153.0,Raymond Snow,,6311635918.0,389 Richard Knoll,San Jose,Nevada,89630.0,USA,20.0,Female,Low,New,06-04-23,2023.0,June,5:48:38,2.0,255.6140647,511.2281295,Electronics,Sony,Headphones,Bad,Standard,Cash,Processing,1.0,Studio headphones,2023-06-04,2025-11-15 05:48:38,Missing values; 
5337259.0,,Cheryl Stevens,Melissa7@gmail.com,5581970117.0,296 Yu Stravenue Suite 832,Nottingham,England,78405.0,UK,20.0,Female,Low,New,01-05-24,2024.0,January,11:57:00,9.0,348.704517,3138.340653,Home Decor,Home Depot,Decorations,Bad,Standard,PayPal,Processing,1.0,Decorative pillows,2024-01-05,2025-11-15 11:57:00,Missing values; 
3518304.0,16872.0,Jessica Johnson,Tony72@gmail.com,1632970819.0,1727 Jonathan Terrace,Bristol,England,21097.0,UK,20.0,Female,Medium,New,11/17/2023,2023.0,November,21:40:52,,186.3076348,745.2305393,Books,HarperCollins,Fiction,Bad,Express,PayPal,Shipped,1.0,Science fiction,2023-11-17,2025-11-15 21:40:52,Missing values; 
8370380.0,14060.0,,Brianna61@gmail.com,3329076645.0,28907 Kelly Estate,Kelowna,Ontario,98432.0,Canada,20.0,Male,High,New,2/26/2024,2024.0,February,4:12:31,8.0,73.91430275,591.314422,Books,Random House,Non-Fiction,Bad,Standard,Debit Card,Delivered,1.0,Health,2024-02-26,2025-11-15 04:12:31,Missing values; 
7245965.0,99688.0,Laura Taylor,Angela10@gmail.com,2801664411.0,02438 Amy Falls Apt. 436,Calgary,Ontario,40725.0,Canada,20.0,Male,Low,New,10-05-23,2023.0,October,14:11:56,6.0,381.4589263,,Grocery,Pepsi,Soft Drink,Bad,Standard,Cash,Delivered,1.0,Root beer,2023-10-05,2025-11-15 14:11:56,Missing values; 
4768761.0,,Jamie Pena,Steven18@gmail.com,7669749733.0,04773 Rogers Union Apt. 450,Ottawa,Ontario,2599.0,Canada,20.0,Male,Low,New,3/15/2023,2023.0,March,21:18:13,6.0,89.1178016,534.7068096,Electronics,Samsung,Smartphone,Bad,Express,Cash,Processing,1.0,iPhone,2023-03-15,2025-11-15 21:18:13,Missing values; 
2355252.0,54544.0,Shannon Dominguez,John43@gmail.com,6479308887.0,796 Chelsea Canyon Suite 727,Washington,South Carolina,29752.0,USA,20.0,Male,Medium,New,6/18/2023,2023.0,June,15:32:28,,251.1936745,2009.549396,Clothing,Zara,Jeans,Excellent,Same-Day,Credit Card,Processing,5.0,Low-rise jeans,2023-06-18,2025-11-15 15:32:28,Missing values; 
5350761.0,89532.0,Tina Ward,Ronald10@gmail.com,2048964827.0,5702 Mcdonald Canyon Suite 799,New Orleans,Oklahoma,73024.0,USA,20.0,Male,High,New,12/25/2023,2023.0,December,,7.0,207.0057128,1449.03999,Books,Penguin Books,Fiction,Average,Standard,Cash,Shipped,2.0,Mystery,2023-12-25,,Missing values; 
9135777.0,40804.0,Tyler Edwards,William58@gmail.com,,083 Mario Union Suite 214,Southampton,England,15905.0,UK,20.0,Female,Medium,New,12/16/2023,2023.0,December,9:15:19,1.0,373.1877648,373.1877648,Home Decor,Home Depot,Tools,Excellent,Express,Cash,Shipped,4.0,Level,2023-12-16,2025-11-15 09:15:19,Missing values; 
7809491.0,55070.0,Jeremiah Mcknight,Tracy24@gmail.com,6769600389.0,0973 Hale Pike,Ballarat,New South Wales,10422.0,Australia,20.0,Female,Medium,New,12-11-23,2023.0,,6:04:42,7.0,451.6815709,3161.770996,Grocery,Coca-Cola,Soft Drink,Average,Standard,PayPal,Shipped,2.0,Cream soda,2023-12-11,2025-11-15 06:04:42,Missing values; 
,55845.0,Juan Torres,Christopher40@gmail.com,7472298869.0,47332 Obrien Coves Suite 986,Canberra,New South Wales,67146.0,Australia,20.0,Male,Low,New,9/29/2023,2023.0,September,0:21:21,10.0,491.8477892,4918.477892,Grocery,Pepsi,Juice,Good,Standard,PayPal,Processing,3.0,Mixed fruit juice,2023-09-29,2025-11-15 00:21:21,Missing values; 
2629026.0,73981.0,Anthony Nelson,Julie40@gmail.com,9888563767.0,01186 Gonzalez Wells,New Orleans,Pennsylvania,17353.0,USA,20.0,Male,High,New,01-09-24,2024.0,January,4:42:47,6.0,,420.83171,Home Decor,Home Depot,Decorations,Bad,Same-Day,Credit Card,Delivered,1.0,Candles,2024-01-09,2025-11-15 04:42:47,Missing values; 
5561293.0,15113.0,Stephanie Perez,Heather14@gmail.com,8169535323.0,7484 Ian Road,Winnipeg,Ontario,45988.0,Canada,20.0,Male,Low,New,10/17/2023,2023.0,October,20:16:36,5.0,434.3768481,2171.884241,Home Decor,Bed Bath & Beyond,Kitchen,,Same-Day,Credit Card,Delivered,,Blender,2023-10-17,2025-11-15 20:16:36,Missing values; 
2658448.0,,Seth Collins,Jacqueline41@gmail.com,9775642199.0,043 Rachel Brooks Apt. 359,London,England,85608.0,UK,20.0,Male,Low,New,5/20/2023,2023.0,May,8:45:34,9.0,232.2450893,2090.205804,Electronics,Apple,Smartphone,Bad,Standard,Debit Card,Processing,1.0,Nokia,2023-05-20,2025-11-15 08:45:34,Missing values; 
,91654.0,Mike Mcconnell,Anna48@gmail.com,2808325398.0,660 Brent Haven,Perth,New South Wales,30354.0,Australia,20.0,Male,Medium,New,7/18/2023,2023.0,July,7:43:16,5.0,154.5058967,772.5294835,Books,Penguin Books,Non-Fiction,Bad,Same-Day,PayPal,Delivered,1.0,Memoir,2023-07-18,2025-11-15 07:43:16,Missing values; 
8534589.0,79061.0,Tyler Chapman,Nicholas8@gmail.com,6116929140.0,51562 Jay Islands Apt. 923,London,England,32885.0,UK,20.0,Male,Medium,New,02-12-24,2024.0,February,3:41:34,1.0,322.7522586,322.7522586,Books,Random House,Non-Fiction,Excellent,Express,PayPal,,5.0,History,2024-02-12,2025-11-15 03:41:34,Missing values; 
,20539.0,Raymond Clark,Joshua49@gmail.com,3979227045.0,6033 Lopez Crest,Ballarat,New South Wales,23485.0,Australia,20.0,Male,High,New,1/21/2024,2024.0,January,4:32:09,5.0,234.7641875,1173.820937,Books,Penguin Books,Fiction,Bad,Standard,Cash,Delivered,1.0,Literary fiction,2024-01-21,2025-11-15 04:32:09,Missing values; 
4177228.0,,Patricia Jones,Steven39@gmail.com,8400059238.0,27135 Bell Gateway,Bielefeld,Berlin,13150.0,Germany,20.0,Female,Low,New,3/28/2023,2023.0,March,15:55:59,2.0,337.8745327,675.7490654,Clothing,Nike,Shoes,Bad,Standard,Debit Card,Pending,1.0,High heels,2023-03-28,2025-11-15 15:55:59,Missing values; 
4180882.0,65358.0,Joshua Cameron MD,Andrew61@gmail.com,8771092537.0,43952 Johnson Field Apt. 269,Ottawa,Ontario,90593.0,Canada,20.0,Male,Medium,New,12/14/2023,2023.0,December,22:32:20,5.0,483.6924348,2418.462174,Clothing,,Jacket,Average,Standard,Cash,Pending,2.0,Blazer,2023-12-14,2025-11-15 22:32:20,Missing values; 
7688082.0,31143.0,Jason English,Peter47@gmail.com,1768086874.0,5374 Nicholas Ferry,Regina,Ontario,48943.0,Canada,20.0,Male,Low,New,08-09-23,2023.0,August,16:04:11,2.0,151.1834346,302.3668691,,Sony,Television,Good,Express,Cash,Delivered,3.0,Smart TV,2023-08-09,2025-11-15 16:04:11,Missing values; 
9010438.0,82034.0,Matthew Glenn,Lindsey64@gmail.com,6171475424.0,95609 Peterson Pass,Stuttgart,Berlin,82073.0,Germany,20.0,,Low,New,5/22/2023,2023.0,May,10:18:59,4.0,231.272716,925.090864,Electronics,Samsung,Smartphone,Excellent,Same-Day,Credit Card,Delivered,5.0,Samsung Galaxy,2023-05-22,2025-11-15 10:18:59,Missing values; 
,52245.0,Sandra Walsh,Suzanne60@gmail.com,8260531899.0,80854 Michael Burgs,Raleigh,Wyoming,83078.0,USA,20.0,Female,High,New,4/28/2023,2023.0,April,1:00:13,1.0,489.0157585,489.0157585,Electronics,Sony,Smartphone,Average,Express,PayPal,Processing,2.0,Sony Xperia,2023-04-28,2025-11-15 01:00:13,Missing values; 
4502495.0,97380.0,Tommy Cross,Kristi41@gmail.com,9548105675.0,879 Caroline Dam,Hamburg,Berlin,83656.0,Germany,20.0,Female,Low,New,02-09-24,2024.0,February,8:45:02,5.0,438.2632486,2191.316243,Books,,Non-Fiction,Excellent,Standard,Credit Card,Processing,5.0,Travel,2024-02-09,2025-11-15 08:45:02,Missing values; 
5339623.0,44626.0,Ashlee Bowen,Tracy17@gmail.com,2694361972.0,3253 Osborne Greens,Duisburg,Berlin,,Germany,20.0,Male,Medium,New,10/16/2023,2023.0,October,8:08:22,7.0,204.6430614,1432.50143,Grocery,Pepsi,Water,Excellent,Same-Day,PayPal,Pending,4.0,Bottled water,2023-10-16,2025-11-15 08:08:22,Missing values; 
8330672.0,23420.0,Scott Martinez,Keith46@gmail.com,6446118940.0,1282 Blair Tunnel Suite 571,Tucson,Nebraska,68053.0,USA,20.0,Female,Low,New,09-11-23,2023.0,September,6:13:45,4.0,318.7540769,1275.016308,Books,Penguin Books,Children's,Bad,Same-Day,,Shipped,1.0,Building blocks,2023-09-11,2025-11-15 06:13:45,Missing values; 
7242049.0,34829.0,Bradley Jones,Jessica86@gmail.com,1194707815.0,0338 Kathy Oval,Leipzig,Berlin,77871.0,Germany,20.0,Male,Medium,New,01-01-24,2024.0,January,17:55:14,7.0,89.686578,627.806046,Clothing,Zara,Jeans,Excellent,Express,Cash,,4.0,Low-rise jeans,2024-01-01,2025-11-15 17:55:14,Missing values; 
1812178.0,11181.0,Tamara Moore,Chad33@gmail.com,5967968227.0,52132 Matthew Terrace,Duisburg,Berlin,9521.0,Germany,20.0,Male,Medium,New,03-05-23,2023.0,March,14:55:43,1.0,203.606092,203.606092,Electronics,Sony,Headphones,Excellent,,PayPal,Shipped,4.0,Over-ear headphones,2023-03-05,2025-11-15 14:55:43,Missing values; 
3389074.0,69795.0,Jordan Maddox,David24@gmail.com,4039145961.0,132 Kim Meadows,Canberra,New South Wales,5868.0,Australia,20.0,Male,Low,New,1/16/2024,2024.0,January,0:05:47,1.0,365.4635922,365.4635922,Home Decor,IKEA,Decorations,,Express,Debit Card,Delivered,,Wall art,2024-01-16,2025-11-15 00:05:47,Missing values; 
8365403.0,83976.0,Diana Moore,Brandon67@gmail.com,7821675571.0,4907 Amanda Crossing Apt. 776,Leicester,England,69791.0,UK,20.0,Female,High,New,5/22/2023,2023.0,May,23:49:46,8.0,477.3749944,3818.999955,Electronics,Apple,Smartphone,,Express,PayPal,Delivered,,Samsung Galaxy,2023-05-22,2025-11-15 23:49:46,Missing values; 
7073773.0,22546.0,Nancy Pace,,1938072058.0,8544 Erica Courts Apt. 110,Cleveland,West Virginia,26714.0,USA,20.0,Female,Low,New,6/19/2023,2023.0,June,9:25:42,10.0,424.1663376,4241.663376,Electronics,Sony,Smartphone,Good,Standard,PayPal,Pending,3.0,Nokia,2023-06-19,2025-11-15 09:25:42,Missing values; 
5704740.0,12964.0,Randy Weber,Jessica28@gmail.com,8561642265.0,6682 Amanda Trail,Washington,Utah,84141.0,USA,20.0,Male,Low,New,2/26/2024,2024.0,February,,2.0,300.1959269,600.3918538,Grocery,Coca-Cola,Soft Drink,Bad,Same-Day,Credit Card,Shipped,1.0,Orange soda,2024-02-26,,Missing values; 
